Sheet: NavigateDailyPlanning
A1: ARY(P)
A2: Atlas Topco 1 Limited : Atlas Midco 1 Limited : Atlas Bidco 1 Limited : Aryza Holdings Limited : Chiron Holdings Limited : Saturn Topco S.a.r.l : Saturn F17-349 Midco GmbH : Saturn F17-350 Bidco GmbH : Aryza Europe GmbH : Aryza Holding B.V. : Collenda Holding B.V : Aryza B.V.
A3: Navigate Daily Planning
A4: 29 July 2025 - 28 October 2025
A7: Resource | B7: Customer: Project | C7: Week 31 2025 | F7: Week 32 2025 | I7: Week 33 2025 | L7: Week 34 2025 | O7: Week 35 2025 | R7: Week 36 2025 | U7: Week 37 2025 | X7: Week 38 2025 | AA7: Week 39 2025 | AD7: Week 40 2025 | AG7: Week 41 2025 | AJ7: Week 42 2025 | AM7: Week 43 2025 | AP7: Week 44 2025 | AS7: Total
A8: Â | C8: Allocated Time | D8: Available Hours | E8: Utilization | F8: Allocated Time | G8: Available Hours | H8: Utilization | I8: Allocated Time | J8: Available Hours | K8: Utilization | L8: Allocated Time | M8: Available Hours | N8: Utilization | O8: Allocated Time | P8: Available Hours | Q8: Utilization | R8: Allocated Time | S8: Available Hours | T8: Utilization | U8: Allocated Time | V8: Available Hours | W8: Utilization | X8: Allocated Time | Y8: Available Hours | Z8: Utilization | AA8: Allocated Time | AB8: Available Hours | AC8: Utilization | AD8: Allocated Time | AE8: Available Hours | AF8: Utilization | AG8: Allocated Time | AH8: Available Hours | AI8: Utilization | AJ8: Allocated Time | AK8: Available Hours | AL8: Utilization | AM8: Allocated Time | AN8: Available Hours | AO8: Utilization | AP8: Allocated Time | AQ8: Available Hours | AR8: Utilization | AS8: Allocated Time | AT8: Available Hours | AU8: Utilization
A9: Abe Nieuwhoff
B10: Cus-01163 Aryza B.V. : Proj-00978 Training SmartComponents | D10: 32.0 | E10: (if((ROUND(RC[-1],2) = 0),0,((100 * ROUND(RC[-2],2)) / ROUND(RC[-1],2))))/100.0 -> 0.0 | G10: 40.0 | H10: (if((ROUND(RC[-1],2) = 0),0,((100 * ROUND(RC[-2],2)) / ROUND(RC[-1],2))))/100.0 -> 0.0 | J10: 40.0 | K10: (if((ROUND(RC[-1],2) = 0),0,((100 * ROUND(RC[-2],2)) / ROUND(RC[-1],2))))/100.0 -> 0.0 | M10: 40.0 | N10: (if((ROUND(RC[-1],2) = 0),0,((100 * ROUND(RC[-2],2)) / ROUND(RC[-1],2))))/100.0 -> 0.0 | P10: 40.0 | Q10: (if((ROUND(RC[-1],2) = 0),0,((100 * ROUND(RC[-2],2)) / ROUND(RC[-1],2))))/100.0 -> 0.0 | S10: 40.0 | T10: (if((ROUND(RC[-1],2) = 0),0,((100 * ROUND(RC[-2],2)) / ROUND(RC[-1],2))))/100.0 -> 0.0 | U10: 24.0 | V10: 40.0 | W10: (if((ROUND(RC[-1],2) = 0),0,((100 * ROUND(RC[-2],2)) / ROUND(RC[-1],2))))/100.0 -> 0.6 | X10: 24.0 | Y10: 40.0 | Z10: (if((ROUND(RC[-1],2) = 0),0,((100 * ROUND(RC[-2],2)) / ROUND(RC[-1],2))))/100.0 -> 0.6 | AB10: 40.0 | AC10: (if((ROUND(RC[-1],2) = 0),0,((100 * ROUND(RC[-2],2)) / ROUND(RC[-1],2))))/100.0 -> 0.0 | AE10: 40.0 | AF10: (if((ROUND(RC[-1],2) = 0),0,((100 * ROUND(RC[-2],2)) / ROUND(RC[-1],2))))/100.0 -> 0.0 | AH10: 40.0 | AI10: (if((ROUND(RC[-1],2) = 0),0,((100 * ROUND(RC[-2],2)) / ROUND(RC[-1],2))))/100.0 -> 0.0 | AK10: 40.0 | AL10: (if((ROUND(RC[-1],2) = 0),0,((100 * ROUND(RC[-2],2)) / ROUND(RC[-1],2))))/100.0 -> 0.0 | AN10: 40.0 | AO10: (if((ROUND(RC[-1],2) = 0),0,((100 * ROUND(RC[-2],2)) / ROUND(RC[-1],2))))/100.0 -> 0.0 | AQ10: 16.0 | AR10: (if((ROUND(RC[-1],2) = 0),0,((100 * ROUND(RC[-2],2)) / ROUND(RC[-1],2))))/100.0 -> 0.0 | AS10: SUM(RC[-42],RC[-39],RC[-36],RC[-33],RC[-30],RC[-27],RC[-24],RC[-21],RC[-18],RC[-15],RC[-12],RC[-9],RC[-6],RC[-3]) -> 48.0 | AT10: SUM(RC[-42],RC[-39],RC[-36],RC[-33],RC[-30],RC[-27],RC[-24],RC[-21],RC[-18],RC[-15],RC[-12],RC[-9],RC[-6],RC[-3]) -> 528.0 | AU10: (if((ROUND(RC[-1],2) = 0),0,((100 * ROUND(RC[-2],2)) / ROUND(RC[-1],2))))/100.0 -> 0.09090909090909091
B11: Cus-01214 Creditbility B.V. : Proj-00992 Check handmatig/automatisch per klant GoCOllect | D11: 32.0 | E11: (if((ROUND(RC[-1],2) = 0),0,((100 * ROUND(RC[-2],2)) / ROUND(RC[-1],2))))/100.0 -> 0.0 | G11: 40.0 | H11: (if((ROUND(RC[-1],2) = 0),0,((100 * ROUND(RC[-2],2)) / ROUND(RC[-1],2))))/100.0 -> 0.0 | I11: 4.0 | J11: 40.0 | K11: (if((ROUND(RC[-1],2) = 0),0,((100 * ROUND(RC[-2],2)) / ROUND(RC[-1],2))))/100.0 -> 0.1 | M11: 40.0 | N11: (if((ROUND(RC[-1],2) = 0),0,((100 * ROUND(RC[-2],2)) / ROUND(RC[-1],2))))/100.0 -> 0.0 | P11: 40.0 | Q11: (if((ROUND(RC[-1],2) = 0),0,((100 * ROUND(RC[-2],2)) / ROUND(RC[-1],2))))/100.0 -> 0.0 | S11: 40.0 | T11: (if((ROUND(RC[-1],2) = 0),0,((100 * ROUND(RC[-2],2)) / ROUND(RC[-1],2))))/100.0 -> 0.0 | V11: 40.0 | W11: (if((ROUND(RC[-1],2) = 0),0,((100 * ROUND(RC[-2],2)) / ROUND(RC[-1],2))))/100.0 -> 0.0 | Y11: 40.0 | Z11: (if((ROUND(RC[-1],2) = 0),0,((100 * ROUND(RC[-2],2)) / ROUND(RC[-1],2))))/100.0 -> 0.0 | AB11: 40.0 | AC11: (if((ROUND(RC[-1],2) = 0),0,((100 * ROUND(RC[-2],2)) / ROUND(RC[-1],2))))/100.0 -> 0.0 | AE11: 40.0 | AF11: (if((ROUND(RC[-1],2) = 0),0,((100 * ROUND(RC[-2],2)) / ROUND(RC[-1],2))))/100.0 -> 0.0 | AH11: 40.0 | AI11: (if((ROUND(RC[-1],2) = 0),0,((100 * ROUND(RC[-2],2)) / ROUND(RC[-1],2))))/100.0 -> 0.0 | AK11: 40.0 | AL11: (if((ROUND(RC[-1],2) = 0),0,((100 * ROUND(RC[-2],2)) / ROUND(RC[-1],2))))/100.0 -> 0.0 | AN11: 40.0 | AO11: (if((ROUND(RC[-1],2) = 0),0,((100 * ROUND(RC[-2],2)) / ROUND(RC[-1],2))))/100.0 -> 0.0 | AQ11: 16.0 | AR11: (if((ROUND(RC[-1],2) = 0),0,((100 * ROUND(RC[-2],2)) / ROUND(RC[-1],2))))/100.0 -> 0.0 | AS11: SUM(RC[-42],RC[-39],RC[-36],RC[-33],RC[-30],RC[-27],RC[-24],RC[-21],RC[-18],RC[-15],RC[-12],RC[-9],RC[-6],RC[-3]) -> 4.0 | AT11: SUM(RC[-42],RC[-39],RC[-36],RC[-33],RC[-30],RC[-27],RC[-24],RC[-21],RC[-18],RC[-15],RC[-12],RC[-9],RC[-6],RC[-3]) -> 528.0 | AU11: (if((ROUND(RC[-1],2) = 0),0,((100 * ROUND(RC[-2],2)) / ROUND(RC[-1],2))))/100.0 -> 0.007575757575757576
B12: Cus-01736 LDCR Afd. Fin. : Proj-00805 LDCR C-Kasapplicatie | D12: 32.0 | E12: (if((ROUND(RC[-1],2) = 0),0,((100 * ROUND(RC[-2],2)) / ROUND(RC[-1],2))))/100.0 -> 0.0 | G12: 40.0 | H12: (if((ROUND(RC[-1],2) = 0),0,((100 * ROUND(RC[-2],2)) / ROUND(RC[-1],2))))/100.0 -> 0.0 | J12: 40.0 | K12: (if((ROUND(RC[-1],2) = 0),0,((100 * ROUND(RC[-2],2)) / ROUND(RC[-1],2))))/100.0 -> 0.0 | M12: 40.0 | N12: (if((ROUND(RC[-1],2) = 0),0,((100 * ROUND(RC[-2],2)) / ROUND(RC[-1],2))))/100.0 -> 0.0 | P12: 40.0 | Q12: (if((ROUND(RC[-1],2) = 0),0,((100 * ROUND(RC[-2],2)) / ROUND(RC[-1],2))))/100.0 -> 0.0 | S12: 40.0 | T12: (if((ROUND(RC[-1],2) = 0),0,((100 * ROUND(RC[-2],2)) / ROUND(RC[-1],2))))/100.0 -> 0.0 | V12: 40.0 | W12: (if((ROUND(RC[-1],2) = 0),0,((100 * ROUND(RC[-2],2)) / ROUND(RC[-1],2))))/100.0 -> 0.0 | Y12: 40.0 | Z12: (if((ROUND(RC[-1],2) = 0),0,((100 * ROUND(RC[-2],2)) / ROUND(RC[-1],2))))/100.0 -> 0.0 | AA12: 24.0 | AB12: 40.0 | AC12: (if((ROUND(RC[-1],2) = 0),0,((100 * ROUND(RC[-2],2)) / ROUND(RC[-1],2))))/100.0 -> 0.6 | AD12: 24.0 | AE12: 40.0 | AF12: (if((ROUND(RC[-1],2) = 0),0,((100 * ROUND(RC[-2],2)) / ROUND(RC[-1],2))))/100.0 -> 0.6 | AG12: 24.0 | AH12: 40.0 | AI12: (if((ROUND(RC[-1],2) = 0),0,((100 * ROUND(RC[-2],2)) / ROUND(RC[-1],2))))/100.0 -> 0.6 | AJ12: 24.0 | AK12: 40.0 | AL12: (if((ROUND(RC[-1],2) = 0),0,((100 * ROUND(RC[-2],2)) / ROUND(RC[-1],2))))/100.0 -> 0.6 | AM12: 24.0 | AN12: 40.0 | AO12: (if((ROUND(RC[-1],2) = 0),0,((100 * ROUND(RC[-2],2)) / ROUND(RC[-1],2))))/100.0 -> 0.6 | AP12: 9.6 | AQ12: 16.0 | AR12: (if((ROUND(RC[-1],2) = 0),0,((100 * ROUND(RC[-2],2)) / ROUND(RC[-1],2))))/100.0 -> 0.6 | AS12: SUM(RC[-42],RC[-39],RC[-36],RC[-33],RC[-30],RC[-27],RC[-24],RC[-21],RC[-18],RC[-15],RC[-12],RC[-9],RC[-6],RC[-3]) -> 129.6 | AT12: SUM(RC[-42],RC[-39],RC[-36],RC[-33],RC[-30],RC[-27],RC[-24],RC[-21],RC[-18],RC[-15],RC[-12],RC[-9],RC[-6],RC[-3]) -> 528.0 | AU12: (if((ROUND(RC[-1],2) = 0),0,((100 * ROUND(RC[-2],2)) / ROUND(RC[-1],2))))/100.0 -> 0.24545454545454548
A13: Total - Abe Nieuwhoff | C13: SUM(R[-3]C:R[-1]C) ->  | D13: 32.0 | E13: (if((ROUND(RC[-1],2) = 0),0,((100 * ROUND(RC[-2],2)) / ROUND(RC[-1],2))))/100.0 -> 0.0 | F13: SUM(R[-3]C:R[-1]C) ->  | G13: 40.0 | H13: (if((ROUND(RC[-1],2) = 0),0,((100 * ROUND(RC[-2],2)) / ROUND(RC[-1],2))))/100.0 -> 0.0 | I13: SUM(R[-3]C:R[-1]C) -> 4.0 | J13: 40.0 | K13: (if((ROUND(RC[-1],2) = 0),0,((100 * ROUND(RC[-2],2)) / ROUND(RC[-1],2))))/100.0 -> 0.1 | L13: SUM(R[-3]C:R[-1]C) ->  | M13: 40.0 | N13: (if((ROUND(RC[-1],2) = 0),0,((100 * ROUND(RC[-2],2)) / ROUND(RC[-1],2))))/100.0 -> 0.0 | O13: SUM(R[-3]C:R[-1]C) ->  | P13: 40.0 | Q13: (if((ROUND(RC[-1],2) = 0),0,((100 * ROUND(RC[-2],2)) / ROUND(RC[-1],2))))/100.0 -> 0.0 | R13: SUM(R[-3]C:R[-1]C) ->  | S13: 40.0 | T13: (if((ROUND(RC[-1],2) = 0),0,((100 * ROUND(RC[-2],2)) / ROUND(RC[-1],2))))/100.0 -> 0.0 | U13: SUM(R[-3]C:R[-1]C) -> 24.0 | V13: 40.0 | W13: (if((ROUND(RC[-1],2) = 0),0,((100 * ROUND(RC[-2],2)) / ROUND(RC[-1],2))))/100.0 -> 0.6 | X13: SUM(R[-3]C:R[-1]C) -> 24.0 | Y13: 40.0 | Z13: (if((ROUND(RC[-1],2) = 0),0,((100 * ROUND(RC[-2],2)) / ROUND(RC[-1],2))))/100.0 -> 0.6 | AA13: SUM(R[-3]C:R[-1]C) -> 24.0 | AB13: 40.0 | AC13: (if((ROUND(RC[-1],2) = 0),0,((100 * ROUND(RC[-2],2)) / ROUND(RC[-1],2))))/100.0 -> 0.6 | AD13: SUM(R[-3]C:R[-1]C) -> 24.0 | AE13: 40.0 | AF13: (if((ROUND(RC[-1],2) = 0),0,((100 * ROUND(RC[-2],2)) / ROUND(RC[-1],2))))/100.0 -> 0.6 | AG13: SUM(R[-3]C:R[-1]C) -> 24.0 | AH13: 40.0 | AI13: (if((ROUND(RC[-1],2) = 0),0,((100 * ROUND(RC[-2],2)) / ROUND(RC[-1],2))))/100.0 -> 0.6 | AJ13: SUM(R[-3]C:R[-1]C) -> 24.0 | AK13: 40.0 | AL13: (if((ROUND(RC[-1],2) = 0),0,((100 * ROUND(RC[-2],2)) / ROUND(RC[-1],2))))/100.0 -> 0.6 | AM13: SUM(R[-3]C:R[-1]C) -> 24.0 | AN13: 40.0 | AO13: (if((ROUND(RC[-1],2) = 0),0,((100 * ROUND(RC[-2],2)) / ROUND(RC[-1],2))))/100.0 -> 0.6 | AP13: SUM(R[-3]C:R[-1]C) -> 9.6 | AQ13: 16.0 | AR13: (if((ROUND(RC[-1],2) = 0),0,((100 * ROUND(RC[-2],2)) / ROUND(RC[-1],2))))/100.0 -> 0.6 | AS13: SUM(R[-3]C:R[-1]C) -> 181.6 | AT13: SUM(R[-3]C:R[-1]C) -> 528.0 | AU13: (if((ROUND(RC[-1],2) = 0),0,((100 * ROUND(RC[-2],2)) / ROUND(RC[-1],2))))/100.0 -> 0.34393939393939393
A14: Bappi Ahmed
B15: Cus-01163 Aryza B.V. : Proj-00976 Interne uren 2025 | C15: 16.0 | D15: 32.0 | E15: (if((ROUND(RC[-1],2) = 0),0,((100 * ROUND(RC[-2],2)) / ROUND(RC[-1],2))))/100.0 -> 0.5 | F15: 20.0 | G15: 40.0 | H15: (if((ROUND(RC[-1],2) = 0),0,((100 * ROUND(RC[-2],2)) / ROUND(RC[-1],2))))/100.0 -> 0.5 | I15: 20.0 | J15: 40.0 | K15: (if((ROUND(RC[-1],2) = 0),0,((100 * ROUND(RC[-2],2)) / ROUND(RC[-1],2))))/100.0 -> 0.5 | L15: 20.0 | M15: 40.0 | N15: (if((ROUND(RC[-1],2) = 0),0,((100 * ROUND(RC[-2],2)) / ROUND(RC[-1],2))))/100.0 -> 0.5 | O15: 20.0 | P15: 40.0 | Q15: (if((ROUND(RC[-1],2) = 0),0,((100 * ROUND(RC[-2],2)) / ROUND(RC[-1],2))))/100.0 -> 0.5 | R15: 20.0 | S15: 40.0 | T15: (if((ROUND(RC[-1],2) = 0),0,((100 * ROUND(RC[-2],2)) / ROUND(RC[-1],2))))/100.0 -> 0.5 | U15: 20.0 | V15: 40.0 | W15: (if((ROUND(RC[-1],2) = 0),0,((100 * ROUND(RC[-2],2)) / ROUND(RC[-1],2))))/100.0 -> 0.5 | X15: 20.0 | Y15: 40.0 | Z15: (if((ROUND(RC[-1],2) = 0),0,((100 * ROUND(RC[-2],2)) / ROUND(RC[-1],2))))/100.0 -> 0.5 | AA15: 20.0 | AB15: 40.0 | AC15: (if((ROUND(RC[-1],2) = 0),0,((100 * ROUND(RC[-2],2)) / ROUND(RC[-1],2))))/100.0 -> 0.5 | AD15: 20.0 | AE15: 40.0 | AF15: (if((ROUND(RC[-1],2) = 0),0,((100 * ROUND(RC[-2],2)) / ROUND(RC[-1],2))))/100.0 -> 0.5 | AG15: 20.0 | AH15: 40.0 | AI15: (if((ROUND(RC[-1],2) = 0),0,((100 * ROUND(RC[-2],2)) / ROUND(RC[-1],2))))/100.0 -> 0.5 | AJ15: 20.0 | AK15: 40.0 | AL15: (if((ROUND(RC[-1],2) = 0),0,((100 * ROUND(RC[-2],2)) / ROUND(RC[-1],2))))/100.0 -> 0.5 | AM15: 20.0 | AN15: 40.0 | AO15: (if((ROUND(RC[-1],2) = 0),0,((100 * ROUND(RC[-2],2)) / ROUND(RC[-1],2))))/100.0 -> 0.5 | AP15: 8.0 | AQ15: 16.0 | AR15: (if((ROUND(RC[-1],2) = 0),0,((100 * ROUND(RC[-2],2)) / ROUND(RC[-1],2))))/100.0 -> 0.5 | AS15: SUM(RC[-42],RC[-39],RC[-36],RC[-33],RC[-30],RC[-27],RC[-24],RC[-21],RC[-18],RC[-15],RC[-12],RC[-9],RC[-6],RC[-3]) -> 264.0 | AT15: SUM(RC[-42],RC[-39],RC[-36],RC[-33],RC[-30],RC[-27],RC[-24],RC[-21],RC[-18],RC[-15],RC[-12],RC[-9],RC[-6],RC[-3]) -> 528.0 | AU15: (if((ROUND(RC[-1],2) = 0),0,((100 * ROUND(RC[-2],2)) / ROUND(RC[-1],2))))/100.0 -> 0.5
B16: Cus-01163 Aryza B.V. : Proj-01059 Upgrade Framework GRFO | C16: 3.2 | D16: 32.0 | E16: (if((ROUND(RC[-1],2) = 0),0,((100 * ROUND(RC[-2],2)) / ROUND(RC[-1],2))))/100.0 -> 0.1 | F16: 4.0 | G16: 40.0 | H16: (if((ROUND(RC[-1],2) = 0),0,((100 * ROUND(RC[-2],2)) / ROUND(RC[-1],2))))/100.0 -> 0.1 | I16: 4.0 | J16: 40.0 | K16: (if((ROUND(RC[-1],2) = 0),0,((100 * ROUND(RC[-2],2)) / ROUND(RC[-1],2))))/100.0 -> 0.1 | L16: 4.0 | M16: 40.0 | N16: (if((ROUND(RC[-1],2) = 0),0,((100 * ROUND(RC[-2],2)) / ROUND(RC[-1],2))))/100.0 -> 0.1 | O16: 4.0 | P16: 40.0 | Q16: (if((ROUND(RC[-1],2) = 0),0,((100 * ROUND(RC[-2],2)) / ROUND(RC[-1],2))))/100.0 -> 0.1 | S16: 40.0 | T16: (if((ROUND(RC[-1],2) = 0),0,((100 * ROUND(RC[-2],2)) / ROUND(RC[-1],2))))/100.0 -> 0.0 | V16: 40.0 | W16: (if((ROUND(RC[-1],2) = 0),0,((100 * ROUND(RC[-2],2)) / ROUND(RC[-1],2))))/100.0 -> 0.0 | Y16: 40.0 | Z16: (if((ROUND(RC[-1],2) = 0),0,((100 * ROUND(RC[-2],2)) / ROUND(RC[-1],2))))/100.0 -> 0.0 | AB16: 40.0 | AC16: (if((ROUND(RC[-1],2) = 0),0,((100 * ROUND(RC[-2],2)) / ROUND(RC[-1],2))))/100.0 -> 0.0 | AE16: 40.0 | AF16: (if((ROUND(RC[-1],2) = 0),0,((100 * ROUND(RC[-2],2)) / ROUND(RC[-1],2))))/100.0 -> 0.0 | AH16: 40.0 | AI16: (if((ROUND(RC[-1],2) = 0),0,((100 * ROUND(RC[-2],2)) / ROUND(RC[-1],2))))/100.0 -> 0.0 | AK16: 40.0 | AL16: (if((ROUND(RC[-1],2) = 0),0,((100 * ROUND(RC[-2],2)) / ROUND(RC[-1],2))))/100.0 -> 0.0 | AN16: 40.0 | AO16: (if((ROUND(RC[-1],2) = 0),0,((100 * ROUND(RC[-2],2)) / ROUND(RC[-1],2))))/100.0 -> 0.0 | AQ16: 16.0 | AR16: (if((ROUND(RC[-1],2) = 0),0,((100 * ROUND(RC[-2],2)) / ROUND(RC[-1],2))))/100.0 -> 0.0 | AS16: SUM(RC[-42],RC[-39],RC[-36],RC[-33],RC[-30],RC[-27],RC[-24],RC[-21],RC[-18],RC[-15],RC[-12],RC[-9],RC[-6],RC[-3]) -> 19.2 | AT16: SUM(RC[-42],RC[-39],RC[-36],RC[-33],RC[-30],RC[-27],RC[-24],RC[-21],RC[-18],RC[-15],RC[-12],RC[-9],RC[-6],RC[-3]) -> 528.0 | AU16: (if((ROUND(RC[-1],2) = 0),0,((100 * ROUND(RC[-2],2)) / ROUND(RC[-1],2))))/100.0 -> 0.03636363636363636
B17: Cus-01163 Aryza B.V. : Proj-01060 PTV T&T | C17: 0.8 | D17: 32.0 | E17: (if((ROUND(RC[-1],2) = 0),0,((100 * ROUND(RC[-2],2)) / ROUND(RC[-1],2))))/100.0 -> 0.025 | G17: 40.0 | H17: (if((ROUND(RC[-1],2) = 0),0,((100 * ROUND(RC[-2],2)) / ROUND(RC[-1],2))))/100.0 -> 0.0 | J17: 40.0 | K17: (if((ROUND(RC[-1],2) = 0),0,((100 * ROUND(RC[-2],2)) / ROUND(RC[-1],2))))/100.0 -> 0.0 | M17: 40.0 | N17: (if((ROUND(RC[-1],2) = 0),0,((100 * ROUND(RC[-2],2)) / ROUND(RC[-1],2))))/100.0 -> 0.0 | P17: 40.0 | Q17: (if((ROUND(RC[-1],2) = 0),0,((100 * ROUND(RC[-2],2)) / ROUND(RC[-1],2))))/100.0 -> 0.0 | S17: 40.0 | T17: (if((ROUND(RC[-1],2) = 0),0,((100 * ROUND(RC[-2],2)) / ROUND(RC[-1],2))))/100.0 -> 0.0 | V17: 40.0 | W17: (if((ROUND(RC[-1],2) = 0),0,((100 * ROUND(RC[-2],2)) / ROUND(RC[-1],2))))/100.0 -> 0.0 | Y17: 40.0 | Z17: (if((ROUND(RC[-1],2) = 0),0,((100 * ROUND(RC[-2],2)) / ROUND(RC[-1],2))))/100.0 -> 0.0 | AB17: 40.0 | AC17: (if((ROUND(RC[-1],2) = 0),0,((100 * ROUND(RC[-2],2)) / ROUND(RC[-1],2))))/100.0 -> 0.0 | AE17: 40.0 | AF17: (if((ROUND(RC[-1],2) = 0),0,((100 * ROUND(RC[-2],2)) / ROUND(RC[-1],2))))/100.0 -> 0.0 | AH17: 40.0 | AI17: (if((ROUND(RC[-1],2) = 0),0,((100 * ROUND(RC[-2],2)) / ROUND(RC[-1],2))))/100.0 -> 0.0 | AK17: 40.0 | AL17: (if((ROUND(RC[-1],2) = 0),0,((100 * ROUND(RC[-2],2)) / ROUND(RC[-1],2))))/100.0 -> 0.0 | AN17: 40.0 | AO17: (if((ROUND(RC[-1],2) = 0),0,((100 * ROUND(RC[-2],2)) / ROUND(RC[-1],2))))/100.0 -> 0.0 | AQ17: 16.0 | AR17: (if((ROUND(RC[-1],2) = 0),0,((100 * ROUND(RC[-2],2)) / ROUND(RC[-1],2))))/100.0 -> 0.0 | AS17: SUM(RC[-42],RC[-39],RC[-36],RC[-33],RC[-30],RC[-27],RC[-24],RC[-21],RC[-18],RC[-15],RC[-12],RC[-9],RC[-6],RC[-3]) -> 0.8 | AT17: SUM(RC[-42],RC[-39],RC[-36],RC[-33],RC[-30],RC[-27],RC[-24],RC[-21],RC[-18],RC[-15],RC[-12],RC[-9],RC[-6],RC[-3]) -> 528.0 | AU17: (if((ROUND(RC[-1],2) = 0),0,((100 * ROUND(RC[-2],2)) / ROUND(RC[-1],2))))/100.0 -> 0.0015151515151515152
B18: Cus-01163 Aryza B.V. : Proj-01064 Backup/restore of Elastic Search Data | D18: 32.0 | E18: (if((ROUND(RC[-1],2) = 0),0,((100 * ROUND(RC[-2],2)) / ROUND(RC[-1],2))))/100.0 -> 0.0 | G18: 40.0 | H18: (if((ROUND(RC[-1],2) = 0),0,((100 * ROUND(RC[-2],2)) / ROUND(RC[-1],2))))/100.0 -> 0.0 | J18: 40.0 | K18: (if((ROUND(RC[-1],2) = 0),0,((100 * ROUND(RC[-2],2)) / ROUND(RC[-1],2))))/100.0 -> 0.0 | M18: 40.0 | N18: (if((ROUND(RC[-1],2) = 0),0,((100 * ROUND(RC[-2],2)) / ROUND(RC[-1],2))))/100.0 -> 0.0 | O18: 8.0 | P18: 40.0 | Q18: (if((ROUND(RC[-1],2) = 0),0,((100 * ROUND(RC[-2],2)) / ROUND(RC[-1],2))))/100.0 -> 0.2 | S18: 40.0 | T18: (if((ROUND(RC[-1],2) = 0),0,((100 * ROUND(RC[-2],2)) / ROUND(RC[-1],2))))/100.0 -> 0.0 | V18: 40.0 | W18: (if((ROUND(RC[-1],2) = 0),0,((100 * ROUND(RC[-2],2)) / ROUND(RC[-1],2))))/100.0 -> 0.0 | Y18: 40.0 | Z18: (if((ROUND(RC[-1],2) = 0),0,((100 * ROUND(RC[-2],2)) / ROUND(RC[-1],2))))/100.0 -> 0.0 | AB18: 40.0 | AC18: (if((ROUND(RC[-1],2) = 0),0,((100 * ROUND(RC[-2],2)) / ROUND(RC[-1],2))))/100.0 -> 0.0 | AE18: 40.0 | AF18: (if((ROUND(RC[-1],2) = 0),0,((100 * ROUND(RC[-2],2)) / ROUND(RC[-1],2))))/100.0 -> 0.0 | AH18: 40.0 | AI18: (if((ROUND(RC[-1],2) = 0),0,((100 * ROUND(RC[-2],2)) / ROUND(RC[-1],2))))/100.0 -> 0.0 | AK18: 40.0 | AL18: (if((ROUND(RC[-1],2) = 0),0,((100 * ROUND(RC[-2],2)) / ROUND(RC[-1],2))))/100.0 -> 0.0 | AN18: 40.0 | AO18: (if((ROUND(RC[-1],2) = 0),0,((100 * ROUND(RC[-2],2)) / ROUND(RC[-1],2))))/100.0 -> 0.0 | AQ18: 16.0 | AR18: (if((ROUND(RC[-1],2) = 0),0,((100 * ROUND(RC[-2],2)) / ROUND(RC[-1],2))))/100.0 -> 0.0 | AS18: SUM(RC[-42],RC[-39],RC[-36],RC[-33],RC[-30],RC[-27],RC[-24],RC[-21],RC[-18],RC[-15],RC[-12],RC[-9],RC[-6],RC[-3]) -> 8.0 | AT18: SUM(RC[-42],RC[-39],RC[-36],RC[-33],RC[-30],RC[-27],RC[-24],RC[-21],RC[-18],RC[-15],RC[-12],RC[-9],RC[-6],RC[-3]) -> 528.0 | AU18: (if((ROUND(RC[-1],2) = 0),0,((100 * ROUND(RC[-2],2)) / ROUND(RC[-1],2))))/100.0 -> 0.015151515151515152
B19: Cus-01736 LDCR Afd. Fin. : Proj-00805 LDCR C-Kasapplicatie | D19: 32.0 | E19: (if((ROUND(RC[-1],2) = 0),0,((100 * ROUND(RC[-2],2)) / ROUND(RC[-1],2))))/100.0 -> 0.0 | G19: 40.0 | H19: (if((ROUND(RC[-1],2) = 0),0,((100 * ROUND(RC[-2],2)) / ROUND(RC[-1],2))))/100.0 -> 0.0 | J19: 40.0 | K19: (if((ROUND(RC[-1],2) = 0),0,((100 * ROUND(RC[-2],2)) / ROUND(RC[-1],2))))/100.0 -> 0.0 | M19: 40.0 | N19: (if((ROUND(RC[-1],2) = 0),0,((100 * ROUND(RC[-2],2)) / ROUND(RC[-1],2))))/100.0 -> 0.0 | P19: 40.0 | Q19: (if((ROUND(RC[-1],2) = 0),0,((100 * ROUND(RC[-2],2)) / ROUND(RC[-1],2))))/100.0 -> 0.0 | S19: 40.0 | T19: (if((ROUND(RC[-1],2) = 0),0,((100 * ROUND(RC[-2],2)) / ROUND(RC[-1],2))))/100.0 -> 0.0 | V19: 40.0 | W19: (if((ROUND(RC[-1],2) = 0),0,((100 * ROUND(RC[-2],2)) / ROUND(RC[-1],2))))/100.0 -> 0.0 | X19: 20.0 | Y19: 40.0 | Z19: (if((ROUND(RC[-1],2) = 0),0,((100 * ROUND(RC[-2],2)) / ROUND(RC[-1],2))))/100.0 -> 0.5 | AA19: 20.0 | AB19: 40.0 | AC19: (if((ROUND(RC[-1],2) = 0),0,((100 * ROUND(RC[-2],2)) / ROUND(RC[-1],2))))/100.0 -> 0.5 | AD19: 20.0 | AE19: 40.0 | AF19: (if((ROUND(RC[-1],2) = 0),0,((100 * ROUND(RC[-2],2)) / ROUND(RC[-1],2))))/100.0 -> 0.5 | AG19: 20.0 | AH19: 40.0 | AI19: (if((ROUND(RC[-1],2) = 0),0,((100 * ROUND(RC[-2],2)) / ROUND(RC[-1],2))))/100.0 -> 0.5 | AJ19: 20.0 | AK19: 40.0 | AL19: (if((ROUND(RC[-1],2) = 0),0,((100 * ROUND(RC[-2],2)) / ROUND(RC[-1],2))))/100.0 -> 0.5 | AM19: 20.0 | AN19: 40.0 | AO19: (if((ROUND(RC[-1],2) = 0),0,((100 * ROUND(RC[-2],2)) / ROUND(RC[-1],2))))/100.0 -> 0.5 | AP19: 8.0 | AQ19: 16.0 | AR19: (if((ROUND(RC[-1],2) = 0),0,((100 * ROUND(RC[-2],2)) / ROUND(RC[-1],2))))/100.0 -> 0.5 | AS19: SUM(RC[-42],RC[-39],RC[-36],RC[-33],RC[-30],RC[-27],RC[-24],RC[-21],RC[-18],RC[-15],RC[-12],RC[-9],RC[-6],RC[-3]) -> 128.0 | AT19: SUM(RC[-42],RC[-39],RC[-36],RC[-33],RC[-30],RC[-27],RC[-24],RC[-21],RC[-18],RC[-15],RC[-12],RC[-9],RC[-6],RC[-3]) -> 528.0 | AU19: (if((ROUND(RC[-1],2) = 0),0,((100 * ROUND(RC[-2],2)) / ROUND(RC[-1],2))))/100.0 -> 0.24242424242424243
A20: Total - Bappi Ahmed | C20: SUM(R[-5]C:R[-1]C) -> 20.0 | D20: 32.0 | E20: (if((ROUND(RC[-1],2) = 0),0,((100 * ROUND(RC[-2],2)) / ROUND(RC[-1],2))))/100.0 -> 0.625 | F20: SUM(R[-5]C:R[-1]C) -> 24.0 | G20: 40.0 | H20: (if((ROUND(RC[-1],2) = 0),0,((100 * ROUND(RC[-2],2)) / ROUND(RC[-1],2))))/100.0 -> 0.6 | I20: SUM(R[-5]C:R[-1]C) -> 24.0 | J20: 40.0 | K20: (if((ROUND(RC[-1],2) = 0),0,((100 * ROUND(RC[-2],2)) / ROUND(RC[-1],2))))/100.0 -> 0.6 | L20: SUM(R[-5]C:R[-1]C) -> 24.0 | M20: 40.0 | N20: (if((ROUND(RC[-1],2) = 0),0,((100 * ROUND(RC[-2],2)) / ROUND(RC[-1],2))))/100.0 -> 0.6 | O20: SUM(R[-5]C:R[-1]C) -> 32.0 | P20: 40.0 | Q20: (if((ROUND(RC[-1],2) = 0),0,((100 * ROUND(RC[-2],2)) / ROUND(RC[-1],2))))/100.0 -> 0.8 | R20: SUM(R[-5]C:R[-1]C) -> 20.0 | S20: 40.0 | T20: (if((ROUND(RC[-1],2) = 0),0,((100 * ROUND(RC[-2],2)) / ROUND(RC[-1],2))))/100.0 -> 0.5 | U20: SUM(R[-5]C:R[-1]C) -> 20.0 | V20: 40.0 | W20: (if((ROUND(RC[-1],2) = 0),0,((100 * ROUND(RC[-2],2)) / ROUND(RC[-1],2))))/100.0 -> 0.5 | X20: SUM(R[-5]C:R[-1]C) -> 40.0 | Y20: 40.0 | Z20: (if((ROUND(RC[-1],2) = 0),0,((100 * ROUND(RC[-2],2)) / ROUND(RC[-1],2))))/100.0 -> 1.0 | AA20: SUM(R[-5]C:R[-1]C) -> 40.0 | AB20: 40.0 | AC20: (if((ROUND(RC[-1],2) = 0),0,((100 * ROUND(RC[-2],2)) / ROUND(RC[-1],2))))/100.0 -> 1.0 | AD20: SUM(R[-5]C:R[-1]C) -> 40.0 | AE20: 40.0 | AF20: (if((ROUND(RC[-1],2) = 0),0,((100 * ROUND(RC[-2],2)) / ROUND(RC[-1],2))))/100.0 -> 1.0 | AG20: SUM(R[-5]C:R[-1]C) -> 40.0 | AH20: 40.0 | AI20: (if((ROUND(RC[-1],2) = 0),0,((100 * ROUND(RC[-2],2)) / ROUND(RC[-1],2))))/100.0 -> 1.0 | AJ20: SUM(R[-5]C:R[-1]C) -> 40.0 | AK20: 40.0 | AL20: (if((ROUND(RC[-1],2) = 0),0,((100 * ROUND(RC[-2],2)) / ROUND(RC[-1],2))))/100.0 -> 1.0 | AM20: SUM(R[-5]C:R[-1]C) -> 40.0 | AN20: 40.0 | AO20: (if((ROUND(RC[-1],2) = 0),0,((100 * ROUND(RC[-2],2)) / ROUND(RC[-1],2))))/100.0 -> 1.0 | AP20: SUM(R[-5]C:R[-1]C) -> 16.0 | AQ20: 16.0 | AR20: (if((ROUND(RC[-1],2) = 0),0,((100 * ROUND(RC[-2],2)) / ROUND(RC[-1],2))))/100.0 -> 1.0 | AS20: SUM(R[-5]C:R[-1]C) -> 420.0 | AT20: SUM(R[-5]C:R[-1]C) -> 528.0 | AU20: (if((ROUND(RC[-1],2) = 0),0,((100 * ROUND(RC[-2],2)) / ROUND(RC[-1],2))))/100.0 -> 0.7954545454545454
A21: Frank Geerds | B21: Cus-01163 Aryza B.V. : Proj-00976 Interne uren 2025 | D21: 32.0 | E21: (if((ROUND(RC[-1],2) = 0),0,((100 * ROUND(RC[-2],2)) / ROUND(RC[-1],2))))/100.0 -> 0.0 | G21: 40.0 | H21: (if((ROUND(RC[-1],2) = 0),0,((100 * ROUND(RC[-2],2)) / ROUND(RC[-1],2))))/100.0 -> 0.0 | J21: 40.0 | K21: (if((ROUND(RC[-1],2) = 0),0,((100 * ROUND(RC[-2],2)) / ROUND(RC[-1],2))))/100.0 -> 0.0 | L21: 20.0 | M21: 40.0 | N21: (if((ROUND(RC[-1],2) = 0),0,((100 * ROUND(RC[-2],2)) / ROUND(RC[-1],2))))/100.0 -> 0.5 | O21: 20.0 | P21: 40.0 | Q21: (if((ROUND(RC[-1],2) = 0),0,((100 * ROUND(RC[-2],2)) / ROUND(RC[-1],2))))/100.0 -> 0.5 | R21: 20.0 | S21: 40.0 | T21: (if((ROUND(RC[-1],2) = 0),0,((100 * ROUND(RC[-2],2)) / ROUND(RC[-1],2))))/100.0 -> 0.5 | U21: 20.0 | V21: 40.0 | W21: (if((ROUND(RC[-1],2) = 0),0,((100 * ROUND(RC[-2],2)) / ROUND(RC[-1],2))))/100.0 -> 0.5 | X21: 20.0 | Y21: 40.0 | Z21: (if((ROUND(RC[-1],2) = 0),0,((100 * ROUND(RC[-2],2)) / ROUND(RC[-1],2))))/100.0 -> 0.5 | AA21: 20.0 | AB21: 40.0 | AC21: (if((ROUND(RC[-1],2) = 0),0,((100 * ROUND(RC[-2],2)) / ROUND(RC[-1],2))))/100.0 -> 0.5 | AD21: 20.0 | AE21: 40.0 | AF21: (if((ROUND(RC[-1],2) = 0),0,((100 * ROUND(RC[-2],2)) / ROUND(RC[-1],2))))/100.0 -> 0.5 | AG21: 20.0 | AH21: 40.0 | AI21: (if((ROUND(RC[-1],2) = 0),0,((100 * ROUND(RC[-2],2)) / ROUND(RC[-1],2))))/100.0 -> 0.5 | AJ21: 20.0 | AK21: 40.0 | AL21: (if((ROUND(RC[-1],2) = 0),0,((100 * ROUND(RC[-2],2)) / ROUND(RC[-1],2))))/100.0 -> 0.5 | AN21: 40.0 | AO21: (if((ROUND(RC[-1],2) = 0),0,((100 * ROUND(RC[-2],2)) / ROUND(RC[-1],2))))/100.0 -> 0.0 | AP21: 8.0 | AQ21: 16.0 | AR21: (if((ROUND(RC[-1],2) = 0),0,((100 * ROUND(RC[-2],2)) / ROUND(RC[-1],2))))/100.0 -> 0.5 | AS21: SUM(RC[-42],RC[-39],RC[-36],RC[-33],RC[-30],RC[-27],RC[-24],RC[-21],RC[-18],RC[-15],RC[-12],RC[-9],RC[-6],RC[-3]) -> 188.0 | AT21: SUM(RC[-42],RC[-39],RC[-36],RC[-33],RC[-30],RC[-27],RC[-24],RC[-21],RC[-18],RC[-15],RC[-12],RC[-9],RC[-6],RC[-3]) -> 528.0 | AU21: (if((ROUND(RC[-1],2) = 0),0,((100 * ROUND(RC[-2],2)) / ROUND(RC[-1],2))))/100.0 -> 0.3560606060606061
A22: Gerrit Hop
B23: Cus-01163 Aryza B.V. : Proj-00875 Direct sales 2025 | C23: 12.8 | D23: 32.0 | E23: (if((ROUND(RC[-1],2) = 0),0,((100 * ROUND(RC[-2],2)) / ROUND(RC[-1],2))))/100.0 -> 0.4 | G23: 40.0 | H23: (if((ROUND(RC[-1],2) = 0),0,((100 * ROUND(RC[-2],2)) / ROUND(RC[-1],2))))/100.0 -> 0.0 | J23: 40.0 | K23: (if((ROUND(RC[-1],2) = 0),0,((100 * ROUND(RC[-2],2)) / ROUND(RC[-1],2))))/100.0 -> 0.0 | M23: 40.0 | N23: (if((ROUND(RC[-1],2) = 0),0,((100 * ROUND(RC[-2],2)) / ROUND(RC[-1],2))))/100.0 -> 0.0 | P23: 40.0 | Q23: (if((ROUND(RC[-1],2) = 0),0,((100 * ROUND(RC[-2],2)) / ROUND(RC[-1],2))))/100.0 -> 0.0 | S23: 40.0 | T23: (if((ROUND(RC[-1],2) = 0),0,((100 * ROUND(RC[-2],2)) / ROUND(RC[-1],2))))/100.0 -> 0.0 | V23: 40.0 | W23: (if((ROUND(RC[-1],2) = 0),0,((100 * ROUND(RC[-2],2)) / ROUND(RC[-1],2))))/100.0 -> 0.0 | Y23: 40.0 | Z23: (if((ROUND(RC[-1],2) = 0),0,((100 * ROUND(RC[-2],2)) / ROUND(RC[-1],2))))/100.0 -> 0.0 | AB23: 40.0 | AC23: (if((ROUND(RC[-1],2) = 0),0,((100 * ROUND(RC[-2],2)) / ROUND(RC[-1],2))))/100.0 -> 0.0 | AE23: 40.0 | AF23: (if((ROUND(RC[-1],2) = 0),0,((100 * ROUND(RC[-2],2)) / ROUND(RC[-1],2))))/100.0 -> 0.0 | AH23: 40.0 | AI23: (if((ROUND(RC[-1],2) = 0),0,((100 * ROUND(RC[-2],2)) / ROUND(RC[-1],2))))/100.0 -> 0.0 | AK23: 40.0 | AL23: (if((ROUND(RC[-1],2) = 0),0,((100 * ROUND(RC[-2],2)) / ROUND(RC[-1],2))))/100.0 -> 0.0 | AN23: 40.0 | AO23: (if((ROUND(RC[-1],2) = 0),0,((100 * ROUND(RC[-2],2)) / ROUND(RC[-1],2))))/100.0 -> 0.0 | AQ23: 16.0 | AR23: (if((ROUND(RC[-1],2) = 0),0,((100 * ROUND(RC[-2],2)) / ROUND(RC[-1],2))))/100.0 -> 0.0 | AS23: SUM(RC[-42],RC[-39],RC[-36],RC[-33],RC[-30],RC[-27],RC[-24],RC[-21],RC[-18],RC[-15],RC[-12],RC[-9],RC[-6],RC[-3]) -> 12.8 | AT23: SUM(RC[-42],RC[-39],RC[-36],RC[-33],RC[-30],RC[-27],RC[-24],RC[-21],RC[-18],RC[-15],RC[-12],RC[-9],RC[-6],RC[-3]) -> 528.0 | AU23: (if((ROUND(RC[-1],2) = 0),0,((100 * ROUND(RC[-2],2)) / ROUND(RC[-1],2))))/100.0 -> 0.024242424242424242
B24: Cus-01163 Aryza B.V. : Proj-00976 Interne uren 2025 | C24: 3.2 | D24: 32.0 | E24: (if((ROUND(RC[-1],2) = 0),0,((100 * ROUND(RC[-2],2)) / ROUND(RC[-1],2))))/100.0 -> 0.1 | F24: 4.0 | G24: 40.0 | H24: (if((ROUND(RC[-1],2) = 0),0,((100 * ROUND(RC[-2],2)) / ROUND(RC[-1],2))))/100.0 -> 0.1 | I24: 4.0 | J24: 40.0 | K24: (if((ROUND(RC[-1],2) = 0),0,((100 * ROUND(RC[-2],2)) / ROUND(RC[-1],2))))/100.0 -> 0.1 | L24: 4.0 | M24: 40.0 | N24: (if((ROUND(RC[-1],2) = 0),0,((100 * ROUND(RC[-2],2)) / ROUND(RC[-1],2))))/100.0 -> 0.1 | O24: 6.0 | P24: 40.0 | Q24: (if((ROUND(RC[-1],2) = 0),0,((100 * ROUND(RC[-2],2)) / ROUND(RC[-1],2))))/100.0 -> 0.15 | R24: 4.0 | S24: 40.0 | T24: (if((ROUND(RC[-1],2) = 0),0,((100 * ROUND(RC[-2],2)) / ROUND(RC[-1],2))))/100.0 -> 0.1 | V24: 40.0 | W24: (if((ROUND(RC[-1],2) = 0),0,((100 * ROUND(RC[-2],2)) / ROUND(RC[-1],2))))/100.0 -> 0.0 | X24: 4.0 | Y24: 40.0 | Z24: (if((ROUND(RC[-1],2) = 0),0,((100 * ROUND(RC[-2],2)) / ROUND(RC[-1],2))))/100.0 -> 0.1 | AA24: 4.0 | AB24: 40.0 | AC24: (if((ROUND(RC[-1],2) = 0),0,((100 * ROUND(RC[-2],2)) / ROUND(RC[-1],2))))/100.0 -> 0.1 | AD24: 6.0 | AE24: 40.0 | AF24: (if((ROUND(RC[-1],2) = 0),0,((100 * ROUND(RC[-2],2)) / ROUND(RC[-1],2))))/100.0 -> 0.15 | AG24: 4.0 | AH24: 40.0 | AI24: (if((ROUND(RC[-1],2) = 0),0,((100 * ROUND(RC[-2],2)) / ROUND(RC[-1],2))))/100.0 -> 0.1 | AJ24: 4.0 | AK24: 40.0 | AL24: (if((ROUND(RC[-1],2) = 0),0,((100 * ROUND(RC[-2],2)) / ROUND(RC[-1],2))))/100.0 -> 0.1 | AM24: 4.0 | AN24: 40.0 | AO24: (if((ROUND(RC[-1],2) = 0),0,((100 * ROUND(RC[-2],2)) / ROUND(RC[-1],2))))/100.0 -> 0.1 | AP24: 2.4 | AQ24: 16.0 | AR24: (if((ROUND(RC[-1],2) = 0),0,((100 * ROUND(RC[-2],2)) / ROUND(RC[-1],2))))/100.0 -> 0.15 | AS24: SUM(RC[-42],RC[-39],RC[-36],RC[-33],RC[-30],RC[-27],RC[-24],RC[-21],RC[-18],RC[-15],RC[-12],RC[-9],RC[-6],RC[-3]) -> 53.6 | AT24: SUM(RC[-42],RC[-39],RC[-36],RC[-33],RC[-30],RC[-27],RC[-24],RC[-21],RC[-18],RC[-15],RC[-12],RC[-9],RC[-6],RC[-3]) -> 528.0 | AU24: (if((ROUND(RC[-1],2) = 0),0,((100 * ROUND(RC[-2],2)) / ROUND(RC[-1],2))))/100.0 -> 0.10151515151515152
B25: Cus-01163 Aryza B.V. : Proj-01123 GoPay Email in Bulk | D25: 32.0 | E25: (if((ROUND(RC[-1],2) = 0),0,((100 * ROUND(RC[-2],2)) / ROUND(RC[-1],2))))/100.0 -> 0.0 | G25: 40.0 | H25: (if((ROUND(RC[-1],2) = 0),0,((100 * ROUND(RC[-2],2)) / ROUND(RC[-1],2))))/100.0 -> 0.0 | J25: 40.0 | K25: (if((ROUND(RC[-1],2) = 0),0,((100 * ROUND(RC[-2],2)) / ROUND(RC[-1],2))))/100.0 -> 0.0 | L25: 2.0 | M25: 40.0 | N25: (if((ROUND(RC[-1],2) = 0),0,((100 * ROUND(RC[-2],2)) / ROUND(RC[-1],2))))/100.0 -> 0.05 | P25: 40.0 | Q25: (if((ROUND(RC[-1],2) = 0),0,((100 * ROUND(RC[-2],2)) / ROUND(RC[-1],2))))/100.0 -> 0.0 | S25: 40.0 | T25: (if((ROUND(RC[-1],2) = 0),0,((100 * ROUND(RC[-2],2)) / ROUND(RC[-1],2))))/100.0 -> 0.0 | V25: 40.0 | W25: (if((ROUND(RC[-1],2) = 0),0,((100 * ROUND(RC[-2],2)) / ROUND(RC[-1],2))))/100.0 -> 0.0 | Y25: 40.0 | Z25: (if((ROUND(RC[-1],2) = 0),0,((100 * ROUND(RC[-2],2)) / ROUND(RC[-1],2))))/100.0 -> 0.0 | AB25: 40.0 | AC25: (if((ROUND(RC[-1],2) = 0),0,((100 * ROUND(RC[-2],2)) / ROUND(RC[-1],2))))/100.0 -> 0.0 | AE25: 40.0 | AF25: (if((ROUND(RC[-1],2) = 0),0,((100 * ROUND(RC[-2],2)) / ROUND(RC[-1],2))))/100.0 -> 0.0 | AH25: 40.0 | AI25: (if((ROUND(RC[-1],2) = 0),0,((100 * ROUND(RC[-2],2)) / ROUND(RC[-1],2))))/100.0 -> 0.0 | AK25: 40.0 | AL25: (if((ROUND(RC[-1],2) = 0),0,((100 * ROUND(RC[-2],2)) / ROUND(RC[-1],2))))/100.0 -> 0.0 | AN25: 40.0 | AO25: (if((ROUND(RC[-1],2) = 0),0,((100 * ROUND(RC[-2],2)) / ROUND(RC[-1],2))))/100.0 -> 0.0 | AQ25: 16.0 | AR25: (if((ROUND(RC[-1],2) = 0),0,((100 * ROUND(RC[-2],2)) / ROUND(RC[-1],2))))/100.0 -> 0.0 | AS25: SUM(RC[-42],RC[-39],RC[-36],RC[-33],RC[-30],RC[-27],RC[-24],RC[-21],RC[-18],RC[-15],RC[-12],RC[-9],RC[-6],RC[-3]) -> 2.0 | AT25: SUM(RC[-42],RC[-39],RC[-36],RC[-33],RC[-30],RC[-27],RC[-24],RC[-21],RC[-18],RC[-15],RC[-12],RC[-9],RC[-6],RC[-3]) -> 528.0 | AU25: (if((ROUND(RC[-1],2) = 0),0,((100 * ROUND(RC[-2],2)) / ROUND(RC[-1],2))))/100.0 -> 0.003787878787878788
B26: Cus-01214 Creditbility B.V. : Proj-01056 OPDPortal Notificaties | C26: 8.0 | D26: 32.0 | E26: (if((ROUND(RC[-1],2) = 0),0,((100 * ROUND(RC[-2],2)) / ROUND(RC[-1],2))))/100.0 -> 0.25 | G26: 40.0 | H26: (if((ROUND(RC[-1],2) = 0),0,((100 * ROUND(RC[-2],2)) / ROUND(RC[-1],2))))/100.0 -> 0.0 | J26: 40.0 | K26: (if((ROUND(RC[-1],2) = 0),0,((100 * ROUND(RC[-2],2)) / ROUND(RC[-1],2))))/100.0 -> 0.0 | M26: 40.0 | N26: (if((ROUND(RC[-1],2) = 0),0,((100 * ROUND(RC[-2],2)) / ROUND(RC[-1],2))))/100.0 -> 0.0 | P26: 40.0 | Q26: (if((ROUND(RC[-1],2) = 0),0,((100 * ROUND(RC[-2],2)) / ROUND(RC[-1],2))))/100.0 -> 0.0 | S26: 40.0 | T26: (if((ROUND(RC[-1],2) = 0),0,((100 * ROUND(RC[-2],2)) / ROUND(RC[-1],2))))/100.0 -> 0.0 | V26: 40.0 | W26: (if((ROUND(RC[-1],2) = 0),0,((100 * ROUND(RC[-2],2)) / ROUND(RC[-1],2))))/100.0 -> 0.0 | Y26: 40.0 | Z26: (if((ROUND(RC[-1],2) = 0),0,((100 * ROUND(RC[-2],2)) / ROUND(RC[-1],2))))/100.0 -> 0.0 | AB26: 40.0 | AC26: (if((ROUND(RC[-1],2) = 0),0,((100 * ROUND(RC[-2],2)) / ROUND(RC[-1],2))))/100.0 -> 0.0 | AE26: 40.0 | AF26: (if((ROUND(RC[-1],2) = 0),0,((100 * ROUND(RC[-2],2)) / ROUND(RC[-1],2))))/100.0 -> 0.0 | AH26: 40.0 | AI26: (if((ROUND(RC[-1],2) = 0),0,((100 * ROUND(RC[-2],2)) / ROUND(RC[-1],2))))/100.0 -> 0.0 | AK26: 40.0 | AL26: (if((ROUND(RC[-1],2) = 0),0,((100 * ROUND(RC[-2],2)) / ROUND(RC[-1],2))))/100.0 -> 0.0 | AN26: 40.0 | AO26: (if((ROUND(RC[-1],2) = 0),0,((100 * ROUND(RC[-2],2)) / ROUND(RC[-1],2))))/100.0 -> 0.0 | AQ26: 16.0 | AR26: (if((ROUND(RC[-1],2) = 0),0,((100 * ROUND(RC[-2],2)) / ROUND(RC[-1],2))))/100.0 -> 0.0 | AS26: SUM(RC[-42],RC[-39],RC[-36],RC[-33],RC[-30],RC[-27],RC[-24],RC[-21],RC[-18],RC[-15],RC[-12],RC[-9],RC[-6],RC[-3]) -> 8.0 | AT26: SUM(RC[-42],RC[-39],RC[-36],RC[-33],RC[-30],RC[-27],RC[-24],RC[-21],RC[-18],RC[-15],RC[-12],RC[-9],RC[-6],RC[-3]) -> 528.0 | AU26: (if((ROUND(RC[-1],2) = 0),0,((100 * ROUND(RC[-2],2)) / ROUND(RC[-1],2))))/100.0 -> 0.015151515151515152
B27: Cus-01736 LDCR Afd. Fin. : Proj-00805 LDCR C-Kasapplicatie | D27: 32.0 | E27: (if((ROUND(RC[-1],2) = 0),0,((100 * ROUND(RC[-2],2)) / ROUND(RC[-1],2))))/100.0 -> 0.0 | G27: 40.0 | H27: (if((ROUND(RC[-1],2) = 0),0,((100 * ROUND(RC[-2],2)) / ROUND(RC[-1],2))))/100.0 -> 0.0 | J27: 40.0 | K27: (if((ROUND(RC[-1],2) = 0),0,((100 * ROUND(RC[-2],2)) / ROUND(RC[-1],2))))/100.0 -> 0.0 | L27: 28.0 | M27: 40.0 | N27: (if((ROUND(RC[-1],2) = 0),0,((100 * ROUND(RC[-2],2)) / ROUND(RC[-1],2))))/100.0 -> 0.7 | O27: 28.0 | P27: 40.0 | Q27: (if((ROUND(RC[-1],2) = 0),0,((100 * ROUND(RC[-2],2)) / ROUND(RC[-1],2))))/100.0 -> 0.7 | S27: 40.0 | T27: (if((ROUND(RC[-1],2) = 0),0,((100 * ROUND(RC[-2],2)) / ROUND(RC[-1],2))))/100.0 -> 0.0 | V27: 40.0 | W27: (if((ROUND(RC[-1],2) = 0),0,((100 * ROUND(RC[-2],2)) / ROUND(RC[-1],2))))/100.0 -> 0.0 | X27: 30.0 | Y27: 40.0 | Z27: (if((ROUND(RC[-1],2) = 0),0,((100 * ROUND(RC[-2],2)) / ROUND(RC[-1],2))))/100.0 -> 0.75 | AA27: 7.0 | AB27: 40.0 | AC27: (if((ROUND(RC[-1],2) = 0),0,((100 * ROUND(RC[-2],2)) / ROUND(RC[-1],2))))/100.0 -> 0.175 | AD27: 7.0 | AE27: 40.0 | AF27: (if((ROUND(RC[-1],2) = 0),0,((100 * ROUND(RC[-2],2)) / ROUND(RC[-1],2))))/100.0 -> 0.175 | AG27: 7.0 | AH27: 40.0 | AI27: (if((ROUND(RC[-1],2) = 0),0,((100 * ROUND(RC[-2],2)) / ROUND(RC[-1],2))))/100.0 -> 0.175 | AJ27: 7.0 | AK27: 40.0 | AL27: (if((ROUND(RC[-1],2) = 0),0,((100 * ROUND(RC[-2],2)) / ROUND(RC[-1],2))))/100.0 -> 0.175 | AM27: 7.0 | AN27: 40.0 | AO27: (if((ROUND(RC[-1],2) = 0),0,((100 * ROUND(RC[-2],2)) / ROUND(RC[-1],2))))/100.0 -> 0.175 | AP27: 2.8 | AQ27: 16.0 | AR27: (if((ROUND(RC[-1],2) = 0),0,((100 * ROUND(RC[-2],2)) / ROUND(RC[-1],2))))/100.0 -> 0.175 | AS27: SUM(RC[-42],RC[-39],RC[-36],RC[-33],RC[-30],RC[-27],RC[-24],RC[-21],RC[-18],RC[-15],RC[-12],RC[-9],RC[-6],RC[-3]) -> 123.8 | AT27: SUM(RC[-42],RC[-39],RC[-36],RC[-33],RC[-30],RC[-27],RC[-24],RC[-21],RC[-18],RC[-15],RC[-12],RC[-9],RC[-6],RC[-3]) -> 528.0 | AU27: (if((ROUND(RC[-1],2) = 0),0,((100 * ROUND(RC[-2],2)) / ROUND(RC[-1],2))))/100.0 -> 0.23446969696969697
A28: Total - Gerrit Hop | C28: SUM(R[-5]C:R[-1]C) -> 24.0 | D28: 32.0 | E28: (if((ROUND(RC[-1],2) = 0),0,((100 * ROUND(RC[-2],2)) / ROUND(RC[-1],2))))/100.0 -> 0.75 | F28: SUM(R[-5]C:R[-1]C) -> 4.0 | G28: 40.0 | H28: (if((ROUND(RC[-1],2) = 0),0,((100 * ROUND(RC[-2],2)) / ROUND(RC[-1],2))))/100.0 -> 0.1 | I28: SUM(R[-5]C:R[-1]C) -> 4.0 | J28: 40.0 | K28: (if((ROUND(RC[-1],2) = 0),0,((100 * ROUND(RC[-2],2)) / ROUND(RC[-1],2))))/100.0 -> 0.1 | L28: SUM(R[-5]C:R[-1]C) -> 34.0 | M28: 40.0 | N28: (if((ROUND(RC[-1],2) = 0),0,((100 * ROUND(RC[-2],2)) / ROUND(RC[-1],2))))/100.0 -> 0.85 | O28: SUM(R[-5]C:R[-1]C) -> 34.0 | P28: 40.0 | Q28: (if((ROUND(RC[-1],2) = 0),0,((100 * ROUND(RC[-2],2)) / ROUND(RC[-1],2))))/100.0 -> 0.85 | R28: SUM(R[-5]C:R[-1]C) -> 4.0 | S28: 40.0 | T28: (if((ROUND(RC[-1],2) = 0),0,((100 * ROUND(RC[-2],2)) / ROUND(RC[-1],2))))/100.0 -> 0.1 | U28: SUM(R[-5]C:R[-1]C) ->  | V28: 40.0 | W28: (if((ROUND(RC[-1],2) = 0),0,((100 * ROUND(RC[-2],2)) / ROUND(RC[-1],2))))/100.0 -> 0.0 | X28: SUM(R[-5]C:R[-1]C) -> 34.0 | Y28: 40.0 | Z28: (if((ROUND(RC[-1],2) = 0),0,((100 * ROUND(RC[-2],2)) / ROUND(RC[-1],2))))/100.0 -> 0.85 | AA28: SUM(R[-5]C:R[-1]C) -> 11.0 | AB28: 40.0 | AC28: (if((ROUND(RC[-1],2) = 0),0,((100 * ROUND(RC[-2],2)) / ROUND(RC[-1],2))))/100.0 -> 0.275 | AD28: SUM(R[-5]C:R[-1]C) -> 13.0 | AE28: 40.0 | AF28: (if((ROUND(RC[-1],2) = 0),0,((100 * ROUND(RC[-2],2)) / ROUND(RC[-1],2))))/100.0 -> 0.325 | AG28: SUM(R[-5]C:R[-1]C) -> 11.0 | AH28: 40.0 | AI28: (if((ROUND(RC[-1],2) = 0),0,((100 * ROUND(RC[-2],2)) / ROUND(RC[-1],2))))/100.0 -> 0.275 | AJ28: SUM(R[-5]C:R[-1]C) -> 11.0 | AK28: 40.0 | AL28: (if((ROUND(RC[-1],2) = 0),0,((100 * ROUND(RC[-2],2)) / ROUND(RC[-1],2))))/100.0 -> 0.275 | AM28: SUM(R[-5]C:R[-1]C) -> 11.0 | AN28: 40.0 | AO28: (if((ROUND(RC[-1],2) = 0),0,((100 * ROUND(RC[-2],2)) / ROUND(RC[-1],2))))/100.0 -> 0.275 | AP28: SUM(R[-5]C:R[-1]C) -> 5.199999999999999 | AQ28: 16.0 | AR28: (if((ROUND(RC[-1],2) = 0),0,((100 * ROUND(RC[-2],2)) / ROUND(RC[-1],2))))/100.0 -> 0.325 | AS28: SUM(R[-5]C:R[-1]C) -> 200.2 | AT28: SUM(R[-5]C:R[-1]C) -> 528.0 | AU28: (if((ROUND(RC[-1],2) = 0),0,((100 * ROUND(RC[-2],2)) / ROUND(RC[-1],2))))/100.0 -> 0.37916666666666665
A29: Hans Janssen
B30: Cus-01163 Aryza B.V. : Proj-00976 Interne uren 2025 | C30: 26.4 | D30: 32.0 | E30: (if((ROUND(RC[-1],2) = 0),0,((100 * ROUND(RC[-2],2)) / ROUND(RC[-1],2))))/100.0 -> 0.825 | F30: 33.0 | G30: 40.0 | H30: (if((ROUND(RC[-1],2) = 0),0,((100 * ROUND(RC[-2],2)) / ROUND(RC[-1],2))))/100.0 -> 0.825 | I30: 33.0 | J30: 40.0 | K30: (if((ROUND(RC[-1],2) = 0),0,((100 * ROUND(RC[-2],2)) / ROUND(RC[-1],2))))/100.0 -> 0.825 | L30: 33.0 | M30: 40.0 | N30: (if((ROUND(RC[-1],2) = 0),0,((100 * ROUND(RC[-2],2)) / ROUND(RC[-1],2))))/100.0 -> 0.825 | O30: 33.0 | P30: 40.0 | Q30: (if((ROUND(RC[-1],2) = 0),0,((100 * ROUND(RC[-2],2)) / ROUND(RC[-1],2))))/100.0 -> 0.825 | R30: 1.0 | S30: 40.0 | T30: (if((ROUND(RC[-1],2) = 0),0,((100 * ROUND(RC[-2],2)) / ROUND(RC[-1],2))))/100.0 -> 0.025 | U30: 1.0 | V30: 40.0 | W30: (if((ROUND(RC[-1],2) = 0),0,((100 * ROUND(RC[-2],2)) / ROUND(RC[-1],2))))/100.0 -> 0.025 | X30: 1.0 | Y30: 40.0 | Z30: (if((ROUND(RC[-1],2) = 0),0,((100 * ROUND(RC[-2],2)) / ROUND(RC[-1],2))))/100.0 -> 0.025 | AA30: 1.0 | AB30: 40.0 | AC30: (if((ROUND(RC[-1],2) = 0),0,((100 * ROUND(RC[-2],2)) / ROUND(RC[-1],2))))/100.0 -> 0.025 | AD30: 3.0 | AE30: 40.0 | AF30: (if((ROUND(RC[-1],2) = 0),0,((100 * ROUND(RC[-2],2)) / ROUND(RC[-1],2))))/100.0 -> 0.075 | AG30: 1.0 | AH30: 40.0 | AI30: (if((ROUND(RC[-1],2) = 0),0,((100 * ROUND(RC[-2],2)) / ROUND(RC[-1],2))))/100.0 -> 0.025 | AJ30: 1.0 | AK30: 40.0 | AL30: (if((ROUND(RC[-1],2) = 0),0,((100 * ROUND(RC[-2],2)) / ROUND(RC[-1],2))))/100.0 -> 0.025 | AM30: 1.0 | AN30: 40.0 | AO30: (if((ROUND(RC[-1],2) = 0),0,((100 * ROUND(RC[-2],2)) / ROUND(RC[-1],2))))/100.0 -> 0.025 | AP30: 1.2 | AQ30: 16.0 | AR30: (if((ROUND(RC[-1],2) = 0),0,((100 * ROUND(RC[-2],2)) / ROUND(RC[-1],2))))/100.0 -> 0.075 | AS30: SUM(RC[-42],RC[-39],RC[-36],RC[-33],RC[-30],RC[-27],RC[-24],RC[-21],RC[-18],RC[-15],RC[-12],RC[-9],RC[-6],RC[-3]) -> 169.6 | AT30: SUM(RC[-42],RC[-39],RC[-36],RC[-33],RC[-30],RC[-27],RC[-24],RC[-21],RC[-18],RC[-15],RC[-12],RC[-9],RC[-6],RC[-3]) -> 528.0 | AU30: (if((ROUND(RC[-1],2) = 0),0,((100 * ROUND(RC[-2],2)) / ROUND(RC[-1],2))))/100.0 -> 0.3212121212121212
B31: Cus-01168 DipNed MR : Proj-00993 DipNed - DipNed Algemeen 2025 | D31: 32.0 | E31: (if((ROUND(RC[-1],2) = 0),0,((100 * ROUND(RC[-2],2)) / ROUND(RC[-1],2))))/100.0 -> 0.0 | G31: 40.0 | H31: (if((ROUND(RC[-1],2) = 0),0,((100 * ROUND(RC[-2],2)) / ROUND(RC[-1],2))))/100.0 -> 0.0 | J31: 40.0 | K31: (if((ROUND(RC[-1],2) = 0),0,((100 * ROUND(RC[-2],2)) / ROUND(RC[-1],2))))/100.0 -> 0.0 | M31: 40.0 | N31: (if((ROUND(RC[-1],2) = 0),0,((100 * ROUND(RC[-2],2)) / ROUND(RC[-1],2))))/100.0 -> 0.0 | P31: 40.0 | Q31: (if((ROUND(RC[-1],2) = 0),0,((100 * ROUND(RC[-2],2)) / ROUND(RC[-1],2))))/100.0 -> 0.0 | S31: 40.0 | T31: (if((ROUND(RC[-1],2) = 0),0,((100 * ROUND(RC[-2],2)) / ROUND(RC[-1],2))))/100.0 -> 0.0 | U31: 2.0 | V31: 40.0 | W31: (if((ROUND(RC[-1],2) = 0),0,((100 * ROUND(RC[-2],2)) / ROUND(RC[-1],2))))/100.0 -> 0.05 | Y31: 40.0 | Z31: (if((ROUND(RC[-1],2) = 0),0,((100 * ROUND(RC[-2],2)) / ROUND(RC[-1],2))))/100.0 -> 0.0 | AB31: 40.0 | AC31: (if((ROUND(RC[-1],2) = 0),0,((100 * ROUND(RC[-2],2)) / ROUND(RC[-1],2))))/100.0 -> 0.0 | AE31: 40.0 | AF31: (if((ROUND(RC[-1],2) = 0),0,((100 * ROUND(RC[-2],2)) / ROUND(RC[-1],2))))/100.0 -> 0.0 | AH31: 40.0 | AI31: (if((ROUND(RC[-1],2) = 0),0,((100 * ROUND(RC[-2],2)) / ROUND(RC[-1],2))))/100.0 -> 0.0 | AK31: 40.0 | AL31: (if((ROUND(RC[-1],2) = 0),0,((100 * ROUND(RC[-2],2)) / ROUND(RC[-1],2))))/100.0 -> 0.0 | AN31: 40.0 | AO31: (if((ROUND(RC[-1],2) = 0),0,((100 * ROUND(RC[-2],2)) / ROUND(RC[-1],2))))/100.0 -> 0.0 | AQ31: 16.0 | AR31: (if((ROUND(RC[-1],2) = 0),0,((100 * ROUND(RC[-2],2)) / ROUND(RC[-1],2))))/100.0 -> 0.0 | AS31: SUM(RC[-42],RC[-39],RC[-36],RC[-33],RC[-30],RC[-27],RC[-24],RC[-21],RC[-18],RC[-15],RC[-12],RC[-9],RC[-6],RC[-3]) -> 2.0 | AT31: SUM(RC[-42],RC[-39],RC[-36],RC[-33],RC[-30],RC[-27],RC[-24],RC[-21],RC[-18],RC[-15],RC[-12],RC[-9],RC[-6],RC[-3]) -> 528.0 | AU31: (if((ROUND(RC[-1],2) = 0),0,((100 * ROUND(RC[-2],2)) / ROUND(RC[-1],2))))/100.0 -> 0.003787878787878788
B32: Cus-01168 DipNed MR : Proj-01001 DipNed WKI implementatie in HHF 2025 | D32: 32.0 | E32: (if((ROUND(RC[-1],2) = 0),0,((100 * ROUND(RC[-2],2)) / ROUND(RC[-1],2))))/100.0 -> 0.0 | G32: 40.0 | H32: (if((ROUND(RC[-1],2) = 0),0,((100 * ROUND(RC[-2],2)) / ROUND(RC[-1],2))))/100.0 -> 0.0 | J32: 40.0 | K32: (if((ROUND(RC[-1],2) = 0),0,((100 * ROUND(RC[-2],2)) / ROUND(RC[-1],2))))/100.0 -> 0.0 | M32: 40.0 | N32: (if((ROUND(RC[-1],2) = 0),0,((100 * ROUND(RC[-2],2)) / ROUND(RC[-1],2))))/100.0 -> 0.0 | P32: 40.0 | Q32: (if((ROUND(RC[-1],2) = 0),0,((100 * ROUND(RC[-2],2)) / ROUND(RC[-1],2))))/100.0 -> 0.0 | R32: 16.0 | S32: 40.0 | T32: (if((ROUND(RC[-1],2) = 0),0,((100 * ROUND(RC[-2],2)) / ROUND(RC[-1],2))))/100.0 -> 0.4 | V32: 40.0 | W32: (if((ROUND(RC[-1],2) = 0),0,((100 * ROUND(RC[-2],2)) / ROUND(RC[-1],2))))/100.0 -> 0.0 | Y32: 40.0 | Z32: (if((ROUND(RC[-1],2) = 0),0,((100 * ROUND(RC[-2],2)) / ROUND(RC[-1],2))))/100.0 -> 0.0 | AB32: 40.0 | AC32: (if((ROUND(RC[-1],2) = 0),0,((100 * ROUND(RC[-2],2)) / ROUND(RC[-1],2))))/100.0 -> 0.0 | AE32: 40.0 | AF32: (if((ROUND(RC[-1],2) = 0),0,((100 * ROUND(RC[-2],2)) / ROUND(RC[-1],2))))/100.0 -> 0.0 | AH32: 40.0 | AI32: (if((ROUND(RC[-1],2) = 0),0,((100 * ROUND(RC[-2],2)) / ROUND(RC[-1],2))))/100.0 -> 0.0 | AK32: 40.0 | AL32: (if((ROUND(RC[-1],2) = 0),0,((100 * ROUND(RC[-2],2)) / ROUND(RC[-1],2))))/100.0 -> 0.0 | AN32: 40.0 | AO32: (if((ROUND(RC[-1],2) = 0),0,((100 * ROUND(RC[-2],2)) / ROUND(RC[-1],2))))/100.0 -> 0.0 | AQ32: 16.0 | AR32: (if((ROUND(RC[-1],2) = 0),0,((100 * ROUND(RC[-2],2)) / ROUND(RC[-1],2))))/100.0 -> 0.0 | AS32: SUM(RC[-42],RC[-39],RC[-36],RC[-33],RC[-30],RC[-27],RC[-24],RC[-21],RC[-18],RC[-15],RC[-12],RC[-9],RC[-6],RC[-3]) -> 16.0 | AT32: SUM(RC[-42],RC[-39],RC[-36],RC[-33],RC[-30],RC[-27],RC[-24],RC[-21],RC[-18],RC[-15],RC[-12],RC[-9],RC[-6],RC[-3]) -> 528.0 | AU32: (if((ROUND(RC[-1],2) = 0),0,((100 * ROUND(RC[-2],2)) / ROUND(RC[-1],2))))/100.0 -> 0.030303030303030304
A33: Total - Hans Janssen | C33: SUM(R[-3]C:R[-1]C) -> 26.4 | D33: 32.0 | E33: (if((ROUND(RC[-1],2) = 0),0,((100 * ROUND(RC[-2],2)) / ROUND(RC[-1],2))))/100.0 -> 0.825 | F33: SUM(R[-3]C:R[-1]C) -> 33.0 | G33: 40.0 | H33: (if((ROUND(RC[-1],2) = 0),0,((100 * ROUND(RC[-2],2)) / ROUND(RC[-1],2))))/100.0 -> 0.825 | I33: SUM(R[-3]C:R[-1]C) -> 33.0 | J33: 40.0 | K33: (if((ROUND(RC[-1],2) = 0),0,((100 * ROUND(RC[-2],2)) / ROUND(RC[-1],2))))/100.0 -> 0.825 | L33: SUM(R[-3]C:R[-1]C) -> 33.0 | M33: 40.0 | N33: (if((ROUND(RC[-1],2) = 0),0,((100 * ROUND(RC[-2],2)) / ROUND(RC[-1],2))))/100.0 -> 0.825 | O33: SUM(R[-3]C:R[-1]C) -> 33.0 | P33: 40.0 | Q33: (if((ROUND(RC[-1],2) = 0),0,((100 * ROUND(RC[-2],2)) / ROUND(RC[-1],2))))/100.0 -> 0.825 | R33: SUM(R[-3]C:R[-1]C) -> 17.0 | S33: 40.0 | T33: (if((ROUND(RC[-1],2) = 0),0,((100 * ROUND(RC[-2],2)) / ROUND(RC[-1],2))))/100.0 -> 0.425 | U33: SUM(R[-3]C:R[-1]C) -> 3.0 | V33: 40.0 | W33: (if((ROUND(RC[-1],2) = 0),0,((100 * ROUND(RC[-2],2)) / ROUND(RC[-1],2))))/100.0 -> 0.075 | X33: SUM(R[-3]C:R[-1]C) -> 1.0 | Y33: 40.0 | Z33: (if((ROUND(RC[-1],2) = 0),0,((100 * ROUND(RC[-2],2)) / ROUND(RC[-1],2))))/100.0 -> 0.025 | AA33: SUM(R[-3]C:R[-1]C) -> 1.0 | AB33: 40.0 | AC33: (if((ROUND(RC[-1],2) = 0),0,((100 * ROUND(RC[-2],2)) / ROUND(RC[-1],2))))/100.0 -> 0.025 | AD33: SUM(R[-3]C:R[-1]C) -> 3.0 | AE33: 40.0 | AF33: (if((ROUND(RC[-1],2) = 0),0,((100 * ROUND(RC[-2],2)) / ROUND(RC[-1],2))))/100.0 -> 0.075 | AG33: SUM(R[-3]C:R[-1]C) -> 1.0 | AH33: 40.0 | AI33: (if((ROUND(RC[-1],2) = 0),0,((100 * ROUND(RC[-2],2)) / ROUND(RC[-1],2))))/100.0 -> 0.025 | AJ33: SUM(R[-3]C:R[-1]C) -> 1.0 | AK33: 40.0 | AL33: (if((ROUND(RC[-1],2) = 0),0,((100 * ROUND(RC[-2],2)) / ROUND(RC[-1],2))))/100.0 -> 0.025 | AM33: SUM(R[-3]C:R[-1]C) -> 1.0 | AN33: 40.0 | AO33: (if((ROUND(RC[-1],2) = 0),0,((100 * ROUND(RC[-2],2)) / ROUND(RC[-1],2))))/100.0 -> 0.025 | AP33: SUM(R[-3]C:R[-1]C) -> 1.2 | AQ33: 16.0 | AR33: (if((ROUND(RC[-1],2) = 0),0,((100 * ROUND(RC[-2],2)) / ROUND(RC[-1],2))))/100.0 -> 0.075 | AS33: SUM(R[-3]C:R[-1]C) -> 187.6 | AT33: SUM(R[-3]C:R[-1]C) -> 528.0 | AU33: (if((ROUND(RC[-1],2) = 0),0,((100 * ROUND(RC[-2],2)) / ROUND(RC[-1],2))))/100.0 -> 0.3553030303030303
A34: Henk Bootsma
B35: Cus-01159 Vesting Finance : Proj-00846 Vesting Finance Maintenance 2025 | D35: 32.0 | E35: (if((ROUND(RC[-1],2) = 0),0,((100 * ROUND(RC[-2],2)) / ROUND(RC[-1],2))))/100.0 -> 0.0 | G35: 40.0 | H35: (if((ROUND(RC[-1],2) = 0),0,((100 * ROUND(RC[-2],2)) / ROUND(RC[-1],2))))/100.0 -> 0.0 | J35: 40.0 | K35: (if((ROUND(RC[-1],2) = 0),0,((100 * ROUND(RC[-2],2)) / ROUND(RC[-1],2))))/100.0 -> 0.0 | L35: 4.0 | M35: 40.0 | N35: (if((ROUND(RC[-1],2) = 0),0,((100 * ROUND(RC[-2],2)) / ROUND(RC[-1],2))))/100.0 -> 0.1 | P35: 40.0 | Q35: (if((ROUND(RC[-1],2) = 0),0,((100 * ROUND(RC[-2],2)) / ROUND(RC[-1],2))))/100.0 -> 0.0 | S35: 40.0 | T35: (if((ROUND(RC[-1],2) = 0),0,((100 * ROUND(RC[-2],2)) / ROUND(RC[-1],2))))/100.0 -> 0.0 | V35: 40.0 | W35: (if((ROUND(RC[-1],2) = 0),0,((100 * ROUND(RC[-2],2)) / ROUND(RC[-1],2))))/100.0 -> 0.0 | Y35: 40.0 | Z35: (if((ROUND(RC[-1],2) = 0),0,((100 * ROUND(RC[-2],2)) / ROUND(RC[-1],2))))/100.0 -> 0.0 | AB35: 40.0 | AC35: (if((ROUND(RC[-1],2) = 0),0,((100 * ROUND(RC[-2],2)) / ROUND(RC[-1],2))))/100.0 -> 0.0 | AE35: 40.0 | AF35: (if((ROUND(RC[-1],2) = 0),0,((100 * ROUND(RC[-2],2)) / ROUND(RC[-1],2))))/100.0 -> 0.0 | AH35: 40.0 | AI35: (if((ROUND(RC[-1],2) = 0),0,((100 * ROUND(RC[-2],2)) / ROUND(RC[-1],2))))/100.0 -> 0.0 | AK35: 40.0 | AL35: (if((ROUND(RC[-1],2) = 0),0,((100 * ROUND(RC[-2],2)) / ROUND(RC[-1],2))))/100.0 -> 0.0 | AN35: 40.0 | AO35: (if((ROUND(RC[-1],2) = 0),0,((100 * ROUND(RC[-2],2)) / ROUND(RC[-1],2))))/100.0 -> 0.0 | AQ35: 16.0 | AR35: (if((ROUND(RC[-1],2) = 0),0,((100 * ROUND(RC[-2],2)) / ROUND(RC[-1],2))))/100.0 -> 0.0 | AS35: SUM(RC[-42],RC[-39],RC[-36],RC[-33],RC[-30],RC[-27],RC[-24],RC[-21],RC[-18],RC[-15],RC[-12],RC[-9],RC[-6],RC[-3]) -> 4.0 | AT35: SUM(RC[-42],RC[-39],RC[-36],RC[-33],RC[-30],RC[-27],RC[-24],RC[-21],RC[-18],RC[-15],RC[-12],RC[-9],RC[-6],RC[-3]) -> 528.0 | AU35: (if((ROUND(RC[-1],2) = 0),0,((100 * ROUND(RC[-2],2)) / ROUND(RC[-1],2))))/100.0 -> 0.007575757575757576
B36: Cus-01163 Aryza B.V. : Proj-00842 Algemeen beheer 2025 | D36: 32.0 | E36: (if((ROUND(RC[-1],2) = 0),0,((100 * ROUND(RC[-2],2)) / ROUND(RC[-1],2))))/100.0 -> 0.0 | G36: 40.0 | H36: (if((ROUND(RC[-1],2) = 0),0,((100 * ROUND(RC[-2],2)) / ROUND(RC[-1],2))))/100.0 -> 0.0 | I36: 4.0 | J36: 40.0 | K36: (if((ROUND(RC[-1],2) = 0),0,((100 * ROUND(RC[-2],2)) / ROUND(RC[-1],2))))/100.0 -> 0.1 | M36: 40.0 | N36: (if((ROUND(RC[-1],2) = 0),0,((100 * ROUND(RC[-2],2)) / ROUND(RC[-1],2))))/100.0 -> 0.0 | O36: 4.0 | P36: 40.0 | Q36: (if((ROUND(RC[-1],2) = 0),0,((100 * ROUND(RC[-2],2)) / ROUND(RC[-1],2))))/100.0 -> 0.1 | R36: 4.0 | S36: 40.0 | T36: (if((ROUND(RC[-1],2) = 0),0,((100 * ROUND(RC[-2],2)) / ROUND(RC[-1],2))))/100.0 -> 0.1 | U36: 4.0 | V36: 40.0 | W36: (if((ROUND(RC[-1],2) = 0),0,((100 * ROUND(RC[-2],2)) / ROUND(RC[-1],2))))/100.0 -> 0.1 | X36: 4.0 | Y36: 40.0 | Z36: (if((ROUND(RC[-1],2) = 0),0,((100 * ROUND(RC[-2],2)) / ROUND(RC[-1],2))))/100.0 -> 0.1 | AA36: 4.0 | AB36: 40.0 | AC36: (if((ROUND(RC[-1],2) = 0),0,((100 * ROUND(RC[-2],2)) / ROUND(RC[-1],2))))/100.0 -> 0.1 | AD36: 4.0 | AE36: 40.0 | AF36: (if((ROUND(RC[-1],2) = 0),0,((100 * ROUND(RC[-2],2)) / ROUND(RC[-1],2))))/100.0 -> 0.1 | AG36: 4.0 | AH36: 40.0 | AI36: (if((ROUND(RC[-1],2) = 0),0,((100 * ROUND(RC[-2],2)) / ROUND(RC[-1],2))))/100.0 -> 0.1 | AJ36: 4.0 | AK36: 40.0 | AL36: (if((ROUND(RC[-1],2) = 0),0,((100 * ROUND(RC[-2],2)) / ROUND(RC[-1],2))))/100.0 -> 0.1 | AM36: 4.0 | AN36: 40.0 | AO36: (if((ROUND(RC[-1],2) = 0),0,((100 * ROUND(RC[-2],2)) / ROUND(RC[-1],2))))/100.0 -> 0.1 | AP36: 1.6 | AQ36: 16.0 | AR36: (if((ROUND(RC[-1],2) = 0),0,((100 * ROUND(RC[-2],2)) / ROUND(RC[-1],2))))/100.0 -> 0.1 | AS36: SUM(RC[-42],RC[-39],RC[-36],RC[-33],RC[-30],RC[-27],RC[-24],RC[-21],RC[-18],RC[-15],RC[-12],RC[-9],RC[-6],RC[-3]) -> 41.6 | AT36: SUM(RC[-42],RC[-39],RC[-36],RC[-33],RC[-30],RC[-27],RC[-24],RC[-21],RC[-18],RC[-15],RC[-12],RC[-9],RC[-6],RC[-3]) -> 528.0 | AU36: (if((ROUND(RC[-1],2) = 0),0,((100 * ROUND(RC[-2],2)) / ROUND(RC[-1],2))))/100.0 -> 0.0787878787878788
B37: Cus-01163 Aryza B.V. : Proj-00874 Roll out 12.2 - 2025 | D37: 32.0 | E37: (if((ROUND(RC[-1],2) = 0),0,((100 * ROUND(RC[-2],2)) / ROUND(RC[-1],2))))/100.0 -> 0.0 | G37: 40.0 | H37: (if((ROUND(RC[-1],2) = 0),0,((100 * ROUND(RC[-2],2)) / ROUND(RC[-1],2))))/100.0 -> 0.0 | I37: 12.0 | J37: 40.0 | K37: (if((ROUND(RC[-1],2) = 0),0,((100 * ROUND(RC[-2],2)) / ROUND(RC[-1],2))))/100.0 -> 0.3 | L37: 12.0 | M37: 40.0 | N37: (if((ROUND(RC[-1],2) = 0),0,((100 * ROUND(RC[-2],2)) / ROUND(RC[-1],2))))/100.0 -> 0.3 | O37: 12.0 | P37: 40.0 | Q37: (if((ROUND(RC[-1],2) = 0),0,((100 * ROUND(RC[-2],2)) / ROUND(RC[-1],2))))/100.0 -> 0.3 | R37: 12.0 | S37: 40.0 | T37: (if((ROUND(RC[-1],2) = 0),0,((100 * ROUND(RC[-2],2)) / ROUND(RC[-1],2))))/100.0 -> 0.3 | U37: 12.0 | V37: 40.0 | W37: (if((ROUND(RC[-1],2) = 0),0,((100 * ROUND(RC[-2],2)) / ROUND(RC[-1],2))))/100.0 -> 0.3 | X37: 12.0 | Y37: 40.0 | Z37: (if((ROUND(RC[-1],2) = 0),0,((100 * ROUND(RC[-2],2)) / ROUND(RC[-1],2))))/100.0 -> 0.3 | AA37: 12.0 | AB37: 40.0 | AC37: (if((ROUND(RC[-1],2) = 0),0,((100 * ROUND(RC[-2],2)) / ROUND(RC[-1],2))))/100.0 -> 0.3 | AD37: 12.0 | AE37: 40.0 | AF37: (if((ROUND(RC[-1],2) = 0),0,((100 * ROUND(RC[-2],2)) / ROUND(RC[-1],2))))/100.0 -> 0.3 | AG37: 12.0 | AH37: 40.0 | AI37: (if((ROUND(RC[-1],2) = 0),0,((100 * ROUND(RC[-2],2)) / ROUND(RC[-1],2))))/100.0 -> 0.3 | AJ37: 12.0 | AK37: 40.0 | AL37: (if((ROUND(RC[-1],2) = 0),0,((100 * ROUND(RC[-2],2)) / ROUND(RC[-1],2))))/100.0 -> 0.3 | AN37: 40.0 | AO37: (if((ROUND(RC[-1],2) = 0),0,((100 * ROUND(RC[-2],2)) / ROUND(RC[-1],2))))/100.0 -> 0.0 | AQ37: 16.0 | AR37: (if((ROUND(RC[-1],2) = 0),0,((100 * ROUND(RC[-2],2)) / ROUND(RC[-1],2))))/100.0 -> 0.0 | AS37: SUM(RC[-42],RC[-39],RC[-36],RC[-33],RC[-30],RC[-27],RC[-24],RC[-21],RC[-18],RC[-15],RC[-12],RC[-9],RC[-6],RC[-3]) -> 120.0 | AT37: SUM(RC[-42],RC[-39],RC[-36],RC[-33],RC[-30],RC[-27],RC[-24],RC[-21],RC[-18],RC[-15],RC[-12],RC[-9],RC[-6],RC[-3]) -> 528.0 | AU37: (if((ROUND(RC[-1],2) = 0),0,((100 * ROUND(RC[-2],2)) / ROUND(RC[-1],2))))/100.0 -> 0.22727272727272727
B38: Cus-01163 Aryza B.V. : Proj-00976 Interne uren 2025 | D38: 32.0 | E38: (if((ROUND(RC[-1],2) = 0),0,((100 * ROUND(RC[-2],2)) / ROUND(RC[-1],2))))/100.0 -> 0.0 | G38: 40.0 | H38: (if((ROUND(RC[-1],2) = 0),0,((100 * ROUND(RC[-2],2)) / ROUND(RC[-1],2))))/100.0 -> 0.0 | I38: 8.0 | J38: 40.0 | K38: (if((ROUND(RC[-1],2) = 0),0,((100 * ROUND(RC[-2],2)) / ROUND(RC[-1],2))))/100.0 -> 0.2 | L38: 8.0 | M38: 40.0 | N38: (if((ROUND(RC[-1],2) = 0),0,((100 * ROUND(RC[-2],2)) / ROUND(RC[-1],2))))/100.0 -> 0.2 | O38: 8.0 | P38: 40.0 | Q38: (if((ROUND(RC[-1],2) = 0),0,((100 * ROUND(RC[-2],2)) / ROUND(RC[-1],2))))/100.0 -> 0.2 | R38: 8.0 | S38: 40.0 | T38: (if((ROUND(RC[-1],2) = 0),0,((100 * ROUND(RC[-2],2)) / ROUND(RC[-1],2))))/100.0 -> 0.2 | U38: 8.0 | V38: 40.0 | W38: (if((ROUND(RC[-1],2) = 0),0,((100 * ROUND(RC[-2],2)) / ROUND(RC[-1],2))))/100.0 -> 0.2 | X38: 8.0 | Y38: 40.0 | Z38: (if((ROUND(RC[-1],2) = 0),0,((100 * ROUND(RC[-2],2)) / ROUND(RC[-1],2))))/100.0 -> 0.2 | AA38: 8.0 | AB38: 40.0 | AC38: (if((ROUND(RC[-1],2) = 0),0,((100 * ROUND(RC[-2],2)) / ROUND(RC[-1],2))))/100.0 -> 0.2 | AD38: 8.0 | AE38: 40.0 | AF38: (if((ROUND(RC[-1],2) = 0),0,((100 * ROUND(RC[-2],2)) / ROUND(RC[-1],2))))/100.0 -> 0.2 | AG38: 8.0 | AH38: 40.0 | AI38: (if((ROUND(RC[-1],2) = 0),0,((100 * ROUND(RC[-2],2)) / ROUND(RC[-1],2))))/100.0 -> 0.2 | AJ38: 8.0 | AK38: 40.0 | AL38: (if((ROUND(RC[-1],2) = 0),0,((100 * ROUND(RC[-2],2)) / ROUND(RC[-1],2))))/100.0 -> 0.2 | AM38: 8.0 | AN38: 40.0 | AO38: (if((ROUND(RC[-1],2) = 0),0,((100 * ROUND(RC[-2],2)) / ROUND(RC[-1],2))))/100.0 -> 0.2 | AP38: 3.2 | AQ38: 16.0 | AR38: (if((ROUND(RC[-1],2) = 0),0,((100 * ROUND(RC[-2],2)) / ROUND(RC[-1],2))))/100.0 -> 0.2 | AS38: SUM(RC[-42],RC[-39],RC[-36],RC[-33],RC[-30],RC[-27],RC[-24],RC[-21],RC[-18],RC[-15],RC[-12],RC[-9],RC[-6],RC[-3]) -> 91.2 | AT38: SUM(RC[-42],RC[-39],RC[-36],RC[-33],RC[-30],RC[-27],RC[-24],RC[-21],RC[-18],RC[-15],RC[-12],RC[-9],RC[-6],RC[-3]) -> 528.0 | AU38: (if((ROUND(RC[-1],2) = 0),0,((100 * ROUND(RC[-2],2)) / ROUND(RC[-1],2))))/100.0 -> 0.17272727272727273
A39: Total - Henk Bootsma | C39: SUM(R[-4]C:R[-1]C) ->  | D39: 32.0 | E39: (if((ROUND(RC[-1],2) = 0),0,((100 * ROUND(RC[-2],2)) / ROUND(RC[-1],2))))/100.0 -> 0.0 | F39: SUM(R[-4]C:R[-1]C) ->  | G39: 40.0 | H39: (if((ROUND(RC[-1],2) = 0),0,((100 * ROUND(RC[-2],2)) / ROUND(RC[-1],2))))/100.0 -> 0.0 | I39: SUM(R[-4]C:R[-1]C) -> 24.0 | J39: 40.0 | K39: (if((ROUND(RC[-1],2) = 0),0,((100 * ROUND(RC[-2],2)) / ROUND(RC[-1],2))))/100.0 -> 0.6 | L39: SUM(R[-4]C:R[-1]C) -> 24.0 | M39: 40.0 | N39: (if((ROUND(RC[-1],2) = 0),0,((100 * ROUND(RC[-2],2)) / ROUND(RC[-1],2))))/100.0 -> 0.6 | O39: SUM(R[-4]C:R[-1]C) -> 24.0 | P39: 40.0 | Q39: (if((ROUND(RC[-1],2) = 0),0,((100 * ROUND(RC[-2],2)) / ROUND(RC[-1],2))))/100.0 -> 0.6 | R39: SUM(R[-4]C:R[-1]C) -> 24.0 | S39: 40.0 | T39: (if((ROUND(RC[-1],2) = 0),0,((100 * ROUND(RC[-2],2)) / ROUND(RC[-1],2))))/100.0 -> 0.6 | U39: SUM(R[-4]C:R[-1]C) -> 24.0 | V39: 40.0 | W39: (if((ROUND(RC[-1],2) = 0),0,((100 * ROUND(RC[-2],2)) / ROUND(RC[-1],2))))/100.0 -> 0.6 | X39: SUM(R[-4]C:R[-1]C) -> 24.0 | Y39: 40.0 | Z39: (if((ROUND(RC[-1],2) = 0),0,((100 * ROUND(RC[-2],2)) / ROUND(RC[-1],2))))/100.0 -> 0.6 | AA39: SUM(R[-4]C:R[-1]C) -> 24.0 | AB39: 40.0 | AC39: (if((ROUND(RC[-1],2) = 0),0,((100 * ROUND(RC[-2],2)) / ROUND(RC[-1],2))))/100.0 -> 0.6 | AD39: SUM(R[-4]C:R[-1]C) -> 24.0 | AE39: 40.0 | AF39: (if((ROUND(RC[-1],2) = 0),0,((100 * ROUND(RC[-2],2)) / ROUND(RC[-1],2))))/100.0 -> 0.6 | AG39: SUM(R[-4]C:R[-1]C) -> 24.0 | AH39: 40.0 | AI39: (if((ROUND(RC[-1],2) = 0),0,((100 * ROUND(RC[-2],2)) / ROUND(RC[-1],2))))/100.0 -> 0.6 | AJ39: SUM(R[-4]C:R[-1]C) -> 24.0 | AK39: 40.0 | AL39: (if((ROUND(RC[-1],2) = 0),0,((100 * ROUND(RC[-2],2)) / ROUND(RC[-1],2))))/100.0 -> 0.6 | AM39: SUM(R[-4]C:R[-1]C) -> 12.0 | AN39: 40.0 | AO39: (if((ROUND(RC[-1],2) = 0),0,((100 * ROUND(RC[-2],2)) / ROUND(RC[-1],2))))/100.0 -> 0.3 | AP39: SUM(R[-4]C:R[-1]C) -> 4.800000000000001 | AQ39: 16.0 | AR39: (if((ROUND(RC[-1],2) = 0),0,((100 * ROUND(RC[-2],2)) / ROUND(RC[-1],2))))/100.0 -> 0.3 | AS39: SUM(R[-4]C:R[-1]C) -> 256.8 | AT39: SUM(R[-4]C:R[-1]C) -> 528.0 | AU39: (if((ROUND(RC[-1],2) = 0),0,((100 * ROUND(RC[-2],2)) / ROUND(RC[-1],2))))/100.0 -> 0.48636363636363633
A40: Hielko Santema
B41: Cus-01120 HNL en Deurwaarder.com : Proj-01039 Voeging HNLBUS - HNLLELY | C41: 0.0 | D41: 32.0 | E41: (if((ROUND(RC[-1],2) = 0),0,((100 * ROUND(RC[-2],2)) / ROUND(RC[-1],2))))/100.0 -> 0.0 | F41: 0.0 | G41: 40.0 | H41: (if((ROUND(RC[-1],2) = 0),0,((100 * ROUND(RC[-2],2)) / ROUND(RC[-1],2))))/100.0 -> 0.0 | I41: 0.0 | J41: 40.0 | K41: (if((ROUND(RC[-1],2) = 0),0,((100 * ROUND(RC[-2],2)) / ROUND(RC[-1],2))))/100.0 -> 0.0 | L41: 32.0 | M41: 40.0 | N41: (if((ROUND(RC[-1],2) = 0),0,((100 * ROUND(RC[-2],2)) / ROUND(RC[-1],2))))/100.0 -> 0.8 | O41: 32.0 | P41: 40.0 | Q41: (if((ROUND(RC[-1],2) = 0),0,((100 * ROUND(RC[-2],2)) / ROUND(RC[-1],2))))/100.0 -> 0.8 | R41: 0.0 | S41: 40.0 | T41: (if((ROUND(RC[-1],2) = 0),0,((100 * ROUND(RC[-2],2)) / ROUND(RC[-1],2))))/100.0 -> 0.0 | U41: 0.0 | V41: 40.0 | W41: (if((ROUND(RC[-1],2) = 0),0,((100 * ROUND(RC[-2],2)) / ROUND(RC[-1],2))))/100.0 -> 0.0 | X41: 0.0 | Y41: 40.0 | Z41: (if((ROUND(RC[-1],2) = 0),0,((100 * ROUND(RC[-2],2)) / ROUND(RC[-1],2))))/100.0 -> 0.0 | AA41: 32.0 | AB41: 40.0 | AC41: (if((ROUND(RC[-1],2) = 0),0,((100 * ROUND(RC[-2],2)) / ROUND(RC[-1],2))))/100.0 -> 0.8 | AD41: 32.0 | AE41: 40.0 | AF41: (if((ROUND(RC[-1],2) = 0),0,((100 * ROUND(RC[-2],2)) / ROUND(RC[-1],2))))/100.0 -> 0.8 | AG41: 32.0 | AH41: 40.0 | AI41: (if((ROUND(RC[-1],2) = 0),0,((100 * ROUND(RC[-2],2)) / ROUND(RC[-1],2))))/100.0 -> 0.8 | AJ41: 32.0 | AK41: 40.0 | AL41: (if((ROUND(RC[-1],2) = 0),0,((100 * ROUND(RC[-2],2)) / ROUND(RC[-1],2))))/100.0 -> 0.8 | AM41: 32.0 | AN41: 40.0 | AO41: (if((ROUND(RC[-1],2) = 0),0,((100 * ROUND(RC[-2],2)) / ROUND(RC[-1],2))))/100.0 -> 0.8 | AP41: 12.8 | AQ41: 16.0 | AR41: (if((ROUND(RC[-1],2) = 0),0,((100 * ROUND(RC[-2],2)) / ROUND(RC[-1],2))))/100.0 -> 0.8 | AS41: SUM(RC[-42],RC[-39],RC[-36],RC[-33],RC[-30],RC[-27],RC[-24],RC[-21],RC[-18],RC[-15],RC[-12],RC[-9],RC[-6],RC[-3]) -> 236.8 | AT41: SUM(RC[-42],RC[-39],RC[-36],RC[-33],RC[-30],RC[-27],RC[-24],RC[-21],RC[-18],RC[-15],RC[-12],RC[-9],RC[-6],RC[-3]) -> 528.0 | AU41: (if((ROUND(RC[-1],2) = 0),0,((100 * ROUND(RC[-2],2)) / ROUND(RC[-1],2))))/100.0 -> 0.4484848484848485
B42: Cus-01159 Vesting Finance : Proj-00797 Samenvoegen VFinc en VFhst - VF | C42: 25.6 | D42: 32.0 | E42: (if((ROUND(RC[-1],2) = 0),0,((100 * ROUND(RC[-2],2)) / ROUND(RC[-1],2))))/100.0 -> 0.8 | F42: 32.0 | G42: 40.0 | H42: (if((ROUND(RC[-1],2) = 0),0,((100 * ROUND(RC[-2],2)) / ROUND(RC[-1],2))))/100.0 -> 0.8 | I42: 32.0 | J42: 40.0 | K42: (if((ROUND(RC[-1],2) = 0),0,((100 * ROUND(RC[-2],2)) / ROUND(RC[-1],2))))/100.0 -> 0.8 | M42: 40.0 | N42: (if((ROUND(RC[-1],2) = 0),0,((100 * ROUND(RC[-2],2)) / ROUND(RC[-1],2))))/100.0 -> 0.0 | P42: 40.0 | Q42: (if((ROUND(RC[-1],2) = 0),0,((100 * ROUND(RC[-2],2)) / ROUND(RC[-1],2))))/100.0 -> 0.0 | S42: 40.0 | T42: (if((ROUND(RC[-1],2) = 0),0,((100 * ROUND(RC[-2],2)) / ROUND(RC[-1],2))))/100.0 -> 0.0 | V42: 40.0 | W42: (if((ROUND(RC[-1],2) = 0),0,((100 * ROUND(RC[-2],2)) / ROUND(RC[-1],2))))/100.0 -> 0.0 | Y42: 40.0 | Z42: (if((ROUND(RC[-1],2) = 0),0,((100 * ROUND(RC[-2],2)) / ROUND(RC[-1],2))))/100.0 -> 0.0 | AB42: 40.0 | AC42: (if((ROUND(RC[-1],2) = 0),0,((100 * ROUND(RC[-2],2)) / ROUND(RC[-1],2))))/100.0 -> 0.0 | AE42: 40.0 | AF42: (if((ROUND(RC[-1],2) = 0),0,((100 * ROUND(RC[-2],2)) / ROUND(RC[-1],2))))/100.0 -> 0.0 | AH42: 40.0 | AI42: (if((ROUND(RC[-1],2) = 0),0,((100 * ROUND(RC[-2],2)) / ROUND(RC[-1],2))))/100.0 -> 0.0 | AK42: 40.0 | AL42: (if((ROUND(RC[-1],2) = 0),0,((100 * ROUND(RC[-2],2)) / ROUND(RC[-1],2))))/100.0 -> 0.0 | AN42: 40.0 | AO42: (if((ROUND(RC[-1],2) = 0),0,((100 * ROUND(RC[-2],2)) / ROUND(RC[-1],2))))/100.0 -> 0.0 | AQ42: 16.0 | AR42: (if((ROUND(RC[-1],2) = 0),0,((100 * ROUND(RC[-2],2)) / ROUND(RC[-1],2))))/100.0 -> 0.0 | AS42: SUM(RC[-42],RC[-39],RC[-36],RC[-33],RC[-30],RC[-27],RC[-24],RC[-21],RC[-18],RC[-15],RC[-12],RC[-9],RC[-6],RC[-3]) -> 89.6 | AT42: SUM(RC[-42],RC[-39],RC[-36],RC[-33],RC[-30],RC[-27],RC[-24],RC[-21],RC[-18],RC[-15],RC[-12],RC[-9],RC[-6],RC[-3]) -> 528.0 | AU42: (if((ROUND(RC[-1],2) = 0),0,((100 * ROUND(RC[-2],2)) / ROUND(RC[-1],2))))/100.0 -> 0.16969696969696968
B43: Cus-01163 Aryza B.V. : Proj-00842 Algemeen beheer 2025 | C43: 3.2 | D43: 32.0 | E43: (if((ROUND(RC[-1],2) = 0),0,((100 * ROUND(RC[-2],2)) / ROUND(RC[-1],2))))/100.0 -> 0.1 | F43: 4.0 | G43: 40.0 | H43: (if((ROUND(RC[-1],2) = 0),0,((100 * ROUND(RC[-2],2)) / ROUND(RC[-1],2))))/100.0 -> 0.1 | I43: 4.0 | J43: 40.0 | K43: (if((ROUND(RC[-1],2) = 0),0,((100 * ROUND(RC[-2],2)) / ROUND(RC[-1],2))))/100.0 -> 0.1 | L43: 4.0 | M43: 40.0 | N43: (if((ROUND(RC[-1],2) = 0),0,((100 * ROUND(RC[-2],2)) / ROUND(RC[-1],2))))/100.0 -> 0.1 | O43: 4.0 | P43: 40.0 | Q43: (if((ROUND(RC[-1],2) = 0),0,((100 * ROUND(RC[-2],2)) / ROUND(RC[-1],2))))/100.0 -> 0.1 | S43: 40.0 | T43: (if((ROUND(RC[-1],2) = 0),0,((100 * ROUND(RC[-2],2)) / ROUND(RC[-1],2))))/100.0 -> 0.0 | V43: 40.0 | W43: (if((ROUND(RC[-1],2) = 0),0,((100 * ROUND(RC[-2],2)) / ROUND(RC[-1],2))))/100.0 -> 0.0 | Y43: 40.0 | Z43: (if((ROUND(RC[-1],2) = 0),0,((100 * ROUND(RC[-2],2)) / ROUND(RC[-1],2))))/100.0 -> 0.0 | AA43: 4.0 | AB43: 40.0 | AC43: (if((ROUND(RC[-1],2) = 0),0,((100 * ROUND(RC[-2],2)) / ROUND(RC[-1],2))))/100.0 -> 0.1 | AD43: 4.0 | AE43: 40.0 | AF43: (if((ROUND(RC[-1],2) = 0),0,((100 * ROUND(RC[-2],2)) / ROUND(RC[-1],2))))/100.0 -> 0.1 | AG43: 4.0 | AH43: 40.0 | AI43: (if((ROUND(RC[-1],2) = 0),0,((100 * ROUND(RC[-2],2)) / ROUND(RC[-1],2))))/100.0 -> 0.1 | AJ43: 2.0 | AK43: 40.0 | AL43: (if((ROUND(RC[-1],2) = 0),0,((100 * ROUND(RC[-2],2)) / ROUND(RC[-1],2))))/100.0 -> 0.05 | AM43: 4.0 | AN43: 40.0 | AO43: (if((ROUND(RC[-1],2) = 0),0,((100 * ROUND(RC[-2],2)) / ROUND(RC[-1],2))))/100.0 -> 0.1 | AP43: 1.6 | AQ43: 16.0 | AR43: (if((ROUND(RC[-1],2) = 0),0,((100 * ROUND(RC[-2],2)) / ROUND(RC[-1],2))))/100.0 -> 0.1 | AS43: SUM(RC[-42],RC[-39],RC[-36],RC[-33],RC[-30],RC[-27],RC[-24],RC[-21],RC[-18],RC[-15],RC[-12],RC[-9],RC[-6],RC[-3]) -> 38.800000000000004 | AT43: SUM(RC[-42],RC[-39],RC[-36],RC[-33],RC[-30],RC[-27],RC[-24],RC[-21],RC[-18],RC[-15],RC[-12],RC[-9],RC[-6],RC[-3]) -> 528.0 | AU43: (if((ROUND(RC[-1],2) = 0),0,((100 * ROUND(RC[-2],2)) / ROUND(RC[-1],2))))/100.0 -> 0.07348484848484847
B44: Cus-01163 Aryza B.V. : Proj-00976 Interne uren 2025 | C44: 1.6 | D44: 32.0 | E44: (if((ROUND(RC[-1],2) = 0),0,((100 * ROUND(RC[-2],2)) / ROUND(RC[-1],2))))/100.0 -> 0.05 | F44: 2.0 | G44: 40.0 | H44: (if((ROUND(RC[-1],2) = 0),0,((100 * ROUND(RC[-2],2)) / ROUND(RC[-1],2))))/100.0 -> 0.05 | I44: 2.0 | J44: 40.0 | K44: (if((ROUND(RC[-1],2) = 0),0,((100 * ROUND(RC[-2],2)) / ROUND(RC[-1],2))))/100.0 -> 0.05 | L44: 2.0 | M44: 40.0 | N44: (if((ROUND(RC[-1],2) = 0),0,((100 * ROUND(RC[-2],2)) / ROUND(RC[-1],2))))/100.0 -> 0.05 | O44: 3.0 | P44: 40.0 | Q44: (if((ROUND(RC[-1],2) = 0),0,((100 * ROUND(RC[-2],2)) / ROUND(RC[-1],2))))/100.0 -> 0.075 | S44: 40.0 | T44: (if((ROUND(RC[-1],2) = 0),0,((100 * ROUND(RC[-2],2)) / ROUND(RC[-1],2))))/100.0 -> 0.0 | V44: 40.0 | W44: (if((ROUND(RC[-1],2) = 0),0,((100 * ROUND(RC[-2],2)) / ROUND(RC[-1],2))))/100.0 -> 0.0 | Y44: 40.0 | Z44: (if((ROUND(RC[-1],2) = 0),0,((100 * ROUND(RC[-2],2)) / ROUND(RC[-1],2))))/100.0 -> 0.0 | AA44: 1.0 | AB44: 40.0 | AC44: (if((ROUND(RC[-1],2) = 0),0,((100 * ROUND(RC[-2],2)) / ROUND(RC[-1],2))))/100.0 -> 0.025 | AD44: 2.0 | AE44: 40.0 | AF44: (if((ROUND(RC[-1],2) = 0),0,((100 * ROUND(RC[-2],2)) / ROUND(RC[-1],2))))/100.0 -> 0.05 | AG44: 1.0 | AH44: 40.0 | AI44: (if((ROUND(RC[-1],2) = 0),0,((100 * ROUND(RC[-2],2)) / ROUND(RC[-1],2))))/100.0 -> 0.025 | AJ44: 1.0 | AK44: 40.0 | AL44: (if((ROUND(RC[-1],2) = 0),0,((100 * ROUND(RC[-2],2)) / ROUND(RC[-1],2))))/100.0 -> 0.025 | AM44: 1.0 | AN44: 40.0 | AO44: (if((ROUND(RC[-1],2) = 0),0,((100 * ROUND(RC[-2],2)) / ROUND(RC[-1],2))))/100.0 -> 0.025 | AP44: 0.8 | AQ44: 16.0 | AR44: (if((ROUND(RC[-1],2) = 0),0,((100 * ROUND(RC[-2],2)) / ROUND(RC[-1],2))))/100.0 -> 0.05 | AS44: SUM(RC[-42],RC[-39],RC[-36],RC[-33],RC[-30],RC[-27],RC[-24],RC[-21],RC[-18],RC[-15],RC[-12],RC[-9],RC[-6],RC[-3]) -> 17.400000000000002 | AT44: SUM(RC[-42],RC[-39],RC[-36],RC[-33],RC[-30],RC[-27],RC[-24],RC[-21],RC[-18],RC[-15],RC[-12],RC[-9],RC[-6],RC[-3]) -> 528.0 | AU44: (if((ROUND(RC[-1],2) = 0),0,((100 * ROUND(RC[-2],2)) / ROUND(RC[-1],2))))/100.0 -> 0.03295454545454545
B45: Cus-01163 Aryza B.V. : Proj-00977 Support CITA 2025 | C45: 0.8 | D45: 32.0 | E45: (if((ROUND(RC[-1],2) = 0),0,((100 * ROUND(RC[-2],2)) / ROUND(RC[-1],2))))/100.0 -> 0.025 | F45: 1.0 | G45: 40.0 | H45: (if((ROUND(RC[-1],2) = 0),0,((100 * ROUND(RC[-2],2)) / ROUND(RC[-1],2))))/100.0 -> 0.025 | I45: 1.0 | J45: 40.0 | K45: (if((ROUND(RC[-1],2) = 0),0,((100 * ROUND(RC[-2],2)) / ROUND(RC[-1],2))))/100.0 -> 0.025 | L45: 1.0 | M45: 40.0 | N45: (if((ROUND(RC[-1],2) = 0),0,((100 * ROUND(RC[-2],2)) / ROUND(RC[-1],2))))/100.0 -> 0.025 | P45: 40.0 | Q45: (if((ROUND(RC[-1],2) = 0),0,((100 * ROUND(RC[-2],2)) / ROUND(RC[-1],2))))/100.0 -> 0.0 | S45: 40.0 | T45: (if((ROUND(RC[-1],2) = 0),0,((100 * ROUND(RC[-2],2)) / ROUND(RC[-1],2))))/100.0 -> 0.0 | V45: 40.0 | W45: (if((ROUND(RC[-1],2) = 0),0,((100 * ROUND(RC[-2],2)) / ROUND(RC[-1],2))))/100.0 -> 0.0 | Y45: 40.0 | Z45: (if((ROUND(RC[-1],2) = 0),0,((100 * ROUND(RC[-2],2)) / ROUND(RC[-1],2))))/100.0 -> 0.0 | AA45: 1.0 | AB45: 40.0 | AC45: (if((ROUND(RC[-1],2) = 0),0,((100 * ROUND(RC[-2],2)) / ROUND(RC[-1],2))))/100.0 -> 0.025 | AD45: 1.0 | AE45: 40.0 | AF45: (if((ROUND(RC[-1],2) = 0),0,((100 * ROUND(RC[-2],2)) / ROUND(RC[-1],2))))/100.0 -> 0.025 | AG45: 1.0 | AH45: 40.0 | AI45: (if((ROUND(RC[-1],2) = 0),0,((100 * ROUND(RC[-2],2)) / ROUND(RC[-1],2))))/100.0 -> 0.025 | AJ45: 1.0 | AK45: 40.0 | AL45: (if((ROUND(RC[-1],2) = 0),0,((100 * ROUND(RC[-2],2)) / ROUND(RC[-1],2))))/100.0 -> 0.025 | AM45: 1.0 | AN45: 40.0 | AO45: (if((ROUND(RC[-1],2) = 0),0,((100 * ROUND(RC[-2],2)) / ROUND(RC[-1],2))))/100.0 -> 0.025 | AP45: 0.4 | AQ45: 16.0 | AR45: (if((ROUND(RC[-1],2) = 0),0,((100 * ROUND(RC[-2],2)) / ROUND(RC[-1],2))))/100.0 -> 0.025 | AS45: SUM(RC[-42],RC[-39],RC[-36],RC[-33],RC[-30],RC[-27],RC[-24],RC[-21],RC[-18],RC[-15],RC[-12],RC[-9],RC[-6],RC[-3]) -> 9.200000000000001 | AT45: SUM(RC[-42],RC[-39],RC[-36],RC[-33],RC[-30],RC[-27],RC[-24],RC[-21],RC[-18],RC[-15],RC[-12],RC[-9],RC[-6],RC[-3]) -> 528.0 | AU45: (if((ROUND(RC[-1],2) = 0),0,((100 * ROUND(RC[-2],2)) / ROUND(RC[-1],2))))/100.0 -> 0.017424242424242422
B46: Cus-01163 Aryza B.V. : Proj-01043 Issue CN-20505 | C46: 0.0 | D46: 32.0 | E46: (if((ROUND(RC[-1],2) = 0),0,((100 * ROUND(RC[-2],2)) / ROUND(RC[-1],2))))/100.0 -> 0.0 | F46: 0.0 | G46: 40.0 | H46: (if((ROUND(RC[-1],2) = 0),0,((100 * ROUND(RC[-2],2)) / ROUND(RC[-1],2))))/100.0 -> 0.0 | I46: 0.0 | J46: 40.0 | K46: (if((ROUND(RC[-1],2) = 0),0,((100 * ROUND(RC[-2],2)) / ROUND(RC[-1],2))))/100.0 -> 0.0 | M46: 40.0 | N46: (if((ROUND(RC[-1],2) = 0),0,((100 * ROUND(RC[-2],2)) / ROUND(RC[-1],2))))/100.0 -> 0.0 | P46: 40.0 | Q46: (if((ROUND(RC[-1],2) = 0),0,((100 * ROUND(RC[-2],2)) / ROUND(RC[-1],2))))/100.0 -> 0.0 | S46: 40.0 | T46: (if((ROUND(RC[-1],2) = 0),0,((100 * ROUND(RC[-2],2)) / ROUND(RC[-1],2))))/100.0 -> 0.0 | V46: 40.0 | W46: (if((ROUND(RC[-1],2) = 0),0,((100 * ROUND(RC[-2],2)) / ROUND(RC[-1],2))))/100.0 -> 0.0 | Y46: 40.0 | Z46: (if((ROUND(RC[-1],2) = 0),0,((100 * ROUND(RC[-2],2)) / ROUND(RC[-1],2))))/100.0 -> 0.0 | AB46: 40.0 | AC46: (if((ROUND(RC[-1],2) = 0),0,((100 * ROUND(RC[-2],2)) / ROUND(RC[-1],2))))/100.0 -> 0.0 | AE46: 40.0 | AF46: (if((ROUND(RC[-1],2) = 0),0,((100 * ROUND(RC[-2],2)) / ROUND(RC[-1],2))))/100.0 -> 0.0 | AH46: 40.0 | AI46: (if((ROUND(RC[-1],2) = 0),0,((100 * ROUND(RC[-2],2)) / ROUND(RC[-1],2))))/100.0 -> 0.0 | AK46: 40.0 | AL46: (if((ROUND(RC[-1],2) = 0),0,((100 * ROUND(RC[-2],2)) / ROUND(RC[-1],2))))/100.0 -> 0.0 | AN46: 40.0 | AO46: (if((ROUND(RC[-1],2) = 0),0,((100 * ROUND(RC[-2],2)) / ROUND(RC[-1],2))))/100.0 -> 0.0 | AQ46: 16.0 | AR46: (if((ROUND(RC[-1],2) = 0),0,((100 * ROUND(RC[-2],2)) / ROUND(RC[-1],2))))/100.0 -> 0.0 | AS46: SUM(RC[-42],RC[-39],RC[-36],RC[-33],RC[-30],RC[-27],RC[-24],RC[-21],RC[-18],RC[-15],RC[-12],RC[-9],RC[-6],RC[-3]) -> 0.0 | AT46: SUM(RC[-42],RC[-39],RC[-36],RC[-33],RC[-30],RC[-27],RC[-24],RC[-21],RC[-18],RC[-15],RC[-12],RC[-9],RC[-6],RC[-3]) -> 528.0 | AU46: (if((ROUND(RC[-1],2) = 0),0,((100 * ROUND(RC[-2],2)) / ROUND(RC[-1],2))))/100.0 -> 0.0
B47: Cus-01163 Aryza B.V. : Proj-01055 LDCR 2025 | C47: 1.0 | D47: 32.0 | E47: (if((ROUND(RC[-1],2) = 0),0,((100 * ROUND(RC[-2],2)) / ROUND(RC[-1],2))))/100.0 -> 0.03125 | G47: 40.0 | H47: (if((ROUND(RC[-1],2) = 0),0,((100 * ROUND(RC[-2],2)) / ROUND(RC[-1],2))))/100.0 -> 0.0 | J47: 40.0 | K47: (if((ROUND(RC[-1],2) = 0),0,((100 * ROUND(RC[-2],2)) / ROUND(RC[-1],2))))/100.0 -> 0.0 | M47: 40.0 | N47: (if((ROUND(RC[-1],2) = 0),0,((100 * ROUND(RC[-2],2)) / ROUND(RC[-1],2))))/100.0 -> 0.0 | P47: 40.0 | Q47: (if((ROUND(RC[-1],2) = 0),0,((100 * ROUND(RC[-2],2)) / ROUND(RC[-1],2))))/100.0 -> 0.0 | S47: 40.0 | T47: (if((ROUND(RC[-1],2) = 0),0,((100 * ROUND(RC[-2],2)) / ROUND(RC[-1],2))))/100.0 -> 0.0 | V47: 40.0 | W47: (if((ROUND(RC[-1],2) = 0),0,((100 * ROUND(RC[-2],2)) / ROUND(RC[-1],2))))/100.0 -> 0.0 | Y47: 40.0 | Z47: (if((ROUND(RC[-1],2) = 0),0,((100 * ROUND(RC[-2],2)) / ROUND(RC[-1],2))))/100.0 -> 0.0 | AB47: 40.0 | AC47: (if((ROUND(RC[-1],2) = 0),0,((100 * ROUND(RC[-2],2)) / ROUND(RC[-1],2))))/100.0 -> 0.0 | AE47: 40.0 | AF47: (if((ROUND(RC[-1],2) = 0),0,((100 * ROUND(RC[-2],2)) / ROUND(RC[-1],2))))/100.0 -> 0.0 | AH47: 40.0 | AI47: (if((ROUND(RC[-1],2) = 0),0,((100 * ROUND(RC[-2],2)) / ROUND(RC[-1],2))))/100.0 -> 0.0 | AK47: 40.0 | AL47: (if((ROUND(RC[-1],2) = 0),0,((100 * ROUND(RC[-2],2)) / ROUND(RC[-1],2))))/100.0 -> 0.0 | AN47: 40.0 | AO47: (if((ROUND(RC[-1],2) = 0),0,((100 * ROUND(RC[-2],2)) / ROUND(RC[-1],2))))/100.0 -> 0.0 | AQ47: 16.0 | AR47: (if((ROUND(RC[-1],2) = 0),0,((100 * ROUND(RC[-2],2)) / ROUND(RC[-1],2))))/100.0 -> 0.0 | AS47: SUM(RC[-42],RC[-39],RC[-36],RC[-33],RC[-30],RC[-27],RC[-24],RC[-21],RC[-18],RC[-15],RC[-12],RC[-9],RC[-6],RC[-3]) -> 1.0 | AT47: SUM(RC[-42],RC[-39],RC[-36],RC[-33],RC[-30],RC[-27],RC[-24],RC[-21],RC[-18],RC[-15],RC[-12],RC[-9],RC[-6],RC[-3]) -> 528.0 | AU47: (if((ROUND(RC[-1],2) = 0),0,((100 * ROUND(RC[-2],2)) / ROUND(RC[-1],2))))/100.0 -> 0.001893939393939394
B48: Cus-01163 Aryza B.V. : Proj-01123 GoPay Email in Bulk | D48: 32.0 | E48: (if((ROUND(RC[-1],2) = 0),0,((100 * ROUND(RC[-2],2)) / ROUND(RC[-1],2))))/100.0 -> 0.0 | G48: 40.0 | H48: (if((ROUND(RC[-1],2) = 0),0,((100 * ROUND(RC[-2],2)) / ROUND(RC[-1],2))))/100.0 -> 0.0 | J48: 40.0 | K48: (if((ROUND(RC[-1],2) = 0),0,((100 * ROUND(RC[-2],2)) / ROUND(RC[-1],2))))/100.0 -> 0.0 | L48: 2.0 | M48: 40.0 | N48: (if((ROUND(RC[-1],2) = 0),0,((100 * ROUND(RC[-2],2)) / ROUND(RC[-1],2))))/100.0 -> 0.05 | P48: 40.0 | Q48: (if((ROUND(RC[-1],2) = 0),0,((100 * ROUND(RC[-2],2)) / ROUND(RC[-1],2))))/100.0 -> 0.0 | S48: 40.0 | T48: (if((ROUND(RC[-1],2) = 0),0,((100 * ROUND(RC[-2],2)) / ROUND(RC[-1],2))))/100.0 -> 0.0 | V48: 40.0 | W48: (if((ROUND(RC[-1],2) = 0),0,((100 * ROUND(RC[-2],2)) / ROUND(RC[-1],2))))/100.0 -> 0.0 | Y48: 40.0 | Z48: (if((ROUND(RC[-1],2) = 0),0,((100 * ROUND(RC[-2],2)) / ROUND(RC[-1],2))))/100.0 -> 0.0 | AB48: 40.0 | AC48: (if((ROUND(RC[-1],2) = 0),0,((100 * ROUND(RC[-2],2)) / ROUND(RC[-1],2))))/100.0 -> 0.0 | AE48: 40.0 | AF48: (if((ROUND(RC[-1],2) = 0),0,((100 * ROUND(RC[-2],2)) / ROUND(RC[-1],2))))/100.0 -> 0.0 | AH48: 40.0 | AI48: (if((ROUND(RC[-1],2) = 0),0,((100 * ROUND(RC[-2],2)) / ROUND(RC[-1],2))))/100.0 -> 0.0 | AK48: 40.0 | AL48: (if((ROUND(RC[-1],2) = 0),0,((100 * ROUND(RC[-2],2)) / ROUND(RC[-1],2))))/100.0 -> 0.0 | AN48: 40.0 | AO48: (if((ROUND(RC[-1],2) = 0),0,((100 * ROUND(RC[-2],2)) / ROUND(RC[-1],2))))/100.0 -> 0.0 | AQ48: 16.0 | AR48: (if((ROUND(RC[-1],2) = 0),0,((100 * ROUND(RC[-2],2)) / ROUND(RC[-1],2))))/100.0 -> 0.0 | AS48: SUM(RC[-42],RC[-39],RC[-36],RC[-33],RC[-30],RC[-27],RC[-24],RC[-21],RC[-18],RC[-15],RC[-12],RC[-9],RC[-6],RC[-3]) -> 2.0 | AT48: SUM(RC[-42],RC[-39],RC[-36],RC[-33],RC[-30],RC[-27],RC[-24],RC[-21],RC[-18],RC[-15],RC[-12],RC[-9],RC[-6],RC[-3]) -> 528.0 | AU48: (if((ROUND(RC[-1],2) = 0),0,((100 * ROUND(RC[-2],2)) / ROUND(RC[-1],2))))/100.0 -> 0.003787878787878788
B49: Cus-01168 DipNed MR : Proj-00997 DipNed Escrow deponering 2025 | D49: 32.0 | E49: (if((ROUND(RC[-1],2) = 0),0,((100 * ROUND(RC[-2],2)) / ROUND(RC[-1],2))))/100.0 -> 0.0 | G49: 40.0 | H49: (if((ROUND(RC[-1],2) = 0),0,((100 * ROUND(RC[-2],2)) / ROUND(RC[-1],2))))/100.0 -> 0.0 | J49: 40.0 | K49: (if((ROUND(RC[-1],2) = 0),0,((100 * ROUND(RC[-2],2)) / ROUND(RC[-1],2))))/100.0 -> 0.0 | M49: 40.0 | N49: (if((ROUND(RC[-1],2) = 0),0,((100 * ROUND(RC[-2],2)) / ROUND(RC[-1],2))))/100.0 -> 0.0 | P49: 40.0 | Q49: (if((ROUND(RC[-1],2) = 0),0,((100 * ROUND(RC[-2],2)) / ROUND(RC[-1],2))))/100.0 -> 0.0 | S49: 40.0 | T49: (if((ROUND(RC[-1],2) = 0),0,((100 * ROUND(RC[-2],2)) / ROUND(RC[-1],2))))/100.0 -> 0.0 | V49: 40.0 | W49: (if((ROUND(RC[-1],2) = 0),0,((100 * ROUND(RC[-2],2)) / ROUND(RC[-1],2))))/100.0 -> 0.0 | Y49: 40.0 | Z49: (if((ROUND(RC[-1],2) = 0),0,((100 * ROUND(RC[-2],2)) / ROUND(RC[-1],2))))/100.0 -> 0.0 | AB49: 40.0 | AC49: (if((ROUND(RC[-1],2) = 0),0,((100 * ROUND(RC[-2],2)) / ROUND(RC[-1],2))))/100.0 -> 0.0 | AE49: 40.0 | AF49: (if((ROUND(RC[-1],2) = 0),0,((100 * ROUND(RC[-2],2)) / ROUND(RC[-1],2))))/100.0 -> 0.0 | AH49: 40.0 | AI49: (if((ROUND(RC[-1],2) = 0),0,((100 * ROUND(RC[-2],2)) / ROUND(RC[-1],2))))/100.0 -> 0.0 | AJ49: 4.0 | AK49: 40.0 | AL49: (if((ROUND(RC[-1],2) = 0),0,((100 * ROUND(RC[-2],2)) / ROUND(RC[-1],2))))/100.0 -> 0.1 | AN49: 40.0 | AO49: (if((ROUND(RC[-1],2) = 0),0,((100 * ROUND(RC[-2],2)) / ROUND(RC[-1],2))))/100.0 -> 0.0 | AQ49: 16.0 | AR49: (if((ROUND(RC[-1],2) = 0),0,((100 * ROUND(RC[-2],2)) / ROUND(RC[-1],2))))/100.0 -> 0.0 | AS49: SUM(RC[-42],RC[-39],RC[-36],RC[-33],RC[-30],RC[-27],RC[-24],RC[-21],RC[-18],RC[-15],RC[-12],RC[-9],RC[-6],RC[-3]) -> 4.0 | AT49: SUM(RC[-42],RC[-39],RC[-36],RC[-33],RC[-30],RC[-27],RC[-24],RC[-21],RC[-18],RC[-15],RC[-12],RC[-9],RC[-6],RC[-3]) -> 528.0 | AU49: (if((ROUND(RC[-1],2) = 0),0,((100 * ROUND(RC[-2],2)) / ROUND(RC[-1],2))))/100.0 -> 0.007575757575757576
B50: Cus-01168 DipNed MR : Proj-01024 DipNed SEPA betaalbestanden SDD en SCT | D50: 32.0 | E50: (if((ROUND(RC[-1],2) = 0),0,((100 * ROUND(RC[-2],2)) / ROUND(RC[-1],2))))/100.0 -> 0.0 | G50: 40.0 | H50: (if((ROUND(RC[-1],2) = 0),0,((100 * ROUND(RC[-2],2)) / ROUND(RC[-1],2))))/100.0 -> 0.0 | J50: 40.0 | K50: (if((ROUND(RC[-1],2) = 0),0,((100 * ROUND(RC[-2],2)) / ROUND(RC[-1],2))))/100.0 -> 0.0 | M50: 40.0 | N50: (if((ROUND(RC[-1],2) = 0),0,((100 * ROUND(RC[-2],2)) / ROUND(RC[-1],2))))/100.0 -> 0.0 | O50: 1.0 | P50: 40.0 | Q50: (if((ROUND(RC[-1],2) = 0),0,((100 * ROUND(RC[-2],2)) / ROUND(RC[-1],2))))/100.0 -> 0.025 | S50: 40.0 | T50: (if((ROUND(RC[-1],2) = 0),0,((100 * ROUND(RC[-2],2)) / ROUND(RC[-1],2))))/100.0 -> 0.0 | V50: 40.0 | W50: (if((ROUND(RC[-1],2) = 0),0,((100 * ROUND(RC[-2],2)) / ROUND(RC[-1],2))))/100.0 -> 0.0 | Y50: 40.0 | Z50: (if((ROUND(RC[-1],2) = 0),0,((100 * ROUND(RC[-2],2)) / ROUND(RC[-1],2))))/100.0 -> 0.0 | AB50: 40.0 | AC50: (if((ROUND(RC[-1],2) = 0),0,((100 * ROUND(RC[-2],2)) / ROUND(RC[-1],2))))/100.0 -> 0.0 | AE50: 40.0 | AF50: (if((ROUND(RC[-1],2) = 0),0,((100 * ROUND(RC[-2],2)) / ROUND(RC[-1],2))))/100.0 -> 0.0 | AH50: 40.0 | AI50: (if((ROUND(RC[-1],2) = 0),0,((100 * ROUND(RC[-2],2)) / ROUND(RC[-1],2))))/100.0 -> 0.0 | AK50: 40.0 | AL50: (if((ROUND(RC[-1],2) = 0),0,((100 * ROUND(RC[-2],2)) / ROUND(RC[-1],2))))/100.0 -> 0.0 | AN50: 40.0 | AO50: (if((ROUND(RC[-1],2) = 0),0,((100 * ROUND(RC[-2],2)) / ROUND(RC[-1],2))))/100.0 -> 0.0 | AQ50: 16.0 | AR50: (if((ROUND(RC[-1],2) = 0),0,((100 * ROUND(RC[-2],2)) / ROUND(RC[-1],2))))/100.0 -> 0.0 | AS50: SUM(RC[-42],RC[-39],RC[-36],RC[-33],RC[-30],RC[-27],RC[-24],RC[-21],RC[-18],RC[-15],RC[-12],RC[-9],RC[-6],RC[-3]) -> 1.0 | AT50: SUM(RC[-42],RC[-39],RC[-36],RC[-33],RC[-30],RC[-27],RC[-24],RC[-21],RC[-18],RC[-15],RC[-12],RC[-9],RC[-6],RC[-3]) -> 528.0 | AU50: (if((ROUND(RC[-1],2) = 0),0,((100 * ROUND(RC[-2],2)) / ROUND(RC[-1],2))))/100.0 -> 0.001893939393939394
A51: Total - Hielko Santema | C51: SUM(R[-10]C:R[-1]C) -> 32.2 | D51: 32.0 | E51: (if((ROUND(RC[-1],2) = 0),0,((100 * ROUND(RC[-2],2)) / ROUND(RC[-1],2))))/100.0 -> 1.00625 | F51: SUM(R[-10]C:R[-1]C) -> 39.0 | G51: 40.0 | H51: (if((ROUND(RC[-1],2) = 0),0,((100 * ROUND(RC[-2],2)) / ROUND(RC[-1],2))))/100.0 -> 0.975 | I51: SUM(R[-10]C:R[-1]C) -> 39.0 | J51: 40.0 | K51: (if((ROUND(RC[-1],2) = 0),0,((100 * ROUND(RC[-2],2)) / ROUND(RC[-1],2))))/100.0 -> 0.975 | L51: SUM(R[-10]C:R[-1]C) -> 41.0 | M51: 40.0 | N51: (if((ROUND(RC[-1],2) = 0),0,((100 * ROUND(RC[-2],2)) / ROUND(RC[-1],2))))/100.0 -> 1.025 | O51: SUM(R[-10]C:R[-1]C) -> 40.0 | P51: 40.0 | Q51: (if((ROUND(RC[-1],2) = 0),0,((100 * ROUND(RC[-2],2)) / ROUND(RC[-1],2))))/100.0 -> 1.0 | R51: SUM(R[-10]C:R[-1]C) -> 0.0 | S51: 40.0 | T51: (if((ROUND(RC[-1],2) = 0),0,((100 * ROUND(RC[-2],2)) / ROUND(RC[-1],2))))/100.0 -> 0.0 | U51: SUM(R[-10]C:R[-1]C) -> 0.0 | V51: 40.0 | W51: (if((ROUND(RC[-1],2) = 0),0,((100 * ROUND(RC[-2],2)) / ROUND(RC[-1],2))))/100.0 -> 0.0 | X51: SUM(R[-10]C:R[-1]C) -> 0.0 | Y51: 40.0 | Z51: (if((ROUND(RC[-1],2) = 0),0,((100 * ROUND(RC[-2],2)) / ROUND(RC[-1],2))))/100.0 -> 0.0 | AA51: SUM(R[-10]C:R[-1]C) -> 38.0 | AB51: 40.0 | AC51: (if((ROUND(RC[-1],2) = 0),0,((100 * ROUND(RC[-2],2)) / ROUND(RC[-1],2))))/100.0 -> 0.95 | AD51: SUM(R[-10]C:R[-1]C) -> 39.0 | AE51: 40.0 | AF51: (if((ROUND(RC[-1],2) = 0),0,((100 * ROUND(RC[-2],2)) / ROUND(RC[-1],2))))/100.0 -> 0.975 | AG51: SUM(R[-10]C:R[-1]C) -> 38.0 | AH51: 40.0 | AI51: (if((ROUND(RC[-1],2) = 0),0,((100 * ROUND(RC[-2],2)) / ROUND(RC[-1],2))))/100.0 -> 0.95 | AJ51: SUM(R[-10]C:R[-1]C) -> 40.0 | AK51: 40.0 | AL51: (if((ROUND(RC[-1],2) = 0),0,((100 * ROUND(RC[-2],2)) / ROUND(RC[-1],2))))/100.0 -> 1.0 | AM51: SUM(R[-10]C:R[-1]C) -> 38.0 | AN51: 40.0 | AO51: (if((ROUND(RC[-1],2) = 0),0,((100 * ROUND(RC[-2],2)) / ROUND(RC[-1],2))))/100.0 -> 0.95 | AP51: SUM(R[-10]C:R[-1]C) -> 15.600000000000001 | AQ51: 16.0 | AR51: (if((ROUND(RC[-1],2) = 0),0,((100 * ROUND(RC[-2],2)) / ROUND(RC[-1],2))))/100.0 -> 0.975 | AS51: SUM(R[-10]C:R[-1]C) -> 399.8 | AT51: SUM(R[-10]C:R[-1]C) -> 528.0 | AU51: (if((ROUND(RC[-1],2) = 0),0,((100 * ROUND(RC[-2],2)) / ROUND(RC[-1],2))))/100.0 -> 0.7571969696969697
A52: Ivo GÃ¶ertz
B53: Cus-01114 GGN Mastering Credit B.V. : Proj-00774 Inzet Ivo Goertz 2025 - GGN | D53: 32.0 | E53: (if((ROUND(RC[-1],2) = 0),0,((100 * ROUND(RC[-2],2)) / ROUND(RC[-1],2))))/100.0 -> 0.0 | F53: 12.0 | G53: 40.0 | H53: (if((ROUND(RC[-1],2) = 0),0,((100 * ROUND(RC[-2],2)) / ROUND(RC[-1],2))))/100.0 -> 0.3 | I53: 20.0 | J53: 40.0 | K53: (if((ROUND(RC[-1],2) = 0),0,((100 * ROUND(RC[-2],2)) / ROUND(RC[-1],2))))/100.0 -> 0.5 | L53: 16.0 | M53: 40.0 | N53: (if((ROUND(RC[-1],2) = 0),0,((100 * ROUND(RC[-2],2)) / ROUND(RC[-1],2))))/100.0 -> 0.4 | O53: 16.0 | P53: 40.0 | Q53: (if((ROUND(RC[-1],2) = 0),0,((100 * ROUND(RC[-2],2)) / ROUND(RC[-1],2))))/100.0 -> 0.4 | R53: 16.0 | S53: 40.0 | T53: (if((ROUND(RC[-1],2) = 0),0,((100 * ROUND(RC[-2],2)) / ROUND(RC[-1],2))))/100.0 -> 0.4 | V53: 40.0 | W53: (if((ROUND(RC[-1],2) = 0),0,((100 * ROUND(RC[-2],2)) / ROUND(RC[-1],2))))/100.0 -> 0.0 | Y53: 40.0 | Z53: (if((ROUND(RC[-1],2) = 0),0,((100 * ROUND(RC[-2],2)) / ROUND(RC[-1],2))))/100.0 -> 0.0 | AA53: 16.0 | AB53: 40.0 | AC53: (if((ROUND(RC[-1],2) = 0),0,((100 * ROUND(RC[-2],2)) / ROUND(RC[-1],2))))/100.0 -> 0.4 | AD53: 16.0 | AE53: 40.0 | AF53: (if((ROUND(RC[-1],2) = 0),0,((100 * ROUND(RC[-2],2)) / ROUND(RC[-1],2))))/100.0 -> 0.4 | AG53: 16.0 | AH53: 40.0 | AI53: (if((ROUND(RC[-1],2) = 0),0,((100 * ROUND(RC[-2],2)) / ROUND(RC[-1],2))))/100.0 -> 0.4 | AJ53: 16.0 | AK53: 40.0 | AL53: (if((ROUND(RC[-1],2) = 0),0,((100 * ROUND(RC[-2],2)) / ROUND(RC[-1],2))))/100.0 -> 0.4 | AM53: 16.0 | AN53: 40.0 | AO53: (if((ROUND(RC[-1],2) = 0),0,((100 * ROUND(RC[-2],2)) / ROUND(RC[-1],2))))/100.0 -> 0.4 | AP53: 6.4 | AQ53: 16.0 | AR53: (if((ROUND(RC[-1],2) = 0),0,((100 * ROUND(RC[-2],2)) / ROUND(RC[-1],2))))/100.0 -> 0.4 | AS53: SUM(RC[-42],RC[-39],RC[-36],RC[-33],RC[-30],RC[-27],RC[-24],RC[-21],RC[-18],RC[-15],RC[-12],RC[-9],RC[-6],RC[-3]) -> 166.4 | AT53: SUM(RC[-42],RC[-39],RC[-36],RC[-33],RC[-30],RC[-27],RC[-24],RC[-21],RC[-18],RC[-15],RC[-12],RC[-9],RC[-6],RC[-3]) -> 528.0 | AU53: (if((ROUND(RC[-1],2) = 0),0,((100 * ROUND(RC[-2],2)) / ROUND(RC[-1],2))))/100.0 -> 0.3151515151515152
B54: Cus-01159 Vesting Finance : Proj-00772 Applicatiebeheer 2025 - VF | D54: 32.0 | E54: (if((ROUND(RC[-1],2) = 0),0,((100 * ROUND(RC[-2],2)) / ROUND(RC[-1],2))))/100.0 -> 0.0 | G54: 40.0 | H54: (if((ROUND(RC[-1],2) = 0),0,((100 * ROUND(RC[-2],2)) / ROUND(RC[-1],2))))/100.0 -> 0.0 | I54: 16.0 | J54: 40.0 | K54: (if((ROUND(RC[-1],2) = 0),0,((100 * ROUND(RC[-2],2)) / ROUND(RC[-1],2))))/100.0 -> 0.4 | M54: 40.0 | N54: (if((ROUND(RC[-1],2) = 0),0,((100 * ROUND(RC[-2],2)) / ROUND(RC[-1],2))))/100.0 -> 0.0 | P54: 40.0 | Q54: (if((ROUND(RC[-1],2) = 0),0,((100 * ROUND(RC[-2],2)) / ROUND(RC[-1],2))))/100.0 -> 0.0 | S54: 40.0 | T54: (if((ROUND(RC[-1],2) = 0),0,((100 * ROUND(RC[-2],2)) / ROUND(RC[-1],2))))/100.0 -> 0.0 | V54: 40.0 | W54: (if((ROUND(RC[-1],2) = 0),0,((100 * ROUND(RC[-2],2)) / ROUND(RC[-1],2))))/100.0 -> 0.0 | Y54: 40.0 | Z54: (if((ROUND(RC[-1],2) = 0),0,((100 * ROUND(RC[-2],2)) / ROUND(RC[-1],2))))/100.0 -> 0.0 | AB54: 40.0 | AC54: (if((ROUND(RC[-1],2) = 0),0,((100 * ROUND(RC[-2],2)) / ROUND(RC[-1],2))))/100.0 -> 0.0 | AE54: 40.0 | AF54: (if((ROUND(RC[-1],2) = 0),0,((100 * ROUND(RC[-2],2)) / ROUND(RC[-1],2))))/100.0 -> 0.0 | AH54: 40.0 | AI54: (if((ROUND(RC[-1],2) = 0),0,((100 * ROUND(RC[-2],2)) / ROUND(RC[-1],2))))/100.0 -> 0.0 | AK54: 40.0 | AL54: (if((ROUND(RC[-1],2) = 0),0,((100 * ROUND(RC[-2],2)) / ROUND(RC[-1],2))))/100.0 -> 0.0 | AN54: 40.0 | AO54: (if((ROUND(RC[-1],2) = 0),0,((100 * ROUND(RC[-2],2)) / ROUND(RC[-1],2))))/100.0 -> 0.0 | AQ54: 16.0 | AR54: (if((ROUND(RC[-1],2) = 0),0,((100 * ROUND(RC[-2],2)) / ROUND(RC[-1],2))))/100.0 -> 0.0 | AS54: SUM(RC[-42],RC[-39],RC[-36],RC[-33],RC[-30],RC[-27],RC[-24],RC[-21],RC[-18],RC[-15],RC[-12],RC[-9],RC[-6],RC[-3]) -> 16.0 | AT54: SUM(RC[-42],RC[-39],RC[-36],RC[-33],RC[-30],RC[-27],RC[-24],RC[-21],RC[-18],RC[-15],RC[-12],RC[-9],RC[-6],RC[-3]) -> 528.0 | AU54: (if((ROUND(RC[-1],2) = 0),0,((100 * ROUND(RC[-2],2)) / ROUND(RC[-1],2))))/100.0 -> 0.030303030303030304
B55: Cus-01163 Aryza B.V. : Proj-00842 Algemeen beheer 2025 | D55: 32.0 | E55: (if((ROUND(RC[-1],2) = 0),0,((100 * ROUND(RC[-2],2)) / ROUND(RC[-1],2))))/100.0 -> 0.0 | G55: 40.0 | H55: (if((ROUND(RC[-1],2) = 0),0,((100 * ROUND(RC[-2],2)) / ROUND(RC[-1],2))))/100.0 -> 0.0 | J55: 40.0 | K55: (if((ROUND(RC[-1],2) = 0),0,((100 * ROUND(RC[-2],2)) / ROUND(RC[-1],2))))/100.0 -> 0.0 | M55: 40.0 | N55: (if((ROUND(RC[-1],2) = 0),0,((100 * ROUND(RC[-2],2)) / ROUND(RC[-1],2))))/100.0 -> 0.0 | O55: 4.0 | P55: 40.0 | Q55: (if((ROUND(RC[-1],2) = 0),0,((100 * ROUND(RC[-2],2)) / ROUND(RC[-1],2))))/100.0 -> 0.1 | S55: 40.0 | T55: (if((ROUND(RC[-1],2) = 0),0,((100 * ROUND(RC[-2],2)) / ROUND(RC[-1],2))))/100.0 -> 0.0 | V55: 40.0 | W55: (if((ROUND(RC[-1],2) = 0),0,((100 * ROUND(RC[-2],2)) / ROUND(RC[-1],2))))/100.0 -> 0.0 | Y55: 40.0 | Z55: (if((ROUND(RC[-1],2) = 0),0,((100 * ROUND(RC[-2],2)) / ROUND(RC[-1],2))))/100.0 -> 0.0 | AA55: 8.0 | AB55: 40.0 | AC55: (if((ROUND(RC[-1],2) = 0),0,((100 * ROUND(RC[-2],2)) / ROUND(RC[-1],2))))/100.0 -> 0.2 | AD55: 2.0 | AE55: 40.0 | AF55: (if((ROUND(RC[-1],2) = 0),0,((100 * ROUND(RC[-2],2)) / ROUND(RC[-1],2))))/100.0 -> 0.05 | AH55: 40.0 | AI55: (if((ROUND(RC[-1],2) = 0),0,((100 * ROUND(RC[-2],2)) / ROUND(RC[-1],2))))/100.0 -> 0.0 | AK55: 40.0 | AL55: (if((ROUND(RC[-1],2) = 0),0,((100 * ROUND(RC[-2],2)) / ROUND(RC[-1],2))))/100.0 -> 0.0 | AN55: 40.0 | AO55: (if((ROUND(RC[-1],2) = 0),0,((100 * ROUND(RC[-2],2)) / ROUND(RC[-1],2))))/100.0 -> 0.0 | AP55: 1.6 | AQ55: 16.0 | AR55: (if((ROUND(RC[-1],2) = 0),0,((100 * ROUND(RC[-2],2)) / ROUND(RC[-1],2))))/100.0 -> 0.1 | AS55: SUM(RC[-42],RC[-39],RC[-36],RC[-33],RC[-30],RC[-27],RC[-24],RC[-21],RC[-18],RC[-15],RC[-12],RC[-9],RC[-6],RC[-3]) -> 15.6 | AT55: SUM(RC[-42],RC[-39],RC[-36],RC[-33],RC[-30],RC[-27],RC[-24],RC[-21],RC[-18],RC[-15],RC[-12],RC[-9],RC[-6],RC[-3]) -> 528.0 | AU55: (if((ROUND(RC[-1],2) = 0),0,((100 * ROUND(RC[-2],2)) / ROUND(RC[-1],2))))/100.0 -> 0.029545454545454545
B56: Cus-01163 Aryza B.V. : Proj-00874 Roll out 12.2 - 2025 | D56: 32.0 | E56: (if((ROUND(RC[-1],2) = 0),0,((100 * ROUND(RC[-2],2)) / ROUND(RC[-1],2))))/100.0 -> 0.0 | G56: 40.0 | H56: (if((ROUND(RC[-1],2) = 0),0,((100 * ROUND(RC[-2],2)) / ROUND(RC[-1],2))))/100.0 -> 0.0 | J56: 40.0 | K56: (if((ROUND(RC[-1],2) = 0),0,((100 * ROUND(RC[-2],2)) / ROUND(RC[-1],2))))/100.0 -> 0.0 | L56: 4.0 | M56: 40.0 | N56: (if((ROUND(RC[-1],2) = 0),0,((100 * ROUND(RC[-2],2)) / ROUND(RC[-1],2))))/100.0 -> 0.1 | O56: 7.0 | P56: 40.0 | Q56: (if((ROUND(RC[-1],2) = 0),0,((100 * ROUND(RC[-2],2)) / ROUND(RC[-1],2))))/100.0 -> 0.175 | S56: 40.0 | T56: (if((ROUND(RC[-1],2) = 0),0,((100 * ROUND(RC[-2],2)) / ROUND(RC[-1],2))))/100.0 -> 0.0 | V56: 40.0 | W56: (if((ROUND(RC[-1],2) = 0),0,((100 * ROUND(RC[-2],2)) / ROUND(RC[-1],2))))/100.0 -> 0.0 | Y56: 40.0 | Z56: (if((ROUND(RC[-1],2) = 0),0,((100 * ROUND(RC[-2],2)) / ROUND(RC[-1],2))))/100.0 -> 0.0 | AB56: 40.0 | AC56: (if((ROUND(RC[-1],2) = 0),0,((100 * ROUND(RC[-2],2)) / ROUND(RC[-1],2))))/100.0 -> 0.0 | AE56: 40.0 | AF56: (if((ROUND(RC[-1],2) = 0),0,((100 * ROUND(RC[-2],2)) / ROUND(RC[-1],2))))/100.0 -> 0.0 | AH56: 40.0 | AI56: (if((ROUND(RC[-1],2) = 0),0,((100 * ROUND(RC[-2],2)) / ROUND(RC[-1],2))))/100.0 -> 0.0 | AK56: 40.0 | AL56: (if((ROUND(RC[-1],2) = 0),0,((100 * ROUND(RC[-2],2)) / ROUND(RC[-1],2))))/100.0 -> 0.0 | AN56: 40.0 | AO56: (if((ROUND(RC[-1],2) = 0),0,((100 * ROUND(RC[-2],2)) / ROUND(RC[-1],2))))/100.0 -> 0.0 | AQ56: 16.0 | AR56: (if((ROUND(RC[-1],2) = 0),0,((100 * ROUND(RC[-2],2)) / ROUND(RC[-1],2))))/100.0 -> 0.0 | AS56: SUM(RC[-42],RC[-39],RC[-36],RC[-33],RC[-30],RC[-27],RC[-24],RC[-21],RC[-18],RC[-15],RC[-12],RC[-9],RC[-6],RC[-3]) -> 11.0 | AT56: SUM(RC[-42],RC[-39],RC[-36],RC[-33],RC[-30],RC[-27],RC[-24],RC[-21],RC[-18],RC[-15],RC[-12],RC[-9],RC[-6],RC[-3]) -> 528.0 | AU56: (if((ROUND(RC[-1],2) = 0),0,((100 * ROUND(RC[-2],2)) / ROUND(RC[-1],2))))/100.0 -> 0.020833333333333336
B57: Cus-01163 Aryza B.V. : Proj-00976 Interne uren 2025 | D57: 32.0 | E57: (if((ROUND(RC[-1],2) = 0),0,((100 * ROUND(RC[-2],2)) / ROUND(RC[-1],2))))/100.0 -> 0.0 | F57: 1.0 | G57: 40.0 | H57: (if((ROUND(RC[-1],2) = 0),0,((100 * ROUND(RC[-2],2)) / ROUND(RC[-1],2))))/100.0 -> 0.025 | I57: 1.0 | J57: 40.0 | K57: (if((ROUND(RC[-1],2) = 0),0,((100 * ROUND(RC[-2],2)) / ROUND(RC[-1],2))))/100.0 -> 0.025 | L57: 1.0 | M57: 40.0 | N57: (if((ROUND(RC[-1],2) = 0),0,((100 * ROUND(RC[-2],2)) / ROUND(RC[-1],2))))/100.0 -> 0.025 | O57: 3.0 | P57: 40.0 | Q57: (if((ROUND(RC[-1],2) = 0),0,((100 * ROUND(RC[-2],2)) / ROUND(RC[-1],2))))/100.0 -> 0.075 | R57: 1.0 | S57: 40.0 | T57: (if((ROUND(RC[-1],2) = 0),0,((100 * ROUND(RC[-2],2)) / ROUND(RC[-1],2))))/100.0 -> 0.025 | V57: 40.0 | W57: (if((ROUND(RC[-1],2) = 0),0,((100 * ROUND(RC[-2],2)) / ROUND(RC[-1],2))))/100.0 -> 0.0 | Y57: 40.0 | Z57: (if((ROUND(RC[-1],2) = 0),0,((100 * ROUND(RC[-2],2)) / ROUND(RC[-1],2))))/100.0 -> 0.0 | AA57: 1.0 | AB57: 40.0 | AC57: (if((ROUND(RC[-1],2) = 0),0,((100 * ROUND(RC[-2],2)) / ROUND(RC[-1],2))))/100.0 -> 0.025 | AD57: 2.0 | AE57: 40.0 | AF57: (if((ROUND(RC[-1],2) = 0),0,((100 * ROUND(RC[-2],2)) / ROUND(RC[-1],2))))/100.0 -> 0.05 | AG57: 1.0 | AH57: 40.0 | AI57: (if((ROUND(RC[-1],2) = 0),0,((100 * ROUND(RC[-2],2)) / ROUND(RC[-1],2))))/100.0 -> 0.025 | AJ57: 1.0 | AK57: 40.0 | AL57: (if((ROUND(RC[-1],2) = 0),0,((100 * ROUND(RC[-2],2)) / ROUND(RC[-1],2))))/100.0 -> 0.025 | AM57: 1.0 | AN57: 40.0 | AO57: (if((ROUND(RC[-1],2) = 0),0,((100 * ROUND(RC[-2],2)) / ROUND(RC[-1],2))))/100.0 -> 0.025 | AP57: 0.8 | AQ57: 16.0 | AR57: (if((ROUND(RC[-1],2) = 0),0,((100 * ROUND(RC[-2],2)) / ROUND(RC[-1],2))))/100.0 -> 0.05 | AS57: SUM(RC[-42],RC[-39],RC[-36],RC[-33],RC[-30],RC[-27],RC[-24],RC[-21],RC[-18],RC[-15],RC[-12],RC[-9],RC[-6],RC[-3]) -> 13.8 | AT57: SUM(RC[-42],RC[-39],RC[-36],RC[-33],RC[-30],RC[-27],RC[-24],RC[-21],RC[-18],RC[-15],RC[-12],RC[-9],RC[-6],RC[-3]) -> 528.0 | AU57: (if((ROUND(RC[-1],2) = 0),0,((100 * ROUND(RC[-2],2)) / ROUND(RC[-1],2))))/100.0 -> 0.026136363636363638
B58: Cus-01163 Aryza B.V. : Proj-00977 Support CITA 2025 | D58: 32.0 | E58: (if((ROUND(RC[-1],2) = 0),0,((100 * ROUND(RC[-2],2)) / ROUND(RC[-1],2))))/100.0 -> 0.0 | F58: 1.0 | G58: 40.0 | H58: (if((ROUND(RC[-1],2) = 0),0,((100 * ROUND(RC[-2],2)) / ROUND(RC[-1],2))))/100.0 -> 0.025 | I58: 1.0 | J58: 40.0 | K58: (if((ROUND(RC[-1],2) = 0),0,((100 * ROUND(RC[-2],2)) / ROUND(RC[-1],2))))/100.0 -> 0.025 | L58: 1.0 | M58: 40.0 | N58: (if((ROUND(RC[-1],2) = 0),0,((100 * ROUND(RC[-2],2)) / ROUND(RC[-1],2))))/100.0 -> 0.025 | O58: 1.0 | P58: 40.0 | Q58: (if((ROUND(RC[-1],2) = 0),0,((100 * ROUND(RC[-2],2)) / ROUND(RC[-1],2))))/100.0 -> 0.025 | R58: 1.0 | S58: 40.0 | T58: (if((ROUND(RC[-1],2) = 0),0,((100 * ROUND(RC[-2],2)) / ROUND(RC[-1],2))))/100.0 -> 0.025 | V58: 40.0 | W58: (if((ROUND(RC[-1],2) = 0),0,((100 * ROUND(RC[-2],2)) / ROUND(RC[-1],2))))/100.0 -> 0.0 | Y58: 40.0 | Z58: (if((ROUND(RC[-1],2) = 0),0,((100 * ROUND(RC[-2],2)) / ROUND(RC[-1],2))))/100.0 -> 0.0 | AA58: 1.0 | AB58: 40.0 | AC58: (if((ROUND(RC[-1],2) = 0),0,((100 * ROUND(RC[-2],2)) / ROUND(RC[-1],2))))/100.0 -> 0.025 | AD58: 1.0 | AE58: 40.0 | AF58: (if((ROUND(RC[-1],2) = 0),0,((100 * ROUND(RC[-2],2)) / ROUND(RC[-1],2))))/100.0 -> 0.025 | AG58: 1.0 | AH58: 40.0 | AI58: (if((ROUND(RC[-1],2) = 0),0,((100 * ROUND(RC[-2],2)) / ROUND(RC[-1],2))))/100.0 -> 0.025 | AJ58: 1.0 | AK58: 40.0 | AL58: (if((ROUND(RC[-1],2) = 0),0,((100 * ROUND(RC[-2],2)) / ROUND(RC[-1],2))))/100.0 -> 0.025 | AM58: 1.0 | AN58: 40.0 | AO58: (if((ROUND(RC[-1],2) = 0),0,((100 * ROUND(RC[-2],2)) / ROUND(RC[-1],2))))/100.0 -> 0.025 | AP58: 0.4 | AQ58: 16.0 | AR58: (if((ROUND(RC[-1],2) = 0),0,((100 * ROUND(RC[-2],2)) / ROUND(RC[-1],2))))/100.0 -> 0.025 | AS58: SUM(RC[-42],RC[-39],RC[-36],RC[-33],RC[-30],RC[-27],RC[-24],RC[-21],RC[-18],RC[-15],RC[-12],RC[-9],RC[-6],RC[-3]) -> 10.4 | AT58: SUM(RC[-42],RC[-39],RC[-36],RC[-33],RC[-30],RC[-27],RC[-24],RC[-21],RC[-18],RC[-15],RC[-12],RC[-9],RC[-6],RC[-3]) -> 528.0 | AU58: (if((ROUND(RC[-1],2) = 0),0,((100 * ROUND(RC[-2],2)) / ROUND(RC[-1],2))))/100.0 -> 0.0196969696969697
B59: Cus-01163 Aryza B.V. : Proj-00978 Training SmartComponents | D59: 32.0 | E59: (if((ROUND(RC[-1],2) = 0),0,((100 * ROUND(RC[-2],2)) / ROUND(RC[-1],2))))/100.0 -> 0.0 | G59: 40.0 | H59: (if((ROUND(RC[-1],2) = 0),0,((100 * ROUND(RC[-2],2)) / ROUND(RC[-1],2))))/100.0 -> 0.0 | J59: 40.0 | K59: (if((ROUND(RC[-1],2) = 0),0,((100 * ROUND(RC[-2],2)) / ROUND(RC[-1],2))))/100.0 -> 0.0 | M59: 40.0 | N59: (if((ROUND(RC[-1],2) = 0),0,((100 * ROUND(RC[-2],2)) / ROUND(RC[-1],2))))/100.0 -> 0.0 | P59: 40.0 | Q59: (if((ROUND(RC[-1],2) = 0),0,((100 * ROUND(RC[-2],2)) / ROUND(RC[-1],2))))/100.0 -> 0.0 | S59: 40.0 | T59: (if((ROUND(RC[-1],2) = 0),0,((100 * ROUND(RC[-2],2)) / ROUND(RC[-1],2))))/100.0 -> 0.0 | U59: 37.0 | V59: 40.0 | W59: (if((ROUND(RC[-1],2) = 0),0,((100 * ROUND(RC[-2],2)) / ROUND(RC[-1],2))))/100.0 -> 0.925 | X59: 37.0 | Y59: 40.0 | Z59: (if((ROUND(RC[-1],2) = 0),0,((100 * ROUND(RC[-2],2)) / ROUND(RC[-1],2))))/100.0 -> 0.925 | AB59: 40.0 | AC59: (if((ROUND(RC[-1],2) = 0),0,((100 * ROUND(RC[-2],2)) / ROUND(RC[-1],2))))/100.0 -> 0.0 | AE59: 40.0 | AF59: (if((ROUND(RC[-1],2) = 0),0,((100 * ROUND(RC[-2],2)) / ROUND(RC[-1],2))))/100.0 -> 0.0 | AH59: 40.0 | AI59: (if((ROUND(RC[-1],2) = 0),0,((100 * ROUND(RC[-2],2)) / ROUND(RC[-1],2))))/100.0 -> 0.0 | AK59: 40.0 | AL59: (if((ROUND(RC[-1],2) = 0),0,((100 * ROUND(RC[-2],2)) / ROUND(RC[-1],2))))/100.0 -> 0.0 | AN59: 40.0 | AO59: (if((ROUND(RC[-1],2) = 0),0,((100 * ROUND(RC[-2],2)) / ROUND(RC[-1],2))))/100.0 -> 0.0 | AQ59: 16.0 | AR59: (if((ROUND(RC[-1],2) = 0),0,((100 * ROUND(RC[-2],2)) / ROUND(RC[-1],2))))/100.0 -> 0.0 | AS59: SUM(RC[-42],RC[-39],RC[-36],RC[-33],RC[-30],RC[-27],RC[-24],RC[-21],RC[-18],RC[-15],RC[-12],RC[-9],RC[-6],RC[-3]) -> 74.0 | AT59: SUM(RC[-42],RC[-39],RC[-36],RC[-33],RC[-30],RC[-27],RC[-24],RC[-21],RC[-18],RC[-15],RC[-12],RC[-9],RC[-6],RC[-3]) -> 528.0 | AU59: (if((ROUND(RC[-1],2) = 0),0,((100 * ROUND(RC[-2],2)) / ROUND(RC[-1],2))))/100.0 -> 0.14015151515151517
B60: Cus-01168 DipNed MR : Proj-01024 DipNed SEPA betaalbestanden SDD en SCT | D60: 32.0 | E60: (if((ROUND(RC[-1],2) = 0),0,((100 * ROUND(RC[-2],2)) / ROUND(RC[-1],2))))/100.0 -> 0.0 | F60: 8.0 | G60: 40.0 | H60: (if((ROUND(RC[-1],2) = 0),0,((100 * ROUND(RC[-2],2)) / ROUND(RC[-1],2))))/100.0 -> 0.2 | J60: 40.0 | K60: (if((ROUND(RC[-1],2) = 0),0,((100 * ROUND(RC[-2],2)) / ROUND(RC[-1],2))))/100.0 -> 0.0 | M60: 40.0 | N60: (if((ROUND(RC[-1],2) = 0),0,((100 * ROUND(RC[-2],2)) / ROUND(RC[-1],2))))/100.0 -> 0.0 | O60: 1.0 | P60: 40.0 | Q60: (if((ROUND(RC[-1],2) = 0),0,((100 * ROUND(RC[-2],2)) / ROUND(RC[-1],2))))/100.0 -> 0.025 | S60: 40.0 | T60: (if((ROUND(RC[-1],2) = 0),0,((100 * ROUND(RC[-2],2)) / ROUND(RC[-1],2))))/100.0 -> 0.0 | V60: 40.0 | W60: (if((ROUND(RC[-1],2) = 0),0,((100 * ROUND(RC[-2],2)) / ROUND(RC[-1],2))))/100.0 -> 0.0 | Y60: 40.0 | Z60: (if((ROUND(RC[-1],2) = 0),0,((100 * ROUND(RC[-2],2)) / ROUND(RC[-1],2))))/100.0 -> 0.0 | AB60: 40.0 | AC60: (if((ROUND(RC[-1],2) = 0),0,((100 * ROUND(RC[-2],2)) / ROUND(RC[-1],2))))/100.0 -> 0.0 | AE60: 40.0 | AF60: (if((ROUND(RC[-1],2) = 0),0,((100 * ROUND(RC[-2],2)) / ROUND(RC[-1],2))))/100.0 -> 0.0 | AH60: 40.0 | AI60: (if((ROUND(RC[-1],2) = 0),0,((100 * ROUND(RC[-2],2)) / ROUND(RC[-1],2))))/100.0 -> 0.0 | AK60: 40.0 | AL60: (if((ROUND(RC[-1],2) = 0),0,((100 * ROUND(RC[-2],2)) / ROUND(RC[-1],2))))/100.0 -> 0.0 | AN60: 40.0 | AO60: (if((ROUND(RC[-1],2) = 0),0,((100 * ROUND(RC[-2],2)) / ROUND(RC[-1],2))))/100.0 -> 0.0 | AQ60: 16.0 | AR60: (if((ROUND(RC[-1],2) = 0),0,((100 * ROUND(RC[-2],2)) / ROUND(RC[-1],2))))/100.0 -> 0.0 | AS60: SUM(RC[-42],RC[-39],RC[-36],RC[-33],RC[-30],RC[-27],RC[-24],RC[-21],RC[-18],RC[-15],RC[-12],RC[-9],RC[-6],RC[-3]) -> 9.0 | AT60: SUM(RC[-42],RC[-39],RC[-36],RC[-33],RC[-30],RC[-27],RC[-24],RC[-21],RC[-18],RC[-15],RC[-12],RC[-9],RC[-6],RC[-3]) -> 528.0 | AU60: (if((ROUND(RC[-1],2) = 0),0,((100 * ROUND(RC[-2],2)) / ROUND(RC[-1],2))))/100.0 -> 0.017045454545454544
B61: Cus-01202 Syntrus Achmea Hypotheekdiensten B.V. : Proj-00901 Strippenkaart Syntrus 2025 | C61: 0.0 | D61: 32.0 | E61: (if((ROUND(RC[-1],2) = 0),0,((100 * ROUND(RC[-2],2)) / ROUND(RC[-1],2))))/100.0 -> 0.0 | G61: 40.0 | H61: (if((ROUND(RC[-1],2) = 0),0,((100 * ROUND(RC[-2],2)) / ROUND(RC[-1],2))))/100.0 -> 0.0 | J61: 40.0 | K61: (if((ROUND(RC[-1],2) = 0),0,((100 * ROUND(RC[-2],2)) / ROUND(RC[-1],2))))/100.0 -> 0.0 | M61: 40.0 | N61: (if((ROUND(RC[-1],2) = 0),0,((100 * ROUND(RC[-2],2)) / ROUND(RC[-1],2))))/100.0 -> 0.0 | P61: 40.0 | Q61: (if((ROUND(RC[-1],2) = 0),0,((100 * ROUND(RC[-2],2)) / ROUND(RC[-1],2))))/100.0 -> 0.0 | S61: 40.0 | T61: (if((ROUND(RC[-1],2) = 0),0,((100 * ROUND(RC[-2],2)) / ROUND(RC[-1],2))))/100.0 -> 0.0 | V61: 40.0 | W61: (if((ROUND(RC[-1],2) = 0),0,((100 * ROUND(RC[-2],2)) / ROUND(RC[-1],2))))/100.0 -> 0.0 | Y61: 40.0 | Z61: (if((ROUND(RC[-1],2) = 0),0,((100 * ROUND(RC[-2],2)) / ROUND(RC[-1],2))))/100.0 -> 0.0 | AB61: 40.0 | AC61: (if((ROUND(RC[-1],2) = 0),0,((100 * ROUND(RC[-2],2)) / ROUND(RC[-1],2))))/100.0 -> 0.0 | AE61: 40.0 | AF61: (if((ROUND(RC[-1],2) = 0),0,((100 * ROUND(RC[-2],2)) / ROUND(RC[-1],2))))/100.0 -> 0.0 | AH61: 40.0 | AI61: (if((ROUND(RC[-1],2) = 0),0,((100 * ROUND(RC[-2],2)) / ROUND(RC[-1],2))))/100.0 -> 0.0 | AK61: 40.0 | AL61: (if((ROUND(RC[-1],2) = 0),0,((100 * ROUND(RC[-2],2)) / ROUND(RC[-1],2))))/100.0 -> 0.0 | AN61: 40.0 | AO61: (if((ROUND(RC[-1],2) = 0),0,((100 * ROUND(RC[-2],2)) / ROUND(RC[-1],2))))/100.0 -> 0.0 | AQ61: 16.0 | AR61: (if((ROUND(RC[-1],2) = 0),0,((100 * ROUND(RC[-2],2)) / ROUND(RC[-1],2))))/100.0 -> 0.0 | AS61: SUM(RC[-42],RC[-39],RC[-36],RC[-33],RC[-30],RC[-27],RC[-24],RC[-21],RC[-18],RC[-15],RC[-12],RC[-9],RC[-6],RC[-3]) -> 0.0 | AT61: SUM(RC[-42],RC[-39],RC[-36],RC[-33],RC[-30],RC[-27],RC[-24],RC[-21],RC[-18],RC[-15],RC[-12],RC[-9],RC[-6],RC[-3]) -> 528.0 | AU61: (if((ROUND(RC[-1],2) = 0),0,((100 * ROUND(RC[-2],2)) / ROUND(RC[-1],2))))/100.0 -> 0.0
B62: Cus-01202 Syntrus Achmea Hypotheekdiensten B.V. : Proj-00943 Rapportage werkvoorraad - Syntrus | C62: 0.0 | D62: 32.0 | E62: (if((ROUND(RC[-1],2) = 0),0,((100 * ROUND(RC[-2],2)) / ROUND(RC[-1],2))))/100.0 -> 0.0 | F62: 0.0 | G62: 40.0 | H62: (if((ROUND(RC[-1],2) = 0),0,((100 * ROUND(RC[-2],2)) / ROUND(RC[-1],2))))/100.0 -> 0.0 | I62: 0.0 | J62: 40.0 | K62: (if((ROUND(RC[-1],2) = 0),0,((100 * ROUND(RC[-2],2)) / ROUND(RC[-1],2))))/100.0 -> 0.0 | L62: 0.0 | M62: 40.0 | N62: (if((ROUND(RC[-1],2) = 0),0,((100 * ROUND(RC[-2],2)) / ROUND(RC[-1],2))))/100.0 -> 0.0 | O62: 0.0 | P62: 40.0 | Q62: (if((ROUND(RC[-1],2) = 0),0,((100 * ROUND(RC[-2],2)) / ROUND(RC[-1],2))))/100.0 -> 0.0 | S62: 40.0 | T62: (if((ROUND(RC[-1],2) = 0),0,((100 * ROUND(RC[-2],2)) / ROUND(RC[-1],2))))/100.0 -> 0.0 | V62: 40.0 | W62: (if((ROUND(RC[-1],2) = 0),0,((100 * ROUND(RC[-2],2)) / ROUND(RC[-1],2))))/100.0 -> 0.0 | Y62: 40.0 | Z62: (if((ROUND(RC[-1],2) = 0),0,((100 * ROUND(RC[-2],2)) / ROUND(RC[-1],2))))/100.0 -> 0.0 | AB62: 40.0 | AC62: (if((ROUND(RC[-1],2) = 0),0,((100 * ROUND(RC[-2],2)) / ROUND(RC[-1],2))))/100.0 -> 0.0 | AE62: 40.0 | AF62: (if((ROUND(RC[-1],2) = 0),0,((100 * ROUND(RC[-2],2)) / ROUND(RC[-1],2))))/100.0 -> 0.0 | AH62: 40.0 | AI62: (if((ROUND(RC[-1],2) = 0),0,((100 * ROUND(RC[-2],2)) / ROUND(RC[-1],2))))/100.0 -> 0.0 | AK62: 40.0 | AL62: (if((ROUND(RC[-1],2) = 0),0,((100 * ROUND(RC[-2],2)) / ROUND(RC[-1],2))))/100.0 -> 0.0 | AN62: 40.0 | AO62: (if((ROUND(RC[-1],2) = 0),0,((100 * ROUND(RC[-2],2)) / ROUND(RC[-1],2))))/100.0 -> 0.0 | AQ62: 16.0 | AR62: (if((ROUND(RC[-1],2) = 0),0,((100 * ROUND(RC[-2],2)) / ROUND(RC[-1],2))))/100.0 -> 0.0 | AS62: SUM(RC[-42],RC[-39],RC[-36],RC[-33],RC[-30],RC[-27],RC[-24],RC[-21],RC[-18],RC[-15],RC[-12],RC[-9],RC[-6],RC[-3]) -> 0.0 | AT62: SUM(RC[-42],RC[-39],RC[-36],RC[-33],RC[-30],RC[-27],RC[-24],RC[-21],RC[-18],RC[-15],RC[-12],RC[-9],RC[-6],RC[-3]) -> 528.0 | AU62: (if((ROUND(RC[-1],2) = 0),0,((100 * ROUND(RC[-2],2)) / ROUND(RC[-1],2))))/100.0 -> 0.0
B63: Cus-01202 Syntrus Achmea Hypotheekdiensten B.V. : Proj-01089 Ontsluiting klantportaal API - Syntrus | C63: 0.0 | D63: 32.0 | E63: (if((ROUND(RC[-1],2) = 0),0,((100 * ROUND(RC[-2],2)) / ROUND(RC[-1],2))))/100.0 -> 0.0 | F63: 0.0 | G63: 40.0 | H63: (if((ROUND(RC[-1],2) = 0),0,((100 * ROUND(RC[-2],2)) / ROUND(RC[-1],2))))/100.0 -> 0.0 | J63: 40.0 | K63: (if((ROUND(RC[-1],2) = 0),0,((100 * ROUND(RC[-2],2)) / ROUND(RC[-1],2))))/100.0 -> 0.0 | M63: 40.0 | N63: (if((ROUND(RC[-1],2) = 0),0,((100 * ROUND(RC[-2],2)) / ROUND(RC[-1],2))))/100.0 -> 0.0 | P63: 40.0 | Q63: (if((ROUND(RC[-1],2) = 0),0,((100 * ROUND(RC[-2],2)) / ROUND(RC[-1],2))))/100.0 -> 0.0 | S63: 40.0 | T63: (if((ROUND(RC[-1],2) = 0),0,((100 * ROUND(RC[-2],2)) / ROUND(RC[-1],2))))/100.0 -> 0.0 | V63: 40.0 | W63: (if((ROUND(RC[-1],2) = 0),0,((100 * ROUND(RC[-2],2)) / ROUND(RC[-1],2))))/100.0 -> 0.0 | Y63: 40.0 | Z63: (if((ROUND(RC[-1],2) = 0),0,((100 * ROUND(RC[-2],2)) / ROUND(RC[-1],2))))/100.0 -> 0.0 | AB63: 40.0 | AC63: (if((ROUND(RC[-1],2) = 0),0,((100 * ROUND(RC[-2],2)) / ROUND(RC[-1],2))))/100.0 -> 0.0 | AE63: 40.0 | AF63: (if((ROUND(RC[-1],2) = 0),0,((100 * ROUND(RC[-2],2)) / ROUND(RC[-1],2))))/100.0 -> 0.0 | AH63: 40.0 | AI63: (if((ROUND(RC[-1],2) = 0),0,((100 * ROUND(RC[-2],2)) / ROUND(RC[-1],2))))/100.0 -> 0.0 | AK63: 40.0 | AL63: (if((ROUND(RC[-1],2) = 0),0,((100 * ROUND(RC[-2],2)) / ROUND(RC[-1],2))))/100.0 -> 0.0 | AN63: 40.0 | AO63: (if((ROUND(RC[-1],2) = 0),0,((100 * ROUND(RC[-2],2)) / ROUND(RC[-1],2))))/100.0 -> 0.0 | AQ63: 16.0 | AR63: (if((ROUND(RC[-1],2) = 0),0,((100 * ROUND(RC[-2],2)) / ROUND(RC[-1],2))))/100.0 -> 0.0 | AS63: SUM(RC[-42],RC[-39],RC[-36],RC[-33],RC[-30],RC[-27],RC[-24],RC[-21],RC[-18],RC[-15],RC[-12],RC[-9],RC[-6],RC[-3]) -> 0.0 | AT63: SUM(RC[-42],RC[-39],RC[-36],RC[-33],RC[-30],RC[-27],RC[-24],RC[-21],RC[-18],RC[-15],RC[-12],RC[-9],RC[-6],RC[-3]) -> 528.0 | AU63: (if((ROUND(RC[-1],2) = 0),0,((100 * ROUND(RC[-2],2)) / ROUND(RC[-1],2))))/100.0 -> 0.0
B64: Cus-01736 LDCR Afd. Fin. : Proj-00805 LDCR C-Kasapplicatie | D64: 32.0 | E64: (if((ROUND(RC[-1],2) = 0),0,((100 * ROUND(RC[-2],2)) / ROUND(RC[-1],2))))/100.0 -> 0.0 | G64: 40.0 | H64: (if((ROUND(RC[-1],2) = 0),0,((100 * ROUND(RC[-2],2)) / ROUND(RC[-1],2))))/100.0 -> 0.0 | J64: 40.0 | K64: (if((ROUND(RC[-1],2) = 0),0,((100 * ROUND(RC[-2],2)) / ROUND(RC[-1],2))))/100.0 -> 0.0 | M64: 40.0 | N64: (if((ROUND(RC[-1],2) = 0),0,((100 * ROUND(RC[-2],2)) / ROUND(RC[-1],2))))/100.0 -> 0.0 | P64: 40.0 | Q64: (if((ROUND(RC[-1],2) = 0),0,((100 * ROUND(RC[-2],2)) / ROUND(RC[-1],2))))/100.0 -> 0.0 | S64: 40.0 | T64: (if((ROUND(RC[-1],2) = 0),0,((100 * ROUND(RC[-2],2)) / ROUND(RC[-1],2))))/100.0 -> 0.0 | V64: 40.0 | W64: (if((ROUND(RC[-1],2) = 0),0,((100 * ROUND(RC[-2],2)) / ROUND(RC[-1],2))))/100.0 -> 0.0 | Y64: 40.0 | Z64: (if((ROUND(RC[-1],2) = 0),0,((100 * ROUND(RC[-2],2)) / ROUND(RC[-1],2))))/100.0 -> 0.0 | AA64: 12.0 | AB64: 40.0 | AC64: (if((ROUND(RC[-1],2) = 0),0,((100 * ROUND(RC[-2],2)) / ROUND(RC[-1],2))))/100.0 -> 0.3 | AD64: 18.0 | AE64: 40.0 | AF64: (if((ROUND(RC[-1],2) = 0),0,((100 * ROUND(RC[-2],2)) / ROUND(RC[-1],2))))/100.0 -> 0.45 | AG64: 20.0 | AH64: 40.0 | AI64: (if((ROUND(RC[-1],2) = 0),0,((100 * ROUND(RC[-2],2)) / ROUND(RC[-1],2))))/100.0 -> 0.5 | AJ64: 20.0 | AK64: 40.0 | AL64: (if((ROUND(RC[-1],2) = 0),0,((100 * ROUND(RC[-2],2)) / ROUND(RC[-1],2))))/100.0 -> 0.5 | AM64: 20.0 | AN64: 40.0 | AO64: (if((ROUND(RC[-1],2) = 0),0,((100 * ROUND(RC[-2],2)) / ROUND(RC[-1],2))))/100.0 -> 0.5 | AP64: 6.4 | AQ64: 16.0 | AR64: (if((ROUND(RC[-1],2) = 0),0,((100 * ROUND(RC[-2],2)) / ROUND(RC[-1],2))))/100.0 -> 0.4 | AS64: SUM(RC[-42],RC[-39],RC[-36],RC[-33],RC[-30],RC[-27],RC[-24],RC[-21],RC[-18],RC[-15],RC[-12],RC[-9],RC[-6],RC[-3]) -> 96.4 | AT64: SUM(RC[-42],RC[-39],RC[-36],RC[-33],RC[-30],RC[-27],RC[-24],RC[-21],RC[-18],RC[-15],RC[-12],RC[-9],RC[-6],RC[-3]) -> 528.0 | AU64: (if((ROUND(RC[-1],2) = 0),0,((100 * ROUND(RC[-2],2)) / ROUND(RC[-1],2))))/100.0 -> 0.18257575757575759
A65: Total - Ivo GÃ¶ertz | C65: SUM(R[-12]C:R[-1]C) -> 0.0 | D65: 32.0 | E65: (if((ROUND(RC[-1],2) = 0),0,((100 * ROUND(RC[-2],2)) / ROUND(RC[-1],2))))/100.0 -> 0.0 | F65: SUM(R[-12]C:R[-1]C) -> 22.0 | G65: 40.0 | H65: (if((ROUND(RC[-1],2) = 0),0,((100 * ROUND(RC[-2],2)) / ROUND(RC[-1],2))))/100.0 -> 0.55 | I65: SUM(R[-12]C:R[-1]C) -> 38.0 | J65: 40.0 | K65: (if((ROUND(RC[-1],2) = 0),0,((100 * ROUND(RC[-2],2)) / ROUND(RC[-1],2))))/100.0 -> 0.95 | L65: SUM(R[-12]C:R[-1]C) -> 22.0 | M65: 40.0 | N65: (if((ROUND(RC[-1],2) = 0),0,((100 * ROUND(RC[-2],2)) / ROUND(RC[-1],2))))/100.0 -> 0.55 | O65: SUM(R[-12]C:R[-1]C) -> 32.0 | P65: 40.0 | Q65: (if((ROUND(RC[-1],2) = 0),0,((100 * ROUND(RC[-2],2)) / ROUND(RC[-1],2))))/100.0 -> 0.8 | R65: SUM(R[-12]C:R[-1]C) -> 18.0 | S65: 40.0 | T65: (if((ROUND(RC[-1],2) = 0),0,((100 * ROUND(RC[-2],2)) / ROUND(RC[-1],2))))/100.0 -> 0.45 | U65: SUM(R[-12]C:R[-1]C) -> 37.0 | V65: 40.0 | W65: (if((ROUND(RC[-1],2) = 0),0,((100 * ROUND(RC[-2],2)) / ROUND(RC[-1],2))))/100.0 -> 0.925 | X65: SUM(R[-12]C:R[-1]C) -> 37.0 | Y65: 40.0 | Z65: (if((ROUND(RC[-1],2) = 0),0,((100 * ROUND(RC[-2],2)) / ROUND(RC[-1],2))))/100.0 -> 0.925 | AA65: SUM(R[-12]C:R[-1]C) -> 38.0 | AB65: 40.0 | AC65: (if((ROUND(RC[-1],2) = 0),0,((100 * ROUND(RC[-2],2)) / ROUND(RC[-1],2))))/100.0 -> 0.95 | AD65: SUM(R[-12]C:R[-1]C) -> 39.0 | AE65: 40.0 | AF65: (if((ROUND(RC[-1],2) = 0),0,((100 * ROUND(RC[-2],2)) / ROUND(RC[-1],2))))/100.0 -> 0.975 | AG65: SUM(R[-12]C:R[-1]C) -> 38.0 | AH65: 40.0 | AI65: (if((ROUND(RC[-1],2) = 0),0,((100 * ROUND(RC[-2],2)) / ROUND(RC[-1],2))))/100.0 -> 0.95 | AJ65: SUM(R[-12]C:R[-1]C) -> 38.0 | AK65: 40.0 | AL65: (if((ROUND(RC[-1],2) = 0),0,((100 * ROUND(RC[-2],2)) / ROUND(RC[-1],2))))/100.0 -> 0.95 | AM65: SUM(R[-12]C:R[-1]C) -> 38.0 | AN65: 40.0 | AO65: (if((ROUND(RC[-1],2) = 0),0,((100 * ROUND(RC[-2],2)) / ROUND(RC[-1],2))))/100.0 -> 0.95 | AP65: SUM(R[-12]C:R[-1]C) -> 15.600000000000001 | AQ65: 16.0 | AR65: (if((ROUND(RC[-1],2) = 0),0,((100 * ROUND(RC[-2],2)) / ROUND(RC[-1],2))))/100.0 -> 0.975 | AS65: SUM(R[-12]C:R[-1]C) -> 412.6 | AT65: SUM(R[-12]C:R[-1]C) -> 528.0 | AU65: (if((ROUND(RC[-1],2) = 0),0,((100 * ROUND(RC[-2],2)) / ROUND(RC[-1],2))))/100.0 -> 0.7814393939393939
A66: Ivo Oude Veldhuis
B67: Cus-01105 Lariks Exploitatie B.V. : Proj-00658 Lariks dedicated begeleiding 2025 | C67: 9.6 | D67: 32.0 | E67: (if((ROUND(RC[-1],2) = 0),0,((100 * ROUND(RC[-2],2)) / ROUND(RC[-1],2))))/100.0 -> 0.3 | F67: 12.0 | G67: 40.0 | H67: (if((ROUND(RC[-1],2) = 0),0,((100 * ROUND(RC[-2],2)) / ROUND(RC[-1],2))))/100.0 -> 0.3 | J67: 40.0 | K67: (if((ROUND(RC[-1],2) = 0),0,((100 * ROUND(RC[-2],2)) / ROUND(RC[-1],2))))/100.0 -> 0.0 | M67: 40.0 | N67: (if((ROUND(RC[-1],2) = 0),0,((100 * ROUND(RC[-2],2)) / ROUND(RC[-1],2))))/100.0 -> 0.0 | P67: 40.0 | Q67: (if((ROUND(RC[-1],2) = 0),0,((100 * ROUND(RC[-2],2)) / ROUND(RC[-1],2))))/100.0 -> 0.0 | R67: 12.0 | S67: 40.0 | T67: (if((ROUND(RC[-1],2) = 0),0,((100 * ROUND(RC[-2],2)) / ROUND(RC[-1],2))))/100.0 -> 0.3 | U67: 12.0 | V67: 40.0 | W67: (if((ROUND(RC[-1],2) = 0),0,((100 * ROUND(RC[-2],2)) / ROUND(RC[-1],2))))/100.0 -> 0.3 | X67: 12.0 | Y67: 40.0 | Z67: (if((ROUND(RC[-1],2) = 0),0,((100 * ROUND(RC[-2],2)) / ROUND(RC[-1],2))))/100.0 -> 0.3 | AA67: 12.0 | AB67: 40.0 | AC67: (if((ROUND(RC[-1],2) = 0),0,((100 * ROUND(RC[-2],2)) / ROUND(RC[-1],2))))/100.0 -> 0.3 | AD67: 12.0 | AE67: 40.0 | AF67: (if((ROUND(RC[-1],2) = 0),0,((100 * ROUND(RC[-2],2)) / ROUND(RC[-1],2))))/100.0 -> 0.3 | AG67: 12.0 | AH67: 40.0 | AI67: (if((ROUND(RC[-1],2) = 0),0,((100 * ROUND(RC[-2],2)) / ROUND(RC[-1],2))))/100.0 -> 0.3 | AJ67: 12.0 | AK67: 40.0 | AL67: (if((ROUND(RC[-1],2) = 0),0,((100 * ROUND(RC[-2],2)) / ROUND(RC[-1],2))))/100.0 -> 0.3 | AM67: 12.0 | AN67: 40.0 | AO67: (if((ROUND(RC[-1],2) = 0),0,((100 * ROUND(RC[-2],2)) / ROUND(RC[-1],2))))/100.0 -> 0.3 | AP67: 4.8 | AQ67: 16.0 | AR67: (if((ROUND(RC[-1],2) = 0),0,((100 * ROUND(RC[-2],2)) / ROUND(RC[-1],2))))/100.0 -> 0.3 | AS67: SUM(RC[-42],RC[-39],RC[-36],RC[-33],RC[-30],RC[-27],RC[-24],RC[-21],RC[-18],RC[-15],RC[-12],RC[-9],RC[-6],RC[-3]) -> 122.39999999999999 | AT67: SUM(RC[-42],RC[-39],RC[-36],RC[-33],RC[-30],RC[-27],RC[-24],RC[-21],RC[-18],RC[-15],RC[-12],RC[-9],RC[-6],RC[-3]) -> 528.0 | AU67: (if((ROUND(RC[-1],2) = 0),0,((100 * ROUND(RC[-2],2)) / ROUND(RC[-1],2))))/100.0 -> 0.23181818181818184
B68: Cus-01114 GGN Mastering Credit B.V. : Proj-01035 Diverse werkzaamheden - GGN | C68: 0.0 | D68: 32.0 | E68: (if((ROUND(RC[-1],2) = 0),0,((100 * ROUND(RC[-2],2)) / ROUND(RC[-1],2))))/100.0 -> 0.0 | G68: 40.0 | H68: (if((ROUND(RC[-1],2) = 0),0,((100 * ROUND(RC[-2],2)) / ROUND(RC[-1],2))))/100.0 -> 0.0 | J68: 40.0 | K68: (if((ROUND(RC[-1],2) = 0),0,((100 * ROUND(RC[-2],2)) / ROUND(RC[-1],2))))/100.0 -> 0.0 | M68: 40.0 | N68: (if((ROUND(RC[-1],2) = 0),0,((100 * ROUND(RC[-2],2)) / ROUND(RC[-1],2))))/100.0 -> 0.0 | P68: 40.0 | Q68: (if((ROUND(RC[-1],2) = 0),0,((100 * ROUND(RC[-2],2)) / ROUND(RC[-1],2))))/100.0 -> 0.0 | S68: 40.0 | T68: (if((ROUND(RC[-1],2) = 0),0,((100 * ROUND(RC[-2],2)) / ROUND(RC[-1],2))))/100.0 -> 0.0 | V68: 40.0 | W68: (if((ROUND(RC[-1],2) = 0),0,((100 * ROUND(RC[-2],2)) / ROUND(RC[-1],2))))/100.0 -> 0.0 | Y68: 40.0 | Z68: (if((ROUND(RC[-1],2) = 0),0,((100 * ROUND(RC[-2],2)) / ROUND(RC[-1],2))))/100.0 -> 0.0 | AB68: 40.0 | AC68: (if((ROUND(RC[-1],2) = 0),0,((100 * ROUND(RC[-2],2)) / ROUND(RC[-1],2))))/100.0 -> 0.0 | AE68: 40.0 | AF68: (if((ROUND(RC[-1],2) = 0),0,((100 * ROUND(RC[-2],2)) / ROUND(RC[-1],2))))/100.0 -> 0.0 | AH68: 40.0 | AI68: (if((ROUND(RC[-1],2) = 0),0,((100 * ROUND(RC[-2],2)) / ROUND(RC[-1],2))))/100.0 -> 0.0 | AK68: 40.0 | AL68: (if((ROUND(RC[-1],2) = 0),0,((100 * ROUND(RC[-2],2)) / ROUND(RC[-1],2))))/100.0 -> 0.0 | AN68: 40.0 | AO68: (if((ROUND(RC[-1],2) = 0),0,((100 * ROUND(RC[-2],2)) / ROUND(RC[-1],2))))/100.0 -> 0.0 | AQ68: 16.0 | AR68: (if((ROUND(RC[-1],2) = 0),0,((100 * ROUND(RC[-2],2)) / ROUND(RC[-1],2))))/100.0 -> 0.0 | AS68: SUM(RC[-42],RC[-39],RC[-36],RC[-33],RC[-30],RC[-27],RC[-24],RC[-21],RC[-18],RC[-15],RC[-12],RC[-9],RC[-6],RC[-3]) -> 0.0 | AT68: SUM(RC[-42],RC[-39],RC[-36],RC[-33],RC[-30],RC[-27],RC[-24],RC[-21],RC[-18],RC[-15],RC[-12],RC[-9],RC[-6],RC[-3]) -> 528.0 | AU68: (if((ROUND(RC[-1],2) = 0),0,((100 * ROUND(RC[-2],2)) / ROUND(RC[-1],2))))/100.0 -> 0.0
B69: Cus-01162 Koninklijke Beroepsorganisatie : Proj-01071 SNG Release 2601 - KBvG | C69: 6.4 | D69: 32.0 | E69: (if((ROUND(RC[-1],2) = 0),0,((100 * ROUND(RC[-2],2)) / ROUND(RC[-1],2))))/100.0 -> 0.2 | F69: 0.0 | G69: 40.0 | H69: (if((ROUND(RC[-1],2) = 0),0,((100 * ROUND(RC[-2],2)) / ROUND(RC[-1],2))))/100.0 -> 0.0 | I69: 0.0 | J69: 40.0 | K69: (if((ROUND(RC[-1],2) = 0),0,((100 * ROUND(RC[-2],2)) / ROUND(RC[-1],2))))/100.0 -> 0.0 | L69: 0.0 | M69: 40.0 | N69: (if((ROUND(RC[-1],2) = 0),0,((100 * ROUND(RC[-2],2)) / ROUND(RC[-1],2))))/100.0 -> 0.0 | O69: 0.0 | P69: 40.0 | Q69: (if((ROUND(RC[-1],2) = 0),0,((100 * ROUND(RC[-2],2)) / ROUND(RC[-1],2))))/100.0 -> 0.0 | R69: 0.0 | S69: 40.0 | T69: (if((ROUND(RC[-1],2) = 0),0,((100 * ROUND(RC[-2],2)) / ROUND(RC[-1],2))))/100.0 -> 0.0 | U69: 0.0 | V69: 40.0 | W69: (if((ROUND(RC[-1],2) = 0),0,((100 * ROUND(RC[-2],2)) / ROUND(RC[-1],2))))/100.0 -> 0.0 | X69: 0.0 | Y69: 40.0 | Z69: (if((ROUND(RC[-1],2) = 0),0,((100 * ROUND(RC[-2],2)) / ROUND(RC[-1],2))))/100.0 -> 0.0 | AA69: 0.0 | AB69: 40.0 | AC69: (if((ROUND(RC[-1],2) = 0),0,((100 * ROUND(RC[-2],2)) / ROUND(RC[-1],2))))/100.0 -> 0.0 | AD69: 0.0 | AE69: 40.0 | AF69: (if((ROUND(RC[-1],2) = 0),0,((100 * ROUND(RC[-2],2)) / ROUND(RC[-1],2))))/100.0 -> 0.0 | AG69: 0.0 | AH69: 40.0 | AI69: (if((ROUND(RC[-1],2) = 0),0,((100 * ROUND(RC[-2],2)) / ROUND(RC[-1],2))))/100.0 -> 0.0 | AJ69: 0.0 | AK69: 40.0 | AL69: (if((ROUND(RC[-1],2) = 0),0,((100 * ROUND(RC[-2],2)) / ROUND(RC[-1],2))))/100.0 -> 0.0 | AM69: 0.0 | AN69: 40.0 | AO69: (if((ROUND(RC[-1],2) = 0),0,((100 * ROUND(RC[-2],2)) / ROUND(RC[-1],2))))/100.0 -> 0.0 | AP69: 0.0 | AQ69: 16.0 | AR69: (if((ROUND(RC[-1],2) = 0),0,((100 * ROUND(RC[-2],2)) / ROUND(RC[-1],2))))/100.0 -> 0.0 | AS69: SUM(RC[-42],RC[-39],RC[-36],RC[-33],RC[-30],RC[-27],RC[-24],RC[-21],RC[-18],RC[-15],RC[-12],RC[-9],RC[-6],RC[-3]) -> 6.4 | AT69: SUM(RC[-42],RC[-39],RC[-36],RC[-33],RC[-30],RC[-27],RC[-24],RC[-21],RC[-18],RC[-15],RC[-12],RC[-9],RC[-6],RC[-3]) -> 528.0 | AU69: (if((ROUND(RC[-1],2) = 0),0,((100 * ROUND(RC[-2],2)) / ROUND(RC[-1],2))))/100.0 -> 0.012121212121212121
B70: Cus-01163 Aryza B.V. : Proj-00976 Interne uren 2025 | C70: 0.8 | D70: 32.0 | E70: (if((ROUND(RC[-1],2) = 0),0,((100 * ROUND(RC[-2],2)) / ROUND(RC[-1],2))))/100.0 -> 0.025 | F70: 1.0 | G70: 40.0 | H70: (if((ROUND(RC[-1],2) = 0),0,((100 * ROUND(RC[-2],2)) / ROUND(RC[-1],2))))/100.0 -> 0.025 | J70: 40.0 | K70: (if((ROUND(RC[-1],2) = 0),0,((100 * ROUND(RC[-2],2)) / ROUND(RC[-1],2))))/100.0 -> 0.0 | M70: 40.0 | N70: (if((ROUND(RC[-1],2) = 0),0,((100 * ROUND(RC[-2],2)) / ROUND(RC[-1],2))))/100.0 -> 0.0 | P70: 40.0 | Q70: (if((ROUND(RC[-1],2) = 0),0,((100 * ROUND(RC[-2],2)) / ROUND(RC[-1],2))))/100.0 -> 0.0 | R70: 1.0 | S70: 40.0 | T70: (if((ROUND(RC[-1],2) = 0),0,((100 * ROUND(RC[-2],2)) / ROUND(RC[-1],2))))/100.0 -> 0.025 | U70: 1.0 | V70: 40.0 | W70: (if((ROUND(RC[-1],2) = 0),0,((100 * ROUND(RC[-2],2)) / ROUND(RC[-1],2))))/100.0 -> 0.025 | X70: 1.0 | Y70: 40.0 | Z70: (if((ROUND(RC[-1],2) = 0),0,((100 * ROUND(RC[-2],2)) / ROUND(RC[-1],2))))/100.0 -> 0.025 | AA70: 1.0 | AB70: 40.0 | AC70: (if((ROUND(RC[-1],2) = 0),0,((100 * ROUND(RC[-2],2)) / ROUND(RC[-1],2))))/100.0 -> 0.025 | AD70: 1.0 | AE70: 40.0 | AF70: (if((ROUND(RC[-1],2) = 0),0,((100 * ROUND(RC[-2],2)) / ROUND(RC[-1],2))))/100.0 -> 0.025 | AG70: 1.0 | AH70: 40.0 | AI70: (if((ROUND(RC[-1],2) = 0),0,((100 * ROUND(RC[-2],2)) / ROUND(RC[-1],2))))/100.0 -> 0.025 | AJ70: 1.0 | AK70: 40.0 | AL70: (if((ROUND(RC[-1],2) = 0),0,((100 * ROUND(RC[-2],2)) / ROUND(RC[-1],2))))/100.0 -> 0.025 | AM70: 1.0 | AN70: 40.0 | AO70: (if((ROUND(RC[-1],2) = 0),0,((100 * ROUND(RC[-2],2)) / ROUND(RC[-1],2))))/100.0 -> 0.025 | AP70: 1.2 | AQ70: 16.0 | AR70: (if((ROUND(RC[-1],2) = 0),0,((100 * ROUND(RC[-2],2)) / ROUND(RC[-1],2))))/100.0 -> 0.075 | AS70: SUM(RC[-42],RC[-39],RC[-36],RC[-33],RC[-30],RC[-27],RC[-24],RC[-21],RC[-18],RC[-15],RC[-12],RC[-9],RC[-6],RC[-3]) -> 11.0 | AT70: SUM(RC[-42],RC[-39],RC[-36],RC[-33],RC[-30],RC[-27],RC[-24],RC[-21],RC[-18],RC[-15],RC[-12],RC[-9],RC[-6],RC[-3]) -> 528.0 | AU70: (if((ROUND(RC[-1],2) = 0),0,((100 * ROUND(RC[-2],2)) / ROUND(RC[-1],2))))/100.0 -> 0.020833333333333336
B71: Cus-01168 DipNed MR : Proj-01122 DipNed - Korte termijn verbeteringen matchen bankafschriften | C71: 15.2 | D71: 32.0 | E71: (if((ROUND(RC[-1],2) = 0),0,((100 * ROUND(RC[-2],2)) / ROUND(RC[-1],2))))/100.0 -> 0.475 | F71: 27.0 | G71: 40.0 | H71: (if((ROUND(RC[-1],2) = 0),0,((100 * ROUND(RC[-2],2)) / ROUND(RC[-1],2))))/100.0 -> 0.675 | J71: 40.0 | K71: (if((ROUND(RC[-1],2) = 0),0,((100 * ROUND(RC[-2],2)) / ROUND(RC[-1],2))))/100.0 -> 0.0 | M71: 40.0 | N71: (if((ROUND(RC[-1],2) = 0),0,((100 * ROUND(RC[-2],2)) / ROUND(RC[-1],2))))/100.0 -> 0.0 | P71: 40.0 | Q71: (if((ROUND(RC[-1],2) = 0),0,((100 * ROUND(RC[-2],2)) / ROUND(RC[-1],2))))/100.0 -> 0.0 | R71: 19.0 | S71: 40.0 | T71: (if((ROUND(RC[-1],2) = 0),0,((100 * ROUND(RC[-2],2)) / ROUND(RC[-1],2))))/100.0 -> 0.475 | U71: 3.0 | V71: 40.0 | W71: (if((ROUND(RC[-1],2) = 0),0,((100 * ROUND(RC[-2],2)) / ROUND(RC[-1],2))))/100.0 -> 0.075 | X71: 3.0 | Y71: 40.0 | Z71: (if((ROUND(RC[-1],2) = 0),0,((100 * ROUND(RC[-2],2)) / ROUND(RC[-1],2))))/100.0 -> 0.075 | AA71: 3.0 | AB71: 40.0 | AC71: (if((ROUND(RC[-1],2) = 0),0,((100 * ROUND(RC[-2],2)) / ROUND(RC[-1],2))))/100.0 -> 0.075 | AD71: 19.0 | AE71: 40.0 | AF71: (if((ROUND(RC[-1],2) = 0),0,((100 * ROUND(RC[-2],2)) / ROUND(RC[-1],2))))/100.0 -> 0.475 | AG71: 27.0 | AH71: 40.0 | AI71: (if((ROUND(RC[-1],2) = 0),0,((100 * ROUND(RC[-2],2)) / ROUND(RC[-1],2))))/100.0 -> 0.675 | AJ71: 27.0 | AK71: 40.0 | AL71: (if((ROUND(RC[-1],2) = 0),0,((100 * ROUND(RC[-2],2)) / ROUND(RC[-1],2))))/100.0 -> 0.675 | AM71: 27.0 | AN71: 40.0 | AO71: (if((ROUND(RC[-1],2) = 0),0,((100 * ROUND(RC[-2],2)) / ROUND(RC[-1],2))))/100.0 -> 0.675 | AP71: 10.0 | AQ71: 16.0 | AR71: (if((ROUND(RC[-1],2) = 0),0,((100 * ROUND(RC[-2],2)) / ROUND(RC[-1],2))))/100.0 -> 0.625 | AS71: SUM(RC[-42],RC[-39],RC[-36],RC[-33],RC[-30],RC[-27],RC[-24],RC[-21],RC[-18],RC[-15],RC[-12],RC[-9],RC[-6],RC[-3]) -> 180.2 | AT71: SUM(RC[-42],RC[-39],RC[-36],RC[-33],RC[-30],RC[-27],RC[-24],RC[-21],RC[-18],RC[-15],RC[-12],RC[-9],RC[-6],RC[-3]) -> 528.0 | AU71: (if((ROUND(RC[-1],2) = 0),0,((100 * ROUND(RC[-2],2)) / ROUND(RC[-1],2))))/100.0 -> 0.34128787878787875
B72: Cus-01736 LDCR Afd. Fin. : Proj-01031 Wishes LDCR Period 3 | D72: 32.0 | E72: (if((ROUND(RC[-1],2) = 0),0,((100 * ROUND(RC[-2],2)) / ROUND(RC[-1],2))))/100.0 -> 0.0 | G72: 40.0 | H72: (if((ROUND(RC[-1],2) = 0),0,((100 * ROUND(RC[-2],2)) / ROUND(RC[-1],2))))/100.0 -> 0.0 | J72: 40.0 | K72: (if((ROUND(RC[-1],2) = 0),0,((100 * ROUND(RC[-2],2)) / ROUND(RC[-1],2))))/100.0 -> 0.0 | M72: 40.0 | N72: (if((ROUND(RC[-1],2) = 0),0,((100 * ROUND(RC[-2],2)) / ROUND(RC[-1],2))))/100.0 -> 0.0 | P72: 40.0 | Q72: (if((ROUND(RC[-1],2) = 0),0,((100 * ROUND(RC[-2],2)) / ROUND(RC[-1],2))))/100.0 -> 0.0 | S72: 40.0 | T72: (if((ROUND(RC[-1],2) = 0),0,((100 * ROUND(RC[-2],2)) / ROUND(RC[-1],2))))/100.0 -> 0.0 | U72: 24.0 | V72: 40.0 | W72: (if((ROUND(RC[-1],2) = 0),0,((100 * ROUND(RC[-2],2)) / ROUND(RC[-1],2))))/100.0 -> 0.6 | X72: 24.0 | Y72: 40.0 | Z72: (if((ROUND(RC[-1],2) = 0),0,((100 * ROUND(RC[-2],2)) / ROUND(RC[-1],2))))/100.0 -> 0.6 | AA72: 24.0 | AB72: 40.0 | AC72: (if((ROUND(RC[-1],2) = 0),0,((100 * ROUND(RC[-2],2)) / ROUND(RC[-1],2))))/100.0 -> 0.6 | AD72: 8.0 | AE72: 40.0 | AF72: (if((ROUND(RC[-1],2) = 0),0,((100 * ROUND(RC[-2],2)) / ROUND(RC[-1],2))))/100.0 -> 0.2 | AH72: 40.0 | AI72: (if((ROUND(RC[-1],2) = 0),0,((100 * ROUND(RC[-2],2)) / ROUND(RC[-1],2))))/100.0 -> 0.0 | AK72: 40.0 | AL72: (if((ROUND(RC[-1],2) = 0),0,((100 * ROUND(RC[-2],2)) / ROUND(RC[-1],2))))/100.0 -> 0.0 | AN72: 40.0 | AO72: (if((ROUND(RC[-1],2) = 0),0,((100 * ROUND(RC[-2],2)) / ROUND(RC[-1],2))))/100.0 -> 0.0 | AQ72: 16.0 | AR72: (if((ROUND(RC[-1],2) = 0),0,((100 * ROUND(RC[-2],2)) / ROUND(RC[-1],2))))/100.0 -> 0.0 | AS72: SUM(RC[-42],RC[-39],RC[-36],RC[-33],RC[-30],RC[-27],RC[-24],RC[-21],RC[-18],RC[-15],RC[-12],RC[-9],RC[-6],RC[-3]) -> 80.0 | AT72: SUM(RC[-42],RC[-39],RC[-36],RC[-33],RC[-30],RC[-27],RC[-24],RC[-21],RC[-18],RC[-15],RC[-12],RC[-9],RC[-6],RC[-3]) -> 528.0 | AU72: (if((ROUND(RC[-1],2) = 0),0,((100 * ROUND(RC[-2],2)) / ROUND(RC[-1],2))))/100.0 -> 0.15151515151515152
A73: Total - Ivo Oude Veldhuis | C73: SUM(R[-6]C:R[-1]C) -> 32.0 | D73: 32.0 | E73: (if((ROUND(RC[-1],2) = 0),0,((100 * ROUND(RC[-2],2)) / ROUND(RC[-1],2))))/100.0 -> 1.0 | F73: SUM(R[-6]C:R[-1]C) -> 40.0 | G73: 40.0 | H73: (if((ROUND(RC[-1],2) = 0),0,((100 * ROUND(RC[-2],2)) / ROUND(RC[-1],2))))/100.0 -> 1.0 | I73: SUM(R[-6]C:R[-1]C) -> 0.0 | J73: 40.0 | K73: (if((ROUND(RC[-1],2) = 0),0,((100 * ROUND(RC[-2],2)) / ROUND(RC[-1],2))))/100.0 -> 0.0 | L73: SUM(R[-6]C:R[-1]C) -> 0.0 | M73: 40.0 | N73: (if((ROUND(RC[-1],2) = 0),0,((100 * ROUND(RC[-2],2)) / ROUND(RC[-1],2))))/100.0 -> 0.0 | O73: SUM(R[-6]C:R[-1]C) -> 0.0 | P73: 40.0 | Q73: (if((ROUND(RC[-1],2) = 0),0,((100 * ROUND(RC[-2],2)) / ROUND(RC[-1],2))))/100.0 -> 0.0 | R73: SUM(R[-6]C:R[-1]C) -> 32.0 | S73: 40.0 | T73: (if((ROUND(RC[-1],2) = 0),0,((100 * ROUND(RC[-2],2)) / ROUND(RC[-1],2))))/100.0 -> 0.8 | U73: SUM(R[-6]C:R[-1]C) -> 40.0 | V73: 40.0 | W73: (if((ROUND(RC[-1],2) = 0),0,((100 * ROUND(RC[-2],2)) / ROUND(RC[-1],2))))/100.0 -> 1.0 | X73: SUM(R[-6]C:R[-1]C) -> 40.0 | Y73: 40.0 | Z73: (if((ROUND(RC[-1],2) = 0),0,((100 * ROUND(RC[-2],2)) / ROUND(RC[-1],2))))/100.0 -> 1.0 | AA73: SUM(R[-6]C:R[-1]C) -> 40.0 | AB73: 40.0 | AC73: (if((ROUND(RC[-1],2) = 0),0,((100 * ROUND(RC[-2],2)) / ROUND(RC[-1],2))))/100.0 -> 1.0 | AD73: SUM(R[-6]C:R[-1]C) -> 40.0 | AE73: 40.0 | AF73: (if((ROUND(RC[-1],2) = 0),0,((100 * ROUND(RC[-2],2)) / ROUND(RC[-1],2))))/100.0 -> 1.0 | AG73: SUM(R[-6]C:R[-1]C) -> 40.0 | AH73: 40.0 | AI73: (if((ROUND(RC[-1],2) = 0),0,((100 * ROUND(RC[-2],2)) / ROUND(RC[-1],2))))/100.0 -> 1.0 | AJ73: SUM(R[-6]C:R[-1]C) -> 40.0 | AK73: 40.0 | AL73: (if((ROUND(RC[-1],2) = 0),0,((100 * ROUND(RC[-2],2)) / ROUND(RC[-1],2))))/100.0 -> 1.0 | AM73: SUM(R[-6]C:R[-1]C) -> 40.0 | AN73: 40.0 | AO73: (if((ROUND(RC[-1],2) = 0),0,((100 * ROUND(RC[-2],2)) / ROUND(RC[-1],2))))/100.0 -> 1.0 | AP73: SUM(R[-6]C:R[-1]C) -> 16.0 | AQ73: 16.0 | AR73: (if((ROUND(RC[-1],2) = 0),0,((100 * ROUND(RC[-2],2)) / ROUND(RC[-1],2))))/100.0 -> 1.0 | AS73: SUM(R[-6]C:R[-1]C) -> 400.0 | AT73: SUM(R[-6]C:R[-1]C) -> 528.0 | AU73: (if((ROUND(RC[-1],2) = 0),0,((100 * ROUND(RC[-2],2)) / ROUND(RC[-1],2))))/100.0 -> 0.7575757575757575
A74: Jacqueline Tol. van der,
B75: Cus-01163 Aryza B.V. : Proj-00842 Algemeen beheer 2025 | D75: 32.0 | E75: (if((ROUND(RC[-1],2) = 0),0,((100 * ROUND(RC[-2],2)) / ROUND(RC[-1],2))))/100.0 -> 0.0 | G75: 40.0 | H75: (if((ROUND(RC[-1],2) = 0),0,((100 * ROUND(RC[-2],2)) / ROUND(RC[-1],2))))/100.0 -> 0.0 | I75: 20.0 | J75: 40.0 | K75: (if((ROUND(RC[-1],2) = 0),0,((100 * ROUND(RC[-2],2)) / ROUND(RC[-1],2))))/100.0 -> 0.5 | L75: 16.0 | M75: 40.0 | N75: (if((ROUND(RC[-1],2) = 0),0,((100 * ROUND(RC[-2],2)) / ROUND(RC[-1],2))))/100.0 -> 0.4 | O75: 24.0 | P75: 40.0 | Q75: (if((ROUND(RC[-1],2) = 0),0,((100 * ROUND(RC[-2],2)) / ROUND(RC[-1],2))))/100.0 -> 0.6 | R75: 23.0 | S75: 40.0 | T75: (if((ROUND(RC[-1],2) = 0),0,((100 * ROUND(RC[-2],2)) / ROUND(RC[-1],2))))/100.0 -> 0.575 | U75: 24.0 | V75: 40.0 | W75: (if((ROUND(RC[-1],2) = 0),0,((100 * ROUND(RC[-2],2)) / ROUND(RC[-1],2))))/100.0 -> 0.6 | X75: 24.0 | Y75: 40.0 | Z75: (if((ROUND(RC[-1],2) = 0),0,((100 * ROUND(RC[-2],2)) / ROUND(RC[-1],2))))/100.0 -> 0.6 | AA75: 12.0 | AB75: 40.0 | AC75: (if((ROUND(RC[-1],2) = 0),0,((100 * ROUND(RC[-2],2)) / ROUND(RC[-1],2))))/100.0 -> 0.3 | AD75: 16.0 | AE75: 40.0 | AF75: (if((ROUND(RC[-1],2) = 0),0,((100 * ROUND(RC[-2],2)) / ROUND(RC[-1],2))))/100.0 -> 0.4 | AG75: 16.0 | AH75: 40.0 | AI75: (if((ROUND(RC[-1],2) = 0),0,((100 * ROUND(RC[-2],2)) / ROUND(RC[-1],2))))/100.0 -> 0.4 | AJ75: 16.0 | AK75: 40.0 | AL75: (if((ROUND(RC[-1],2) = 0),0,((100 * ROUND(RC[-2],2)) / ROUND(RC[-1],2))))/100.0 -> 0.4 | AM75: 16.0 | AN75: 40.0 | AO75: (if((ROUND(RC[-1],2) = 0),0,((100 * ROUND(RC[-2],2)) / ROUND(RC[-1],2))))/100.0 -> 0.4 | AP75: 6.4 | AQ75: 16.0 | AR75: (if((ROUND(RC[-1],2) = 0),0,((100 * ROUND(RC[-2],2)) / ROUND(RC[-1],2))))/100.0 -> 0.4 | AS75: SUM(RC[-42],RC[-39],RC[-36],RC[-33],RC[-30],RC[-27],RC[-24],RC[-21],RC[-18],RC[-15],RC[-12],RC[-9],RC[-6],RC[-3]) -> 213.4 | AT75: SUM(RC[-42],RC[-39],RC[-36],RC[-33],RC[-30],RC[-27],RC[-24],RC[-21],RC[-18],RC[-15],RC[-12],RC[-9],RC[-6],RC[-3]) -> 528.0 | AU75: (if((ROUND(RC[-1],2) = 0),0,((100 * ROUND(RC[-2],2)) / ROUND(RC[-1],2))))/100.0 -> 0.4041666666666666
B76: Cus-01168 DipNed MR : Proj-01024 DipNed SEPA betaalbestanden SDD en SCT | D76: 32.0 | E76: (if((ROUND(RC[-1],2) = 0),0,((100 * ROUND(RC[-2],2)) / ROUND(RC[-1],2))))/100.0 -> 0.0 | G76: 40.0 | H76: (if((ROUND(RC[-1],2) = 0),0,((100 * ROUND(RC[-2],2)) / ROUND(RC[-1],2))))/100.0 -> 0.0 | J76: 40.0 | K76: (if((ROUND(RC[-1],2) = 0),0,((100 * ROUND(RC[-2],2)) / ROUND(RC[-1],2))))/100.0 -> 0.0 | M76: 40.0 | N76: (if((ROUND(RC[-1],2) = 0),0,((100 * ROUND(RC[-2],2)) / ROUND(RC[-1],2))))/100.0 -> 0.0 | P76: 40.0 | Q76: (if((ROUND(RC[-1],2) = 0),0,((100 * ROUND(RC[-2],2)) / ROUND(RC[-1],2))))/100.0 -> 0.0 | R76: 1.0 | S76: 40.0 | T76: (if((ROUND(RC[-1],2) = 0),0,((100 * ROUND(RC[-2],2)) / ROUND(RC[-1],2))))/100.0 -> 0.025 | V76: 40.0 | W76: (if((ROUND(RC[-1],2) = 0),0,((100 * ROUND(RC[-2],2)) / ROUND(RC[-1],2))))/100.0 -> 0.0 | Y76: 40.0 | Z76: (if((ROUND(RC[-1],2) = 0),0,((100 * ROUND(RC[-2],2)) / ROUND(RC[-1],2))))/100.0 -> 0.0 | AB76: 40.0 | AC76: (if((ROUND(RC[-1],2) = 0),0,((100 * ROUND(RC[-2],2)) / ROUND(RC[-1],2))))/100.0 -> 0.0 | AE76: 40.0 | AF76: (if((ROUND(RC[-1],2) = 0),0,((100 * ROUND(RC[-2],2)) / ROUND(RC[-1],2))))/100.0 -> 0.0 | AH76: 40.0 | AI76: (if((ROUND(RC[-1],2) = 0),0,((100 * ROUND(RC[-2],2)) / ROUND(RC[-1],2))))/100.0 -> 0.0 | AK76: 40.0 | AL76: (if((ROUND(RC[-1],2) = 0),0,((100 * ROUND(RC[-2],2)) / ROUND(RC[-1],2))))/100.0 -> 0.0 | AN76: 40.0 | AO76: (if((ROUND(RC[-1],2) = 0),0,((100 * ROUND(RC[-2],2)) / ROUND(RC[-1],2))))/100.0 -> 0.0 | AQ76: 16.0 | AR76: (if((ROUND(RC[-1],2) = 0),0,((100 * ROUND(RC[-2],2)) / ROUND(RC[-1],2))))/100.0 -> 0.0 | AS76: SUM(RC[-42],RC[-39],RC[-36],RC[-33],RC[-30],RC[-27],RC[-24],RC[-21],RC[-18],RC[-15],RC[-12],RC[-9],RC[-6],RC[-3]) -> 1.0 | AT76: SUM(RC[-42],RC[-39],RC[-36],RC[-33],RC[-30],RC[-27],RC[-24],RC[-21],RC[-18],RC[-15],RC[-12],RC[-9],RC[-6],RC[-3]) -> 528.0 | AU76: (if((ROUND(RC[-1],2) = 0),0,((100 * ROUND(RC[-2],2)) / ROUND(RC[-1],2))))/100.0 -> 0.001893939393939394
B77: Cus-01202 Syntrus Achmea Hypotheekdiensten B.V. : Proj-01089 Ontsluiting klantportaal API - Syntrus | D77: 32.0 | E77: (if((ROUND(RC[-1],2) = 0),0,((100 * ROUND(RC[-2],2)) / ROUND(RC[-1],2))))/100.0 -> 0.0 | G77: 40.0 | H77: (if((ROUND(RC[-1],2) = 0),0,((100 * ROUND(RC[-2],2)) / ROUND(RC[-1],2))))/100.0 -> 0.0 | J77: 40.0 | K77: (if((ROUND(RC[-1],2) = 0),0,((100 * ROUND(RC[-2],2)) / ROUND(RC[-1],2))))/100.0 -> 0.0 | L77: 8.0 | M77: 40.0 | N77: (if((ROUND(RC[-1],2) = 0),0,((100 * ROUND(RC[-2],2)) / ROUND(RC[-1],2))))/100.0 -> 0.2 | P77: 40.0 | Q77: (if((ROUND(RC[-1],2) = 0),0,((100 * ROUND(RC[-2],2)) / ROUND(RC[-1],2))))/100.0 -> 0.0 | S77: 40.0 | T77: (if((ROUND(RC[-1],2) = 0),0,((100 * ROUND(RC[-2],2)) / ROUND(RC[-1],2))))/100.0 -> 0.0 | V77: 40.0 | W77: (if((ROUND(RC[-1],2) = 0),0,((100 * ROUND(RC[-2],2)) / ROUND(RC[-1],2))))/100.0 -> 0.0 | Y77: 40.0 | Z77: (if((ROUND(RC[-1],2) = 0),0,((100 * ROUND(RC[-2],2)) / ROUND(RC[-1],2))))/100.0 -> 0.0 | AB77: 40.0 | AC77: (if((ROUND(RC[-1],2) = 0),0,((100 * ROUND(RC[-2],2)) / ROUND(RC[-1],2))))/100.0 -> 0.0 | AE77: 40.0 | AF77: (if((ROUND(RC[-1],2) = 0),0,((100 * ROUND(RC[-2],2)) / ROUND(RC[-1],2))))/100.0 -> 0.0 | AH77: 40.0 | AI77: (if((ROUND(RC[-1],2) = 0),0,((100 * ROUND(RC[-2],2)) / ROUND(RC[-1],2))))/100.0 -> 0.0 | AK77: 40.0 | AL77: (if((ROUND(RC[-1],2) = 0),0,((100 * ROUND(RC[-2],2)) / ROUND(RC[-1],2))))/100.0 -> 0.0 | AN77: 40.0 | AO77: (if((ROUND(RC[-1],2) = 0),0,((100 * ROUND(RC[-2],2)) / ROUND(RC[-1],2))))/100.0 -> 0.0 | AQ77: 16.0 | AR77: (if((ROUND(RC[-1],2) = 0),0,((100 * ROUND(RC[-2],2)) / ROUND(RC[-1],2))))/100.0 -> 0.0 | AS77: SUM(RC[-42],RC[-39],RC[-36],RC[-33],RC[-30],RC[-27],RC[-24],RC[-21],RC[-18],RC[-15],RC[-12],RC[-9],RC[-6],RC[-3]) -> 8.0 | AT77: SUM(RC[-42],RC[-39],RC[-36],RC[-33],RC[-30],RC[-27],RC[-24],RC[-21],RC[-18],RC[-15],RC[-12],RC[-9],RC[-6],RC[-3]) -> 528.0 | AU77: (if((ROUND(RC[-1],2) = 0),0,((100 * ROUND(RC[-2],2)) / ROUND(RC[-1],2))))/100.0 -> 0.015151515151515152
B78: Cus-01214 Creditbility B.V. : Proj-00992 Check handmatig/automatisch per klant GoCOllect | D78: 32.0 | E78: (if((ROUND(RC[-1],2) = 0),0,((100 * ROUND(RC[-2],2)) / ROUND(RC[-1],2))))/100.0 -> 0.0 | G78: 40.0 | H78: (if((ROUND(RC[-1],2) = 0),0,((100 * ROUND(RC[-2],2)) / ROUND(RC[-1],2))))/100.0 -> 0.0 | I78: 4.0 | J78: 40.0 | K78: (if((ROUND(RC[-1],2) = 0),0,((100 * ROUND(RC[-2],2)) / ROUND(RC[-1],2))))/100.0 -> 0.1 | M78: 40.0 | N78: (if((ROUND(RC[-1],2) = 0),0,((100 * ROUND(RC[-2],2)) / ROUND(RC[-1],2))))/100.0 -> 0.0 | P78: 40.0 | Q78: (if((ROUND(RC[-1],2) = 0),0,((100 * ROUND(RC[-2],2)) / ROUND(RC[-1],2))))/100.0 -> 0.0 | S78: 40.0 | T78: (if((ROUND(RC[-1],2) = 0),0,((100 * ROUND(RC[-2],2)) / ROUND(RC[-1],2))))/100.0 -> 0.0 | V78: 40.0 | W78: (if((ROUND(RC[-1],2) = 0),0,((100 * ROUND(RC[-2],2)) / ROUND(RC[-1],2))))/100.0 -> 0.0 | Y78: 40.0 | Z78: (if((ROUND(RC[-1],2) = 0),0,((100 * ROUND(RC[-2],2)) / ROUND(RC[-1],2))))/100.0 -> 0.0 | AB78: 40.0 | AC78: (if((ROUND(RC[-1],2) = 0),0,((100 * ROUND(RC[-2],2)) / ROUND(RC[-1],2))))/100.0 -> 0.0 | AE78: 40.0 | AF78: (if((ROUND(RC[-1],2) = 0),0,((100 * ROUND(RC[-2],2)) / ROUND(RC[-1],2))))/100.0 -> 0.0 | AH78: 40.0 | AI78: (if((ROUND(RC[-1],2) = 0),0,((100 * ROUND(RC[-2],2)) / ROUND(RC[-1],2))))/100.0 -> 0.0 | AK78: 40.0 | AL78: (if((ROUND(RC[-1],2) = 0),0,((100 * ROUND(RC[-2],2)) / ROUND(RC[-1],2))))/100.0 -> 0.0 | AN78: 40.0 | AO78: (if((ROUND(RC[-1],2) = 0),0,((100 * ROUND(RC[-2],2)) / ROUND(RC[-1],2))))/100.0 -> 0.0 | AQ78: 16.0 | AR78: (if((ROUND(RC[-1],2) = 0),0,((100 * ROUND(RC[-2],2)) / ROUND(RC[-1],2))))/100.0 -> 0.0 | AS78: SUM(RC[-42],RC[-39],RC[-36],RC[-33],RC[-30],RC[-27],RC[-24],RC[-21],RC[-18],RC[-15],RC[-12],RC[-9],RC[-6],RC[-3]) -> 4.0 | AT78: SUM(RC[-42],RC[-39],RC[-36],RC[-33],RC[-30],RC[-27],RC[-24],RC[-21],RC[-18],RC[-15],RC[-12],RC[-9],RC[-6],RC[-3]) -> 528.0 | AU78: (if((ROUND(RC[-1],2) = 0),0,((100 * ROUND(RC[-2],2)) / ROUND(RC[-1],2))))/100.0 -> 0.007575757575757576
B79: Cus-01736 LDCR Afd. Fin. : Proj-00805 LDCR C-Kasapplicatie | D79: 32.0 | E79: (if((ROUND(RC[-1],2) = 0),0,((100 * ROUND(RC[-2],2)) / ROUND(RC[-1],2))))/100.0 -> 0.0 | G79: 40.0 | H79: (if((ROUND(RC[-1],2) = 0),0,((100 * ROUND(RC[-2],2)) / ROUND(RC[-1],2))))/100.0 -> 0.0 | J79: 40.0 | K79: (if((ROUND(RC[-1],2) = 0),0,((100 * ROUND(RC[-2],2)) / ROUND(RC[-1],2))))/100.0 -> 0.0 | M79: 40.0 | N79: (if((ROUND(RC[-1],2) = 0),0,((100 * ROUND(RC[-2],2)) / ROUND(RC[-1],2))))/100.0 -> 0.0 | P79: 40.0 | Q79: (if((ROUND(RC[-1],2) = 0),0,((100 * ROUND(RC[-2],2)) / ROUND(RC[-1],2))))/100.0 -> 0.0 | S79: 40.0 | T79: (if((ROUND(RC[-1],2) = 0),0,((100 * ROUND(RC[-2],2)) / ROUND(RC[-1],2))))/100.0 -> 0.0 | V79: 40.0 | W79: (if((ROUND(RC[-1],2) = 0),0,((100 * ROUND(RC[-2],2)) / ROUND(RC[-1],2))))/100.0 -> 0.0 | Y79: 40.0 | Z79: (if((ROUND(RC[-1],2) = 0),0,((100 * ROUND(RC[-2],2)) / ROUND(RC[-1],2))))/100.0 -> 0.0 | AA79: 8.0 | AB79: 40.0 | AC79: (if((ROUND(RC[-1],2) = 0),0,((100 * ROUND(RC[-2],2)) / ROUND(RC[-1],2))))/100.0 -> 0.2 | AD79: 8.0 | AE79: 40.0 | AF79: (if((ROUND(RC[-1],2) = 0),0,((100 * ROUND(RC[-2],2)) / ROUND(RC[-1],2))))/100.0 -> 0.2 | AG79: 8.0 | AH79: 40.0 | AI79: (if((ROUND(RC[-1],2) = 0),0,((100 * ROUND(RC[-2],2)) / ROUND(RC[-1],2))))/100.0 -> 0.2 | AJ79: 8.0 | AK79: 40.0 | AL79: (if((ROUND(RC[-1],2) = 0),0,((100 * ROUND(RC[-2],2)) / ROUND(RC[-1],2))))/100.0 -> 0.2 | AM79: 8.0 | AN79: 40.0 | AO79: (if((ROUND(RC[-1],2) = 0),0,((100 * ROUND(RC[-2],2)) / ROUND(RC[-1],2))))/100.0 -> 0.2 | AP79: 3.2 | AQ79: 16.0 | AR79: (if((ROUND(RC[-1],2) = 0),0,((100 * ROUND(RC[-2],2)) / ROUND(RC[-1],2))))/100.0 -> 0.2 | AS79: SUM(RC[-42],RC[-39],RC[-36],RC[-33],RC[-30],RC[-27],RC[-24],RC[-21],RC[-18],RC[-15],RC[-12],RC[-9],RC[-6],RC[-3]) -> 43.2 | AT79: SUM(RC[-42],RC[-39],RC[-36],RC[-33],RC[-30],RC[-27],RC[-24],RC[-21],RC[-18],RC[-15],RC[-12],RC[-9],RC[-6],RC[-3]) -> 528.0 | AU79: (if((ROUND(RC[-1],2) = 0),0,((100 * ROUND(RC[-2],2)) / ROUND(RC[-1],2))))/100.0 -> 0.08181818181818182
A80: Total - Jacqueline Tol. van der, | C80: SUM(R[-5]C:R[-1]C) ->  | D80: 32.0 | E80: (if((ROUND(RC[-1],2) = 0),0,((100 * ROUND(RC[-2],2)) / ROUND(RC[-1],2))))/100.0 -> 0.0 | F80: SUM(R[-5]C:R[-1]C) ->  | G80: 40.0 | H80: (if((ROUND(RC[-1],2) = 0),0,((100 * ROUND(RC[-2],2)) / ROUND(RC[-1],2))))/100.0 -> 0.0 | I80: SUM(R[-5]C:R[-1]C) -> 24.0 | J80: 40.0 | K80: (if((ROUND(RC[-1],2) = 0),0,((100 * ROUND(RC[-2],2)) / ROUND(RC[-1],2))))/100.0 -> 0.6 | L80: SUM(R[-5]C:R[-1]C) -> 24.0 | M80: 40.0 | N80: (if((ROUND(RC[-1],2) = 0),0,((100 * ROUND(RC[-2],2)) / ROUND(RC[-1],2))))/100.0 -> 0.6 | O80: SUM(R[-5]C:R[-1]C) -> 24.0 | P80: 40.0 | Q80: (if((ROUND(RC[-1],2) = 0),0,((100 * ROUND(RC[-2],2)) / ROUND(RC[-1],2))))/100.0 -> 0.6 | R80: SUM(R[-5]C:R[-1]C) -> 24.0 | S80: 40.0 | T80: (if((ROUND(RC[-1],2) = 0),0,((100 * ROUND(RC[-2],2)) / ROUND(RC[-1],2))))/100.0 -> 0.6 | U80: SUM(R[-5]C:R[-1]C) -> 24.0 | V80: 40.0 | W80: (if((ROUND(RC[-1],2) = 0),0,((100 * ROUND(RC[-2],2)) / ROUND(RC[-1],2))))/100.0 -> 0.6 | X80: SUM(R[-5]C:R[-1]C) -> 24.0 | Y80: 40.0 | Z80: (if((ROUND(RC[-1],2) = 0),0,((100 * ROUND(RC[-2],2)) / ROUND(RC[-1],2))))/100.0 -> 0.6 | AA80: SUM(R[-5]C:R[-1]C) -> 20.0 | AB80: 40.0 | AC80: (if((ROUND(RC[-1],2) = 0),0,((100 * ROUND(RC[-2],2)) / ROUND(RC[-1],2))))/100.0 -> 0.5 | AD80: SUM(R[-5]C:R[-1]C) -> 24.0 | AE80: 40.0 | AF80: (if((ROUND(RC[-1],2) = 0),0,((100 * ROUND(RC[-2],2)) / ROUND(RC[-1],2))))/100.0 -> 0.6 | AG80: SUM(R[-5]C:R[-1]C) -> 24.0 | AH80: 40.0 | AI80: (if((ROUND(RC[-1],2) = 0),0,((100 * ROUND(RC[-2],2)) / ROUND(RC[-1],2))))/100.0 -> 0.6 | AJ80: SUM(R[-5]C:R[-1]C) -> 24.0 | AK80: 40.0 | AL80: (if((ROUND(RC[-1],2) = 0),0,((100 * ROUND(RC[-2],2)) / ROUND(RC[-1],2))))/100.0 -> 0.6 | AM80: SUM(R[-5]C:R[-1]C) -> 24.0 | AN80: 40.0 | AO80: (if((ROUND(RC[-1],2) = 0),0,((100 * ROUND(RC[-2],2)) / ROUND(RC[-1],2))))/100.0 -> 0.6 | AP80: SUM(R[-5]C:R[-1]C) -> 9.600000000000001 | AQ80: 16.0 | AR80: (if((ROUND(RC[-1],2) = 0),0,((100 * ROUND(RC[-2],2)) / ROUND(RC[-1],2))))/100.0 -> 0.6 | AS80: SUM(R[-5]C:R[-1]C) -> 269.6 | AT80: SUM(R[-5]C:R[-1]C) -> 528.0 | AU80: (if((ROUND(RC[-1],2) = 0),0,((100 * ROUND(RC[-2],2)) / ROUND(RC[-1],2))))/100.0 -> 0.5106060606060607
A81: Jan Posthouwer
B82: Cus-01163 Aryza B.V. : Proj-00842 Algemeen beheer 2025 | C82: 14.4 | D82: 32.0 | E82: (if((ROUND(RC[-1],2) = 0),0,((100 * ROUND(RC[-2],2)) / ROUND(RC[-1],2))))/100.0 -> 0.45 | F82: 32.0 | G82: 40.0 | H82: (if((ROUND(RC[-1],2) = 0),0,((100 * ROUND(RC[-2],2)) / ROUND(RC[-1],2))))/100.0 -> 0.8 | I82: 24.0 | J82: 40.0 | K82: (if((ROUND(RC[-1],2) = 0),0,((100 * ROUND(RC[-2],2)) / ROUND(RC[-1],2))))/100.0 -> 0.6 | L82: 30.0 | M82: 40.0 | N82: (if((ROUND(RC[-1],2) = 0),0,((100 * ROUND(RC[-2],2)) / ROUND(RC[-1],2))))/100.0 -> 0.75 | O82: 16.0 | P82: 40.0 | Q82: (if((ROUND(RC[-1],2) = 0),0,((100 * ROUND(RC[-2],2)) / ROUND(RC[-1],2))))/100.0 -> 0.4 | R82: 15.0 | S82: 40.0 | T82: (if((ROUND(RC[-1],2) = 0),0,((100 * ROUND(RC[-2],2)) / ROUND(RC[-1],2))))/100.0 -> 0.375 | V82: 40.0 | W82: (if((ROUND(RC[-1],2) = 0),0,((100 * ROUND(RC[-2],2)) / ROUND(RC[-1],2))))/100.0 -> 0.0 | Y82: 40.0 | Z82: (if((ROUND(RC[-1],2) = 0),0,((100 * ROUND(RC[-2],2)) / ROUND(RC[-1],2))))/100.0 -> 0.0 | AA82: 32.0 | AB82: 40.0 | AC82: (if((ROUND(RC[-1],2) = 0),0,((100 * ROUND(RC[-2],2)) / ROUND(RC[-1],2))))/100.0 -> 0.8 | AD82: 32.0 | AE82: 40.0 | AF82: (if((ROUND(RC[-1],2) = 0),0,((100 * ROUND(RC[-2],2)) / ROUND(RC[-1],2))))/100.0 -> 0.8 | AG82: 32.0 | AH82: 40.0 | AI82: (if((ROUND(RC[-1],2) = 0),0,((100 * ROUND(RC[-2],2)) / ROUND(RC[-1],2))))/100.0 -> 0.8 | AJ82: 32.0 | AK82: 40.0 | AL82: (if((ROUND(RC[-1],2) = 0),0,((100 * ROUND(RC[-2],2)) / ROUND(RC[-1],2))))/100.0 -> 0.8 | AM82: 32.0 | AN82: 40.0 | AO82: (if((ROUND(RC[-1],2) = 0),0,((100 * ROUND(RC[-2],2)) / ROUND(RC[-1],2))))/100.0 -> 0.8 | AP82: 12.8 | AQ82: 16.0 | AR82: (if((ROUND(RC[-1],2) = 0),0,((100 * ROUND(RC[-2],2)) / ROUND(RC[-1],2))))/100.0 -> 0.8 | AS82: SUM(RC[-42],RC[-39],RC[-36],RC[-33],RC[-30],RC[-27],RC[-24],RC[-21],RC[-18],RC[-15],RC[-12],RC[-9],RC[-6],RC[-3]) -> 304.2 | AT82: SUM(RC[-42],RC[-39],RC[-36],RC[-33],RC[-30],RC[-27],RC[-24],RC[-21],RC[-18],RC[-15],RC[-12],RC[-9],RC[-6],RC[-3]) -> 528.0 | AU82: (if((ROUND(RC[-1],2) = 0),0,((100 * ROUND(RC[-2],2)) / ROUND(RC[-1],2))))/100.0 -> 0.5761363636363637
B83: Cus-01163 Aryza B.V. : Proj-00976 Interne uren 2025 | C83: 3.2 | D83: 32.0 | E83: (if((ROUND(RC[-1],2) = 0),0,((100 * ROUND(RC[-2],2)) / ROUND(RC[-1],2))))/100.0 -> 0.1 | F83: 4.0 | G83: 40.0 | H83: (if((ROUND(RC[-1],2) = 0),0,((100 * ROUND(RC[-2],2)) / ROUND(RC[-1],2))))/100.0 -> 0.1 | I83: 4.0 | J83: 40.0 | K83: (if((ROUND(RC[-1],2) = 0),0,((100 * ROUND(RC[-2],2)) / ROUND(RC[-1],2))))/100.0 -> 0.1 | L83: 4.0 | M83: 40.0 | N83: (if((ROUND(RC[-1],2) = 0),0,((100 * ROUND(RC[-2],2)) / ROUND(RC[-1],2))))/100.0 -> 0.1 | O83: 4.0 | P83: 40.0 | Q83: (if((ROUND(RC[-1],2) = 0),0,((100 * ROUND(RC[-2],2)) / ROUND(RC[-1],2))))/100.0 -> 0.1 | R83: 4.0 | S83: 40.0 | T83: (if((ROUND(RC[-1],2) = 0),0,((100 * ROUND(RC[-2],2)) / ROUND(RC[-1],2))))/100.0 -> 0.1 | V83: 40.0 | W83: (if((ROUND(RC[-1],2) = 0),0,((100 * ROUND(RC[-2],2)) / ROUND(RC[-1],2))))/100.0 -> 0.0 | Y83: 40.0 | Z83: (if((ROUND(RC[-1],2) = 0),0,((100 * ROUND(RC[-2],2)) / ROUND(RC[-1],2))))/100.0 -> 0.0 | AA83: 4.0 | AB83: 40.0 | AC83: (if((ROUND(RC[-1],2) = 0),0,((100 * ROUND(RC[-2],2)) / ROUND(RC[-1],2))))/100.0 -> 0.1 | AD83: 4.0 | AE83: 40.0 | AF83: (if((ROUND(RC[-1],2) = 0),0,((100 * ROUND(RC[-2],2)) / ROUND(RC[-1],2))))/100.0 -> 0.1 | AG83: 4.0 | AH83: 40.0 | AI83: (if((ROUND(RC[-1],2) = 0),0,((100 * ROUND(RC[-2],2)) / ROUND(RC[-1],2))))/100.0 -> 0.1 | AJ83: 4.0 | AK83: 40.0 | AL83: (if((ROUND(RC[-1],2) = 0),0,((100 * ROUND(RC[-2],2)) / ROUND(RC[-1],2))))/100.0 -> 0.1 | AM83: 4.0 | AN83: 40.0 | AO83: (if((ROUND(RC[-1],2) = 0),0,((100 * ROUND(RC[-2],2)) / ROUND(RC[-1],2))))/100.0 -> 0.1 | AP83: 1.6 | AQ83: 16.0 | AR83: (if((ROUND(RC[-1],2) = 0),0,((100 * ROUND(RC[-2],2)) / ROUND(RC[-1],2))))/100.0 -> 0.1 | AS83: SUM(RC[-42],RC[-39],RC[-36],RC[-33],RC[-30],RC[-27],RC[-24],RC[-21],RC[-18],RC[-15],RC[-12],RC[-9],RC[-6],RC[-3]) -> 44.800000000000004 | AT83: SUM(RC[-42],RC[-39],RC[-36],RC[-33],RC[-30],RC[-27],RC[-24],RC[-21],RC[-18],RC[-15],RC[-12],RC[-9],RC[-6],RC[-3]) -> 528.0 | AU83: (if((ROUND(RC[-1],2) = 0),0,((100 * ROUND(RC[-2],2)) / ROUND(RC[-1],2))))/100.0 -> 0.08484848484848484
B84: Cus-01163 Aryza B.V. : Proj-01059 Upgrade Framework GRFO | C84: 10.0 | D84: 32.0 | E84: (if((ROUND(RC[-1],2) = 0),0,((100 * ROUND(RC[-2],2)) / ROUND(RC[-1],2))))/100.0 -> 0.3125 | G84: 40.0 | H84: (if((ROUND(RC[-1],2) = 0),0,((100 * ROUND(RC[-2],2)) / ROUND(RC[-1],2))))/100.0 -> 0.0 | J84: 40.0 | K84: (if((ROUND(RC[-1],2) = 0),0,((100 * ROUND(RC[-2],2)) / ROUND(RC[-1],2))))/100.0 -> 0.0 | M84: 40.0 | N84: (if((ROUND(RC[-1],2) = 0),0,((100 * ROUND(RC[-2],2)) / ROUND(RC[-1],2))))/100.0 -> 0.0 | P84: 40.0 | Q84: (if((ROUND(RC[-1],2) = 0),0,((100 * ROUND(RC[-2],2)) / ROUND(RC[-1],2))))/100.0 -> 0.0 | S84: 40.0 | T84: (if((ROUND(RC[-1],2) = 0),0,((100 * ROUND(RC[-2],2)) / ROUND(RC[-1],2))))/100.0 -> 0.0 | V84: 40.0 | W84: (if((ROUND(RC[-1],2) = 0),0,((100 * ROUND(RC[-2],2)) / ROUND(RC[-1],2))))/100.0 -> 0.0 | Y84: 40.0 | Z84: (if((ROUND(RC[-1],2) = 0),0,((100 * ROUND(RC[-2],2)) / ROUND(RC[-1],2))))/100.0 -> 0.0 | AB84: 40.0 | AC84: (if((ROUND(RC[-1],2) = 0),0,((100 * ROUND(RC[-2],2)) / ROUND(RC[-1],2))))/100.0 -> 0.0 | AE84: 40.0 | AF84: (if((ROUND(RC[-1],2) = 0),0,((100 * ROUND(RC[-2],2)) / ROUND(RC[-1],2))))/100.0 -> 0.0 | AH84: 40.0 | AI84: (if((ROUND(RC[-1],2) = 0),0,((100 * ROUND(RC[-2],2)) / ROUND(RC[-1],2))))/100.0 -> 0.0 | AK84: 40.0 | AL84: (if((ROUND(RC[-1],2) = 0),0,((100 * ROUND(RC[-2],2)) / ROUND(RC[-1],2))))/100.0 -> 0.0 | AN84: 40.0 | AO84: (if((ROUND(RC[-1],2) = 0),0,((100 * ROUND(RC[-2],2)) / ROUND(RC[-1],2))))/100.0 -> 0.0 | AQ84: 16.0 | AR84: (if((ROUND(RC[-1],2) = 0),0,((100 * ROUND(RC[-2],2)) / ROUND(RC[-1],2))))/100.0 -> 0.0 | AS84: SUM(RC[-42],RC[-39],RC[-36],RC[-33],RC[-30],RC[-27],RC[-24],RC[-21],RC[-18],RC[-15],RC[-12],RC[-9],RC[-6],RC[-3]) -> 10.0 | AT84: SUM(RC[-42],RC[-39],RC[-36],RC[-33],RC[-30],RC[-27],RC[-24],RC[-21],RC[-18],RC[-15],RC[-12],RC[-9],RC[-6],RC[-3]) -> 528.0 | AU84: (if((ROUND(RC[-1],2) = 0),0,((100 * ROUND(RC[-2],2)) / ROUND(RC[-1],2))))/100.0 -> 0.01893939393939394
B85: Cus-01163 Aryza B.V. : Proj-01060 PTV T&T | C85: 3.2 | D85: 32.0 | E85: (if((ROUND(RC[-1],2) = 0),0,((100 * ROUND(RC[-2],2)) / ROUND(RC[-1],2))))/100.0 -> 0.1 | G85: 40.0 | H85: (if((ROUND(RC[-1],2) = 0),0,((100 * ROUND(RC[-2],2)) / ROUND(RC[-1],2))))/100.0 -> 0.0 | J85: 40.0 | K85: (if((ROUND(RC[-1],2) = 0),0,((100 * ROUND(RC[-2],2)) / ROUND(RC[-1],2))))/100.0 -> 0.0 | M85: 40.0 | N85: (if((ROUND(RC[-1],2) = 0),0,((100 * ROUND(RC[-2],2)) / ROUND(RC[-1],2))))/100.0 -> 0.0 | P85: 40.0 | Q85: (if((ROUND(RC[-1],2) = 0),0,((100 * ROUND(RC[-2],2)) / ROUND(RC[-1],2))))/100.0 -> 0.0 | S85: 40.0 | T85: (if((ROUND(RC[-1],2) = 0),0,((100 * ROUND(RC[-2],2)) / ROUND(RC[-1],2))))/100.0 -> 0.0 | V85: 40.0 | W85: (if((ROUND(RC[-1],2) = 0),0,((100 * ROUND(RC[-2],2)) / ROUND(RC[-1],2))))/100.0 -> 0.0 | Y85: 40.0 | Z85: (if((ROUND(RC[-1],2) = 0),0,((100 * ROUND(RC[-2],2)) / ROUND(RC[-1],2))))/100.0 -> 0.0 | AB85: 40.0 | AC85: (if((ROUND(RC[-1],2) = 0),0,((100 * ROUND(RC[-2],2)) / ROUND(RC[-1],2))))/100.0 -> 0.0 | AE85: 40.0 | AF85: (if((ROUND(RC[-1],2) = 0),0,((100 * ROUND(RC[-2],2)) / ROUND(RC[-1],2))))/100.0 -> 0.0 | AH85: 40.0 | AI85: (if((ROUND(RC[-1],2) = 0),0,((100 * ROUND(RC[-2],2)) / ROUND(RC[-1],2))))/100.0 -> 0.0 | AK85: 40.0 | AL85: (if((ROUND(RC[-1],2) = 0),0,((100 * ROUND(RC[-2],2)) / ROUND(RC[-1],2))))/100.0 -> 0.0 | AN85: 40.0 | AO85: (if((ROUND(RC[-1],2) = 0),0,((100 * ROUND(RC[-2],2)) / ROUND(RC[-1],2))))/100.0 -> 0.0 | AQ85: 16.0 | AR85: (if((ROUND(RC[-1],2) = 0),0,((100 * ROUND(RC[-2],2)) / ROUND(RC[-1],2))))/100.0 -> 0.0 | AS85: SUM(RC[-42],RC[-39],RC[-36],RC[-33],RC[-30],RC[-27],RC[-24],RC[-21],RC[-18],RC[-15],RC[-12],RC[-9],RC[-6],RC[-3]) -> 3.2 | AT85: SUM(RC[-42],RC[-39],RC[-36],RC[-33],RC[-30],RC[-27],RC[-24],RC[-21],RC[-18],RC[-15],RC[-12],RC[-9],RC[-6],RC[-3]) -> 528.0 | AU85: (if((ROUND(RC[-1],2) = 0),0,((100 * ROUND(RC[-2],2)) / ROUND(RC[-1],2))))/100.0 -> 0.006060606060606061
B86: Cus-01163 Aryza B.V. : Proj-01123 GoPay Email in Bulk | D86: 32.0 | E86: (if((ROUND(RC[-1],2) = 0),0,((100 * ROUND(RC[-2],2)) / ROUND(RC[-1],2))))/100.0 -> 0.0 | G86: 40.0 | H86: (if((ROUND(RC[-1],2) = 0),0,((100 * ROUND(RC[-2],2)) / ROUND(RC[-1],2))))/100.0 -> 0.0 | J86: 40.0 | K86: (if((ROUND(RC[-1],2) = 0),0,((100 * ROUND(RC[-2],2)) / ROUND(RC[-1],2))))/100.0 -> 0.0 | L86: 2.0 | M86: 40.0 | N86: (if((ROUND(RC[-1],2) = 0),0,((100 * ROUND(RC[-2],2)) / ROUND(RC[-1],2))))/100.0 -> 0.05 | P86: 40.0 | Q86: (if((ROUND(RC[-1],2) = 0),0,((100 * ROUND(RC[-2],2)) / ROUND(RC[-1],2))))/100.0 -> 0.0 | S86: 40.0 | T86: (if((ROUND(RC[-1],2) = 0),0,((100 * ROUND(RC[-2],2)) / ROUND(RC[-1],2))))/100.0 -> 0.0 | V86: 40.0 | W86: (if((ROUND(RC[-1],2) = 0),0,((100 * ROUND(RC[-2],2)) / ROUND(RC[-1],2))))/100.0 -> 0.0 | Y86: 40.0 | Z86: (if((ROUND(RC[-1],2) = 0),0,((100 * ROUND(RC[-2],2)) / ROUND(RC[-1],2))))/100.0 -> 0.0 | AB86: 40.0 | AC86: (if((ROUND(RC[-1],2) = 0),0,((100 * ROUND(RC[-2],2)) / ROUND(RC[-1],2))))/100.0 -> 0.0 | AE86: 40.0 | AF86: (if((ROUND(RC[-1],2) = 0),0,((100 * ROUND(RC[-2],2)) / ROUND(RC[-1],2))))/100.0 -> 0.0 | AH86: 40.0 | AI86: (if((ROUND(RC[-1],2) = 0),0,((100 * ROUND(RC[-2],2)) / ROUND(RC[-1],2))))/100.0 -> 0.0 | AK86: 40.0 | AL86: (if((ROUND(RC[-1],2) = 0),0,((100 * ROUND(RC[-2],2)) / ROUND(RC[-1],2))))/100.0 -> 0.0 | AN86: 40.0 | AO86: (if((ROUND(RC[-1],2) = 0),0,((100 * ROUND(RC[-2],2)) / ROUND(RC[-1],2))))/100.0 -> 0.0 | AQ86: 16.0 | AR86: (if((ROUND(RC[-1],2) = 0),0,((100 * ROUND(RC[-2],2)) / ROUND(RC[-1],2))))/100.0 -> 0.0 | AS86: SUM(RC[-42],RC[-39],RC[-36],RC[-33],RC[-30],RC[-27],RC[-24],RC[-21],RC[-18],RC[-15],RC[-12],RC[-9],RC[-6],RC[-3]) -> 2.0 | AT86: SUM(RC[-42],RC[-39],RC[-36],RC[-33],RC[-30],RC[-27],RC[-24],RC[-21],RC[-18],RC[-15],RC[-12],RC[-9],RC[-6],RC[-3]) -> 528.0 | AU86: (if((ROUND(RC[-1],2) = 0),0,((100 * ROUND(RC[-2],2)) / ROUND(RC[-1],2))))/100.0 -> 0.003787878787878788
B87: Cus-01168 DipNed MR : Proj-01001 DipNed WKI implementatie in HHF 2025 | D87: 32.0 | E87: (if((ROUND(RC[-1],2) = 0),0,((100 * ROUND(RC[-2],2)) / ROUND(RC[-1],2))))/100.0 -> 0.0 | G87: 40.0 | H87: (if((ROUND(RC[-1],2) = 0),0,((100 * ROUND(RC[-2],2)) / ROUND(RC[-1],2))))/100.0 -> 0.0 | J87: 40.0 | K87: (if((ROUND(RC[-1],2) = 0),0,((100 * ROUND(RC[-2],2)) / ROUND(RC[-1],2))))/100.0 -> 0.0 | M87: 40.0 | N87: (if((ROUND(RC[-1],2) = 0),0,((100 * ROUND(RC[-2],2)) / ROUND(RC[-1],2))))/100.0 -> 0.0 | O87: 16.0 | P87: 40.0 | Q87: (if((ROUND(RC[-1],2) = 0),0,((100 * ROUND(RC[-2],2)) / ROUND(RC[-1],2))))/100.0 -> 0.4 | R87: 16.0 | S87: 40.0 | T87: (if((ROUND(RC[-1],2) = 0),0,((100 * ROUND(RC[-2],2)) / ROUND(RC[-1],2))))/100.0 -> 0.4 | V87: 40.0 | W87: (if((ROUND(RC[-1],2) = 0),0,((100 * ROUND(RC[-2],2)) / ROUND(RC[-1],2))))/100.0 -> 0.0 | Y87: 40.0 | Z87: (if((ROUND(RC[-1],2) = 0),0,((100 * ROUND(RC[-2],2)) / ROUND(RC[-1],2))))/100.0 -> 0.0 | AB87: 40.0 | AC87: (if((ROUND(RC[-1],2) = 0),0,((100 * ROUND(RC[-2],2)) / ROUND(RC[-1],2))))/100.0 -> 0.0 | AE87: 40.0 | AF87: (if((ROUND(RC[-1],2) = 0),0,((100 * ROUND(RC[-2],2)) / ROUND(RC[-1],2))))/100.0 -> 0.0 | AH87: 40.0 | AI87: (if((ROUND(RC[-1],2) = 0),0,((100 * ROUND(RC[-2],2)) / ROUND(RC[-1],2))))/100.0 -> 0.0 | AK87: 40.0 | AL87: (if((ROUND(RC[-1],2) = 0),0,((100 * ROUND(RC[-2],2)) / ROUND(RC[-1],2))))/100.0 -> 0.0 | AN87: 40.0 | AO87: (if((ROUND(RC[-1],2) = 0),0,((100 * ROUND(RC[-2],2)) / ROUND(RC[-1],2))))/100.0 -> 0.0 | AQ87: 16.0 | AR87: (if((ROUND(RC[-1],2) = 0),0,((100 * ROUND(RC[-2],2)) / ROUND(RC[-1],2))))/100.0 -> 0.0 | AS87: SUM(RC[-42],RC[-39],RC[-36],RC[-33],RC[-30],RC[-27],RC[-24],RC[-21],RC[-18],RC[-15],RC[-12],RC[-9],RC[-6],RC[-3]) -> 32.0 | AT87: SUM(RC[-42],RC[-39],RC[-36],RC[-33],RC[-30],RC[-27],RC[-24],RC[-21],RC[-18],RC[-15],RC[-12],RC[-9],RC[-6],RC[-3]) -> 528.0 | AU87: (if((ROUND(RC[-1],2) = 0),0,((100 * ROUND(RC[-2],2)) / ROUND(RC[-1],2))))/100.0 -> 0.06060606060606061
B88: Cus-01168 DipNed MR : Proj-01024 DipNed SEPA betaalbestanden SDD en SCT | D88: 32.0 | E88: (if((ROUND(RC[-1],2) = 0),0,((100 * ROUND(RC[-2],2)) / ROUND(RC[-1],2))))/100.0 -> 0.0 | G88: 40.0 | H88: (if((ROUND(RC[-1],2) = 0),0,((100 * ROUND(RC[-2],2)) / ROUND(RC[-1],2))))/100.0 -> 0.0 | J88: 40.0 | K88: (if((ROUND(RC[-1],2) = 0),0,((100 * ROUND(RC[-2],2)) / ROUND(RC[-1],2))))/100.0 -> 0.0 | M88: 40.0 | N88: (if((ROUND(RC[-1],2) = 0),0,((100 * ROUND(RC[-2],2)) / ROUND(RC[-1],2))))/100.0 -> 0.0 | P88: 40.0 | Q88: (if((ROUND(RC[-1],2) = 0),0,((100 * ROUND(RC[-2],2)) / ROUND(RC[-1],2))))/100.0 -> 0.0 | R88: 1.0 | S88: 40.0 | T88: (if((ROUND(RC[-1],2) = 0),0,((100 * ROUND(RC[-2],2)) / ROUND(RC[-1],2))))/100.0 -> 0.025 | V88: 40.0 | W88: (if((ROUND(RC[-1],2) = 0),0,((100 * ROUND(RC[-2],2)) / ROUND(RC[-1],2))))/100.0 -> 0.0 | Y88: 40.0 | Z88: (if((ROUND(RC[-1],2) = 0),0,((100 * ROUND(RC[-2],2)) / ROUND(RC[-1],2))))/100.0 -> 0.0 | AB88: 40.0 | AC88: (if((ROUND(RC[-1],2) = 0),0,((100 * ROUND(RC[-2],2)) / ROUND(RC[-1],2))))/100.0 -> 0.0 | AE88: 40.0 | AF88: (if((ROUND(RC[-1],2) = 0),0,((100 * ROUND(RC[-2],2)) / ROUND(RC[-1],2))))/100.0 -> 0.0 | AH88: 40.0 | AI88: (if((ROUND(RC[-1],2) = 0),0,((100 * ROUND(RC[-2],2)) / ROUND(RC[-1],2))))/100.0 -> 0.0 | AK88: 40.0 | AL88: (if((ROUND(RC[-1],2) = 0),0,((100 * ROUND(RC[-2],2)) / ROUND(RC[-1],2))))/100.0 -> 0.0 | AN88: 40.0 | AO88: (if((ROUND(RC[-1],2) = 0),0,((100 * ROUND(RC[-2],2)) / ROUND(RC[-1],2))))/100.0 -> 0.0 | AQ88: 16.0 | AR88: (if((ROUND(RC[-1],2) = 0),0,((100 * ROUND(RC[-2],2)) / ROUND(RC[-1],2))))/100.0 -> 0.0 | AS88: SUM(RC[-42],RC[-39],RC[-36],RC[-33],RC[-30],RC[-27],RC[-24],RC[-21],RC[-18],RC[-15],RC[-12],RC[-9],RC[-6],RC[-3]) -> 1.0 | AT88: SUM(RC[-42],RC[-39],RC[-36],RC[-33],RC[-30],RC[-27],RC[-24],RC[-21],RC[-18],RC[-15],RC[-12],RC[-9],RC[-6],RC[-3]) -> 528.0 | AU88: (if((ROUND(RC[-1],2) = 0),0,((100 * ROUND(RC[-2],2)) / ROUND(RC[-1],2))))/100.0 -> 0.001893939393939394
B89: Cus-01202 Syntrus Achmea Hypotheekdiensten B.V. : Proj-01089 Ontsluiting klantportaal API - Syntrus | D89: 32.0 | E89: (if((ROUND(RC[-1],2) = 0),0,((100 * ROUND(RC[-2],2)) / ROUND(RC[-1],2))))/100.0 -> 0.0 | G89: 40.0 | H89: (if((ROUND(RC[-1],2) = 0),0,((100 * ROUND(RC[-2],2)) / ROUND(RC[-1],2))))/100.0 -> 0.0 | I89: 8.0 | J89: 40.0 | K89: (if((ROUND(RC[-1],2) = 0),0,((100 * ROUND(RC[-2],2)) / ROUND(RC[-1],2))))/100.0 -> 0.2 | M89: 40.0 | N89: (if((ROUND(RC[-1],2) = 0),0,((100 * ROUND(RC[-2],2)) / ROUND(RC[-1],2))))/100.0 -> 0.0 | P89: 40.0 | Q89: (if((ROUND(RC[-1],2) = 0),0,((100 * ROUND(RC[-2],2)) / ROUND(RC[-1],2))))/100.0 -> 0.0 | S89: 40.0 | T89: (if((ROUND(RC[-1],2) = 0),0,((100 * ROUND(RC[-2],2)) / ROUND(RC[-1],2))))/100.0 -> 0.0 | V89: 40.0 | W89: (if((ROUND(RC[-1],2) = 0),0,((100 * ROUND(RC[-2],2)) / ROUND(RC[-1],2))))/100.0 -> 0.0 | Y89: 40.0 | Z89: (if((ROUND(RC[-1],2) = 0),0,((100 * ROUND(RC[-2],2)) / ROUND(RC[-1],2))))/100.0 -> 0.0 | AB89: 40.0 | AC89: (if((ROUND(RC[-1],2) = 0),0,((100 * ROUND(RC[-2],2)) / ROUND(RC[-1],2))))/100.0 -> 0.0 | AE89: 40.0 | AF89: (if((ROUND(RC[-1],2) = 0),0,((100 * ROUND(RC[-2],2)) / ROUND(RC[-1],2))))/100.0 -> 0.0 | AH89: 40.0 | AI89: (if((ROUND(RC[-1],2) = 0),0,((100 * ROUND(RC[-2],2)) / ROUND(RC[-1],2))))/100.0 -> 0.0 | AK89: 40.0 | AL89: (if((ROUND(RC[-1],2) = 0),0,((100 * ROUND(RC[-2],2)) / ROUND(RC[-1],2))))/100.0 -> 0.0 | AN89: 40.0 | AO89: (if((ROUND(RC[-1],2) = 0),0,((100 * ROUND(RC[-2],2)) / ROUND(RC[-1],2))))/100.0 -> 0.0 | AQ89: 16.0 | AR89: (if((ROUND(RC[-1],2) = 0),0,((100 * ROUND(RC[-2],2)) / ROUND(RC[-1],2))))/100.0 -> 0.0 | AS89: SUM(RC[-42],RC[-39],RC[-36],RC[-33],RC[-30],RC[-27],RC[-24],RC[-21],RC[-18],RC[-15],RC[-12],RC[-9],RC[-6],RC[-3]) -> 8.0 | AT89: SUM(RC[-42],RC[-39],RC[-36],RC[-33],RC[-30],RC[-27],RC[-24],RC[-21],RC[-18],RC[-15],RC[-12],RC[-9],RC[-6],RC[-3]) -> 528.0 | AU89: (if((ROUND(RC[-1],2) = 0),0,((100 * ROUND(RC[-2],2)) / ROUND(RC[-1],2))))/100.0 -> 0.015151515151515152
A90: Total - Jan Posthouwer | C90: SUM(R[-8]C:R[-1]C) -> 30.8 | D90: 32.0 | E90: (if((ROUND(RC[-1],2) = 0),0,((100 * ROUND(RC[-2],2)) / ROUND(RC[-1],2))))/100.0 -> 0.9625 | F90: SUM(R[-8]C:R[-1]C) -> 36.0 | G90: 40.0 | H90: (if((ROUND(RC[-1],2) = 0),0,((100 * ROUND(RC[-2],2)) / ROUND(RC[-1],2))))/100.0 -> 0.9 | I90: SUM(R[-8]C:R[-1]C) -> 36.0 | J90: 40.0 | K90: (if((ROUND(RC[-1],2) = 0),0,((100 * ROUND(RC[-2],2)) / ROUND(RC[-1],2))))/100.0 -> 0.9 | L90: SUM(R[-8]C:R[-1]C) -> 36.0 | M90: 40.0 | N90: (if((ROUND(RC[-1],2) = 0),0,((100 * ROUND(RC[-2],2)) / ROUND(RC[-1],2))))/100.0 -> 0.9 | O90: SUM(R[-8]C:R[-1]C) -> 36.0 | P90: 40.0 | Q90: (if((ROUND(RC[-1],2) = 0),0,((100 * ROUND(RC[-2],2)) / ROUND(RC[-1],2))))/100.0 -> 0.9 | R90: SUM(R[-8]C:R[-1]C) -> 36.0 | S90: 40.0 | T90: (if((ROUND(RC[-1],2) = 0),0,((100 * ROUND(RC[-2],2)) / ROUND(RC[-1],2))))/100.0 -> 0.9 | U90: SUM(R[-8]C:R[-1]C) ->  | V90: 40.0 | W90: (if((ROUND(RC[-1],2) = 0),0,((100 * ROUND(RC[-2],2)) / ROUND(RC[-1],2))))/100.0 -> 0.0 | X90: SUM(R[-8]C:R[-1]C) ->  | Y90: 40.0 | Z90: (if((ROUND(RC[-1],2) = 0),0,((100 * ROUND(RC[-2],2)) / ROUND(RC[-1],2))))/100.0 -> 0.0 | AA90: SUM(R[-8]C:R[-1]C) -> 36.0 | AB90: 40.0 | AC90: (if((ROUND(RC[-1],2) = 0),0,((100 * ROUND(RC[-2],2)) / ROUND(RC[-1],2))))/100.0 -> 0.9 | AD90: SUM(R[-8]C:R[-1]C) -> 36.0 | AE90: 40.0 | AF90: (if((ROUND(RC[-1],2) = 0),0,((100 * ROUND(RC[-2],2)) / ROUND(RC[-1],2))))/100.0 -> 0.9 | AG90: SUM(R[-8]C:R[-1]C) -> 36.0 | AH90: 40.0 | AI90: (if((ROUND(RC[-1],2) = 0),0,((100 * ROUND(RC[-2],2)) / ROUND(RC[-1],2))))/100.0 -> 0.9 | AJ90: SUM(R[-8]C:R[-1]C) -> 36.0 | AK90: 40.0 | AL90: (if((ROUND(RC[-1],2) = 0),0,((100 * ROUND(RC[-2],2)) / ROUND(RC[-1],2))))/100.0 -> 0.9 | AM90: SUM(R[-8]C:R[-1]C) -> 36.0 | AN90: 40.0 | AO90: (if((ROUND(RC[-1],2) = 0),0,((100 * ROUND(RC[-2],2)) / ROUND(RC[-1],2))))/100.0 -> 0.9 | AP90: SUM(R[-8]C:R[-1]C) -> 14.4 | AQ90: 16.0 | AR90: (if((ROUND(RC[-1],2) = 0),0,((100 * ROUND(RC[-2],2)) / ROUND(RC[-1],2))))/100.0 -> 0.9 | AS90: SUM(R[-8]C:R[-1]C) -> 405.2 | AT90: SUM(R[-8]C:R[-1]C) -> 528.0 | AU90: (if((ROUND(RC[-1],2) = 0),0,((100 * ROUND(RC[-2],2)) / ROUND(RC[-1],2))))/100.0 -> 0.7674242424242425
A91: Jarno Bout. van den,
B92: Cus-01163 Aryza B.V. : Proj-00842 Algemeen beheer 2025 | C92: 3.2 | D92: 32.0 | E92: (if((ROUND(RC[-1],2) = 0),0,((100 * ROUND(RC[-2],2)) / ROUND(RC[-1],2))))/100.0 -> 0.1 | F92: 4.0 | G92: 40.0 | H92: (if((ROUND(RC[-1],2) = 0),0,((100 * ROUND(RC[-2],2)) / ROUND(RC[-1],2))))/100.0 -> 0.1 | I92: 4.0 | J92: 40.0 | K92: (if((ROUND(RC[-1],2) = 0),0,((100 * ROUND(RC[-2],2)) / ROUND(RC[-1],2))))/100.0 -> 0.1 | M92: 40.0 | N92: (if((ROUND(RC[-1],2) = 0),0,((100 * ROUND(RC[-2],2)) / ROUND(RC[-1],2))))/100.0 -> 0.0 | P92: 40.0 | Q92: (if((ROUND(RC[-1],2) = 0),0,((100 * ROUND(RC[-2],2)) / ROUND(RC[-1],2))))/100.0 -> 0.0 | S92: 40.0 | T92: (if((ROUND(RC[-1],2) = 0),0,((100 * ROUND(RC[-2],2)) / ROUND(RC[-1],2))))/100.0 -> 0.0 | V92: 40.0 | W92: (if((ROUND(RC[-1],2) = 0),0,((100 * ROUND(RC[-2],2)) / ROUND(RC[-1],2))))/100.0 -> 0.0 | Y92: 40.0 | Z92: (if((ROUND(RC[-1],2) = 0),0,((100 * ROUND(RC[-2],2)) / ROUND(RC[-1],2))))/100.0 -> 0.0 | AA92: 4.0 | AB92: 40.0 | AC92: (if((ROUND(RC[-1],2) = 0),0,((100 * ROUND(RC[-2],2)) / ROUND(RC[-1],2))))/100.0 -> 0.1 | AD92: 4.0 | AE92: 40.0 | AF92: (if((ROUND(RC[-1],2) = 0),0,((100 * ROUND(RC[-2],2)) / ROUND(RC[-1],2))))/100.0 -> 0.1 | AG92: 4.0 | AH92: 40.0 | AI92: (if((ROUND(RC[-1],2) = 0),0,((100 * ROUND(RC[-2],2)) / ROUND(RC[-1],2))))/100.0 -> 0.1 | AJ92: 4.0 | AK92: 40.0 | AL92: (if((ROUND(RC[-1],2) = 0),0,((100 * ROUND(RC[-2],2)) / ROUND(RC[-1],2))))/100.0 -> 0.1 | AM92: 4.0 | AN92: 40.0 | AO92: (if((ROUND(RC[-1],2) = 0),0,((100 * ROUND(RC[-2],2)) / ROUND(RC[-1],2))))/100.0 -> 0.1 | AP92: 1.6 | AQ92: 16.0 | AR92: (if((ROUND(RC[-1],2) = 0),0,((100 * ROUND(RC[-2],2)) / ROUND(RC[-1],2))))/100.0 -> 0.1 | AS92: SUM(RC[-42],RC[-39],RC[-36],RC[-33],RC[-30],RC[-27],RC[-24],RC[-21],RC[-18],RC[-15],RC[-12],RC[-9],RC[-6],RC[-3]) -> 32.8 | AT92: SUM(RC[-42],RC[-39],RC[-36],RC[-33],RC[-30],RC[-27],RC[-24],RC[-21],RC[-18],RC[-15],RC[-12],RC[-9],RC[-6],RC[-3]) -> 528.0 | AU92: (if((ROUND(RC[-1],2) = 0),0,((100 * ROUND(RC[-2],2)) / ROUND(RC[-1],2))))/100.0 -> 0.06212121212121211
B93: Cus-01163 Aryza B.V. : Proj-00976 Interne uren 2025 | C93: 1.6 | D93: 32.0 | E93: (if((ROUND(RC[-1],2) = 0),0,((100 * ROUND(RC[-2],2)) / ROUND(RC[-1],2))))/100.0 -> 0.05 | F93: 8.0 | G93: 40.0 | H93: (if((ROUND(RC[-1],2) = 0),0,((100 * ROUND(RC[-2],2)) / ROUND(RC[-1],2))))/100.0 -> 0.2 | I93: 8.0 | J93: 40.0 | K93: (if((ROUND(RC[-1],2) = 0),0,((100 * ROUND(RC[-2],2)) / ROUND(RC[-1],2))))/100.0 -> 0.2 | M93: 40.0 | N93: (if((ROUND(RC[-1],2) = 0),0,((100 * ROUND(RC[-2],2)) / ROUND(RC[-1],2))))/100.0 -> 0.0 | P93: 40.0 | Q93: (if((ROUND(RC[-1],2) = 0),0,((100 * ROUND(RC[-2],2)) / ROUND(RC[-1],2))))/100.0 -> 0.0 | S93: 40.0 | T93: (if((ROUND(RC[-1],2) = 0),0,((100 * ROUND(RC[-2],2)) / ROUND(RC[-1],2))))/100.0 -> 0.0 | V93: 40.0 | W93: (if((ROUND(RC[-1],2) = 0),0,((100 * ROUND(RC[-2],2)) / ROUND(RC[-1],2))))/100.0 -> 0.0 | Y93: 40.0 | Z93: (if((ROUND(RC[-1],2) = 0),0,((100 * ROUND(RC[-2],2)) / ROUND(RC[-1],2))))/100.0 -> 0.0 | AA93: 8.0 | AB93: 40.0 | AC93: (if((ROUND(RC[-1],2) = 0),0,((100 * ROUND(RC[-2],2)) / ROUND(RC[-1],2))))/100.0 -> 0.2 | AD93: 8.0 | AE93: 40.0 | AF93: (if((ROUND(RC[-1],2) = 0),0,((100 * ROUND(RC[-2],2)) / ROUND(RC[-1],2))))/100.0 -> 0.2 | AG93: 8.0 | AH93: 40.0 | AI93: (if((ROUND(RC[-1],2) = 0),0,((100 * ROUND(RC[-2],2)) / ROUND(RC[-1],2))))/100.0 -> 0.2 | AJ93: 8.0 | AK93: 40.0 | AL93: (if((ROUND(RC[-1],2) = 0),0,((100 * ROUND(RC[-2],2)) / ROUND(RC[-1],2))))/100.0 -> 0.2 | AM93: 8.0 | AN93: 40.0 | AO93: (if((ROUND(RC[-1],2) = 0),0,((100 * ROUND(RC[-2],2)) / ROUND(RC[-1],2))))/100.0 -> 0.2 | AP93: 3.2 | AQ93: 16.0 | AR93: (if((ROUND(RC[-1],2) = 0),0,((100 * ROUND(RC[-2],2)) / ROUND(RC[-1],2))))/100.0 -> 0.2 | AS93: SUM(RC[-42],RC[-39],RC[-36],RC[-33],RC[-30],RC[-27],RC[-24],RC[-21],RC[-18],RC[-15],RC[-12],RC[-9],RC[-6],RC[-3]) -> 60.800000000000004 | AT93: SUM(RC[-42],RC[-39],RC[-36],RC[-33],RC[-30],RC[-27],RC[-24],RC[-21],RC[-18],RC[-15],RC[-12],RC[-9],RC[-6],RC[-3]) -> 528.0 | AU93: (if((ROUND(RC[-1],2) = 0),0,((100 * ROUND(RC[-2],2)) / ROUND(RC[-1],2))))/100.0 -> 0.11515151515151516
B94: Cus-01163 Aryza B.V. : Proj-00978 Training SmartComponents | D94: 32.0 | E94: (if((ROUND(RC[-1],2) = 0),0,((100 * ROUND(RC[-2],2)) / ROUND(RC[-1],2))))/100.0 -> 0.0 | G94: 40.0 | H94: (if((ROUND(RC[-1],2) = 0),0,((100 * ROUND(RC[-2],2)) / ROUND(RC[-1],2))))/100.0 -> 0.0 | J94: 40.0 | K94: (if((ROUND(RC[-1],2) = 0),0,((100 * ROUND(RC[-2],2)) / ROUND(RC[-1],2))))/100.0 -> 0.0 | M94: 40.0 | N94: (if((ROUND(RC[-1],2) = 0),0,((100 * ROUND(RC[-2],2)) / ROUND(RC[-1],2))))/100.0 -> 0.0 | P94: 40.0 | Q94: (if((ROUND(RC[-1],2) = 0),0,((100 * ROUND(RC[-2],2)) / ROUND(RC[-1],2))))/100.0 -> 0.0 | S94: 40.0 | T94: (if((ROUND(RC[-1],2) = 0),0,((100 * ROUND(RC[-2],2)) / ROUND(RC[-1],2))))/100.0 -> 0.0 | U94: 40.0 | V94: 40.0 | W94: (if((ROUND(RC[-1],2) = 0),0,((100 * ROUND(RC[-2],2)) / ROUND(RC[-1],2))))/100.0 -> 1.0 | X94: 40.0 | Y94: 40.0 | Z94: (if((ROUND(RC[-1],2) = 0),0,((100 * ROUND(RC[-2],2)) / ROUND(RC[-1],2))))/100.0 -> 1.0 | AB94: 40.0 | AC94: (if((ROUND(RC[-1],2) = 0),0,((100 * ROUND(RC[-2],2)) / ROUND(RC[-1],2))))/100.0 -> 0.0 | AE94: 40.0 | AF94: (if((ROUND(RC[-1],2) = 0),0,((100 * ROUND(RC[-2],2)) / ROUND(RC[-1],2))))/100.0 -> 0.0 | AH94: 40.0 | AI94: (if((ROUND(RC[-1],2) = 0),0,((100 * ROUND(RC[-2],2)) / ROUND(RC[-1],2))))/100.0 -> 0.0 | AK94: 40.0 | AL94: (if((ROUND(RC[-1],2) = 0),0,((100 * ROUND(RC[-2],2)) / ROUND(RC[-1],2))))/100.0 -> 0.0 | AN94: 40.0 | AO94: (if((ROUND(RC[-1],2) = 0),0,((100 * ROUND(RC[-2],2)) / ROUND(RC[-1],2))))/100.0 -> 0.0 | AQ94: 16.0 | AR94: (if((ROUND(RC[-1],2) = 0),0,((100 * ROUND(RC[-2],2)) / ROUND(RC[-1],2))))/100.0 -> 0.0 | AS94: SUM(RC[-42],RC[-39],RC[-36],RC[-33],RC[-30],RC[-27],RC[-24],RC[-21],RC[-18],RC[-15],RC[-12],RC[-9],RC[-6],RC[-3]) -> 80.0 | AT94: SUM(RC[-42],RC[-39],RC[-36],RC[-33],RC[-30],RC[-27],RC[-24],RC[-21],RC[-18],RC[-15],RC[-12],RC[-9],RC[-6],RC[-3]) -> 528.0 | AU94: (if((ROUND(RC[-1],2) = 0),0,((100 * ROUND(RC[-2],2)) / ROUND(RC[-1],2))))/100.0 -> 0.15151515151515152
B95: Cus-01163 Aryza B.V. : Proj-01057 GRFO Branching Strategy | C95: 6.4 | D95: 32.0 | E95: (if((ROUND(RC[-1],2) = 0),0,((100 * ROUND(RC[-2],2)) / ROUND(RC[-1],2))))/100.0 -> 0.2 | F95: 8.0 | G95: 40.0 | H95: (if((ROUND(RC[-1],2) = 0),0,((100 * ROUND(RC[-2],2)) / ROUND(RC[-1],2))))/100.0 -> 0.2 | J95: 40.0 | K95: (if((ROUND(RC[-1],2) = 0),0,((100 * ROUND(RC[-2],2)) / ROUND(RC[-1],2))))/100.0 -> 0.0 | M95: 40.0 | N95: (if((ROUND(RC[-1],2) = 0),0,((100 * ROUND(RC[-2],2)) / ROUND(RC[-1],2))))/100.0 -> 0.0 | P95: 40.0 | Q95: (if((ROUND(RC[-1],2) = 0),0,((100 * ROUND(RC[-2],2)) / ROUND(RC[-1],2))))/100.0 -> 0.0 | S95: 40.0 | T95: (if((ROUND(RC[-1],2) = 0),0,((100 * ROUND(RC[-2],2)) / ROUND(RC[-1],2))))/100.0 -> 0.0 | V95: 40.0 | W95: (if((ROUND(RC[-1],2) = 0),0,((100 * ROUND(RC[-2],2)) / ROUND(RC[-1],2))))/100.0 -> 0.0 | Y95: 40.0 | Z95: (if((ROUND(RC[-1],2) = 0),0,((100 * ROUND(RC[-2],2)) / ROUND(RC[-1],2))))/100.0 -> 0.0 | AB95: 40.0 | AC95: (if((ROUND(RC[-1],2) = 0),0,((100 * ROUND(RC[-2],2)) / ROUND(RC[-1],2))))/100.0 -> 0.0 | AE95: 40.0 | AF95: (if((ROUND(RC[-1],2) = 0),0,((100 * ROUND(RC[-2],2)) / ROUND(RC[-1],2))))/100.0 -> 0.0 | AH95: 40.0 | AI95: (if((ROUND(RC[-1],2) = 0),0,((100 * ROUND(RC[-2],2)) / ROUND(RC[-1],2))))/100.0 -> 0.0 | AK95: 40.0 | AL95: (if((ROUND(RC[-1],2) = 0),0,((100 * ROUND(RC[-2],2)) / ROUND(RC[-1],2))))/100.0 -> 0.0 | AN95: 40.0 | AO95: (if((ROUND(RC[-1],2) = 0),0,((100 * ROUND(RC[-2],2)) / ROUND(RC[-1],2))))/100.0 -> 0.0 | AQ95: 16.0 | AR95: (if((ROUND(RC[-1],2) = 0),0,((100 * ROUND(RC[-2],2)) / ROUND(RC[-1],2))))/100.0 -> 0.0 | AS95: SUM(RC[-42],RC[-39],RC[-36],RC[-33],RC[-30],RC[-27],RC[-24],RC[-21],RC[-18],RC[-15],RC[-12],RC[-9],RC[-6],RC[-3]) -> 14.4 | AT95: SUM(RC[-42],RC[-39],RC[-36],RC[-33],RC[-30],RC[-27],RC[-24],RC[-21],RC[-18],RC[-15],RC[-12],RC[-9],RC[-6],RC[-3]) -> 528.0 | AU95: (if((ROUND(RC[-1],2) = 0),0,((100 * ROUND(RC[-2],2)) / ROUND(RC[-1],2))))/100.0 -> 0.02727272727272727
B96: Cus-01163 Aryza B.V. : Proj-01059 Upgrade Framework GRFO | C96: 0.8 | D96: 32.0 | E96: (if((ROUND(RC[-1],2) = 0),0,((100 * ROUND(RC[-2],2)) / ROUND(RC[-1],2))))/100.0 -> 0.025 | G96: 40.0 | H96: (if((ROUND(RC[-1],2) = 0),0,((100 * ROUND(RC[-2],2)) / ROUND(RC[-1],2))))/100.0 -> 0.0 | J96: 40.0 | K96: (if((ROUND(RC[-1],2) = 0),0,((100 * ROUND(RC[-2],2)) / ROUND(RC[-1],2))))/100.0 -> 0.0 | M96: 40.0 | N96: (if((ROUND(RC[-1],2) = 0),0,((100 * ROUND(RC[-2],2)) / ROUND(RC[-1],2))))/100.0 -> 0.0 | P96: 40.0 | Q96: (if((ROUND(RC[-1],2) = 0),0,((100 * ROUND(RC[-2],2)) / ROUND(RC[-1],2))))/100.0 -> 0.0 | S96: 40.0 | T96: (if((ROUND(RC[-1],2) = 0),0,((100 * ROUND(RC[-2],2)) / ROUND(RC[-1],2))))/100.0 -> 0.0 | V96: 40.0 | W96: (if((ROUND(RC[-1],2) = 0),0,((100 * ROUND(RC[-2],2)) / ROUND(RC[-1],2))))/100.0 -> 0.0 | Y96: 40.0 | Z96: (if((ROUND(RC[-1],2) = 0),0,((100 * ROUND(RC[-2],2)) / ROUND(RC[-1],2))))/100.0 -> 0.0 | AB96: 40.0 | AC96: (if((ROUND(RC[-1],2) = 0),0,((100 * ROUND(RC[-2],2)) / ROUND(RC[-1],2))))/100.0 -> 0.0 | AE96: 40.0 | AF96: (if((ROUND(RC[-1],2) = 0),0,((100 * ROUND(RC[-2],2)) / ROUND(RC[-1],2))))/100.0 -> 0.0 | AH96: 40.0 | AI96: (if((ROUND(RC[-1],2) = 0),0,((100 * ROUND(RC[-2],2)) / ROUND(RC[-1],2))))/100.0 -> 0.0 | AK96: 40.0 | AL96: (if((ROUND(RC[-1],2) = 0),0,((100 * ROUND(RC[-2],2)) / ROUND(RC[-1],2))))/100.0 -> 0.0 | AN96: 40.0 | AO96: (if((ROUND(RC[-1],2) = 0),0,((100 * ROUND(RC[-2],2)) / ROUND(RC[-1],2))))/100.0 -> 0.0 | AQ96: 16.0 | AR96: (if((ROUND(RC[-1],2) = 0),0,((100 * ROUND(RC[-2],2)) / ROUND(RC[-1],2))))/100.0 -> 0.0 | AS96: SUM(RC[-42],RC[-39],RC[-36],RC[-33],RC[-30],RC[-27],RC[-24],RC[-21],RC[-18],RC[-15],RC[-12],RC[-9],RC[-6],RC[-3]) -> 0.8 | AT96: SUM(RC[-42],RC[-39],RC[-36],RC[-33],RC[-30],RC[-27],RC[-24],RC[-21],RC[-18],RC[-15],RC[-12],RC[-9],RC[-6],RC[-3]) -> 528.0 | AU96: (if((ROUND(RC[-1],2) = 0),0,((100 * ROUND(RC[-2],2)) / ROUND(RC[-1],2))))/100.0 -> 0.0015151515151515152
B97: Cus-01163 Aryza B.V. : Proj-01060 PTV T&T | C97: 20.0 | D97: 32.0 | E97: (if((ROUND(RC[-1],2) = 0),0,((100 * ROUND(RC[-2],2)) / ROUND(RC[-1],2))))/100.0 -> 0.625 | G97: 40.0 | H97: (if((ROUND(RC[-1],2) = 0),0,((100 * ROUND(RC[-2],2)) / ROUND(RC[-1],2))))/100.0 -> 0.0 | J97: 40.0 | K97: (if((ROUND(RC[-1],2) = 0),0,((100 * ROUND(RC[-2],2)) / ROUND(RC[-1],2))))/100.0 -> 0.0 | M97: 40.0 | N97: (if((ROUND(RC[-1],2) = 0),0,((100 * ROUND(RC[-2],2)) / ROUND(RC[-1],2))))/100.0 -> 0.0 | P97: 40.0 | Q97: (if((ROUND(RC[-1],2) = 0),0,((100 * ROUND(RC[-2],2)) / ROUND(RC[-1],2))))/100.0 -> 0.0 | S97: 40.0 | T97: (if((ROUND(RC[-1],2) = 0),0,((100 * ROUND(RC[-2],2)) / ROUND(RC[-1],2))))/100.0 -> 0.0 | V97: 40.0 | W97: (if((ROUND(RC[-1],2) = 0),0,((100 * ROUND(RC[-2],2)) / ROUND(RC[-1],2))))/100.0 -> 0.0 | Y97: 40.0 | Z97: (if((ROUND(RC[-1],2) = 0),0,((100 * ROUND(RC[-2],2)) / ROUND(RC[-1],2))))/100.0 -> 0.0 | AB97: 40.0 | AC97: (if((ROUND(RC[-1],2) = 0),0,((100 * ROUND(RC[-2],2)) / ROUND(RC[-1],2))))/100.0 -> 0.0 | AE97: 40.0 | AF97: (if((ROUND(RC[-1],2) = 0),0,((100 * ROUND(RC[-2],2)) / ROUND(RC[-1],2))))/100.0 -> 0.0 | AH97: 40.0 | AI97: (if((ROUND(RC[-1],2) = 0),0,((100 * ROUND(RC[-2],2)) / ROUND(RC[-1],2))))/100.0 -> 0.0 | AK97: 40.0 | AL97: (if((ROUND(RC[-1],2) = 0),0,((100 * ROUND(RC[-2],2)) / ROUND(RC[-1],2))))/100.0 -> 0.0 | AN97: 40.0 | AO97: (if((ROUND(RC[-1],2) = 0),0,((100 * ROUND(RC[-2],2)) / ROUND(RC[-1],2))))/100.0 -> 0.0 | AQ97: 16.0 | AR97: (if((ROUND(RC[-1],2) = 0),0,((100 * ROUND(RC[-2],2)) / ROUND(RC[-1],2))))/100.0 -> 0.0 | AS97: SUM(RC[-42],RC[-39],RC[-36],RC[-33],RC[-30],RC[-27],RC[-24],RC[-21],RC[-18],RC[-15],RC[-12],RC[-9],RC[-6],RC[-3]) -> 20.0 | AT97: SUM(RC[-42],RC[-39],RC[-36],RC[-33],RC[-30],RC[-27],RC[-24],RC[-21],RC[-18],RC[-15],RC[-12],RC[-9],RC[-6],RC[-3]) -> 528.0 | AU97: (if((ROUND(RC[-1],2) = 0),0,((100 * ROUND(RC[-2],2)) / ROUND(RC[-1],2))))/100.0 -> 0.03787878787878788
B98: Cus-01202 Syntrus Achmea Hypotheekdiensten B.V. : Proj-01089 Ontsluiting klantportaal API - Syntrus | C98: 0.0 | D98: 32.0 | E98: (if((ROUND(RC[-1],2) = 0),0,((100 * ROUND(RC[-2],2)) / ROUND(RC[-1],2))))/100.0 -> 0.0 | F98: 16.0 | G98: 40.0 | H98: (if((ROUND(RC[-1],2) = 0),0,((100 * ROUND(RC[-2],2)) / ROUND(RC[-1],2))))/100.0 -> 0.4 | I98: 12.0 | J98: 40.0 | K98: (if((ROUND(RC[-1],2) = 0),0,((100 * ROUND(RC[-2],2)) / ROUND(RC[-1],2))))/100.0 -> 0.3 | L98: 0.0 | M98: 40.0 | N98: (if((ROUND(RC[-1],2) = 0),0,((100 * ROUND(RC[-2],2)) / ROUND(RC[-1],2))))/100.0 -> 0.0 | O98: 0.0 | P98: 40.0 | Q98: (if((ROUND(RC[-1],2) = 0),0,((100 * ROUND(RC[-2],2)) / ROUND(RC[-1],2))))/100.0 -> 0.0 | R98: 0.0 | S98: 40.0 | T98: (if((ROUND(RC[-1],2) = 0),0,((100 * ROUND(RC[-2],2)) / ROUND(RC[-1],2))))/100.0 -> 0.0 | U98: 0.0 | V98: 40.0 | W98: (if((ROUND(RC[-1],2) = 0),0,((100 * ROUND(RC[-2],2)) / ROUND(RC[-1],2))))/100.0 -> 0.0 | X98: 0.0 | Y98: 40.0 | Z98: (if((ROUND(RC[-1],2) = 0),0,((100 * ROUND(RC[-2],2)) / ROUND(RC[-1],2))))/100.0 -> 0.0 | AA98: 0.0 | AB98: 40.0 | AC98: (if((ROUND(RC[-1],2) = 0),0,((100 * ROUND(RC[-2],2)) / ROUND(RC[-1],2))))/100.0 -> 0.0 | AD98: 0.0 | AE98: 40.0 | AF98: (if((ROUND(RC[-1],2) = 0),0,((100 * ROUND(RC[-2],2)) / ROUND(RC[-1],2))))/100.0 -> 0.0 | AG98: 0.0 | AH98: 40.0 | AI98: (if((ROUND(RC[-1],2) = 0),0,((100 * ROUND(RC[-2],2)) / ROUND(RC[-1],2))))/100.0 -> 0.0 | AJ98: 0.0 | AK98: 40.0 | AL98: (if((ROUND(RC[-1],2) = 0),0,((100 * ROUND(RC[-2],2)) / ROUND(RC[-1],2))))/100.0 -> 0.0 | AM98: 0.0 | AN98: 40.0 | AO98: (if((ROUND(RC[-1],2) = 0),0,((100 * ROUND(RC[-2],2)) / ROUND(RC[-1],2))))/100.0 -> 0.0 | AP98: 0.0 | AQ98: 16.0 | AR98: (if((ROUND(RC[-1],2) = 0),0,((100 * ROUND(RC[-2],2)) / ROUND(RC[-1],2))))/100.0 -> 0.0 | AS98: SUM(RC[-42],RC[-39],RC[-36],RC[-33],RC[-30],RC[-27],RC[-24],RC[-21],RC[-18],RC[-15],RC[-12],RC[-9],RC[-6],RC[-3]) -> 28.0 | AT98: SUM(RC[-42],RC[-39],RC[-36],RC[-33],RC[-30],RC[-27],RC[-24],RC[-21],RC[-18],RC[-15],RC[-12],RC[-9],RC[-6],RC[-3]) -> 528.0 | AU98: (if((ROUND(RC[-1],2) = 0),0,((100 * ROUND(RC[-2],2)) / ROUND(RC[-1],2))))/100.0 -> 0.053030303030303025
B99: Cus-01736 LDCR Afd. Fin. : Proj-00805 LDCR C-Kasapplicatie | D99: 32.0 | E99: (if((ROUND(RC[-1],2) = 0),0,((100 * ROUND(RC[-2],2)) / ROUND(RC[-1],2))))/100.0 -> 0.0 | G99: 40.0 | H99: (if((ROUND(RC[-1],2) = 0),0,((100 * ROUND(RC[-2],2)) / ROUND(RC[-1],2))))/100.0 -> 0.0 | J99: 40.0 | K99: (if((ROUND(RC[-1],2) = 0),0,((100 * ROUND(RC[-2],2)) / ROUND(RC[-1],2))))/100.0 -> 0.0 | M99: 40.0 | N99: (if((ROUND(RC[-1],2) = 0),0,((100 * ROUND(RC[-2],2)) / ROUND(RC[-1],2))))/100.0 -> 0.0 | P99: 40.0 | Q99: (if((ROUND(RC[-1],2) = 0),0,((100 * ROUND(RC[-2],2)) / ROUND(RC[-1],2))))/100.0 -> 0.0 | S99: 40.0 | T99: (if((ROUND(RC[-1],2) = 0),0,((100 * ROUND(RC[-2],2)) / ROUND(RC[-1],2))))/100.0 -> 0.0 | V99: 40.0 | W99: (if((ROUND(RC[-1],2) = 0),0,((100 * ROUND(RC[-2],2)) / ROUND(RC[-1],2))))/100.0 -> 0.0 | Y99: 40.0 | Z99: (if((ROUND(RC[-1],2) = 0),0,((100 * ROUND(RC[-2],2)) / ROUND(RC[-1],2))))/100.0 -> 0.0 | AA99: 28.0 | AB99: 40.0 | AC99: (if((ROUND(RC[-1],2) = 0),0,((100 * ROUND(RC[-2],2)) / ROUND(RC[-1],2))))/100.0 -> 0.7 | AD99: 28.0 | AE99: 40.0 | AF99: (if((ROUND(RC[-1],2) = 0),0,((100 * ROUND(RC[-2],2)) / ROUND(RC[-1],2))))/100.0 -> 0.7 | AG99: 28.0 | AH99: 40.0 | AI99: (if((ROUND(RC[-1],2) = 0),0,((100 * ROUND(RC[-2],2)) / ROUND(RC[-1],2))))/100.0 -> 0.7 | AJ99: 28.0 | AK99: 40.0 | AL99: (if((ROUND(RC[-1],2) = 0),0,((100 * ROUND(RC[-2],2)) / ROUND(RC[-1],2))))/100.0 -> 0.7 | AM99: 28.0 | AN99: 40.0 | AO99: (if((ROUND(RC[-1],2) = 0),0,((100 * ROUND(RC[-2],2)) / ROUND(RC[-1],2))))/100.0 -> 0.7 | AP99: 11.2 | AQ99: 16.0 | AR99: (if((ROUND(RC[-1],2) = 0),0,((100 * ROUND(RC[-2],2)) / ROUND(RC[-1],2))))/100.0 -> 0.7 | AS99: SUM(RC[-42],RC[-39],RC[-36],RC[-33],RC[-30],RC[-27],RC[-24],RC[-21],RC[-18],RC[-15],RC[-12],RC[-9],RC[-6],RC[-3]) -> 151.2 | AT99: SUM(RC[-42],RC[-39],RC[-36],RC[-33],RC[-30],RC[-27],RC[-24],RC[-21],RC[-18],RC[-15],RC[-12],RC[-9],RC[-6],RC[-3]) -> 528.0 | AU99: (if((ROUND(RC[-1],2) = 0),0,((100 * ROUND(RC[-2],2)) / ROUND(RC[-1],2))))/100.0 -> 0.2863636363636363
A100: Total - Jarno Bout. van den, | C100: SUM(R[-8]C:R[-1]C) -> 32.0 | D100: 32.0 | E100: (if((ROUND(RC[-1],2) = 0),0,((100 * ROUND(RC[-2],2)) / ROUND(RC[-1],2))))/100.0 -> 1.0 | F100: SUM(R[-8]C:R[-1]C) -> 36.0 | G100: 40.0 | H100: (if((ROUND(RC[-1],2) = 0),0,((100 * ROUND(RC[-2],2)) / ROUND(RC[-1],2))))/100.0 -> 0.9 | I100: SUM(R[-8]C:R[-1]C) -> 24.0 | J100: 40.0 | K100: (if((ROUND(RC[-1],2) = 0),0,((100 * ROUND(RC[-2],2)) / ROUND(RC[-1],2))))/100.0 -> 0.6 | L100: SUM(R[-8]C:R[-1]C) -> 0.0 | M100: 40.0 | N100: (if((ROUND(RC[-1],2) = 0),0,((100 * ROUND(RC[-2],2)) / ROUND(RC[-1],2))))/100.0 -> 0.0 | O100: SUM(R[-8]C:R[-1]C) -> 0.0 | P100: 40.0 | Q100: (if((ROUND(RC[-1],2) = 0),0,((100 * ROUND(RC[-2],2)) / ROUND(RC[-1],2))))/100.0 -> 0.0 | R100: SUM(R[-8]C:R[-1]C) -> 0.0 | S100: 40.0 | T100: (if((ROUND(RC[-1],2) = 0),0,((100 * ROUND(RC[-2],2)) / ROUND(RC[-1],2))))/100.0 -> 0.0 | U100: SUM(R[-8]C:R[-1]C) -> 40.0 | V100: 40.0 | W100: (if((ROUND(RC[-1],2) = 0),0,((100 * ROUND(RC[-2],2)) / ROUND(RC[-1],2))))/100.0 -> 1.0 | X100: SUM(R[-8]C:R[-1]C) -> 40.0 | Y100: 40.0 | Z100: (if((ROUND(RC[-1],2) = 0),0,((100 * ROUND(RC[-2],2)) / ROUND(RC[-1],2))))/100.0 -> 1.0 | AA100: SUM(R[-8]C:R[-1]C) -> 40.0 | AB100: 40.0 | AC100: (if((ROUND(RC[-1],2) = 0),0,((100 * ROUND(RC[-2],2)) / ROUND(RC[-1],2))))/100.0 -> 1.0 | AD100: SUM(R[-8]C:R[-1]C) -> 40.0 | AE100: 40.0 | AF100: (if((ROUND(RC[-1],2) = 0),0,((100 * ROUND(RC[-2],2)) / ROUND(RC[-1],2))))/100.0 -> 1.0 | AG100: SUM(R[-8]C:R[-1]C) -> 40.0 | AH100: 40.0 | AI100: (if((ROUND(RC[-1],2) = 0),0,((100 * ROUND(RC[-2],2)) / ROUND(RC[-1],2))))/100.0 -> 1.0 | AJ100: SUM(R[-8]C:R[-1]C) -> 40.0 | AK100: 40.0 | AL100: (if((ROUND(RC[-1],2) = 0),0,((100 * ROUND(RC[-2],2)) / ROUND(RC[-1],2))))/100.0 -> 1.0 | AM100: SUM(R[-8]C:R[-1]C) -> 40.0 | AN100: 40.0 | AO100: (if((ROUND(RC[-1],2) = 0),0,((100 * ROUND(RC[-2],2)) / ROUND(RC[-1],2))))/100.0 -> 1.0 | AP100: SUM(R[-8]C:R[-1]C) -> 16.0 | AQ100: 16.0 | AR100: (if((ROUND(RC[-1],2) = 0),0,((100 * ROUND(RC[-2],2)) / ROUND(RC[-1],2))))/100.0 -> 1.0 | AS100: SUM(R[-8]C:R[-1]C) -> 388.0 | AT100: SUM(R[-8]C:R[-1]C) -> 528.0 | AU100: (if((ROUND(RC[-1],2) = 0),0,((100 * ROUND(RC[-2],2)) / ROUND(RC[-1],2))))/100.0 -> 0.7348484848484849
A101: Jerry Broeckaert
B102: Cus-01163 Aryza B.V. : Proj-00976 Interne uren 2025 | D102: 32.0 | E102: (if((ROUND(RC[-1],2) = 0),0,((100 * ROUND(RC[-2],2)) / ROUND(RC[-1],2))))/100.0 -> 0.0 | G102: 40.0 | H102: (if((ROUND(RC[-1],2) = 0),0,((100 * ROUND(RC[-2],2)) / ROUND(RC[-1],2))))/100.0 -> 0.0 | I102: 2.0 | J102: 40.0 | K102: (if((ROUND(RC[-1],2) = 0),0,((100 * ROUND(RC[-2],2)) / ROUND(RC[-1],2))))/100.0 -> 0.05 | L102: 2.0 | M102: 40.0 | N102: (if((ROUND(RC[-1],2) = 0),0,((100 * ROUND(RC[-2],2)) / ROUND(RC[-1],2))))/100.0 -> 0.05 | O102: 4.0 | P102: 40.0 | Q102: (if((ROUND(RC[-1],2) = 0),0,((100 * ROUND(RC[-2],2)) / ROUND(RC[-1],2))))/100.0 -> 0.1 | R102: 2.0 | S102: 40.0 | T102: (if((ROUND(RC[-1],2) = 0),0,((100 * ROUND(RC[-2],2)) / ROUND(RC[-1],2))))/100.0 -> 0.05 | U102: 2.0 | V102: 40.0 | W102: (if((ROUND(RC[-1],2) = 0),0,((100 * ROUND(RC[-2],2)) / ROUND(RC[-1],2))))/100.0 -> 0.05 | X102: 2.0 | Y102: 40.0 | Z102: (if((ROUND(RC[-1],2) = 0),0,((100 * ROUND(RC[-2],2)) / ROUND(RC[-1],2))))/100.0 -> 0.05 | AA102: 2.0 | AB102: 40.0 | AC102: (if((ROUND(RC[-1],2) = 0),0,((100 * ROUND(RC[-2],2)) / ROUND(RC[-1],2))))/100.0 -> 0.05 | AD102: 4.0 | AE102: 40.0 | AF102: (if((ROUND(RC[-1],2) = 0),0,((100 * ROUND(RC[-2],2)) / ROUND(RC[-1],2))))/100.0 -> 0.1 | AG102: 2.0 | AH102: 40.0 | AI102: (if((ROUND(RC[-1],2) = 0),0,((100 * ROUND(RC[-2],2)) / ROUND(RC[-1],2))))/100.0 -> 0.05 | AJ102: 2.0 | AK102: 40.0 | AL102: (if((ROUND(RC[-1],2) = 0),0,((100 * ROUND(RC[-2],2)) / ROUND(RC[-1],2))))/100.0 -> 0.05 | AM102: 2.0 | AN102: 40.0 | AO102: (if((ROUND(RC[-1],2) = 0),0,((100 * ROUND(RC[-2],2)) / ROUND(RC[-1],2))))/100.0 -> 0.05 | AP102: 1.6 | AQ102: 16.0 | AR102: (if((ROUND(RC[-1],2) = 0),0,((100 * ROUND(RC[-2],2)) / ROUND(RC[-1],2))))/100.0 -> 0.1 | AS102: SUM(RC[-42],RC[-39],RC[-36],RC[-33],RC[-30],RC[-27],RC[-24],RC[-21],RC[-18],RC[-15],RC[-12],RC[-9],RC[-6],RC[-3]) -> 27.6 | AT102: SUM(RC[-42],RC[-39],RC[-36],RC[-33],RC[-30],RC[-27],RC[-24],RC[-21],RC[-18],RC[-15],RC[-12],RC[-9],RC[-6],RC[-3]) -> 528.0 | AU102: (if((ROUND(RC[-1],2) = 0),0,((100 * ROUND(RC[-2],2)) / ROUND(RC[-1],2))))/100.0 -> 0.052272727272727276
B103: Cus-01163 Aryza B.V. : Proj-01123 GoPay Email in Bulk | D103: 32.0 | E103: (if((ROUND(RC[-1],2) = 0),0,((100 * ROUND(RC[-2],2)) / ROUND(RC[-1],2))))/100.0 -> 0.0 | G103: 40.0 | H103: (if((ROUND(RC[-1],2) = 0),0,((100 * ROUND(RC[-2],2)) / ROUND(RC[-1],2))))/100.0 -> 0.0 | J103: 40.0 | K103: (if((ROUND(RC[-1],2) = 0),0,((100 * ROUND(RC[-2],2)) / ROUND(RC[-1],2))))/100.0 -> 0.0 | M103: 40.0 | N103: (if((ROUND(RC[-1],2) = 0),0,((100 * ROUND(RC[-2],2)) / ROUND(RC[-1],2))))/100.0 -> 0.0 | P103: 40.0 | Q103: (if((ROUND(RC[-1],2) = 0),0,((100 * ROUND(RC[-2],2)) / ROUND(RC[-1],2))))/100.0 -> 0.0 | S103: 40.0 | T103: (if((ROUND(RC[-1],2) = 0),0,((100 * ROUND(RC[-2],2)) / ROUND(RC[-1],2))))/100.0 -> 0.0 | U103: 8.0 | V103: 40.0 | W103: (if((ROUND(RC[-1],2) = 0),0,((100 * ROUND(RC[-2],2)) / ROUND(RC[-1],2))))/100.0 -> 0.2 | Y103: 40.0 | Z103: (if((ROUND(RC[-1],2) = 0),0,((100 * ROUND(RC[-2],2)) / ROUND(RC[-1],2))))/100.0 -> 0.0 | AB103: 40.0 | AC103: (if((ROUND(RC[-1],2) = 0),0,((100 * ROUND(RC[-2],2)) / ROUND(RC[-1],2))))/100.0 -> 0.0 | AE103: 40.0 | AF103: (if((ROUND(RC[-1],2) = 0),0,((100 * ROUND(RC[-2],2)) / ROUND(RC[-1],2))))/100.0 -> 0.0 | AH103: 40.0 | AI103: (if((ROUND(RC[-1],2) = 0),0,((100 * ROUND(RC[-2],2)) / ROUND(RC[-1],2))))/100.0 -> 0.0 | AK103: 40.0 | AL103: (if((ROUND(RC[-1],2) = 0),0,((100 * ROUND(RC[-2],2)) / ROUND(RC[-1],2))))/100.0 -> 0.0 | AN103: 40.0 | AO103: (if((ROUND(RC[-1],2) = 0),0,((100 * ROUND(RC[-2],2)) / ROUND(RC[-1],2))))/100.0 -> 0.0 | AQ103: 16.0 | AR103: (if((ROUND(RC[-1],2) = 0),0,((100 * ROUND(RC[-2],2)) / ROUND(RC[-1],2))))/100.0 -> 0.0 | AS103: SUM(RC[-42],RC[-39],RC[-36],RC[-33],RC[-30],RC[-27],RC[-24],RC[-21],RC[-18],RC[-15],RC[-12],RC[-9],RC[-6],RC[-3]) -> 8.0 | AT103: SUM(RC[-42],RC[-39],RC[-36],RC[-33],RC[-30],RC[-27],RC[-24],RC[-21],RC[-18],RC[-15],RC[-12],RC[-9],RC[-6],RC[-3]) -> 528.0 | AU103: (if((ROUND(RC[-1],2) = 0),0,((100 * ROUND(RC[-2],2)) / ROUND(RC[-1],2))))/100.0 -> 0.015151515151515152
B104: Cus-01168 DipNed MR : Proj-00995 DipNed Wensen Kredietverstrekkers 2025 | D104: 32.0 | E104: (if((ROUND(RC[-1],2) = 0),0,((100 * ROUND(RC[-2],2)) / ROUND(RC[-1],2))))/100.0 -> 0.0 | G104: 40.0 | H104: (if((ROUND(RC[-1],2) = 0),0,((100 * ROUND(RC[-2],2)) / ROUND(RC[-1],2))))/100.0 -> 0.0 | J104: 40.0 | K104: (if((ROUND(RC[-1],2) = 0),0,((100 * ROUND(RC[-2],2)) / ROUND(RC[-1],2))))/100.0 -> 0.0 | M104: 40.0 | N104: (if((ROUND(RC[-1],2) = 0),0,((100 * ROUND(RC[-2],2)) / ROUND(RC[-1],2))))/100.0 -> 0.0 | P104: 40.0 | Q104: (if((ROUND(RC[-1],2) = 0),0,((100 * ROUND(RC[-2],2)) / ROUND(RC[-1],2))))/100.0 -> 0.0 | R104: 4.0 | S104: 40.0 | T104: (if((ROUND(RC[-1],2) = 0),0,((100 * ROUND(RC[-2],2)) / ROUND(RC[-1],2))))/100.0 -> 0.1 | U104: 4.0 | V104: 40.0 | W104: (if((ROUND(RC[-1],2) = 0),0,((100 * ROUND(RC[-2],2)) / ROUND(RC[-1],2))))/100.0 -> 0.1 | Y104: 40.0 | Z104: (if((ROUND(RC[-1],2) = 0),0,((100 * ROUND(RC[-2],2)) / ROUND(RC[-1],2))))/100.0 -> 0.0 | AB104: 40.0 | AC104: (if((ROUND(RC[-1],2) = 0),0,((100 * ROUND(RC[-2],2)) / ROUND(RC[-1],2))))/100.0 -> 0.0 | AE104: 40.0 | AF104: (if((ROUND(RC[-1],2) = 0),0,((100 * ROUND(RC[-2],2)) / ROUND(RC[-1],2))))/100.0 -> 0.0 | AH104: 40.0 | AI104: (if((ROUND(RC[-1],2) = 0),0,((100 * ROUND(RC[-2],2)) / ROUND(RC[-1],2))))/100.0 -> 0.0 | AK104: 40.0 | AL104: (if((ROUND(RC[-1],2) = 0),0,((100 * ROUND(RC[-2],2)) / ROUND(RC[-1],2))))/100.0 -> 0.0 | AN104: 40.0 | AO104: (if((ROUND(RC[-1],2) = 0),0,((100 * ROUND(RC[-2],2)) / ROUND(RC[-1],2))))/100.0 -> 0.0 | AQ104: 16.0 | AR104: (if((ROUND(RC[-1],2) = 0),0,((100 * ROUND(RC[-2],2)) / ROUND(RC[-1],2))))/100.0 -> 0.0 | AS104: SUM(RC[-42],RC[-39],RC[-36],RC[-33],RC[-30],RC[-27],RC[-24],RC[-21],RC[-18],RC[-15],RC[-12],RC[-9],RC[-6],RC[-3]) -> 8.0 | AT104: SUM(RC[-42],RC[-39],RC[-36],RC[-33],RC[-30],RC[-27],RC[-24],RC[-21],RC[-18],RC[-15],RC[-12],RC[-9],RC[-6],RC[-3]) -> 528.0 | AU104: (if((ROUND(RC[-1],2) = 0),0,((100 * ROUND(RC[-2],2)) / ROUND(RC[-1],2))))/100.0 -> 0.015151515151515152
B105: Cus-01168 DipNed MR : Proj-01024 DipNed SEPA betaalbestanden SDD en SCT | D105: 32.0 | E105: (if((ROUND(RC[-1],2) = 0),0,((100 * ROUND(RC[-2],2)) / ROUND(RC[-1],2))))/100.0 -> 0.0 | G105: 40.0 | H105: (if((ROUND(RC[-1],2) = 0),0,((100 * ROUND(RC[-2],2)) / ROUND(RC[-1],2))))/100.0 -> 0.0 | J105: 40.0 | K105: (if((ROUND(RC[-1],2) = 0),0,((100 * ROUND(RC[-2],2)) / ROUND(RC[-1],2))))/100.0 -> 0.0 | M105: 40.0 | N105: (if((ROUND(RC[-1],2) = 0),0,((100 * ROUND(RC[-2],2)) / ROUND(RC[-1],2))))/100.0 -> 0.0 | P105: 40.0 | Q105: (if((ROUND(RC[-1],2) = 0),0,((100 * ROUND(RC[-2],2)) / ROUND(RC[-1],2))))/100.0 -> 0.0 | S105: 40.0 | T105: (if((ROUND(RC[-1],2) = 0),0,((100 * ROUND(RC[-2],2)) / ROUND(RC[-1],2))))/100.0 -> 0.0 | U105: 4.0 | V105: 40.0 | W105: (if((ROUND(RC[-1],2) = 0),0,((100 * ROUND(RC[-2],2)) / ROUND(RC[-1],2))))/100.0 -> 0.1 | Y105: 40.0 | Z105: (if((ROUND(RC[-1],2) = 0),0,((100 * ROUND(RC[-2],2)) / ROUND(RC[-1],2))))/100.0 -> 0.0 | AB105: 40.0 | AC105: (if((ROUND(RC[-1],2) = 0),0,((100 * ROUND(RC[-2],2)) / ROUND(RC[-1],2))))/100.0 -> 0.0 | AE105: 40.0 | AF105: (if((ROUND(RC[-1],2) = 0),0,((100 * ROUND(RC[-2],2)) / ROUND(RC[-1],2))))/100.0 -> 0.0 | AH105: 40.0 | AI105: (if((ROUND(RC[-1],2) = 0),0,((100 * ROUND(RC[-2],2)) / ROUND(RC[-1],2))))/100.0 -> 0.0 | AK105: 40.0 | AL105: (if((ROUND(RC[-1],2) = 0),0,((100 * ROUND(RC[-2],2)) / ROUND(RC[-1],2))))/100.0 -> 0.0 | AN105: 40.0 | AO105: (if((ROUND(RC[-1],2) = 0),0,((100 * ROUND(RC[-2],2)) / ROUND(RC[-1],2))))/100.0 -> 0.0 | AQ105: 16.0 | AR105: (if((ROUND(RC[-1],2) = 0),0,((100 * ROUND(RC[-2],2)) / ROUND(RC[-1],2))))/100.0 -> 0.0 | AS105: SUM(RC[-42],RC[-39],RC[-36],RC[-33],RC[-30],RC[-27],RC[-24],RC[-21],RC[-18],RC[-15],RC[-12],RC[-9],RC[-6],RC[-3]) -> 4.0 | AT105: SUM(RC[-42],RC[-39],RC[-36],RC[-33],RC[-30],RC[-27],RC[-24],RC[-21],RC[-18],RC[-15],RC[-12],RC[-9],RC[-6],RC[-3]) -> 528.0 | AU105: (if((ROUND(RC[-1],2) = 0),0,((100 * ROUND(RC[-2],2)) / ROUND(RC[-1],2))))/100.0 -> 0.007575757575757576
B106: Cus-01202 Syntrus Achmea Hypotheekdiensten B.V. : Proj-01089 Ontsluiting klantportaal API - Syntrus | C106: 0.0 | D106: 32.0 | E106: (if((ROUND(RC[-1],2) = 0),0,((100 * ROUND(RC[-2],2)) / ROUND(RC[-1],2))))/100.0 -> 0.0 | F106: 0.0 | G106: 40.0 | H106: (if((ROUND(RC[-1],2) = 0),0,((100 * ROUND(RC[-2],2)) / ROUND(RC[-1],2))))/100.0 -> 0.0 | I106: 12.0 | J106: 40.0 | K106: (if((ROUND(RC[-1],2) = 0),0,((100 * ROUND(RC[-2],2)) / ROUND(RC[-1],2))))/100.0 -> 0.3 | L106: 0.0 | M106: 40.0 | N106: (if((ROUND(RC[-1],2) = 0),0,((100 * ROUND(RC[-2],2)) / ROUND(RC[-1],2))))/100.0 -> 0.0 | O106: 0.0 | P106: 40.0 | Q106: (if((ROUND(RC[-1],2) = 0),0,((100 * ROUND(RC[-2],2)) / ROUND(RC[-1],2))))/100.0 -> 0.0 | R106: 0.0 | S106: 40.0 | T106: (if((ROUND(RC[-1],2) = 0),0,((100 * ROUND(RC[-2],2)) / ROUND(RC[-1],2))))/100.0 -> 0.0 | U106: 0.0 | V106: 40.0 | W106: (if((ROUND(RC[-1],2) = 0),0,((100 * ROUND(RC[-2],2)) / ROUND(RC[-1],2))))/100.0 -> 0.0 | Y106: 40.0 | Z106: (if((ROUND(RC[-1],2) = 0),0,((100 * ROUND(RC[-2],2)) / ROUND(RC[-1],2))))/100.0 -> 0.0 | AB106: 40.0 | AC106: (if((ROUND(RC[-1],2) = 0),0,((100 * ROUND(RC[-2],2)) / ROUND(RC[-1],2))))/100.0 -> 0.0 | AE106: 40.0 | AF106: (if((ROUND(RC[-1],2) = 0),0,((100 * ROUND(RC[-2],2)) / ROUND(RC[-1],2))))/100.0 -> 0.0 | AH106: 40.0 | AI106: (if((ROUND(RC[-1],2) = 0),0,((100 * ROUND(RC[-2],2)) / ROUND(RC[-1],2))))/100.0 -> 0.0 | AK106: 40.0 | AL106: (if((ROUND(RC[-1],2) = 0),0,((100 * ROUND(RC[-2],2)) / ROUND(RC[-1],2))))/100.0 -> 0.0 | AN106: 40.0 | AO106: (if((ROUND(RC[-1],2) = 0),0,((100 * ROUND(RC[-2],2)) / ROUND(RC[-1],2))))/100.0 -> 0.0 | AQ106: 16.0 | AR106: (if((ROUND(RC[-1],2) = 0),0,((100 * ROUND(RC[-2],2)) / ROUND(RC[-1],2))))/100.0 -> 0.0 | AS106: SUM(RC[-42],RC[-39],RC[-36],RC[-33],RC[-30],RC[-27],RC[-24],RC[-21],RC[-18],RC[-15],RC[-12],RC[-9],RC[-6],RC[-3]) -> 12.0 | AT106: SUM(RC[-42],RC[-39],RC[-36],RC[-33],RC[-30],RC[-27],RC[-24],RC[-21],RC[-18],RC[-15],RC[-12],RC[-9],RC[-6],RC[-3]) -> 528.0 | AU106: (if((ROUND(RC[-1],2) = 0),0,((100 * ROUND(RC[-2],2)) / ROUND(RC[-1],2))))/100.0 -> 0.022727272727272728
A107: Total - Jerry Broeckaert | C107: SUM(R[-5]C:R[-1]C) -> 0.0 | D107: 32.0 | E107: (if((ROUND(RC[-1],2) = 0),0,((100 * ROUND(RC[-2],2)) / ROUND(RC[-1],2))))/100.0 -> 0.0 | F107: SUM(R[-5]C:R[-1]C) -> 0.0 | G107: 40.0 | H107: (if((ROUND(RC[-1],2) = 0),0,((100 * ROUND(RC[-2],2)) / ROUND(RC[-1],2))))/100.0 -> 0.0 | I107: SUM(R[-5]C:R[-1]C) -> 14.0 | J107: 40.0 | K107: (if((ROUND(RC[-1],2) = 0),0,((100 * ROUND(RC[-2],2)) / ROUND(RC[-1],2))))/100.0 -> 0.35 | L107: SUM(R[-5]C:R[-1]C) -> 2.0 | M107: 40.0 | N107: (if((ROUND(RC[-1],2) = 0),0,((100 * ROUND(RC[-2],2)) / ROUND(RC[-1],2))))/100.0 -> 0.05 | O107: SUM(R[-5]C:R[-1]C) -> 4.0 | P107: 40.0 | Q107: (if((ROUND(RC[-1],2) = 0),0,((100 * ROUND(RC[-2],2)) / ROUND(RC[-1],2))))/100.0 -> 0.1 | R107: SUM(R[-5]C:R[-1]C) -> 6.0 | S107: 40.0 | T107: (if((ROUND(RC[-1],2) = 0),0,((100 * ROUND(RC[-2],2)) / ROUND(RC[-1],2))))/100.0 -> 0.15 | U107: SUM(R[-5]C:R[-1]C) -> 18.0 | V107: 40.0 | W107: (if((ROUND(RC[-1],2) = 0),0,((100 * ROUND(RC[-2],2)) / ROUND(RC[-1],2))))/100.0 -> 0.45 | X107: SUM(R[-5]C:R[-1]C) -> 2.0 | Y107: 40.0 | Z107: (if((ROUND(RC[-1],2) = 0),0,((100 * ROUND(RC[-2],2)) / ROUND(RC[-1],2))))/100.0 -> 0.05 | AA107: SUM(R[-5]C:R[-1]C) -> 2.0 | AB107: 40.0 | AC107: (if((ROUND(RC[-1],2) = 0),0,((100 * ROUND(RC[-2],2)) / ROUND(RC[-1],2))))/100.0 -> 0.05 | AD107: SUM(R[-5]C:R[-1]C) -> 4.0 | AE107: 40.0 | AF107: (if((ROUND(RC[-1],2) = 0),0,((100 * ROUND(RC[-2],2)) / ROUND(RC[-1],2))))/100.0 -> 0.1 | AG107: SUM(R[-5]C:R[-1]C) -> 2.0 | AH107: 40.0 | AI107: (if((ROUND(RC[-1],2) = 0),0,((100 * ROUND(RC[-2],2)) / ROUND(RC[-1],2))))/100.0 -> 0.05 | AJ107: SUM(R[-5]C:R[-1]C) -> 2.0 | AK107: 40.0 | AL107: (if((ROUND(RC[-1],2) = 0),0,((100 * ROUND(RC[-2],2)) / ROUND(RC[-1],2))))/100.0 -> 0.05 | AM107: SUM(R[-5]C:R[-1]C) -> 2.0 | AN107: 40.0 | AO107: (if((ROUND(RC[-1],2) = 0),0,((100 * ROUND(RC[-2],2)) / ROUND(RC[-1],2))))/100.0 -> 0.05 | AP107: SUM(R[-5]C:R[-1]C) -> 1.6 | AQ107: 16.0 | AR107: (if((ROUND(RC[-1],2) = 0),0,((100 * ROUND(RC[-2],2)) / ROUND(RC[-1],2))))/100.0 -> 0.1 | AS107: SUM(R[-5]C:R[-1]C) -> 59.6 | AT107: SUM(R[-5]C:R[-1]C) -> 528.0 | AU107: (if((ROUND(RC[-1],2) = 0),0,((100 * ROUND(RC[-2],2)) / ROUND(RC[-1],2))))/100.0 -> 0.11287878787878787
A108: Letty Werdekker
B109: Cus-01103 Bazuin & Partners : Proj-00808 Strippenkaart 200 uur - Bazuin | D109: 32.0 | E109: (if((ROUND(RC[-1],2) = 0),0,((100 * ROUND(RC[-2],2)) / ROUND(RC[-1],2))))/100.0 -> 0.0 | G109: 40.0 | H109: (if((ROUND(RC[-1],2) = 0),0,((100 * ROUND(RC[-2],2)) / ROUND(RC[-1],2))))/100.0 -> 0.0 | J109: 40.0 | K109: (if((ROUND(RC[-1],2) = 0),0,((100 * ROUND(RC[-2],2)) / ROUND(RC[-1],2))))/100.0 -> 0.0 | M109: 40.0 | N109: (if((ROUND(RC[-1],2) = 0),0,((100 * ROUND(RC[-2],2)) / ROUND(RC[-1],2))))/100.0 -> 0.0 | P109: 40.0 | Q109: (if((ROUND(RC[-1],2) = 0),0,((100 * ROUND(RC[-2],2)) / ROUND(RC[-1],2))))/100.0 -> 0.0 | S109: 40.0 | T109: (if((ROUND(RC[-1],2) = 0),0,((100 * ROUND(RC[-2],2)) / ROUND(RC[-1],2))))/100.0 -> 0.0 | U109: 7.0 | V109: 40.0 | W109: (if((ROUND(RC[-1],2) = 0),0,((100 * ROUND(RC[-2],2)) / ROUND(RC[-1],2))))/100.0 -> 0.175 | X109: 14.0 | Y109: 40.0 | Z109: (if((ROUND(RC[-1],2) = 0),0,((100 * ROUND(RC[-2],2)) / ROUND(RC[-1],2))))/100.0 -> 0.35 | AA109: 7.0 | AB109: 40.0 | AC109: (if((ROUND(RC[-1],2) = 0),0,((100 * ROUND(RC[-2],2)) / ROUND(RC[-1],2))))/100.0 -> 0.175 | AD109: 7.0 | AE109: 40.0 | AF109: (if((ROUND(RC[-1],2) = 0),0,((100 * ROUND(RC[-2],2)) / ROUND(RC[-1],2))))/100.0 -> 0.175 | AH109: 40.0 | AI109: (if((ROUND(RC[-1],2) = 0),0,((100 * ROUND(RC[-2],2)) / ROUND(RC[-1],2))))/100.0 -> 0.0 | AK109: 40.0 | AL109: (if((ROUND(RC[-1],2) = 0),0,((100 * ROUND(RC[-2],2)) / ROUND(RC[-1],2))))/100.0 -> 0.0 | AN109: 40.0 | AO109: (if((ROUND(RC[-1],2) = 0),0,((100 * ROUND(RC[-2],2)) / ROUND(RC[-1],2))))/100.0 -> 0.0 | AQ109: 16.0 | AR109: (if((ROUND(RC[-1],2) = 0),0,((100 * ROUND(RC[-2],2)) / ROUND(RC[-1],2))))/100.0 -> 0.0 | AS109: SUM(RC[-42],RC[-39],RC[-36],RC[-33],RC[-30],RC[-27],RC[-24],RC[-21],RC[-18],RC[-15],RC[-12],RC[-9],RC[-6],RC[-3]) -> 35.0 | AT109: SUM(RC[-42],RC[-39],RC[-36],RC[-33],RC[-30],RC[-27],RC[-24],RC[-21],RC[-18],RC[-15],RC[-12],RC[-9],RC[-6],RC[-3]) -> 528.0 | AU109: (if((ROUND(RC[-1],2) = 0),0,((100 * ROUND(RC[-2],2)) / ROUND(RC[-1],2))))/100.0 -> 0.06628787878787878
B110: Cus-01120 HNL en Deurwaarder.com : Proj-01039 Voeging HNLBUS - HNLLELY | D110: 32.0 | E110: (if((ROUND(RC[-1],2) = 0),0,((100 * ROUND(RC[-2],2)) / ROUND(RC[-1],2))))/100.0 -> 0.0 | F110: 1.0 | G110: 40.0 | H110: (if((ROUND(RC[-1],2) = 0),0,((100 * ROUND(RC[-2],2)) / ROUND(RC[-1],2))))/100.0 -> 0.025 | J110: 40.0 | K110: (if((ROUND(RC[-1],2) = 0),0,((100 * ROUND(RC[-2],2)) / ROUND(RC[-1],2))))/100.0 -> 0.0 | M110: 40.0 | N110: (if((ROUND(RC[-1],2) = 0),0,((100 * ROUND(RC[-2],2)) / ROUND(RC[-1],2))))/100.0 -> 0.0 | P110: 40.0 | Q110: (if((ROUND(RC[-1],2) = 0),0,((100 * ROUND(RC[-2],2)) / ROUND(RC[-1],2))))/100.0 -> 0.0 | S110: 40.0 | T110: (if((ROUND(RC[-1],2) = 0),0,((100 * ROUND(RC[-2],2)) / ROUND(RC[-1],2))))/100.0 -> 0.0 | V110: 40.0 | W110: (if((ROUND(RC[-1],2) = 0),0,((100 * ROUND(RC[-2],2)) / ROUND(RC[-1],2))))/100.0 -> 0.0 | Y110: 40.0 | Z110: (if((ROUND(RC[-1],2) = 0),0,((100 * ROUND(RC[-2],2)) / ROUND(RC[-1],2))))/100.0 -> 0.0 | AB110: 40.0 | AC110: (if((ROUND(RC[-1],2) = 0),0,((100 * ROUND(RC[-2],2)) / ROUND(RC[-1],2))))/100.0 -> 0.0 | AE110: 40.0 | AF110: (if((ROUND(RC[-1],2) = 0),0,((100 * ROUND(RC[-2],2)) / ROUND(RC[-1],2))))/100.0 -> 0.0 | AH110: 40.0 | AI110: (if((ROUND(RC[-1],2) = 0),0,((100 * ROUND(RC[-2],2)) / ROUND(RC[-1],2))))/100.0 -> 0.0 | AK110: 40.0 | AL110: (if((ROUND(RC[-1],2) = 0),0,((100 * ROUND(RC[-2],2)) / ROUND(RC[-1],2))))/100.0 -> 0.0 | AN110: 40.0 | AO110: (if((ROUND(RC[-1],2) = 0),0,((100 * ROUND(RC[-2],2)) / ROUND(RC[-1],2))))/100.0 -> 0.0 | AQ110: 16.0 | AR110: (if((ROUND(RC[-1],2) = 0),0,((100 * ROUND(RC[-2],2)) / ROUND(RC[-1],2))))/100.0 -> 0.0 | AS110: SUM(RC[-42],RC[-39],RC[-36],RC[-33],RC[-30],RC[-27],RC[-24],RC[-21],RC[-18],RC[-15],RC[-12],RC[-9],RC[-6],RC[-3]) -> 1.0 | AT110: SUM(RC[-42],RC[-39],RC[-36],RC[-33],RC[-30],RC[-27],RC[-24],RC[-21],RC[-18],RC[-15],RC[-12],RC[-9],RC[-6],RC[-3]) -> 528.0 | AU110: (if((ROUND(RC[-1],2) = 0),0,((100 * ROUND(RC[-2],2)) / ROUND(RC[-1],2))))/100.0 -> 0.001893939393939394
B111: Cus-01163 Aryza B.V. : Proj-00976 Interne uren 2025 | C111: 3.0 | D111: 32.0 | E111: (if((ROUND(RC[-1],2) = 0),0,((100 * ROUND(RC[-2],2)) / ROUND(RC[-1],2))))/100.0 -> 0.09375 | F111: 8.0 | G111: 40.0 | H111: (if((ROUND(RC[-1],2) = 0),0,((100 * ROUND(RC[-2],2)) / ROUND(RC[-1],2))))/100.0 -> 0.2 | I111: 16.0 | J111: 40.0 | K111: (if((ROUND(RC[-1],2) = 0),0,((100 * ROUND(RC[-2],2)) / ROUND(RC[-1],2))))/100.0 -> 0.4 | L111: 8.0 | M111: 40.0 | N111: (if((ROUND(RC[-1],2) = 0),0,((100 * ROUND(RC[-2],2)) / ROUND(RC[-1],2))))/100.0 -> 0.2 | O111: 2.0 | P111: 40.0 | Q111: (if((ROUND(RC[-1],2) = 0),0,((100 * ROUND(RC[-2],2)) / ROUND(RC[-1],2))))/100.0 -> 0.05 | R111: 8.0 | S111: 40.0 | T111: (if((ROUND(RC[-1],2) = 0),0,((100 * ROUND(RC[-2],2)) / ROUND(RC[-1],2))))/100.0 -> 0.2 | U111: 2.0 | V111: 40.0 | W111: (if((ROUND(RC[-1],2) = 0),0,((100 * ROUND(RC[-2],2)) / ROUND(RC[-1],2))))/100.0 -> 0.05 | X111: 9.0 | Y111: 40.0 | Z111: (if((ROUND(RC[-1],2) = 0),0,((100 * ROUND(RC[-2],2)) / ROUND(RC[-1],2))))/100.0 -> 0.225 | AA111: 3.0 | AB111: 40.0 | AC111: (if((ROUND(RC[-1],2) = 0),0,((100 * ROUND(RC[-2],2)) / ROUND(RC[-1],2))))/100.0 -> 0.075 | AD111: 10.2 | AE111: 40.0 | AF111: (if((ROUND(RC[-1],2) = 0),0,((100 * ROUND(RC[-2],2)) / ROUND(RC[-1],2))))/100.0 -> 0.25499999999999995 | AG111: 1.0 | AH111: 40.0 | AI111: (if((ROUND(RC[-1],2) = 0),0,((100 * ROUND(RC[-2],2)) / ROUND(RC[-1],2))))/100.0 -> 0.025 | AJ111: 9.0 | AK111: 40.0 | AL111: (if((ROUND(RC[-1],2) = 0),0,((100 * ROUND(RC[-2],2)) / ROUND(RC[-1],2))))/100.0 -> 0.225 | AM111: 1.0 | AN111: 40.0 | AO111: (if((ROUND(RC[-1],2) = 0),0,((100 * ROUND(RC[-2],2)) / ROUND(RC[-1],2))))/100.0 -> 0.025 | AQ111: 16.0 | AR111: (if((ROUND(RC[-1],2) = 0),0,((100 * ROUND(RC[-2],2)) / ROUND(RC[-1],2))))/100.0 -> 0.0 | AS111: SUM(RC[-42],RC[-39],RC[-36],RC[-33],RC[-30],RC[-27],RC[-24],RC[-21],RC[-18],RC[-15],RC[-12],RC[-9],RC[-6],RC[-3]) -> 80.2 | AT111: SUM(RC[-42],RC[-39],RC[-36],RC[-33],RC[-30],RC[-27],RC[-24],RC[-21],RC[-18],RC[-15],RC[-12],RC[-9],RC[-6],RC[-3]) -> 528.0 | AU111: (if((ROUND(RC[-1],2) = 0),0,((100 * ROUND(RC[-2],2)) / ROUND(RC[-1],2))))/100.0 -> 0.1518939393939394
B112: Cus-01163 Aryza B.V. : Proj-01055 LDCR 2025 | C112: 4.0 | D112: 32.0 | E112: (if((ROUND(RC[-1],2) = 0),0,((100 * ROUND(RC[-2],2)) / ROUND(RC[-1],2))))/100.0 -> 0.125 | G112: 40.0 | H112: (if((ROUND(RC[-1],2) = 0),0,((100 * ROUND(RC[-2],2)) / ROUND(RC[-1],2))))/100.0 -> 0.0 | J112: 40.0 | K112: (if((ROUND(RC[-1],2) = 0),0,((100 * ROUND(RC[-2],2)) / ROUND(RC[-1],2))))/100.0 -> 0.0 | M112: 40.0 | N112: (if((ROUND(RC[-1],2) = 0),0,((100 * ROUND(RC[-2],2)) / ROUND(RC[-1],2))))/100.0 -> 0.0 | P112: 40.0 | Q112: (if((ROUND(RC[-1],2) = 0),0,((100 * ROUND(RC[-2],2)) / ROUND(RC[-1],2))))/100.0 -> 0.0 | S112: 40.0 | T112: (if((ROUND(RC[-1],2) = 0),0,((100 * ROUND(RC[-2],2)) / ROUND(RC[-1],2))))/100.0 -> 0.0 | V112: 40.0 | W112: (if((ROUND(RC[-1],2) = 0),0,((100 * ROUND(RC[-2],2)) / ROUND(RC[-1],2))))/100.0 -> 0.0 | Y112: 40.0 | Z112: (if((ROUND(RC[-1],2) = 0),0,((100 * ROUND(RC[-2],2)) / ROUND(RC[-1],2))))/100.0 -> 0.0 | AB112: 40.0 | AC112: (if((ROUND(RC[-1],2) = 0),0,((100 * ROUND(RC[-2],2)) / ROUND(RC[-1],2))))/100.0 -> 0.0 | AE112: 40.0 | AF112: (if((ROUND(RC[-1],2) = 0),0,((100 * ROUND(RC[-2],2)) / ROUND(RC[-1],2))))/100.0 -> 0.0 | AH112: 40.0 | AI112: (if((ROUND(RC[-1],2) = 0),0,((100 * ROUND(RC[-2],2)) / ROUND(RC[-1],2))))/100.0 -> 0.0 | AK112: 40.0 | AL112: (if((ROUND(RC[-1],2) = 0),0,((100 * ROUND(RC[-2],2)) / ROUND(RC[-1],2))))/100.0 -> 0.0 | AN112: 40.0 | AO112: (if((ROUND(RC[-1],2) = 0),0,((100 * ROUND(RC[-2],2)) / ROUND(RC[-1],2))))/100.0 -> 0.0 | AQ112: 16.0 | AR112: (if((ROUND(RC[-1],2) = 0),0,((100 * ROUND(RC[-2],2)) / ROUND(RC[-1],2))))/100.0 -> 0.0 | AS112: SUM(RC[-42],RC[-39],RC[-36],RC[-33],RC[-30],RC[-27],RC[-24],RC[-21],RC[-18],RC[-15],RC[-12],RC[-9],RC[-6],RC[-3]) -> 4.0 | AT112: SUM(RC[-42],RC[-39],RC[-36],RC[-33],RC[-30],RC[-27],RC[-24],RC[-21],RC[-18],RC[-15],RC[-12],RC[-9],RC[-6],RC[-3]) -> 528.0 | AU112: (if((ROUND(RC[-1],2) = 0),0,((100 * ROUND(RC[-2],2)) / ROUND(RC[-1],2))))/100.0 -> 0.007575757575757576
B113: Cus-01168 DipNed MR : Proj-00993 DipNed - DipNed Algemeen 2025 | D113: 32.0 | E113: (if((ROUND(RC[-1],2) = 0),0,((100 * ROUND(RC[-2],2)) / ROUND(RC[-1],2))))/100.0 -> 0.0 | G113: 40.0 | H113: (if((ROUND(RC[-1],2) = 0),0,((100 * ROUND(RC[-2],2)) / ROUND(RC[-1],2))))/100.0 -> 0.0 | J113: 40.0 | K113: (if((ROUND(RC[-1],2) = 0),0,((100 * ROUND(RC[-2],2)) / ROUND(RC[-1],2))))/100.0 -> 0.0 | M113: 40.0 | N113: (if((ROUND(RC[-1],2) = 0),0,((100 * ROUND(RC[-2],2)) / ROUND(RC[-1],2))))/100.0 -> 0.0 | P113: 40.0 | Q113: (if((ROUND(RC[-1],2) = 0),0,((100 * ROUND(RC[-2],2)) / ROUND(RC[-1],2))))/100.0 -> 0.0 | S113: 40.0 | T113: (if((ROUND(RC[-1],2) = 0),0,((100 * ROUND(RC[-2],2)) / ROUND(RC[-1],2))))/100.0 -> 0.0 | U113: 2.0 | V113: 40.0 | W113: (if((ROUND(RC[-1],2) = 0),0,((100 * ROUND(RC[-2],2)) / ROUND(RC[-1],2))))/100.0 -> 0.05 | Y113: 40.0 | Z113: (if((ROUND(RC[-1],2) = 0),0,((100 * ROUND(RC[-2],2)) / ROUND(RC[-1],2))))/100.0 -> 0.0 | AB113: 40.0 | AC113: (if((ROUND(RC[-1],2) = 0),0,((100 * ROUND(RC[-2],2)) / ROUND(RC[-1],2))))/100.0 -> 0.0 | AE113: 40.0 | AF113: (if((ROUND(RC[-1],2) = 0),0,((100 * ROUND(RC[-2],2)) / ROUND(RC[-1],2))))/100.0 -> 0.0 | AH113: 40.0 | AI113: (if((ROUND(RC[-1],2) = 0),0,((100 * ROUND(RC[-2],2)) / ROUND(RC[-1],2))))/100.0 -> 0.0 | AK113: 40.0 | AL113: (if((ROUND(RC[-1],2) = 0),0,((100 * ROUND(RC[-2],2)) / ROUND(RC[-1],2))))/100.0 -> 0.0 | AN113: 40.0 | AO113: (if((ROUND(RC[-1],2) = 0),0,((100 * ROUND(RC[-2],2)) / ROUND(RC[-1],2))))/100.0 -> 0.0 | AQ113: 16.0 | AR113: (if((ROUND(RC[-1],2) = 0),0,((100 * ROUND(RC[-2],2)) / ROUND(RC[-1],2))))/100.0 -> 0.0 | AS113: SUM(RC[-42],RC[-39],RC[-36],RC[-33],RC[-30],RC[-27],RC[-24],RC[-21],RC[-18],RC[-15],RC[-12],RC[-9],RC[-6],RC[-3]) -> 2.0 | AT113: SUM(RC[-42],RC[-39],RC[-36],RC[-33],RC[-30],RC[-27],RC[-24],RC[-21],RC[-18],RC[-15],RC[-12],RC[-9],RC[-6],RC[-3]) -> 528.0 | AU113: (if((ROUND(RC[-1],2) = 0),0,((100 * ROUND(RC[-2],2)) / ROUND(RC[-1],2))))/100.0 -> 0.003787878787878788
B114: Cus-01168 DipNed MR : Proj-00994 DipNed Wensen eindgebruikers Mappen/financieel 2025 | D114: 32.0 | E114: (if((ROUND(RC[-1],2) = 0),0,((100 * ROUND(RC[-2],2)) / ROUND(RC[-1],2))))/100.0 -> 0.0 | G114: 40.0 | H114: (if((ROUND(RC[-1],2) = 0),0,((100 * ROUND(RC[-2],2)) / ROUND(RC[-1],2))))/100.0 -> 0.0 | J114: 40.0 | K114: (if((ROUND(RC[-1],2) = 0),0,((100 * ROUND(RC[-2],2)) / ROUND(RC[-1],2))))/100.0 -> 0.0 | M114: 40.0 | N114: (if((ROUND(RC[-1],2) = 0),0,((100 * ROUND(RC[-2],2)) / ROUND(RC[-1],2))))/100.0 -> 0.0 | P114: 40.0 | Q114: (if((ROUND(RC[-1],2) = 0),0,((100 * ROUND(RC[-2],2)) / ROUND(RC[-1],2))))/100.0 -> 0.0 | S114: 40.0 | T114: (if((ROUND(RC[-1],2) = 0),0,((100 * ROUND(RC[-2],2)) / ROUND(RC[-1],2))))/100.0 -> 0.0 | U114: 8.0 | V114: 40.0 | W114: (if((ROUND(RC[-1],2) = 0),0,((100 * ROUND(RC[-2],2)) / ROUND(RC[-1],2))))/100.0 -> 0.2 | Y114: 40.0 | Z114: (if((ROUND(RC[-1],2) = 0),0,((100 * ROUND(RC[-2],2)) / ROUND(RC[-1],2))))/100.0 -> 0.0 | AB114: 40.0 | AC114: (if((ROUND(RC[-1],2) = 0),0,((100 * ROUND(RC[-2],2)) / ROUND(RC[-1],2))))/100.0 -> 0.0 | AE114: 40.0 | AF114: (if((ROUND(RC[-1],2) = 0),0,((100 * ROUND(RC[-2],2)) / ROUND(RC[-1],2))))/100.0 -> 0.0 | AH114: 40.0 | AI114: (if((ROUND(RC[-1],2) = 0),0,((100 * ROUND(RC[-2],2)) / ROUND(RC[-1],2))))/100.0 -> 0.0 | AK114: 40.0 | AL114: (if((ROUND(RC[-1],2) = 0),0,((100 * ROUND(RC[-2],2)) / ROUND(RC[-1],2))))/100.0 -> 0.0 | AN114: 40.0 | AO114: (if((ROUND(RC[-1],2) = 0),0,((100 * ROUND(RC[-2],2)) / ROUND(RC[-1],2))))/100.0 -> 0.0 | AQ114: 16.0 | AR114: (if((ROUND(RC[-1],2) = 0),0,((100 * ROUND(RC[-2],2)) / ROUND(RC[-1],2))))/100.0 -> 0.0 | AS114: SUM(RC[-42],RC[-39],RC[-36],RC[-33],RC[-30],RC[-27],RC[-24],RC[-21],RC[-18],RC[-15],RC[-12],RC[-9],RC[-6],RC[-3]) -> 8.0 | AT114: SUM(RC[-42],RC[-39],RC[-36],RC[-33],RC[-30],RC[-27],RC[-24],RC[-21],RC[-18],RC[-15],RC[-12],RC[-9],RC[-6],RC[-3]) -> 528.0 | AU114: (if((ROUND(RC[-1],2) = 0),0,((100 * ROUND(RC[-2],2)) / ROUND(RC[-1],2))))/100.0 -> 0.015151515151515152
B115: Cus-01168 DipNed MR : Proj-01024 DipNed SEPA betaalbestanden SDD en SCT | C115: 8.0 | D115: 32.0 | E115: (if((ROUND(RC[-1],2) = 0),0,((100 * ROUND(RC[-2],2)) / ROUND(RC[-1],2))))/100.0 -> 0.25 | F115: 8.0 | G115: 40.0 | H115: (if((ROUND(RC[-1],2) = 0),0,((100 * ROUND(RC[-2],2)) / ROUND(RC[-1],2))))/100.0 -> 0.2 | I115: 4.0 | J115: 40.0 | K115: (if((ROUND(RC[-1],2) = 0),0,((100 * ROUND(RC[-2],2)) / ROUND(RC[-1],2))))/100.0 -> 0.1 | M115: 40.0 | N115: (if((ROUND(RC[-1],2) = 0),0,((100 * ROUND(RC[-2],2)) / ROUND(RC[-1],2))))/100.0 -> 0.0 | P115: 40.0 | Q115: (if((ROUND(RC[-1],2) = 0),0,((100 * ROUND(RC[-2],2)) / ROUND(RC[-1],2))))/100.0 -> 0.0 | S115: 40.0 | T115: (if((ROUND(RC[-1],2) = 0),0,((100 * ROUND(RC[-2],2)) / ROUND(RC[-1],2))))/100.0 -> 0.0 | U115: 4.0 | V115: 40.0 | W115: (if((ROUND(RC[-1],2) = 0),0,((100 * ROUND(RC[-2],2)) / ROUND(RC[-1],2))))/100.0 -> 0.1 | Y115: 40.0 | Z115: (if((ROUND(RC[-1],2) = 0),0,((100 * ROUND(RC[-2],2)) / ROUND(RC[-1],2))))/100.0 -> 0.0 | AB115: 40.0 | AC115: (if((ROUND(RC[-1],2) = 0),0,((100 * ROUND(RC[-2],2)) / ROUND(RC[-1],2))))/100.0 -> 0.0 | AE115: 40.0 | AF115: (if((ROUND(RC[-1],2) = 0),0,((100 * ROUND(RC[-2],2)) / ROUND(RC[-1],2))))/100.0 -> 0.0 | AH115: 40.0 | AI115: (if((ROUND(RC[-1],2) = 0),0,((100 * ROUND(RC[-2],2)) / ROUND(RC[-1],2))))/100.0 -> 0.0 | AK115: 40.0 | AL115: (if((ROUND(RC[-1],2) = 0),0,((100 * ROUND(RC[-2],2)) / ROUND(RC[-1],2))))/100.0 -> 0.0 | AN115: 40.0 | AO115: (if((ROUND(RC[-1],2) = 0),0,((100 * ROUND(RC[-2],2)) / ROUND(RC[-1],2))))/100.0 -> 0.0 | AQ115: 16.0 | AR115: (if((ROUND(RC[-1],2) = 0),0,((100 * ROUND(RC[-2],2)) / ROUND(RC[-1],2))))/100.0 -> 0.0 | AS115: SUM(RC[-42],RC[-39],RC[-36],RC[-33],RC[-30],RC[-27],RC[-24],RC[-21],RC[-18],RC[-15],RC[-12],RC[-9],RC[-6],RC[-3]) -> 24.0 | AT115: SUM(RC[-42],RC[-39],RC[-36],RC[-33],RC[-30],RC[-27],RC[-24],RC[-21],RC[-18],RC[-15],RC[-12],RC[-9],RC[-6],RC[-3]) -> 528.0 | AU115: (if((ROUND(RC[-1],2) = 0),0,((100 * ROUND(RC[-2],2)) / ROUND(RC[-1],2))))/100.0 -> 0.045454545454545456
B116: Cus-01168 DipNed MR : Proj-01122 DipNed - Korte termijn verbeteringen matchen bankafschriften | D116: 32.0 | E116: (if((ROUND(RC[-1],2) = 0),0,((100 * ROUND(RC[-2],2)) / ROUND(RC[-1],2))))/100.0 -> 0.0 | F116: 4.0 | G116: 40.0 | H116: (if((ROUND(RC[-1],2) = 0),0,((100 * ROUND(RC[-2],2)) / ROUND(RC[-1],2))))/100.0 -> 0.1 | I116: 4.0 | J116: 40.0 | K116: (if((ROUND(RC[-1],2) = 0),0,((100 * ROUND(RC[-2],2)) / ROUND(RC[-1],2))))/100.0 -> 0.1 | M116: 40.0 | N116: (if((ROUND(RC[-1],2) = 0),0,((100 * ROUND(RC[-2],2)) / ROUND(RC[-1],2))))/100.0 -> 0.0 | O116: 4.0 | P116: 40.0 | Q116: (if((ROUND(RC[-1],2) = 0),0,((100 * ROUND(RC[-2],2)) / ROUND(RC[-1],2))))/100.0 -> 0.1 | R116: 4.0 | S116: 40.0 | T116: (if((ROUND(RC[-1],2) = 0),0,((100 * ROUND(RC[-2],2)) / ROUND(RC[-1],2))))/100.0 -> 0.1 | U116: 4.0 | V116: 40.0 | W116: (if((ROUND(RC[-1],2) = 0),0,((100 * ROUND(RC[-2],2)) / ROUND(RC[-1],2))))/100.0 -> 0.1 | X116: 4.0 | Y116: 40.0 | Z116: (if((ROUND(RC[-1],2) = 0),0,((100 * ROUND(RC[-2],2)) / ROUND(RC[-1],2))))/100.0 -> 0.1 | AB116: 40.0 | AC116: (if((ROUND(RC[-1],2) = 0),0,((100 * ROUND(RC[-2],2)) / ROUND(RC[-1],2))))/100.0 -> 0.0 | AE116: 40.0 | AF116: (if((ROUND(RC[-1],2) = 0),0,((100 * ROUND(RC[-2],2)) / ROUND(RC[-1],2))))/100.0 -> 0.0 | AG116: 4.0 | AH116: 40.0 | AI116: (if((ROUND(RC[-1],2) = 0),0,((100 * ROUND(RC[-2],2)) / ROUND(RC[-1],2))))/100.0 -> 0.1 | AJ116: 4.0 | AK116: 40.0 | AL116: (if((ROUND(RC[-1],2) = 0),0,((100 * ROUND(RC[-2],2)) / ROUND(RC[-1],2))))/100.0 -> 0.1 | AM116: 4.0 | AN116: 40.0 | AO116: (if((ROUND(RC[-1],2) = 0),0,((100 * ROUND(RC[-2],2)) / ROUND(RC[-1],2))))/100.0 -> 0.1 | AQ116: 16.0 | AR116: (if((ROUND(RC[-1],2) = 0),0,((100 * ROUND(RC[-2],2)) / ROUND(RC[-1],2))))/100.0 -> 0.0 | AS116: SUM(RC[-42],RC[-39],RC[-36],RC[-33],RC[-30],RC[-27],RC[-24],RC[-21],RC[-18],RC[-15],RC[-12],RC[-9],RC[-6],RC[-3]) -> 36.0 | AT116: SUM(RC[-42],RC[-39],RC[-36],RC[-33],RC[-30],RC[-27],RC[-24],RC[-21],RC[-18],RC[-15],RC[-12],RC[-9],RC[-6],RC[-3]) -> 528.0 | AU116: (if((ROUND(RC[-1],2) = 0),0,((100 * ROUND(RC[-2],2)) / ROUND(RC[-1],2))))/100.0 -> 0.06818181818181818
B117: Cus-01736 LDCR Afd. Fin. : Proj-01031 Wishes LDCR Period 3 | D117: 32.0 | E117: (if((ROUND(RC[-1],2) = 0),0,((100 * ROUND(RC[-2],2)) / ROUND(RC[-1],2))))/100.0 -> 0.0 | F117: 4.0 | G117: 40.0 | H117: (if((ROUND(RC[-1],2) = 0),0,((100 * ROUND(RC[-2],2)) / ROUND(RC[-1],2))))/100.0 -> 0.1 | J117: 40.0 | K117: (if((ROUND(RC[-1],2) = 0),0,((100 * ROUND(RC[-2],2)) / ROUND(RC[-1],2))))/100.0 -> 0.0 | M117: 40.0 | N117: (if((ROUND(RC[-1],2) = 0),0,((100 * ROUND(RC[-2],2)) / ROUND(RC[-1],2))))/100.0 -> 0.0 | P117: 40.0 | Q117: (if((ROUND(RC[-1],2) = 0),0,((100 * ROUND(RC[-2],2)) / ROUND(RC[-1],2))))/100.0 -> 0.0 | S117: 40.0 | T117: (if((ROUND(RC[-1],2) = 0),0,((100 * ROUND(RC[-2],2)) / ROUND(RC[-1],2))))/100.0 -> 0.0 | V117: 40.0 | W117: (if((ROUND(RC[-1],2) = 0),0,((100 * ROUND(RC[-2],2)) / ROUND(RC[-1],2))))/100.0 -> 0.0 | Y117: 40.0 | Z117: (if((ROUND(RC[-1],2) = 0),0,((100 * ROUND(RC[-2],2)) / ROUND(RC[-1],2))))/100.0 -> 0.0 | AB117: 40.0 | AC117: (if((ROUND(RC[-1],2) = 0),0,((100 * ROUND(RC[-2],2)) / ROUND(RC[-1],2))))/100.0 -> 0.0 | AD117: 8.0 | AE117: 40.0 | AF117: (if((ROUND(RC[-1],2) = 0),0,((100 * ROUND(RC[-2],2)) / ROUND(RC[-1],2))))/100.0 -> 0.2 | AH117: 40.0 | AI117: (if((ROUND(RC[-1],2) = 0),0,((100 * ROUND(RC[-2],2)) / ROUND(RC[-1],2))))/100.0 -> 0.0 | AK117: 40.0 | AL117: (if((ROUND(RC[-1],2) = 0),0,((100 * ROUND(RC[-2],2)) / ROUND(RC[-1],2))))/100.0 -> 0.0 | AN117: 40.0 | AO117: (if((ROUND(RC[-1],2) = 0),0,((100 * ROUND(RC[-2],2)) / ROUND(RC[-1],2))))/100.0 -> 0.0 | AQ117: 16.0 | AR117: (if((ROUND(RC[-1],2) = 0),0,((100 * ROUND(RC[-2],2)) / ROUND(RC[-1],2))))/100.0 -> 0.0 | AS117: SUM(RC[-42],RC[-39],RC[-36],RC[-33],RC[-30],RC[-27],RC[-24],RC[-21],RC[-18],RC[-15],RC[-12],RC[-9],RC[-6],RC[-3]) -> 12.0 | AT117: SUM(RC[-42],RC[-39],RC[-36],RC[-33],RC[-30],RC[-27],RC[-24],RC[-21],RC[-18],RC[-15],RC[-12],RC[-9],RC[-6],RC[-3]) -> 528.0 | AU117: (if((ROUND(RC[-1],2) = 0),0,((100 * ROUND(RC[-2],2)) / ROUND(RC[-1],2))))/100.0 -> 0.022727272727272728
B118: Cus-02004 Collect Masters B.V. : Proj-01052 Implementatie Navigate - Collect Masters | C118: 14.0 | D118: 32.0 | E118: (if((ROUND(RC[-1],2) = 0),0,((100 * ROUND(RC[-2],2)) / ROUND(RC[-1],2))))/100.0 -> 0.4375 | G118: 40.0 | H118: (if((ROUND(RC[-1],2) = 0),0,((100 * ROUND(RC[-2],2)) / ROUND(RC[-1],2))))/100.0 -> 0.0 | J118: 40.0 | K118: (if((ROUND(RC[-1],2) = 0),0,((100 * ROUND(RC[-2],2)) / ROUND(RC[-1],2))))/100.0 -> 0.0 | M118: 40.0 | N118: (if((ROUND(RC[-1],2) = 0),0,((100 * ROUND(RC[-2],2)) / ROUND(RC[-1],2))))/100.0 -> 0.0 | O118: 14.0 | P118: 40.0 | Q118: (if((ROUND(RC[-1],2) = 0),0,((100 * ROUND(RC[-2],2)) / ROUND(RC[-1],2))))/100.0 -> 0.35 | S118: 40.0 | T118: (if((ROUND(RC[-1],2) = 0),0,((100 * ROUND(RC[-2],2)) / ROUND(RC[-1],2))))/100.0 -> 0.0 | V118: 40.0 | W118: (if((ROUND(RC[-1],2) = 0),0,((100 * ROUND(RC[-2],2)) / ROUND(RC[-1],2))))/100.0 -> 0.0 | X118: 7.0 | Y118: 40.0 | Z118: (if((ROUND(RC[-1],2) = 0),0,((100 * ROUND(RC[-2],2)) / ROUND(RC[-1],2))))/100.0 -> 0.175 | AA118: 7.0 | AB118: 40.0 | AC118: (if((ROUND(RC[-1],2) = 0),0,((100 * ROUND(RC[-2],2)) / ROUND(RC[-1],2))))/100.0 -> 0.175 | AD118: 14.0 | AE118: 40.0 | AF118: (if((ROUND(RC[-1],2) = 0),0,((100 * ROUND(RC[-2],2)) / ROUND(RC[-1],2))))/100.0 -> 0.35 | AH118: 40.0 | AI118: (if((ROUND(RC[-1],2) = 0),0,((100 * ROUND(RC[-2],2)) / ROUND(RC[-1],2))))/100.0 -> 0.0 | AK118: 40.0 | AL118: (if((ROUND(RC[-1],2) = 0),0,((100 * ROUND(RC[-2],2)) / ROUND(RC[-1],2))))/100.0 -> 0.0 | AN118: 40.0 | AO118: (if((ROUND(RC[-1],2) = 0),0,((100 * ROUND(RC[-2],2)) / ROUND(RC[-1],2))))/100.0 -> 0.0 | AQ118: 16.0 | AR118: (if((ROUND(RC[-1],2) = 0),0,((100 * ROUND(RC[-2],2)) / ROUND(RC[-1],2))))/100.0 -> 0.0 | AS118: SUM(RC[-42],RC[-39],RC[-36],RC[-33],RC[-30],RC[-27],RC[-24],RC[-21],RC[-18],RC[-15],RC[-12],RC[-9],RC[-6],RC[-3]) -> 56.0 | AT118: SUM(RC[-42],RC[-39],RC[-36],RC[-33],RC[-30],RC[-27],RC[-24],RC[-21],RC[-18],RC[-15],RC[-12],RC[-9],RC[-6],RC[-3]) -> 528.0 | AU118: (if((ROUND(RC[-1],2) = 0),0,((100 * ROUND(RC[-2],2)) / ROUND(RC[-1],2))))/100.0 -> 0.10606060606060605
B119: Cus-02250 Smal Otte advocaten en mediators : Proj-01099 Inrichting Navigate - Smal Otte | C119: 7.0 | D119: 32.0 | E119: (if((ROUND(RC[-1],2) = 0),0,((100 * ROUND(RC[-2],2)) / ROUND(RC[-1],2))))/100.0 -> 0.21875 | F119: 0.0 | G119: 40.0 | H119: (if((ROUND(RC[-1],2) = 0),0,((100 * ROUND(RC[-2],2)) / ROUND(RC[-1],2))))/100.0 -> 0.0 | I119: 0.0 | J119: 40.0 | K119: (if((ROUND(RC[-1],2) = 0),0,((100 * ROUND(RC[-2],2)) / ROUND(RC[-1],2))))/100.0 -> 0.0 | L119: 0.0 | M119: 40.0 | N119: (if((ROUND(RC[-1],2) = 0),0,((100 * ROUND(RC[-2],2)) / ROUND(RC[-1],2))))/100.0 -> 0.0 | O119: 0.0 | P119: 40.0 | Q119: (if((ROUND(RC[-1],2) = 0),0,((100 * ROUND(RC[-2],2)) / ROUND(RC[-1],2))))/100.0 -> 0.0 | R119: 0.0 | S119: 40.0 | T119: (if((ROUND(RC[-1],2) = 0),0,((100 * ROUND(RC[-2],2)) / ROUND(RC[-1],2))))/100.0 -> 0.0 | U119: 7.0 | V119: 40.0 | W119: (if((ROUND(RC[-1],2) = 0),0,((100 * ROUND(RC[-2],2)) / ROUND(RC[-1],2))))/100.0 -> 0.175 | X119: 0.0 | Y119: 40.0 | Z119: (if((ROUND(RC[-1],2) = 0),0,((100 * ROUND(RC[-2],2)) / ROUND(RC[-1],2))))/100.0 -> 0.0 | AA119: 7.0 | AB119: 40.0 | AC119: (if((ROUND(RC[-1],2) = 0),0,((100 * ROUND(RC[-2],2)) / ROUND(RC[-1],2))))/100.0 -> 0.175 | AD119: 0.0 | AE119: 40.0 | AF119: (if((ROUND(RC[-1],2) = 0),0,((100 * ROUND(RC[-2],2)) / ROUND(RC[-1],2))))/100.0 -> 0.0 | AG119: 0.0 | AH119: 40.0 | AI119: (if((ROUND(RC[-1],2) = 0),0,((100 * ROUND(RC[-2],2)) / ROUND(RC[-1],2))))/100.0 -> 0.0 | AJ119: 0.0 | AK119: 40.0 | AL119: (if((ROUND(RC[-1],2) = 0),0,((100 * ROUND(RC[-2],2)) / ROUND(RC[-1],2))))/100.0 -> 0.0 | AM119: 7.0 | AN119: 40.0 | AO119: (if((ROUND(RC[-1],2) = 0),0,((100 * ROUND(RC[-2],2)) / ROUND(RC[-1],2))))/100.0 -> 0.175 | AP119: 0.0 | AQ119: 16.0 | AR119: (if((ROUND(RC[-1],2) = 0),0,((100 * ROUND(RC[-2],2)) / ROUND(RC[-1],2))))/100.0 -> 0.0 | AS119: SUM(RC[-42],RC[-39],RC[-36],RC[-33],RC[-30],RC[-27],RC[-24],RC[-21],RC[-18],RC[-15],RC[-12],RC[-9],RC[-6],RC[-3]) -> 28.0 | AT119: SUM(RC[-42],RC[-39],RC[-36],RC[-33],RC[-30],RC[-27],RC[-24],RC[-21],RC[-18],RC[-15],RC[-12],RC[-9],RC[-6],RC[-3]) -> 528.0 | AU119: (if((ROUND(RC[-1],2) = 0),0,((100 * ROUND(RC[-2],2)) / ROUND(RC[-1],2))))/100.0 -> 0.053030303030303025
A120: Total - Letty Werdekker | C120: SUM(R[-11]C:R[-1]C) -> 36.0 | D120: 32.0 | E120: (if((ROUND(RC[-1],2) = 0),0,((100 * ROUND(RC[-2],2)) / ROUND(RC[-1],2))))/100.0 -> 1.125 | F120: SUM(R[-11]C:R[-1]C) -> 25.0 | G120: 40.0 | H120: (if((ROUND(RC[-1],2) = 0),0,((100 * ROUND(RC[-2],2)) / ROUND(RC[-1],2))))/100.0 -> 0.625 | I120: SUM(R[-11]C:R[-1]C) -> 24.0 | J120: 40.0 | K120: (if((ROUND(RC[-1],2) = 0),0,((100 * ROUND(RC[-2],2)) / ROUND(RC[-1],2))))/100.0 -> 0.6 | L120: SUM(R[-11]C:R[-1]C) -> 8.0 | M120: 40.0 | N120: (if((ROUND(RC[-1],2) = 0),0,((100 * ROUND(RC[-2],2)) / ROUND(RC[-1],2))))/100.0 -> 0.2 | O120: SUM(R[-11]C:R[-1]C) -> 20.0 | P120: 40.0 | Q120: (if((ROUND(RC[-1],2) = 0),0,((100 * ROUND(RC[-2],2)) / ROUND(RC[-1],2))))/100.0 -> 0.5 | R120: SUM(R[-11]C:R[-1]C) -> 12.0 | S120: 40.0 | T120: (if((ROUND(RC[-1],2) = 0),0,((100 * ROUND(RC[-2],2)) / ROUND(RC[-1],2))))/100.0 -> 0.3 | U120: SUM(R[-11]C:R[-1]C) -> 34.0 | V120: 40.0 | W120: (if((ROUND(RC[-1],2) = 0),0,((100 * ROUND(RC[-2],2)) / ROUND(RC[-1],2))))/100.0 -> 0.85 | X120: SUM(R[-11]C:R[-1]C) -> 34.0 | Y120: 40.0 | Z120: (if((ROUND(RC[-1],2) = 0),0,((100 * ROUND(RC[-2],2)) / ROUND(RC[-1],2))))/100.0 -> 0.85 | AA120: SUM(R[-11]C:R[-1]C) -> 24.0 | AB120: 40.0 | AC120: (if((ROUND(RC[-1],2) = 0),0,((100 * ROUND(RC[-2],2)) / ROUND(RC[-1],2))))/100.0 -> 0.6 | AD120: SUM(R[-11]C:R[-1]C) -> 39.2 | AE120: 40.0 | AF120: (if((ROUND(RC[-1],2) = 0),0,((100 * ROUND(RC[-2],2)) / ROUND(RC[-1],2))))/100.0 -> 0.9800000000000001 | AG120: SUM(R[-11]C:R[-1]C) -> 5.0 | AH120: 40.0 | AI120: (if((ROUND(RC[-1],2) = 0),0,((100 * ROUND(RC[-2],2)) / ROUND(RC[-1],2))))/100.0 -> 0.125 | AJ120: SUM(R[-11]C:R[-1]C) -> 13.0 | AK120: 40.0 | AL120: (if((ROUND(RC[-1],2) = 0),0,((100 * ROUND(RC[-2],2)) / ROUND(RC[-1],2))))/100.0 -> 0.325 | AM120: SUM(R[-11]C:R[-1]C) -> 12.0 | AN120: 40.0 | AO120: (if((ROUND(RC[-1],2) = 0),0,((100 * ROUND(RC[-2],2)) / ROUND(RC[-1],2))))/100.0 -> 0.3 | AP120: SUM(R[-11]C:R[-1]C) -> 0.0 | AQ120: 16.0 | AR120: (if((ROUND(RC[-1],2) = 0),0,((100 * ROUND(RC[-2],2)) / ROUND(RC[-1],2))))/100.0 -> 0.0 | AS120: SUM(R[-11]C:R[-1]C) -> 286.2 | AT120: SUM(R[-11]C:R[-1]C) -> 528.0 | AU120: (if((ROUND(RC[-1],2) = 0),0,((100 * ROUND(RC[-2],2)) / ROUND(RC[-1],2))))/100.0 -> 0.5420454545454545
A121: Mike Ferkranus
B122: Cus-01108 Gdw kantoor Buik en Van der Horst B : Proj-01120 Voorwaarden - Buik | D122: 32.0 | E122: (if((ROUND(RC[-1],2) = 0),0,((100 * ROUND(RC[-2],2)) / ROUND(RC[-1],2))))/100.0 -> 0.0 | G122: 40.0 | H122: (if((ROUND(RC[-1],2) = 0),0,((100 * ROUND(RC[-2],2)) / ROUND(RC[-1],2))))/100.0 -> 0.0 | J122: 40.0 | K122: (if((ROUND(RC[-1],2) = 0),0,((100 * ROUND(RC[-2],2)) / ROUND(RC[-1],2))))/100.0 -> 0.0 | M122: 40.0 | N122: (if((ROUND(RC[-1],2) = 0),0,((100 * ROUND(RC[-2],2)) / ROUND(RC[-1],2))))/100.0 -> 0.0 | P122: 40.0 | Q122: (if((ROUND(RC[-1],2) = 0),0,((100 * ROUND(RC[-2],2)) / ROUND(RC[-1],2))))/100.0 -> 0.0 | S122: 40.0 | T122: (if((ROUND(RC[-1],2) = 0),0,((100 * ROUND(RC[-2],2)) / ROUND(RC[-1],2))))/100.0 -> 0.0 | U122: 7.0 | V122: 40.0 | W122: (if((ROUND(RC[-1],2) = 0),0,((100 * ROUND(RC[-2],2)) / ROUND(RC[-1],2))))/100.0 -> 0.175 | Y122: 40.0 | Z122: (if((ROUND(RC[-1],2) = 0),0,((100 * ROUND(RC[-2],2)) / ROUND(RC[-1],2))))/100.0 -> 0.0 | AB122: 40.0 | AC122: (if((ROUND(RC[-1],2) = 0),0,((100 * ROUND(RC[-2],2)) / ROUND(RC[-1],2))))/100.0 -> 0.0 | AE122: 40.0 | AF122: (if((ROUND(RC[-1],2) = 0),0,((100 * ROUND(RC[-2],2)) / ROUND(RC[-1],2))))/100.0 -> 0.0 | AH122: 40.0 | AI122: (if((ROUND(RC[-1],2) = 0),0,((100 * ROUND(RC[-2],2)) / ROUND(RC[-1],2))))/100.0 -> 0.0 | AK122: 40.0 | AL122: (if((ROUND(RC[-1],2) = 0),0,((100 * ROUND(RC[-2],2)) / ROUND(RC[-1],2))))/100.0 -> 0.0 | AN122: 40.0 | AO122: (if((ROUND(RC[-1],2) = 0),0,((100 * ROUND(RC[-2],2)) / ROUND(RC[-1],2))))/100.0 -> 0.0 | AQ122: 16.0 | AR122: (if((ROUND(RC[-1],2) = 0),0,((100 * ROUND(RC[-2],2)) / ROUND(RC[-1],2))))/100.0 -> 0.0 | AS122: SUM(RC[-42],RC[-39],RC[-36],RC[-33],RC[-30],RC[-27],RC[-24],RC[-21],RC[-18],RC[-15],RC[-12],RC[-9],RC[-6],RC[-3]) -> 7.0 | AT122: SUM(RC[-42],RC[-39],RC[-36],RC[-33],RC[-30],RC[-27],RC[-24],RC[-21],RC[-18],RC[-15],RC[-12],RC[-9],RC[-6],RC[-3]) -> 528.0 | AU122: (if((ROUND(RC[-1],2) = 0),0,((100 * ROUND(RC[-2],2)) / ROUND(RC[-1],2))))/100.0 -> 0.013257575757575756
B123: Cus-01129 VD&P B.V. : Proj-01072 Periodieke begeleiding - VD&P | D123: 32.0 | E123: (if((ROUND(RC[-1],2) = 0),0,((100 * ROUND(RC[-2],2)) / ROUND(RC[-1],2))))/100.0 -> 0.0 | G123: 40.0 | H123: (if((ROUND(RC[-1],2) = 0),0,((100 * ROUND(RC[-2],2)) / ROUND(RC[-1],2))))/100.0 -> 0.0 | J123: 40.0 | K123: (if((ROUND(RC[-1],2) = 0),0,((100 * ROUND(RC[-2],2)) / ROUND(RC[-1],2))))/100.0 -> 0.0 | M123: 40.0 | N123: (if((ROUND(RC[-1],2) = 0),0,((100 * ROUND(RC[-2],2)) / ROUND(RC[-1],2))))/100.0 -> 0.0 | P123: 40.0 | Q123: (if((ROUND(RC[-1],2) = 0),0,((100 * ROUND(RC[-2],2)) / ROUND(RC[-1],2))))/100.0 -> 0.0 | S123: 40.0 | T123: (if((ROUND(RC[-1],2) = 0),0,((100 * ROUND(RC[-2],2)) / ROUND(RC[-1],2))))/100.0 -> 0.0 | V123: 40.0 | W123: (if((ROUND(RC[-1],2) = 0),0,((100 * ROUND(RC[-2],2)) / ROUND(RC[-1],2))))/100.0 -> 0.0 | Y123: 40.0 | Z123: (if((ROUND(RC[-1],2) = 0),0,((100 * ROUND(RC[-2],2)) / ROUND(RC[-1],2))))/100.0 -> 0.0 | AA123: 7.0 | AB123: 40.0 | AC123: (if((ROUND(RC[-1],2) = 0),0,((100 * ROUND(RC[-2],2)) / ROUND(RC[-1],2))))/100.0 -> 0.175 | AE123: 40.0 | AF123: (if((ROUND(RC[-1],2) = 0),0,((100 * ROUND(RC[-2],2)) / ROUND(RC[-1],2))))/100.0 -> 0.0 | AH123: 40.0 | AI123: (if((ROUND(RC[-1],2) = 0),0,((100 * ROUND(RC[-2],2)) / ROUND(RC[-1],2))))/100.0 -> 0.0 | AK123: 40.0 | AL123: (if((ROUND(RC[-1],2) = 0),0,((100 * ROUND(RC[-2],2)) / ROUND(RC[-1],2))))/100.0 -> 0.0 | AN123: 40.0 | AO123: (if((ROUND(RC[-1],2) = 0),0,((100 * ROUND(RC[-2],2)) / ROUND(RC[-1],2))))/100.0 -> 0.0 | AQ123: 16.0 | AR123: (if((ROUND(RC[-1],2) = 0),0,((100 * ROUND(RC[-2],2)) / ROUND(RC[-1],2))))/100.0 -> 0.0 | AS123: SUM(RC[-42],RC[-39],RC[-36],RC[-33],RC[-30],RC[-27],RC[-24],RC[-21],RC[-18],RC[-15],RC[-12],RC[-9],RC[-6],RC[-3]) -> 7.0 | AT123: SUM(RC[-42],RC[-39],RC[-36],RC[-33],RC[-30],RC[-27],RC[-24],RC[-21],RC[-18],RC[-15],RC[-12],RC[-9],RC[-6],RC[-3]) -> 528.0 | AU123: (if((ROUND(RC[-1],2) = 0),0,((100 * ROUND(RC[-2],2)) / ROUND(RC[-1],2))))/100.0 -> 0.013257575757575756
B124: Cus-01131 Ultimoo Incasso BV : Proj-00771 Wekelijkse ondersteuning 2025 - Ultimoo | C124: 0.0 | D124: 32.0 | E124: (if((ROUND(RC[-1],2) = 0),0,((100 * ROUND(RC[-2],2)) / ROUND(RC[-1],2))))/100.0 -> 0.0 | F124: 0.0 | G124: 40.0 | H124: (if((ROUND(RC[-1],2) = 0),0,((100 * ROUND(RC[-2],2)) / ROUND(RC[-1],2))))/100.0 -> 0.0 | I124: 0.0 | J124: 40.0 | K124: (if((ROUND(RC[-1],2) = 0),0,((100 * ROUND(RC[-2],2)) / ROUND(RC[-1],2))))/100.0 -> 0.0 | L124: 7.0 | M124: 40.0 | N124: (if((ROUND(RC[-1],2) = 0),0,((100 * ROUND(RC[-2],2)) / ROUND(RC[-1],2))))/100.0 -> 0.175 | O124: 7.0 | P124: 40.0 | Q124: (if((ROUND(RC[-1],2) = 0),0,((100 * ROUND(RC[-2],2)) / ROUND(RC[-1],2))))/100.0 -> 0.175 | R124: 7.0 | S124: 40.0 | T124: (if((ROUND(RC[-1],2) = 0),0,((100 * ROUND(RC[-2],2)) / ROUND(RC[-1],2))))/100.0 -> 0.175 | U124: 7.0 | V124: 40.0 | W124: (if((ROUND(RC[-1],2) = 0),0,((100 * ROUND(RC[-2],2)) / ROUND(RC[-1],2))))/100.0 -> 0.175 | X124: 7.0 | Y124: 40.0 | Z124: (if((ROUND(RC[-1],2) = 0),0,((100 * ROUND(RC[-2],2)) / ROUND(RC[-1],2))))/100.0 -> 0.175 | AA124: 7.0 | AB124: 40.0 | AC124: (if((ROUND(RC[-1],2) = 0),0,((100 * ROUND(RC[-2],2)) / ROUND(RC[-1],2))))/100.0 -> 0.175 | AD124: 7.0 | AE124: 40.0 | AF124: (if((ROUND(RC[-1],2) = 0),0,((100 * ROUND(RC[-2],2)) / ROUND(RC[-1],2))))/100.0 -> 0.175 | AG124: 7.0 | AH124: 40.0 | AI124: (if((ROUND(RC[-1],2) = 0),0,((100 * ROUND(RC[-2],2)) / ROUND(RC[-1],2))))/100.0 -> 0.175 | AJ124: 7.0 | AK124: 40.0 | AL124: (if((ROUND(RC[-1],2) = 0),0,((100 * ROUND(RC[-2],2)) / ROUND(RC[-1],2))))/100.0 -> 0.175 | AM124: 7.0 | AN124: 40.0 | AO124: (if((ROUND(RC[-1],2) = 0),0,((100 * ROUND(RC[-2],2)) / ROUND(RC[-1],2))))/100.0 -> 0.175 | AP124: 0.0 | AQ124: 16.0 | AR124: (if((ROUND(RC[-1],2) = 0),0,((100 * ROUND(RC[-2],2)) / ROUND(RC[-1],2))))/100.0 -> 0.0 | AS124: SUM(RC[-42],RC[-39],RC[-36],RC[-33],RC[-30],RC[-27],RC[-24],RC[-21],RC[-18],RC[-15],RC[-12],RC[-9],RC[-6],RC[-3]) -> 70.0 | AT124: SUM(RC[-42],RC[-39],RC[-36],RC[-33],RC[-30],RC[-27],RC[-24],RC[-21],RC[-18],RC[-15],RC[-12],RC[-9],RC[-6],RC[-3]) -> 528.0 | AU124: (if((ROUND(RC[-1],2) = 0),0,((100 * ROUND(RC[-2],2)) / ROUND(RC[-1],2))))/100.0 -> 0.13257575757575757
B125: Cus-01159 Vesting Finance : Proj-00772 Applicatiebeheer 2025 - VF | D125: 32.0 | E125: (if((ROUND(RC[-1],2) = 0),0,((100 * ROUND(RC[-2],2)) / ROUND(RC[-1],2))))/100.0 -> 0.0 | G125: 40.0 | H125: (if((ROUND(RC[-1],2) = 0),0,((100 * ROUND(RC[-2],2)) / ROUND(RC[-1],2))))/100.0 -> 0.0 | J125: 40.0 | K125: (if((ROUND(RC[-1],2) = 0),0,((100 * ROUND(RC[-2],2)) / ROUND(RC[-1],2))))/100.0 -> 0.0 | M125: 40.0 | N125: (if((ROUND(RC[-1],2) = 0),0,((100 * ROUND(RC[-2],2)) / ROUND(RC[-1],2))))/100.0 -> 0.0 | P125: 40.0 | Q125: (if((ROUND(RC[-1],2) = 0),0,((100 * ROUND(RC[-2],2)) / ROUND(RC[-1],2))))/100.0 -> 0.0 | R125: 4.0 | S125: 40.0 | T125: (if((ROUND(RC[-1],2) = 0),0,((100 * ROUND(RC[-2],2)) / ROUND(RC[-1],2))))/100.0 -> 0.1 | V125: 40.0 | W125: (if((ROUND(RC[-1],2) = 0),0,((100 * ROUND(RC[-2],2)) / ROUND(RC[-1],2))))/100.0 -> 0.0 | X125: 4.0 | Y125: 40.0 | Z125: (if((ROUND(RC[-1],2) = 0),0,((100 * ROUND(RC[-2],2)) / ROUND(RC[-1],2))))/100.0 -> 0.1 | AA125: 4.0 | AB125: 40.0 | AC125: (if((ROUND(RC[-1],2) = 0),0,((100 * ROUND(RC[-2],2)) / ROUND(RC[-1],2))))/100.0 -> 0.1 | AD125: 4.0 | AE125: 40.0 | AF125: (if((ROUND(RC[-1],2) = 0),0,((100 * ROUND(RC[-2],2)) / ROUND(RC[-1],2))))/100.0 -> 0.1 | AG125: 4.0 | AH125: 40.0 | AI125: (if((ROUND(RC[-1],2) = 0),0,((100 * ROUND(RC[-2],2)) / ROUND(RC[-1],2))))/100.0 -> 0.1 | AJ125: 4.0 | AK125: 40.0 | AL125: (if((ROUND(RC[-1],2) = 0),0,((100 * ROUND(RC[-2],2)) / ROUND(RC[-1],2))))/100.0 -> 0.1 | AM125: 4.0 | AN125: 40.0 | AO125: (if((ROUND(RC[-1],2) = 0),0,((100 * ROUND(RC[-2],2)) / ROUND(RC[-1],2))))/100.0 -> 0.1 | AP125: 4.0 | AQ125: 16.0 | AR125: (if((ROUND(RC[-1],2) = 0),0,((100 * ROUND(RC[-2],2)) / ROUND(RC[-1],2))))/100.0 -> 0.25 | AS125: SUM(RC[-42],RC[-39],RC[-36],RC[-33],RC[-30],RC[-27],RC[-24],RC[-21],RC[-18],RC[-15],RC[-12],RC[-9],RC[-6],RC[-3]) -> 32.0 | AT125: SUM(RC[-42],RC[-39],RC[-36],RC[-33],RC[-30],RC[-27],RC[-24],RC[-21],RC[-18],RC[-15],RC[-12],RC[-9],RC[-6],RC[-3]) -> 528.0 | AU125: (if((ROUND(RC[-1],2) = 0),0,((100 * ROUND(RC[-2],2)) / ROUND(RC[-1],2))))/100.0 -> 0.06060606060606061
B126: Cus-01163 Aryza B.V. : Proj-00976 Interne uren 2025 | D126: 32.0 | E126: (if((ROUND(RC[-1],2) = 0),0,((100 * ROUND(RC[-2],2)) / ROUND(RC[-1],2))))/100.0 -> 0.0 | G126: 40.0 | H126: (if((ROUND(RC[-1],2) = 0),0,((100 * ROUND(RC[-2],2)) / ROUND(RC[-1],2))))/100.0 -> 0.0 | J126: 40.0 | K126: (if((ROUND(RC[-1],2) = 0),0,((100 * ROUND(RC[-2],2)) / ROUND(RC[-1],2))))/100.0 -> 0.0 | L126: 5.0 | M126: 40.0 | N126: (if((ROUND(RC[-1],2) = 0),0,((100 * ROUND(RC[-2],2)) / ROUND(RC[-1],2))))/100.0 -> 0.125 | O126: 11.0 | P126: 40.0 | Q126: (if((ROUND(RC[-1],2) = 0),0,((100 * ROUND(RC[-2],2)) / ROUND(RC[-1],2))))/100.0 -> 0.275 | R126: 4.0 | S126: 40.0 | T126: (if((ROUND(RC[-1],2) = 0),0,((100 * ROUND(RC[-2],2)) / ROUND(RC[-1],2))))/100.0 -> 0.1 | U126: 19.0 | V126: 40.0 | W126: (if((ROUND(RC[-1],2) = 0),0,((100 * ROUND(RC[-2],2)) / ROUND(RC[-1],2))))/100.0 -> 0.475 | X126: 4.0 | Y126: 40.0 | Z126: (if((ROUND(RC[-1],2) = 0),0,((100 * ROUND(RC[-2],2)) / ROUND(RC[-1],2))))/100.0 -> 0.1 | AA126: 2.0 | AB126: 40.0 | AC126: (if((ROUND(RC[-1],2) = 0),0,((100 * ROUND(RC[-2],2)) / ROUND(RC[-1],2))))/100.0 -> 0.05 | AD126: 4.0 | AE126: 40.0 | AF126: (if((ROUND(RC[-1],2) = 0),0,((100 * ROUND(RC[-2],2)) / ROUND(RC[-1],2))))/100.0 -> 0.1 | AG126: 2.0 | AH126: 40.0 | AI126: (if((ROUND(RC[-1],2) = 0),0,((100 * ROUND(RC[-2],2)) / ROUND(RC[-1],2))))/100.0 -> 0.05 | AJ126: 3.0 | AK126: 40.0 | AL126: (if((ROUND(RC[-1],2) = 0),0,((100 * ROUND(RC[-2],2)) / ROUND(RC[-1],2))))/100.0 -> 0.075 | AM126: 3.0 | AN126: 40.0 | AO126: (if((ROUND(RC[-1],2) = 0),0,((100 * ROUND(RC[-2],2)) / ROUND(RC[-1],2))))/100.0 -> 0.075 | AP126: 1.0 | AQ126: 16.0 | AR126: (if((ROUND(RC[-1],2) = 0),0,((100 * ROUND(RC[-2],2)) / ROUND(RC[-1],2))))/100.0 -> 0.0625 | AS126: SUM(RC[-42],RC[-39],RC[-36],RC[-33],RC[-30],RC[-27],RC[-24],RC[-21],RC[-18],RC[-15],RC[-12],RC[-9],RC[-6],RC[-3]) -> 58.0 | AT126: SUM(RC[-42],RC[-39],RC[-36],RC[-33],RC[-30],RC[-27],RC[-24],RC[-21],RC[-18],RC[-15],RC[-12],RC[-9],RC[-6],RC[-3]) -> 528.0 | AU126: (if((ROUND(RC[-1],2) = 0),0,((100 * ROUND(RC[-2],2)) / ROUND(RC[-1],2))))/100.0 -> 0.10984848484848485
B127: Cus-01202 Syntrus Achmea Hypotheekdiensten B.V. : Proj-00901 Strippenkaart Syntrus 2025 | D127: 32.0 | E127: (if((ROUND(RC[-1],2) = 0),0,((100 * ROUND(RC[-2],2)) / ROUND(RC[-1],2))))/100.0 -> 0.0 | G127: 40.0 | H127: (if((ROUND(RC[-1],2) = 0),0,((100 * ROUND(RC[-2],2)) / ROUND(RC[-1],2))))/100.0 -> 0.0 | J127: 40.0 | K127: (if((ROUND(RC[-1],2) = 0),0,((100 * ROUND(RC[-2],2)) / ROUND(RC[-1],2))))/100.0 -> 0.0 | M127: 40.0 | N127: (if((ROUND(RC[-1],2) = 0),0,((100 * ROUND(RC[-2],2)) / ROUND(RC[-1],2))))/100.0 -> 0.0 | O127: 8.0 | P127: 40.0 | Q127: (if((ROUND(RC[-1],2) = 0),0,((100 * ROUND(RC[-2],2)) / ROUND(RC[-1],2))))/100.0 -> 0.2 | R127: 4.0 | S127: 40.0 | T127: (if((ROUND(RC[-1],2) = 0),0,((100 * ROUND(RC[-2],2)) / ROUND(RC[-1],2))))/100.0 -> 0.1 | V127: 40.0 | W127: (if((ROUND(RC[-1],2) = 0),0,((100 * ROUND(RC[-2],2)) / ROUND(RC[-1],2))))/100.0 -> 0.0 | Y127: 40.0 | Z127: (if((ROUND(RC[-1],2) = 0),0,((100 * ROUND(RC[-2],2)) / ROUND(RC[-1],2))))/100.0 -> 0.0 | AB127: 40.0 | AC127: (if((ROUND(RC[-1],2) = 0),0,((100 * ROUND(RC[-2],2)) / ROUND(RC[-1],2))))/100.0 -> 0.0 | AE127: 40.0 | AF127: (if((ROUND(RC[-1],2) = 0),0,((100 * ROUND(RC[-2],2)) / ROUND(RC[-1],2))))/100.0 -> 0.0 | AH127: 40.0 | AI127: (if((ROUND(RC[-1],2) = 0),0,((100 * ROUND(RC[-2],2)) / ROUND(RC[-1],2))))/100.0 -> 0.0 | AK127: 40.0 | AL127: (if((ROUND(RC[-1],2) = 0),0,((100 * ROUND(RC[-2],2)) / ROUND(RC[-1],2))))/100.0 -> 0.0 | AN127: 40.0 | AO127: (if((ROUND(RC[-1],2) = 0),0,((100 * ROUND(RC[-2],2)) / ROUND(RC[-1],2))))/100.0 -> 0.0 | AQ127: 16.0 | AR127: (if((ROUND(RC[-1],2) = 0),0,((100 * ROUND(RC[-2],2)) / ROUND(RC[-1],2))))/100.0 -> 0.0 | AS127: SUM(RC[-42],RC[-39],RC[-36],RC[-33],RC[-30],RC[-27],RC[-24],RC[-21],RC[-18],RC[-15],RC[-12],RC[-9],RC[-6],RC[-3]) -> 12.0 | AT127: SUM(RC[-42],RC[-39],RC[-36],RC[-33],RC[-30],RC[-27],RC[-24],RC[-21],RC[-18],RC[-15],RC[-12],RC[-9],RC[-6],RC[-3]) -> 528.0 | AU127: (if((ROUND(RC[-1],2) = 0),0,((100 * ROUND(RC[-2],2)) / ROUND(RC[-1],2))))/100.0 -> 0.022727272727272728
B128: Cus-01213 AGIN Timmermans B.V. : Proj-01073 Periodieke begeleiding - Timmermans | C128: 0.0 | D128: 32.0 | E128: (if((ROUND(RC[-1],2) = 0),0,((100 * ROUND(RC[-2],2)) / ROUND(RC[-1],2))))/100.0 -> 0.0 | F128: 0.0 | G128: 40.0 | H128: (if((ROUND(RC[-1],2) = 0),0,((100 * ROUND(RC[-2],2)) / ROUND(RC[-1],2))))/100.0 -> 0.0 | I128: 0.0 | J128: 40.0 | K128: (if((ROUND(RC[-1],2) = 0),0,((100 * ROUND(RC[-2],2)) / ROUND(RC[-1],2))))/100.0 -> 0.0 | L128: 7.0 | M128: 40.0 | N128: (if((ROUND(RC[-1],2) = 0),0,((100 * ROUND(RC[-2],2)) / ROUND(RC[-1],2))))/100.0 -> 0.175 | O128: 0.0 | P128: 40.0 | Q128: (if((ROUND(RC[-1],2) = 0),0,((100 * ROUND(RC[-2],2)) / ROUND(RC[-1],2))))/100.0 -> 0.0 | R128: 7.0 | S128: 40.0 | T128: (if((ROUND(RC[-1],2) = 0),0,((100 * ROUND(RC[-2],2)) / ROUND(RC[-1],2))))/100.0 -> 0.175 | U128: 0.0 | V128: 40.0 | W128: (if((ROUND(RC[-1],2) = 0),0,((100 * ROUND(RC[-2],2)) / ROUND(RC[-1],2))))/100.0 -> 0.0 | X128: 7.0 | Y128: 40.0 | Z128: (if((ROUND(RC[-1],2) = 0),0,((100 * ROUND(RC[-2],2)) / ROUND(RC[-1],2))))/100.0 -> 0.175 | AA128: 0.0 | AB128: 40.0 | AC128: (if((ROUND(RC[-1],2) = 0),0,((100 * ROUND(RC[-2],2)) / ROUND(RC[-1],2))))/100.0 -> 0.0 | AD128: 7.0 | AE128: 40.0 | AF128: (if((ROUND(RC[-1],2) = 0),0,((100 * ROUND(RC[-2],2)) / ROUND(RC[-1],2))))/100.0 -> 0.175 | AG128: 0.0 | AH128: 40.0 | AI128: (if((ROUND(RC[-1],2) = 0),0,((100 * ROUND(RC[-2],2)) / ROUND(RC[-1],2))))/100.0 -> 0.0 | AJ128: 7.0 | AK128: 40.0 | AL128: (if((ROUND(RC[-1],2) = 0),0,((100 * ROUND(RC[-2],2)) / ROUND(RC[-1],2))))/100.0 -> 0.175 | AM128: 0.0 | AN128: 40.0 | AO128: (if((ROUND(RC[-1],2) = 0),0,((100 * ROUND(RC[-2],2)) / ROUND(RC[-1],2))))/100.0 -> 0.0 | AP128: 7.0 | AQ128: 16.0 | AR128: (if((ROUND(RC[-1],2) = 0),0,((100 * ROUND(RC[-2],2)) / ROUND(RC[-1],2))))/100.0 -> 0.4375 | AS128: SUM(RC[-42],RC[-39],RC[-36],RC[-33],RC[-30],RC[-27],RC[-24],RC[-21],RC[-18],RC[-15],RC[-12],RC[-9],RC[-6],RC[-3]) -> 42.0 | AT128: SUM(RC[-42],RC[-39],RC[-36],RC[-33],RC[-30],RC[-27],RC[-24],RC[-21],RC[-18],RC[-15],RC[-12],RC[-9],RC[-6],RC[-3]) -> 528.0 | AU128: (if((ROUND(RC[-1],2) = 0),0,((100 * ROUND(RC[-2],2)) / ROUND(RC[-1],2))))/100.0 -> 0.07954545454545454
B129: Cus-01231 Gdw kantoor De Best & Partners : Proj-01074 Periodieke begeleiding - De Best | D129: 32.0 | E129: (if((ROUND(RC[-1],2) = 0),0,((100 * ROUND(RC[-2],2)) / ROUND(RC[-1],2))))/100.0 -> 0.0 | G129: 40.0 | H129: (if((ROUND(RC[-1],2) = 0),0,((100 * ROUND(RC[-2],2)) / ROUND(RC[-1],2))))/100.0 -> 0.0 | J129: 40.0 | K129: (if((ROUND(RC[-1],2) = 0),0,((100 * ROUND(RC[-2],2)) / ROUND(RC[-1],2))))/100.0 -> 0.0 | M129: 40.0 | N129: (if((ROUND(RC[-1],2) = 0),0,((100 * ROUND(RC[-2],2)) / ROUND(RC[-1],2))))/100.0 -> 0.0 | P129: 40.0 | Q129: (if((ROUND(RC[-1],2) = 0),0,((100 * ROUND(RC[-2],2)) / ROUND(RC[-1],2))))/100.0 -> 0.0 | R129: 7.0 | S129: 40.0 | T129: (if((ROUND(RC[-1],2) = 0),0,((100 * ROUND(RC[-2],2)) / ROUND(RC[-1],2))))/100.0 -> 0.175 | V129: 40.0 | W129: (if((ROUND(RC[-1],2) = 0),0,((100 * ROUND(RC[-2],2)) / ROUND(RC[-1],2))))/100.0 -> 0.0 | Y129: 40.0 | Z129: (if((ROUND(RC[-1],2) = 0),0,((100 * ROUND(RC[-2],2)) / ROUND(RC[-1],2))))/100.0 -> 0.0 | AB129: 40.0 | AC129: (if((ROUND(RC[-1],2) = 0),0,((100 * ROUND(RC[-2],2)) / ROUND(RC[-1],2))))/100.0 -> 0.0 | AE129: 40.0 | AF129: (if((ROUND(RC[-1],2) = 0),0,((100 * ROUND(RC[-2],2)) / ROUND(RC[-1],2))))/100.0 -> 0.0 | AH129: 40.0 | AI129: (if((ROUND(RC[-1],2) = 0),0,((100 * ROUND(RC[-2],2)) / ROUND(RC[-1],2))))/100.0 -> 0.0 | AJ129: 7.0 | AK129: 40.0 | AL129: (if((ROUND(RC[-1],2) = 0),0,((100 * ROUND(RC[-2],2)) / ROUND(RC[-1],2))))/100.0 -> 0.175 | AN129: 40.0 | AO129: (if((ROUND(RC[-1],2) = 0),0,((100 * ROUND(RC[-2],2)) / ROUND(RC[-1],2))))/100.0 -> 0.0 | AQ129: 16.0 | AR129: (if((ROUND(RC[-1],2) = 0),0,((100 * ROUND(RC[-2],2)) / ROUND(RC[-1],2))))/100.0 -> 0.0 | AS129: SUM(RC[-42],RC[-39],RC[-36],RC[-33],RC[-30],RC[-27],RC[-24],RC[-21],RC[-18],RC[-15],RC[-12],RC[-9],RC[-6],RC[-3]) -> 14.0 | AT129: SUM(RC[-42],RC[-39],RC[-36],RC[-33],RC[-30],RC[-27],RC[-24],RC[-21],RC[-18],RC[-15],RC[-12],RC[-9],RC[-6],RC[-3]) -> 528.0 | AU129: (if((ROUND(RC[-1],2) = 0),0,((100 * ROUND(RC[-2],2)) / ROUND(RC[-1],2))))/100.0 -> 0.026515151515151512
B130: Cus-01735 Zuyd Groep : Proj-00790 Strippenkaart 100 uur (3) - Zuyd Groep | C130: 0.0 | D130: 32.0 | E130: (if((ROUND(RC[-1],2) = 0),0,((100 * ROUND(RC[-2],2)) / ROUND(RC[-1],2))))/100.0 -> 0.0 | F130: 0.0 | G130: 40.0 | H130: (if((ROUND(RC[-1],2) = 0),0,((100 * ROUND(RC[-2],2)) / ROUND(RC[-1],2))))/100.0 -> 0.0 | J130: 40.0 | K130: (if((ROUND(RC[-1],2) = 0),0,((100 * ROUND(RC[-2],2)) / ROUND(RC[-1],2))))/100.0 -> 0.0 | L130: 7.0 | M130: 40.0 | N130: (if((ROUND(RC[-1],2) = 0),0,((100 * ROUND(RC[-2],2)) / ROUND(RC[-1],2))))/100.0 -> 0.175 | P130: 40.0 | Q130: (if((ROUND(RC[-1],2) = 0),0,((100 * ROUND(RC[-2],2)) / ROUND(RC[-1],2))))/100.0 -> 0.0 | S130: 40.0 | T130: (if((ROUND(RC[-1],2) = 0),0,((100 * ROUND(RC[-2],2)) / ROUND(RC[-1],2))))/100.0 -> 0.0 | V130: 40.0 | W130: (if((ROUND(RC[-1],2) = 0),0,((100 * ROUND(RC[-2],2)) / ROUND(RC[-1],2))))/100.0 -> 0.0 | X130: 7.0 | Y130: 40.0 | Z130: (if((ROUND(RC[-1],2) = 0),0,((100 * ROUND(RC[-2],2)) / ROUND(RC[-1],2))))/100.0 -> 0.175 | AB130: 40.0 | AC130: (if((ROUND(RC[-1],2) = 0),0,((100 * ROUND(RC[-2],2)) / ROUND(RC[-1],2))))/100.0 -> 0.0 | AE130: 40.0 | AF130: (if((ROUND(RC[-1],2) = 0),0,((100 * ROUND(RC[-2],2)) / ROUND(RC[-1],2))))/100.0 -> 0.0 | AH130: 40.0 | AI130: (if((ROUND(RC[-1],2) = 0),0,((100 * ROUND(RC[-2],2)) / ROUND(RC[-1],2))))/100.0 -> 0.0 | AK130: 40.0 | AL130: (if((ROUND(RC[-1],2) = 0),0,((100 * ROUND(RC[-2],2)) / ROUND(RC[-1],2))))/100.0 -> 0.0 | AM130: 7.0 | AN130: 40.0 | AO130: (if((ROUND(RC[-1],2) = 0),0,((100 * ROUND(RC[-2],2)) / ROUND(RC[-1],2))))/100.0 -> 0.175 | AQ130: 16.0 | AR130: (if((ROUND(RC[-1],2) = 0),0,((100 * ROUND(RC[-2],2)) / ROUND(RC[-1],2))))/100.0 -> 0.0 | AS130: SUM(RC[-42],RC[-39],RC[-36],RC[-33],RC[-30],RC[-27],RC[-24],RC[-21],RC[-18],RC[-15],RC[-12],RC[-9],RC[-6],RC[-3]) -> 21.0 | AT130: SUM(RC[-42],RC[-39],RC[-36],RC[-33],RC[-30],RC[-27],RC[-24],RC[-21],RC[-18],RC[-15],RC[-12],RC[-9],RC[-6],RC[-3]) -> 528.0 | AU130: (if((ROUND(RC[-1],2) = 0),0,((100 * ROUND(RC[-2],2)) / ROUND(RC[-1],2))))/100.0 -> 0.03977272727272727
B131: Cus-01846 Plaggemars Incasso : Proj-00788 Strippenkaart 400 uur (2) - Plaggemars | D131: 32.0 | E131: (if((ROUND(RC[-1],2) = 0),0,((100 * ROUND(RC[-2],2)) / ROUND(RC[-1],2))))/100.0 -> 0.0 | G131: 40.0 | H131: (if((ROUND(RC[-1],2) = 0),0,((100 * ROUND(RC[-2],2)) / ROUND(RC[-1],2))))/100.0 -> 0.0 | J131: 40.0 | K131: (if((ROUND(RC[-1],2) = 0),0,((100 * ROUND(RC[-2],2)) / ROUND(RC[-1],2))))/100.0 -> 0.0 | M131: 40.0 | N131: (if((ROUND(RC[-1],2) = 0),0,((100 * ROUND(RC[-2],2)) / ROUND(RC[-1],2))))/100.0 -> 0.0 | O131: 7.0 | P131: 40.0 | Q131: (if((ROUND(RC[-1],2) = 0),0,((100 * ROUND(RC[-2],2)) / ROUND(RC[-1],2))))/100.0 -> 0.175 | S131: 40.0 | T131: (if((ROUND(RC[-1],2) = 0),0,((100 * ROUND(RC[-2],2)) / ROUND(RC[-1],2))))/100.0 -> 0.0 | V131: 40.0 | W131: (if((ROUND(RC[-1],2) = 0),0,((100 * ROUND(RC[-2],2)) / ROUND(RC[-1],2))))/100.0 -> 0.0 | Y131: 40.0 | Z131: (if((ROUND(RC[-1],2) = 0),0,((100 * ROUND(RC[-2],2)) / ROUND(RC[-1],2))))/100.0 -> 0.0 | AB131: 40.0 | AC131: (if((ROUND(RC[-1],2) = 0),0,((100 * ROUND(RC[-2],2)) / ROUND(RC[-1],2))))/100.0 -> 0.0 | AE131: 40.0 | AF131: (if((ROUND(RC[-1],2) = 0),0,((100 * ROUND(RC[-2],2)) / ROUND(RC[-1],2))))/100.0 -> 0.0 | AG131: 7.0 | AH131: 40.0 | AI131: (if((ROUND(RC[-1],2) = 0),0,((100 * ROUND(RC[-2],2)) / ROUND(RC[-1],2))))/100.0 -> 0.175 | AK131: 40.0 | AL131: (if((ROUND(RC[-1],2) = 0),0,((100 * ROUND(RC[-2],2)) / ROUND(RC[-1],2))))/100.0 -> 0.0 | AN131: 40.0 | AO131: (if((ROUND(RC[-1],2) = 0),0,((100 * ROUND(RC[-2],2)) / ROUND(RC[-1],2))))/100.0 -> 0.0 | AQ131: 16.0 | AR131: (if((ROUND(RC[-1],2) = 0),0,((100 * ROUND(RC[-2],2)) / ROUND(RC[-1],2))))/100.0 -> 0.0 | AS131: SUM(RC[-42],RC[-39],RC[-36],RC[-33],RC[-30],RC[-27],RC[-24],RC[-21],RC[-18],RC[-15],RC[-12],RC[-9],RC[-6],RC[-3]) -> 14.0 | AT131: SUM(RC[-42],RC[-39],RC[-36],RC[-33],RC[-30],RC[-27],RC[-24],RC[-21],RC[-18],RC[-15],RC[-12],RC[-9],RC[-6],RC[-3]) -> 528.0 | AU131: (if((ROUND(RC[-1],2) = 0),0,((100 * ROUND(RC[-2],2)) / ROUND(RC[-1],2))))/100.0 -> 0.026515151515151512
B132: Cus-02004 Collect Masters B.V. : Proj-01052 Implementatie Navigate - Collect Masters | D132: 32.0 | E132: (if((ROUND(RC[-1],2) = 0),0,((100 * ROUND(RC[-2],2)) / ROUND(RC[-1],2))))/100.0 -> 0.0 | G132: 40.0 | H132: (if((ROUND(RC[-1],2) = 0),0,((100 * ROUND(RC[-2],2)) / ROUND(RC[-1],2))))/100.0 -> 0.0 | J132: 40.0 | K132: (if((ROUND(RC[-1],2) = 0),0,((100 * ROUND(RC[-2],2)) / ROUND(RC[-1],2))))/100.0 -> 0.0 | L132: 7.0 | M132: 40.0 | N132: (if((ROUND(RC[-1],2) = 0),0,((100 * ROUND(RC[-2],2)) / ROUND(RC[-1],2))))/100.0 -> 0.175 | O132: 7.0 | P132: 40.0 | Q132: (if((ROUND(RC[-1],2) = 0),0,((100 * ROUND(RC[-2],2)) / ROUND(RC[-1],2))))/100.0 -> 0.175 | R132: 7.0 | S132: 40.0 | T132: (if((ROUND(RC[-1],2) = 0),0,((100 * ROUND(RC[-2],2)) / ROUND(RC[-1],2))))/100.0 -> 0.175 | U132: 7.0 | V132: 40.0 | W132: (if((ROUND(RC[-1],2) = 0),0,((100 * ROUND(RC[-2],2)) / ROUND(RC[-1],2))))/100.0 -> 0.175 | Y132: 40.0 | Z132: (if((ROUND(RC[-1],2) = 0),0,((100 * ROUND(RC[-2],2)) / ROUND(RC[-1],2))))/100.0 -> 0.0 | AB132: 40.0 | AC132: (if((ROUND(RC[-1],2) = 0),0,((100 * ROUND(RC[-2],2)) / ROUND(RC[-1],2))))/100.0 -> 0.0 | AD132: 14.0 | AE132: 40.0 | AF132: (if((ROUND(RC[-1],2) = 0),0,((100 * ROUND(RC[-2],2)) / ROUND(RC[-1],2))))/100.0 -> 0.35 | AH132: 40.0 | AI132: (if((ROUND(RC[-1],2) = 0),0,((100 * ROUND(RC[-2],2)) / ROUND(RC[-1],2))))/100.0 -> 0.0 | AK132: 40.0 | AL132: (if((ROUND(RC[-1],2) = 0),0,((100 * ROUND(RC[-2],2)) / ROUND(RC[-1],2))))/100.0 -> 0.0 | AN132: 40.0 | AO132: (if((ROUND(RC[-1],2) = 0),0,((100 * ROUND(RC[-2],2)) / ROUND(RC[-1],2))))/100.0 -> 0.0 | AQ132: 16.0 | AR132: (if((ROUND(RC[-1],2) = 0),0,((100 * ROUND(RC[-2],2)) / ROUND(RC[-1],2))))/100.0 -> 0.0 | AS132: SUM(RC[-42],RC[-39],RC[-36],RC[-33],RC[-30],RC[-27],RC[-24],RC[-21],RC[-18],RC[-15],RC[-12],RC[-9],RC[-6],RC[-3]) -> 42.0 | AT132: SUM(RC[-42],RC[-39],RC[-36],RC[-33],RC[-30],RC[-27],RC[-24],RC[-21],RC[-18],RC[-15],RC[-12],RC[-9],RC[-6],RC[-3]) -> 528.0 | AU132: (if((ROUND(RC[-1],2) = 0),0,((100 * ROUND(RC[-2],2)) / ROUND(RC[-1],2))))/100.0 -> 0.07954545454545454
B133: Cus-02250 Smal Otte advocaten en mediators : Proj-01099 Inrichting Navigate - Smal Otte | C133: 0.0 | D133: 32.0 | E133: (if((ROUND(RC[-1],2) = 0),0,((100 * ROUND(RC[-2],2)) / ROUND(RC[-1],2))))/100.0 -> 0.0 | F133: 0.0 | G133: 40.0 | H133: (if((ROUND(RC[-1],2) = 0),0,((100 * ROUND(RC[-2],2)) / ROUND(RC[-1],2))))/100.0 -> 0.0 | I133: 0.0 | J133: 40.0 | K133: (if((ROUND(RC[-1],2) = 0),0,((100 * ROUND(RC[-2],2)) / ROUND(RC[-1],2))))/100.0 -> 0.0 | L133: 7.0 | M133: 40.0 | N133: (if((ROUND(RC[-1],2) = 0),0,((100 * ROUND(RC[-2],2)) / ROUND(RC[-1],2))))/100.0 -> 0.175 | O133: 0.0 | P133: 40.0 | Q133: (if((ROUND(RC[-1],2) = 0),0,((100 * ROUND(RC[-2],2)) / ROUND(RC[-1],2))))/100.0 -> 0.0 | R133: 0.0 | S133: 40.0 | T133: (if((ROUND(RC[-1],2) = 0),0,((100 * ROUND(RC[-2],2)) / ROUND(RC[-1],2))))/100.0 -> 0.0 | U133: 0.0 | V133: 40.0 | W133: (if((ROUND(RC[-1],2) = 0),0,((100 * ROUND(RC[-2],2)) / ROUND(RC[-1],2))))/100.0 -> 0.0 | X133: 7.0 | Y133: 40.0 | Z133: (if((ROUND(RC[-1],2) = 0),0,((100 * ROUND(RC[-2],2)) / ROUND(RC[-1],2))))/100.0 -> 0.175 | AB133: 40.0 | AC133: (if((ROUND(RC[-1],2) = 0),0,((100 * ROUND(RC[-2],2)) / ROUND(RC[-1],2))))/100.0 -> 0.0 | AE133: 40.0 | AF133: (if((ROUND(RC[-1],2) = 0),0,((100 * ROUND(RC[-2],2)) / ROUND(RC[-1],2))))/100.0 -> 0.0 | AH133: 40.0 | AI133: (if((ROUND(RC[-1],2) = 0),0,((100 * ROUND(RC[-2],2)) / ROUND(RC[-1],2))))/100.0 -> 0.0 | AK133: 40.0 | AL133: (if((ROUND(RC[-1],2) = 0),0,((100 * ROUND(RC[-2],2)) / ROUND(RC[-1],2))))/100.0 -> 0.0 | AM133: 7.0 | AN133: 40.0 | AO133: (if((ROUND(RC[-1],2) = 0),0,((100 * ROUND(RC[-2],2)) / ROUND(RC[-1],2))))/100.0 -> 0.175 | AQ133: 16.0 | AR133: (if((ROUND(RC[-1],2) = 0),0,((100 * ROUND(RC[-2],2)) / ROUND(RC[-1],2))))/100.0 -> 0.0 | AS133: SUM(RC[-42],RC[-39],RC[-36],RC[-33],RC[-30],RC[-27],RC[-24],RC[-21],RC[-18],RC[-15],RC[-12],RC[-9],RC[-6],RC[-3]) -> 21.0 | AT133: SUM(RC[-42],RC[-39],RC[-36],RC[-33],RC[-30],RC[-27],RC[-24],RC[-21],RC[-18],RC[-15],RC[-12],RC[-9],RC[-6],RC[-3]) -> 528.0 | AU133: (if((ROUND(RC[-1],2) = 0),0,((100 * ROUND(RC[-2],2)) / ROUND(RC[-1],2))))/100.0 -> 0.03977272727272727
A134: Total - Mike Ferkranus | C134: SUM(R[-12]C:R[-1]C) -> 0.0 | D134: 32.0 | E134: (if((ROUND(RC[-1],2) = 0),0,((100 * ROUND(RC[-2],2)) / ROUND(RC[-1],2))))/100.0 -> 0.0 | F134: SUM(R[-12]C:R[-1]C) -> 0.0 | G134: 40.0 | H134: (if((ROUND(RC[-1],2) = 0),0,((100 * ROUND(RC[-2],2)) / ROUND(RC[-1],2))))/100.0 -> 0.0 | I134: SUM(R[-12]C:R[-1]C) -> 0.0 | J134: 40.0 | K134: (if((ROUND(RC[-1],2) = 0),0,((100 * ROUND(RC[-2],2)) / ROUND(RC[-1],2))))/100.0 -> 0.0 | L134: SUM(R[-12]C:R[-1]C) -> 40.0 | M134: 40.0 | N134: (if((ROUND(RC[-1],2) = 0),0,((100 * ROUND(RC[-2],2)) / ROUND(RC[-1],2))))/100.0 -> 1.0 | O134: SUM(R[-12]C:R[-1]C) -> 40.0 | P134: 40.0 | Q134: (if((ROUND(RC[-1],2) = 0),0,((100 * ROUND(RC[-2],2)) / ROUND(RC[-1],2))))/100.0 -> 1.0 | R134: SUM(R[-12]C:R[-1]C) -> 40.0 | S134: 40.0 | T134: (if((ROUND(RC[-1],2) = 0),0,((100 * ROUND(RC[-2],2)) / ROUND(RC[-1],2))))/100.0 -> 1.0 | U134: SUM(R[-12]C:R[-1]C) -> 40.0 | V134: 40.0 | W134: (if((ROUND(RC[-1],2) = 0),0,((100 * ROUND(RC[-2],2)) / ROUND(RC[-1],2))))/100.0 -> 1.0 | X134: SUM(R[-12]C:R[-1]C) -> 36.0 | Y134: 40.0 | Z134: (if((ROUND(RC[-1],2) = 0),0,((100 * ROUND(RC[-2],2)) / ROUND(RC[-1],2))))/100.0 -> 0.9 | AA134: SUM(R[-12]C:R[-1]C) -> 20.0 | AB134: 40.0 | AC134: (if((ROUND(RC[-1],2) = 0),0,((100 * ROUND(RC[-2],2)) / ROUND(RC[-1],2))))/100.0 -> 0.5 | AD134: SUM(R[-12]C:R[-1]C) -> 36.0 | AE134: 40.0 | AF134: (if((ROUND(RC[-1],2) = 0),0,((100 * ROUND(RC[-2],2)) / ROUND(RC[-1],2))))/100.0 -> 0.9 | AG134: SUM(R[-12]C:R[-1]C) -> 20.0 | AH134: 40.0 | AI134: (if((ROUND(RC[-1],2) = 0),0,((100 * ROUND(RC[-2],2)) / ROUND(RC[-1],2))))/100.0 -> 0.5 | AJ134: SUM(R[-12]C:R[-1]C) -> 28.0 | AK134: 40.0 | AL134: (if((ROUND(RC[-1],2) = 0),0,((100 * ROUND(RC[-2],2)) / ROUND(RC[-1],2))))/100.0 -> 0.7 | AM134: SUM(R[-12]C:R[-1]C) -> 28.0 | AN134: 40.0 | AO134: (if((ROUND(RC[-1],2) = 0),0,((100 * ROUND(RC[-2],2)) / ROUND(RC[-1],2))))/100.0 -> 0.7 | AP134: SUM(R[-12]C:R[-1]C) -> 12.0 | AQ134: 16.0 | AR134: (if((ROUND(RC[-1],2) = 0),0,((100 * ROUND(RC[-2],2)) / ROUND(RC[-1],2))))/100.0 -> 0.75 | AS134: SUM(R[-12]C:R[-1]C) -> 340.0 | AT134: SUM(R[-12]C:R[-1]C) -> 528.0 | AU134: (if((ROUND(RC[-1],2) = 0),0,((100 * ROUND(RC[-2],2)) / ROUND(RC[-1],2))))/100.0 -> 0.6439393939393939
A135: Mike Testor
B136: Cus-01159 Vesting Finance : Proj-00846 Vesting Finance Maintenance 2025 | D136: 32.0 | E136: (if((ROUND(RC[-1],2) = 0),0,((100 * ROUND(RC[-2],2)) / ROUND(RC[-1],2))))/100.0 -> 0.0 | G136: 40.0 | H136: (if((ROUND(RC[-1],2) = 0),0,((100 * ROUND(RC[-2],2)) / ROUND(RC[-1],2))))/100.0 -> 0.0 | J136: 40.0 | K136: (if((ROUND(RC[-1],2) = 0),0,((100 * ROUND(RC[-2],2)) / ROUND(RC[-1],2))))/100.0 -> 0.0 | L136: 4.0 | M136: 40.0 | N136: (if((ROUND(RC[-1],2) = 0),0,((100 * ROUND(RC[-2],2)) / ROUND(RC[-1],2))))/100.0 -> 0.1 | P136: 40.0 | Q136: (if((ROUND(RC[-1],2) = 0),0,((100 * ROUND(RC[-2],2)) / ROUND(RC[-1],2))))/100.0 -> 0.0 | S136: 40.0 | T136: (if((ROUND(RC[-1],2) = 0),0,((100 * ROUND(RC[-2],2)) / ROUND(RC[-1],2))))/100.0 -> 0.0 | V136: 40.0 | W136: (if((ROUND(RC[-1],2) = 0),0,((100 * ROUND(RC[-2],2)) / ROUND(RC[-1],2))))/100.0 -> 0.0 | Y136: 40.0 | Z136: (if((ROUND(RC[-1],2) = 0),0,((100 * ROUND(RC[-2],2)) / ROUND(RC[-1],2))))/100.0 -> 0.0 | AB136: 40.0 | AC136: (if((ROUND(RC[-1],2) = 0),0,((100 * ROUND(RC[-2],2)) / ROUND(RC[-1],2))))/100.0 -> 0.0 | AE136: 40.0 | AF136: (if((ROUND(RC[-1],2) = 0),0,((100 * ROUND(RC[-2],2)) / ROUND(RC[-1],2))))/100.0 -> 0.0 | AH136: 40.0 | AI136: (if((ROUND(RC[-1],2) = 0),0,((100 * ROUND(RC[-2],2)) / ROUND(RC[-1],2))))/100.0 -> 0.0 | AK136: 40.0 | AL136: (if((ROUND(RC[-1],2) = 0),0,((100 * ROUND(RC[-2],2)) / ROUND(RC[-1],2))))/100.0 -> 0.0 | AN136: 40.0 | AO136: (if((ROUND(RC[-1],2) = 0),0,((100 * ROUND(RC[-2],2)) / ROUND(RC[-1],2))))/100.0 -> 0.0 | AQ136: 16.0 | AR136: (if((ROUND(RC[-1],2) = 0),0,((100 * ROUND(RC[-2],2)) / ROUND(RC[-1],2))))/100.0 -> 0.0 | AS136: SUM(RC[-42],RC[-39],RC[-36],RC[-33],RC[-30],RC[-27],RC[-24],RC[-21],RC[-18],RC[-15],RC[-12],RC[-9],RC[-6],RC[-3]) -> 4.0 | AT136: SUM(RC[-42],RC[-39],RC[-36],RC[-33],RC[-30],RC[-27],RC[-24],RC[-21],RC[-18],RC[-15],RC[-12],RC[-9],RC[-6],RC[-3]) -> 528.0 | AU136: (if((ROUND(RC[-1],2) = 0),0,((100 * ROUND(RC[-2],2)) / ROUND(RC[-1],2))))/100.0 -> 0.007575757575757576
B137: Cus-01163 Aryza B.V. : Proj-00976 Interne uren 2025 | C137: 1.0 | D137: 32.0 | E137: (if((ROUND(RC[-1],2) = 0),0,((100 * ROUND(RC[-2],2)) / ROUND(RC[-1],2))))/100.0 -> 0.03125 | G137: 40.0 | H137: (if((ROUND(RC[-1],2) = 0),0,((100 * ROUND(RC[-2],2)) / ROUND(RC[-1],2))))/100.0 -> 0.0 | J137: 40.0 | K137: (if((ROUND(RC[-1],2) = 0),0,((100 * ROUND(RC[-2],2)) / ROUND(RC[-1],2))))/100.0 -> 0.0 | L137: 1.0 | M137: 40.0 | N137: (if((ROUND(RC[-1],2) = 0),0,((100 * ROUND(RC[-2],2)) / ROUND(RC[-1],2))))/100.0 -> 0.025 | O137: 3.0 | P137: 40.0 | Q137: (if((ROUND(RC[-1],2) = 0),0,((100 * ROUND(RC[-2],2)) / ROUND(RC[-1],2))))/100.0 -> 0.075 | R137: 1.0 | S137: 40.0 | T137: (if((ROUND(RC[-1],2) = 0),0,((100 * ROUND(RC[-2],2)) / ROUND(RC[-1],2))))/100.0 -> 0.025 | U137: 1.0 | V137: 40.0 | W137: (if((ROUND(RC[-1],2) = 0),0,((100 * ROUND(RC[-2],2)) / ROUND(RC[-1],2))))/100.0 -> 0.025 | X137: 1.0 | Y137: 40.0 | Z137: (if((ROUND(RC[-1],2) = 0),0,((100 * ROUND(RC[-2],2)) / ROUND(RC[-1],2))))/100.0 -> 0.025 | AA137: 1.0 | AB137: 40.0 | AC137: (if((ROUND(RC[-1],2) = 0),0,((100 * ROUND(RC[-2],2)) / ROUND(RC[-1],2))))/100.0 -> 0.025 | AD137: 3.0 | AE137: 40.0 | AF137: (if((ROUND(RC[-1],2) = 0),0,((100 * ROUND(RC[-2],2)) / ROUND(RC[-1],2))))/100.0 -> 0.075 | AG137: 1.0 | AH137: 40.0 | AI137: (if((ROUND(RC[-1],2) = 0),0,((100 * ROUND(RC[-2],2)) / ROUND(RC[-1],2))))/100.0 -> 0.025 | AJ137: 1.0 | AK137: 40.0 | AL137: (if((ROUND(RC[-1],2) = 0),0,((100 * ROUND(RC[-2],2)) / ROUND(RC[-1],2))))/100.0 -> 0.025 | AM137: 1.0 | AN137: 40.0 | AO137: (if((ROUND(RC[-1],2) = 0),0,((100 * ROUND(RC[-2],2)) / ROUND(RC[-1],2))))/100.0 -> 0.025 | AP137: 1.2 | AQ137: 16.0 | AR137: (if((ROUND(RC[-1],2) = 0),0,((100 * ROUND(RC[-2],2)) / ROUND(RC[-1],2))))/100.0 -> 0.075 | AS137: SUM(RC[-42],RC[-39],RC[-36],RC[-33],RC[-30],RC[-27],RC[-24],RC[-21],RC[-18],RC[-15],RC[-12],RC[-9],RC[-6],RC[-3]) -> 16.2 | AT137: SUM(RC[-42],RC[-39],RC[-36],RC[-33],RC[-30],RC[-27],RC[-24],RC[-21],RC[-18],RC[-15],RC[-12],RC[-9],RC[-6],RC[-3]) -> 528.0 | AU137: (if((ROUND(RC[-1],2) = 0),0,((100 * ROUND(RC[-2],2)) / ROUND(RC[-1],2))))/100.0 -> 0.030681818181818185
B138: Cus-01163 Aryza B.V. : Proj-01059 Upgrade Framework GRFO | C138: 20.0 | D138: 32.0 | E138: (if((ROUND(RC[-1],2) = 0),0,((100 * ROUND(RC[-2],2)) / ROUND(RC[-1],2))))/100.0 -> 0.625 | G138: 40.0 | H138: (if((ROUND(RC[-1],2) = 0),0,((100 * ROUND(RC[-2],2)) / ROUND(RC[-1],2))))/100.0 -> 0.0 | J138: 40.0 | K138: (if((ROUND(RC[-1],2) = 0),0,((100 * ROUND(RC[-2],2)) / ROUND(RC[-1],2))))/100.0 -> 0.0 | M138: 40.0 | N138: (if((ROUND(RC[-1],2) = 0),0,((100 * ROUND(RC[-2],2)) / ROUND(RC[-1],2))))/100.0 -> 0.0 | P138: 40.0 | Q138: (if((ROUND(RC[-1],2) = 0),0,((100 * ROUND(RC[-2],2)) / ROUND(RC[-1],2))))/100.0 -> 0.0 | S138: 40.0 | T138: (if((ROUND(RC[-1],2) = 0),0,((100 * ROUND(RC[-2],2)) / ROUND(RC[-1],2))))/100.0 -> 0.0 | V138: 40.0 | W138: (if((ROUND(RC[-1],2) = 0),0,((100 * ROUND(RC[-2],2)) / ROUND(RC[-1],2))))/100.0 -> 0.0 | Y138: 40.0 | Z138: (if((ROUND(RC[-1],2) = 0),0,((100 * ROUND(RC[-2],2)) / ROUND(RC[-1],2))))/100.0 -> 0.0 | AB138: 40.0 | AC138: (if((ROUND(RC[-1],2) = 0),0,((100 * ROUND(RC[-2],2)) / ROUND(RC[-1],2))))/100.0 -> 0.0 | AE138: 40.0 | AF138: (if((ROUND(RC[-1],2) = 0),0,((100 * ROUND(RC[-2],2)) / ROUND(RC[-1],2))))/100.0 -> 0.0 | AH138: 40.0 | AI138: (if((ROUND(RC[-1],2) = 0),0,((100 * ROUND(RC[-2],2)) / ROUND(RC[-1],2))))/100.0 -> 0.0 | AK138: 40.0 | AL138: (if((ROUND(RC[-1],2) = 0),0,((100 * ROUND(RC[-2],2)) / ROUND(RC[-1],2))))/100.0 -> 0.0 | AN138: 40.0 | AO138: (if((ROUND(RC[-1],2) = 0),0,((100 * ROUND(RC[-2],2)) / ROUND(RC[-1],2))))/100.0 -> 0.0 | AQ138: 16.0 | AR138: (if((ROUND(RC[-1],2) = 0),0,((100 * ROUND(RC[-2],2)) / ROUND(RC[-1],2))))/100.0 -> 0.0 | AS138: SUM(RC[-42],RC[-39],RC[-36],RC[-33],RC[-30],RC[-27],RC[-24],RC[-21],RC[-18],RC[-15],RC[-12],RC[-9],RC[-6],RC[-3]) -> 20.0 | AT138: SUM(RC[-42],RC[-39],RC[-36],RC[-33],RC[-30],RC[-27],RC[-24],RC[-21],RC[-18],RC[-15],RC[-12],RC[-9],RC[-6],RC[-3]) -> 528.0 | AU138: (if((ROUND(RC[-1],2) = 0),0,((100 * ROUND(RC[-2],2)) / ROUND(RC[-1],2))))/100.0 -> 0.03787878787878788
B139: Cus-01163 Aryza B.V. : Proj-01123 GoPay Email in Bulk | D139: 32.0 | E139: (if((ROUND(RC[-1],2) = 0),0,((100 * ROUND(RC[-2],2)) / ROUND(RC[-1],2))))/100.0 -> 0.0 | G139: 40.0 | H139: (if((ROUND(RC[-1],2) = 0),0,((100 * ROUND(RC[-2],2)) / ROUND(RC[-1],2))))/100.0 -> 0.0 | J139: 40.0 | K139: (if((ROUND(RC[-1],2) = 0),0,((100 * ROUND(RC[-2],2)) / ROUND(RC[-1],2))))/100.0 -> 0.0 | L139: 2.0 | M139: 40.0 | N139: (if((ROUND(RC[-1],2) = 0),0,((100 * ROUND(RC[-2],2)) / ROUND(RC[-1],2))))/100.0 -> 0.05 | O139: 20.0 | P139: 40.0 | Q139: (if((ROUND(RC[-1],2) = 0),0,((100 * ROUND(RC[-2],2)) / ROUND(RC[-1],2))))/100.0 -> 0.5 | R139: 16.0 | S139: 40.0 | T139: (if((ROUND(RC[-1],2) = 0),0,((100 * ROUND(RC[-2],2)) / ROUND(RC[-1],2))))/100.0 -> 0.4 | U139: 4.0 | V139: 40.0 | W139: (if((ROUND(RC[-1],2) = 0),0,((100 * ROUND(RC[-2],2)) / ROUND(RC[-1],2))))/100.0 -> 0.1 | Y139: 40.0 | Z139: (if((ROUND(RC[-1],2) = 0),0,((100 * ROUND(RC[-2],2)) / ROUND(RC[-1],2))))/100.0 -> 0.0 | AB139: 40.0 | AC139: (if((ROUND(RC[-1],2) = 0),0,((100 * ROUND(RC[-2],2)) / ROUND(RC[-1],2))))/100.0 -> 0.0 | AE139: 40.0 | AF139: (if((ROUND(RC[-1],2) = 0),0,((100 * ROUND(RC[-2],2)) / ROUND(RC[-1],2))))/100.0 -> 0.0 | AH139: 40.0 | AI139: (if((ROUND(RC[-1],2) = 0),0,((100 * ROUND(RC[-2],2)) / ROUND(RC[-1],2))))/100.0 -> 0.0 | AK139: 40.0 | AL139: (if((ROUND(RC[-1],2) = 0),0,((100 * ROUND(RC[-2],2)) / ROUND(RC[-1],2))))/100.0 -> 0.0 | AN139: 40.0 | AO139: (if((ROUND(RC[-1],2) = 0),0,((100 * ROUND(RC[-2],2)) / ROUND(RC[-1],2))))/100.0 -> 0.0 | AQ139: 16.0 | AR139: (if((ROUND(RC[-1],2) = 0),0,((100 * ROUND(RC[-2],2)) / ROUND(RC[-1],2))))/100.0 -> 0.0 | AS139: SUM(RC[-42],RC[-39],RC[-36],RC[-33],RC[-30],RC[-27],RC[-24],RC[-21],RC[-18],RC[-15],RC[-12],RC[-9],RC[-6],RC[-3]) -> 42.0 | AT139: SUM(RC[-42],RC[-39],RC[-36],RC[-33],RC[-30],RC[-27],RC[-24],RC[-21],RC[-18],RC[-15],RC[-12],RC[-9],RC[-6],RC[-3]) -> 528.0 | AU139: (if((ROUND(RC[-1],2) = 0),0,((100 * ROUND(RC[-2],2)) / ROUND(RC[-1],2))))/100.0 -> 0.07954545454545454
B140: Cus-01169 Werkgroep CJIB : Proj-01125 CJIB Tol-zaken | D140: 32.0 | E140: (if((ROUND(RC[-1],2) = 0),0,((100 * ROUND(RC[-2],2)) / ROUND(RC[-1],2))))/100.0 -> 0.0 | G140: 40.0 | H140: (if((ROUND(RC[-1],2) = 0),0,((100 * ROUND(RC[-2],2)) / ROUND(RC[-1],2))))/100.0 -> 0.0 | J140: 40.0 | K140: (if((ROUND(RC[-1],2) = 0),0,((100 * ROUND(RC[-2],2)) / ROUND(RC[-1],2))))/100.0 -> 0.0 | L140: 4.0 | M140: 40.0 | N140: (if((ROUND(RC[-1],2) = 0),0,((100 * ROUND(RC[-2],2)) / ROUND(RC[-1],2))))/100.0 -> 0.1 | P140: 40.0 | Q140: (if((ROUND(RC[-1],2) = 0),0,((100 * ROUND(RC[-2],2)) / ROUND(RC[-1],2))))/100.0 -> 0.0 | S140: 40.0 | T140: (if((ROUND(RC[-1],2) = 0),0,((100 * ROUND(RC[-2],2)) / ROUND(RC[-1],2))))/100.0 -> 0.0 | V140: 40.0 | W140: (if((ROUND(RC[-1],2) = 0),0,((100 * ROUND(RC[-2],2)) / ROUND(RC[-1],2))))/100.0 -> 0.0 | Y140: 40.0 | Z140: (if((ROUND(RC[-1],2) = 0),0,((100 * ROUND(RC[-2],2)) / ROUND(RC[-1],2))))/100.0 -> 0.0 | AB140: 40.0 | AC140: (if((ROUND(RC[-1],2) = 0),0,((100 * ROUND(RC[-2],2)) / ROUND(RC[-1],2))))/100.0 -> 0.0 | AE140: 40.0 | AF140: (if((ROUND(RC[-1],2) = 0),0,((100 * ROUND(RC[-2],2)) / ROUND(RC[-1],2))))/100.0 -> 0.0 | AH140: 40.0 | AI140: (if((ROUND(RC[-1],2) = 0),0,((100 * ROUND(RC[-2],2)) / ROUND(RC[-1],2))))/100.0 -> 0.0 | AK140: 40.0 | AL140: (if((ROUND(RC[-1],2) = 0),0,((100 * ROUND(RC[-2],2)) / ROUND(RC[-1],2))))/100.0 -> 0.0 | AN140: 40.0 | AO140: (if((ROUND(RC[-1],2) = 0),0,((100 * ROUND(RC[-2],2)) / ROUND(RC[-1],2))))/100.0 -> 0.0 | AQ140: 16.0 | AR140: (if((ROUND(RC[-1],2) = 0),0,((100 * ROUND(RC[-2],2)) / ROUND(RC[-1],2))))/100.0 -> 0.0 | AS140: SUM(RC[-42],RC[-39],RC[-36],RC[-33],RC[-30],RC[-27],RC[-24],RC[-21],RC[-18],RC[-15],RC[-12],RC[-9],RC[-6],RC[-3]) -> 4.0 | AT140: SUM(RC[-42],RC[-39],RC[-36],RC[-33],RC[-30],RC[-27],RC[-24],RC[-21],RC[-18],RC[-15],RC[-12],RC[-9],RC[-6],RC[-3]) -> 528.0 | AU140: (if((ROUND(RC[-1],2) = 0),0,((100 * ROUND(RC[-2],2)) / ROUND(RC[-1],2))))/100.0 -> 0.007575757575757576
A141: Total - Mike Testor | C141: SUM(R[-5]C:R[-1]C) -> 21.0 | D141: 32.0 | E141: (if((ROUND(RC[-1],2) = 0),0,((100 * ROUND(RC[-2],2)) / ROUND(RC[-1],2))))/100.0 -> 0.65625 | F141: SUM(R[-5]C:R[-1]C) ->  | G141: 40.0 | H141: (if((ROUND(RC[-1],2) = 0),0,((100 * ROUND(RC[-2],2)) / ROUND(RC[-1],2))))/100.0 -> 0.0 | I141: SUM(R[-5]C:R[-1]C) ->  | J141: 40.0 | K141: (if((ROUND(RC[-1],2) = 0),0,((100 * ROUND(RC[-2],2)) / ROUND(RC[-1],2))))/100.0 -> 0.0 | L141: SUM(R[-5]C:R[-1]C) -> 11.0 | M141: 40.0 | N141: (if((ROUND(RC[-1],2) = 0),0,((100 * ROUND(RC[-2],2)) / ROUND(RC[-1],2))))/100.0 -> 0.275 | O141: SUM(R[-5]C:R[-1]C) -> 23.0 | P141: 40.0 | Q141: (if((ROUND(RC[-1],2) = 0),0,((100 * ROUND(RC[-2],2)) / ROUND(RC[-1],2))))/100.0 -> 0.575 | R141: SUM(R[-5]C:R[-1]C) -> 17.0 | S141: 40.0 | T141: (if((ROUND(RC[-1],2) = 0),0,((100 * ROUND(RC[-2],2)) / ROUND(RC[-1],2))))/100.0 -> 0.425 | U141: SUM(R[-5]C:R[-1]C) -> 5.0 | V141: 40.0 | W141: (if((ROUND(RC[-1],2) = 0),0,((100 * ROUND(RC[-2],2)) / ROUND(RC[-1],2))))/100.0 -> 0.125 | X141: SUM(R[-5]C:R[-1]C) -> 1.0 | Y141: 40.0 | Z141: (if((ROUND(RC[-1],2) = 0),0,((100 * ROUND(RC[-2],2)) / ROUND(RC[-1],2))))/100.0 -> 0.025 | AA141: SUM(R[-5]C:R[-1]C) -> 1.0 | AB141: 40.0 | AC141: (if((ROUND(RC[-1],2) = 0),0,((100 * ROUND(RC[-2],2)) / ROUND(RC[-1],2))))/100.0 -> 0.025 | AD141: SUM(R[-5]C:R[-1]C) -> 3.0 | AE141: 40.0 | AF141: (if((ROUND(RC[-1],2) = 0),0,((100 * ROUND(RC[-2],2)) / ROUND(RC[-1],2))))/100.0 -> 0.075 | AG141: SUM(R[-5]C:R[-1]C) -> 1.0 | AH141: 40.0 | AI141: (if((ROUND(RC[-1],2) = 0),0,((100 * ROUND(RC[-2],2)) / ROUND(RC[-1],2))))/100.0 -> 0.025 | AJ141: SUM(R[-5]C:R[-1]C) -> 1.0 | AK141: 40.0 | AL141: (if((ROUND(RC[-1],2) = 0),0,((100 * ROUND(RC[-2],2)) / ROUND(RC[-1],2))))/100.0 -> 0.025 | AM141: SUM(R[-5]C:R[-1]C) -> 1.0 | AN141: 40.0 | AO141: (if((ROUND(RC[-1],2) = 0),0,((100 * ROUND(RC[-2],2)) / ROUND(RC[-1],2))))/100.0 -> 0.025 | AP141: SUM(R[-5]C:R[-1]C) -> 1.2 | AQ141: 16.0 | AR141: (if((ROUND(RC[-1],2) = 0),0,((100 * ROUND(RC[-2],2)) / ROUND(RC[-1],2))))/100.0 -> 0.075 | AS141: SUM(R[-5]C:R[-1]C) -> 86.2 | AT141: SUM(R[-5]C:R[-1]C) -> 528.0 | AU141: (if((ROUND(RC[-1],2) = 0),0,((100 * ROUND(RC[-2],2)) / ROUND(RC[-1],2))))/100.0 -> 0.16325757575757574
A142: Rob Rolvink
B143: Cus-01163 Aryza B.V. : Proj-00976 Interne uren 2025 | D143: 32.0 | E143: (if((ROUND(RC[-1],2) = 0),0,((100 * ROUND(RC[-2],2)) / ROUND(RC[-1],2))))/100.0 -> 0.0 | G143: 40.0 | H143: (if((ROUND(RC[-1],2) = 0),0,((100 * ROUND(RC[-2],2)) / ROUND(RC[-1],2))))/100.0 -> 0.0 | J143: 40.0 | K143: (if((ROUND(RC[-1],2) = 0),0,((100 * ROUND(RC[-2],2)) / ROUND(RC[-1],2))))/100.0 -> 0.0 | M143: 40.0 | N143: (if((ROUND(RC[-1],2) = 0),0,((100 * ROUND(RC[-2],2)) / ROUND(RC[-1],2))))/100.0 -> 0.0 | O143: 4.0 | P143: 40.0 | Q143: (if((ROUND(RC[-1],2) = 0),0,((100 * ROUND(RC[-2],2)) / ROUND(RC[-1],2))))/100.0 -> 0.1 | R143: 4.0 | S143: 40.0 | T143: (if((ROUND(RC[-1],2) = 0),0,((100 * ROUND(RC[-2],2)) / ROUND(RC[-1],2))))/100.0 -> 0.1 | V143: 40.0 | W143: (if((ROUND(RC[-1],2) = 0),0,((100 * ROUND(RC[-2],2)) / ROUND(RC[-1],2))))/100.0 -> 0.0 | Y143: 40.0 | Z143: (if((ROUND(RC[-1],2) = 0),0,((100 * ROUND(RC[-2],2)) / ROUND(RC[-1],2))))/100.0 -> 0.0 | AA143: 1.0 | AB143: 40.0 | AC143: (if((ROUND(RC[-1],2) = 0),0,((100 * ROUND(RC[-2],2)) / ROUND(RC[-1],2))))/100.0 -> 0.025 | AD143: 1.0 | AE143: 40.0 | AF143: (if((ROUND(RC[-1],2) = 0),0,((100 * ROUND(RC[-2],2)) / ROUND(RC[-1],2))))/100.0 -> 0.025 | AG143: 1.0 | AH143: 40.0 | AI143: (if((ROUND(RC[-1],2) = 0),0,((100 * ROUND(RC[-2],2)) / ROUND(RC[-1],2))))/100.0 -> 0.025 | AJ143: 1.0 | AK143: 40.0 | AL143: (if((ROUND(RC[-1],2) = 0),0,((100 * ROUND(RC[-2],2)) / ROUND(RC[-1],2))))/100.0 -> 0.025 | AM143: 1.0 | AN143: 40.0 | AO143: (if((ROUND(RC[-1],2) = 0),0,((100 * ROUND(RC[-2],2)) / ROUND(RC[-1],2))))/100.0 -> 0.025 | AP143: 0.4 | AQ143: 16.0 | AR143: (if((ROUND(RC[-1],2) = 0),0,((100 * ROUND(RC[-2],2)) / ROUND(RC[-1],2))))/100.0 -> 0.025 | AS143: SUM(RC[-42],RC[-39],RC[-36],RC[-33],RC[-30],RC[-27],RC[-24],RC[-21],RC[-18],RC[-15],RC[-12],RC[-9],RC[-6],RC[-3]) -> 13.4 | AT143: SUM(RC[-42],RC[-39],RC[-36],RC[-33],RC[-30],RC[-27],RC[-24],RC[-21],RC[-18],RC[-15],RC[-12],RC[-9],RC[-6],RC[-3]) -> 528.0 | AU143: (if((ROUND(RC[-1],2) = 0),0,((100 * ROUND(RC[-2],2)) / ROUND(RC[-1],2))))/100.0 -> 0.02537878787878788
B144: Cus-01163 Aryza B.V. : Proj-00978 Training SmartComponents | D144: 32.0 | E144: (if((ROUND(RC[-1],2) = 0),0,((100 * ROUND(RC[-2],2)) / ROUND(RC[-1],2))))/100.0 -> 0.0 | G144: 40.0 | H144: (if((ROUND(RC[-1],2) = 0),0,((100 * ROUND(RC[-2],2)) / ROUND(RC[-1],2))))/100.0 -> 0.0 | J144: 40.0 | K144: (if((ROUND(RC[-1],2) = 0),0,((100 * ROUND(RC[-2],2)) / ROUND(RC[-1],2))))/100.0 -> 0.0 | M144: 40.0 | N144: (if((ROUND(RC[-1],2) = 0),0,((100 * ROUND(RC[-2],2)) / ROUND(RC[-1],2))))/100.0 -> 0.0 | P144: 40.0 | Q144: (if((ROUND(RC[-1],2) = 0),0,((100 * ROUND(RC[-2],2)) / ROUND(RC[-1],2))))/100.0 -> 0.0 | S144: 40.0 | T144: (if((ROUND(RC[-1],2) = 0),0,((100 * ROUND(RC[-2],2)) / ROUND(RC[-1],2))))/100.0 -> 0.0 | U144: 32.0 | V144: 40.0 | W144: (if((ROUND(RC[-1],2) = 0),0,((100 * ROUND(RC[-2],2)) / ROUND(RC[-1],2))))/100.0 -> 0.8 | X144: 32.0 | Y144: 40.0 | Z144: (if((ROUND(RC[-1],2) = 0),0,((100 * ROUND(RC[-2],2)) / ROUND(RC[-1],2))))/100.0 -> 0.8 | AB144: 40.0 | AC144: (if((ROUND(RC[-1],2) = 0),0,((100 * ROUND(RC[-2],2)) / ROUND(RC[-1],2))))/100.0 -> 0.0 | AE144: 40.0 | AF144: (if((ROUND(RC[-1],2) = 0),0,((100 * ROUND(RC[-2],2)) / ROUND(RC[-1],2))))/100.0 -> 0.0 | AH144: 40.0 | AI144: (if((ROUND(RC[-1],2) = 0),0,((100 * ROUND(RC[-2],2)) / ROUND(RC[-1],2))))/100.0 -> 0.0 | AK144: 40.0 | AL144: (if((ROUND(RC[-1],2) = 0),0,((100 * ROUND(RC[-2],2)) / ROUND(RC[-1],2))))/100.0 -> 0.0 | AN144: 40.0 | AO144: (if((ROUND(RC[-1],2) = 0),0,((100 * ROUND(RC[-2],2)) / ROUND(RC[-1],2))))/100.0 -> 0.0 | AQ144: 16.0 | AR144: (if((ROUND(RC[-1],2) = 0),0,((100 * ROUND(RC[-2],2)) / ROUND(RC[-1],2))))/100.0 -> 0.0 | AS144: SUM(RC[-42],RC[-39],RC[-36],RC[-33],RC[-30],RC[-27],RC[-24],RC[-21],RC[-18],RC[-15],RC[-12],RC[-9],RC[-6],RC[-3]) -> 64.0 | AT144: SUM(RC[-42],RC[-39],RC[-36],RC[-33],RC[-30],RC[-27],RC[-24],RC[-21],RC[-18],RC[-15],RC[-12],RC[-9],RC[-6],RC[-3]) -> 528.0 | AU144: (if((ROUND(RC[-1],2) = 0),0,((100 * ROUND(RC[-2],2)) / ROUND(RC[-1],2))))/100.0 -> 0.12121212121212122
B145: Cus-01168 DipNed MR : Proj-01001 DipNed WKI implementatie in HHF 2025 | D145: 32.0 | E145: (if((ROUND(RC[-1],2) = 0),0,((100 * ROUND(RC[-2],2)) / ROUND(RC[-1],2))))/100.0 -> 0.0 | G145: 40.0 | H145: (if((ROUND(RC[-1],2) = 0),0,((100 * ROUND(RC[-2],2)) / ROUND(RC[-1],2))))/100.0 -> 0.0 | J145: 40.0 | K145: (if((ROUND(RC[-1],2) = 0),0,((100 * ROUND(RC[-2],2)) / ROUND(RC[-1],2))))/100.0 -> 0.0 | M145: 40.0 | N145: (if((ROUND(RC[-1],2) = 0),0,((100 * ROUND(RC[-2],2)) / ROUND(RC[-1],2))))/100.0 -> 0.0 | O145: 4.0 | P145: 40.0 | Q145: (if((ROUND(RC[-1],2) = 0),0,((100 * ROUND(RC[-2],2)) / ROUND(RC[-1],2))))/100.0 -> 0.1 | R145: 4.0 | S145: 40.0 | T145: (if((ROUND(RC[-1],2) = 0),0,((100 * ROUND(RC[-2],2)) / ROUND(RC[-1],2))))/100.0 -> 0.1 | V145: 40.0 | W145: (if((ROUND(RC[-1],2) = 0),0,((100 * ROUND(RC[-2],2)) / ROUND(RC[-1],2))))/100.0 -> 0.0 | Y145: 40.0 | Z145: (if((ROUND(RC[-1],2) = 0),0,((100 * ROUND(RC[-2],2)) / ROUND(RC[-1],2))))/100.0 -> 0.0 | AB145: 40.0 | AC145: (if((ROUND(RC[-1],2) = 0),0,((100 * ROUND(RC[-2],2)) / ROUND(RC[-1],2))))/100.0 -> 0.0 | AE145: 40.0 | AF145: (if((ROUND(RC[-1],2) = 0),0,((100 * ROUND(RC[-2],2)) / ROUND(RC[-1],2))))/100.0 -> 0.0 | AH145: 40.0 | AI145: (if((ROUND(RC[-1],2) = 0),0,((100 * ROUND(RC[-2],2)) / ROUND(RC[-1],2))))/100.0 -> 0.0 | AK145: 40.0 | AL145: (if((ROUND(RC[-1],2) = 0),0,((100 * ROUND(RC[-2],2)) / ROUND(RC[-1],2))))/100.0 -> 0.0 | AN145: 40.0 | AO145: (if((ROUND(RC[-1],2) = 0),0,((100 * ROUND(RC[-2],2)) / ROUND(RC[-1],2))))/100.0 -> 0.0 | AQ145: 16.0 | AR145: (if((ROUND(RC[-1],2) = 0),0,((100 * ROUND(RC[-2],2)) / ROUND(RC[-1],2))))/100.0 -> 0.0 | AS145: SUM(RC[-42],RC[-39],RC[-36],RC[-33],RC[-30],RC[-27],RC[-24],RC[-21],RC[-18],RC[-15],RC[-12],RC[-9],RC[-6],RC[-3]) -> 8.0 | AT145: SUM(RC[-42],RC[-39],RC[-36],RC[-33],RC[-30],RC[-27],RC[-24],RC[-21],RC[-18],RC[-15],RC[-12],RC[-9],RC[-6],RC[-3]) -> 528.0 | AU145: (if((ROUND(RC[-1],2) = 0),0,((100 * ROUND(RC[-2],2)) / ROUND(RC[-1],2))))/100.0 -> 0.015151515151515152
B146: Cus-01168 DipNed MR : Proj-01024 DipNed SEPA betaalbestanden SDD en SCT | C146: 5.6 | D146: 32.0 | E146: (if((ROUND(RC[-1],2) = 0),0,((100 * ROUND(RC[-2],2)) / ROUND(RC[-1],2))))/100.0 -> 0.175 | G146: 40.0 | H146: (if((ROUND(RC[-1],2) = 0),0,((100 * ROUND(RC[-2],2)) / ROUND(RC[-1],2))))/100.0 -> 0.0 | J146: 40.0 | K146: (if((ROUND(RC[-1],2) = 0),0,((100 * ROUND(RC[-2],2)) / ROUND(RC[-1],2))))/100.0 -> 0.0 | M146: 40.0 | N146: (if((ROUND(RC[-1],2) = 0),0,((100 * ROUND(RC[-2],2)) / ROUND(RC[-1],2))))/100.0 -> 0.0 | O146: 24.0 | P146: 40.0 | Q146: (if((ROUND(RC[-1],2) = 0),0,((100 * ROUND(RC[-2],2)) / ROUND(RC[-1],2))))/100.0 -> 0.6 | R146: 24.0 | S146: 40.0 | T146: (if((ROUND(RC[-1],2) = 0),0,((100 * ROUND(RC[-2],2)) / ROUND(RC[-1],2))))/100.0 -> 0.6 | V146: 40.0 | W146: (if((ROUND(RC[-1],2) = 0),0,((100 * ROUND(RC[-2],2)) / ROUND(RC[-1],2))))/100.0 -> 0.0 | Y146: 40.0 | Z146: (if((ROUND(RC[-1],2) = 0),0,((100 * ROUND(RC[-2],2)) / ROUND(RC[-1],2))))/100.0 -> 0.0 | AB146: 40.0 | AC146: (if((ROUND(RC[-1],2) = 0),0,((100 * ROUND(RC[-2],2)) / ROUND(RC[-1],2))))/100.0 -> 0.0 | AE146: 40.0 | AF146: (if((ROUND(RC[-1],2) = 0),0,((100 * ROUND(RC[-2],2)) / ROUND(RC[-1],2))))/100.0 -> 0.0 | AH146: 40.0 | AI146: (if((ROUND(RC[-1],2) = 0),0,((100 * ROUND(RC[-2],2)) / ROUND(RC[-1],2))))/100.0 -> 0.0 | AK146: 40.0 | AL146: (if((ROUND(RC[-1],2) = 0),0,((100 * ROUND(RC[-2],2)) / ROUND(RC[-1],2))))/100.0 -> 0.0 | AN146: 40.0 | AO146: (if((ROUND(RC[-1],2) = 0),0,((100 * ROUND(RC[-2],2)) / ROUND(RC[-1],2))))/100.0 -> 0.0 | AQ146: 16.0 | AR146: (if((ROUND(RC[-1],2) = 0),0,((100 * ROUND(RC[-2],2)) / ROUND(RC[-1],2))))/100.0 -> 0.0 | AS146: SUM(RC[-42],RC[-39],RC[-36],RC[-33],RC[-30],RC[-27],RC[-24],RC[-21],RC[-18],RC[-15],RC[-12],RC[-9],RC[-6],RC[-3]) -> 53.6 | AT146: SUM(RC[-42],RC[-39],RC[-36],RC[-33],RC[-30],RC[-27],RC[-24],RC[-21],RC[-18],RC[-15],RC[-12],RC[-9],RC[-6],RC[-3]) -> 528.0 | AU146: (if((ROUND(RC[-1],2) = 0),0,((100 * ROUND(RC[-2],2)) / ROUND(RC[-1],2))))/100.0 -> 0.10151515151515152
B147: Cus-01736 LDCR Afd. Fin. : Proj-00805 LDCR C-Kasapplicatie | D147: 32.0 | E147: (if((ROUND(RC[-1],2) = 0),0,((100 * ROUND(RC[-2],2)) / ROUND(RC[-1],2))))/100.0 -> 0.0 | G147: 40.0 | H147: (if((ROUND(RC[-1],2) = 0),0,((100 * ROUND(RC[-2],2)) / ROUND(RC[-1],2))))/100.0 -> 0.0 | J147: 40.0 | K147: (if((ROUND(RC[-1],2) = 0),0,((100 * ROUND(RC[-2],2)) / ROUND(RC[-1],2))))/100.0 -> 0.0 | M147: 40.0 | N147: (if((ROUND(RC[-1],2) = 0),0,((100 * ROUND(RC[-2],2)) / ROUND(RC[-1],2))))/100.0 -> 0.0 | P147: 40.0 | Q147: (if((ROUND(RC[-1],2) = 0),0,((100 * ROUND(RC[-2],2)) / ROUND(RC[-1],2))))/100.0 -> 0.0 | S147: 40.0 | T147: (if((ROUND(RC[-1],2) = 0),0,((100 * ROUND(RC[-2],2)) / ROUND(RC[-1],2))))/100.0 -> 0.0 | V147: 40.0 | W147: (if((ROUND(RC[-1],2) = 0),0,((100 * ROUND(RC[-2],2)) / ROUND(RC[-1],2))))/100.0 -> 0.0 | Y147: 40.0 | Z147: (if((ROUND(RC[-1],2) = 0),0,((100 * ROUND(RC[-2],2)) / ROUND(RC[-1],2))))/100.0 -> 0.0 | AA147: 31.0 | AB147: 40.0 | AC147: (if((ROUND(RC[-1],2) = 0),0,((100 * ROUND(RC[-2],2)) / ROUND(RC[-1],2))))/100.0 -> 0.775 | AD147: 31.0 | AE147: 40.0 | AF147: (if((ROUND(RC[-1],2) = 0),0,((100 * ROUND(RC[-2],2)) / ROUND(RC[-1],2))))/100.0 -> 0.775 | AG147: 31.0 | AH147: 40.0 | AI147: (if((ROUND(RC[-1],2) = 0),0,((100 * ROUND(RC[-2],2)) / ROUND(RC[-1],2))))/100.0 -> 0.775 | AJ147: 31.0 | AK147: 40.0 | AL147: (if((ROUND(RC[-1],2) = 0),0,((100 * ROUND(RC[-2],2)) / ROUND(RC[-1],2))))/100.0 -> 0.775 | AM147: 31.0 | AN147: 40.0 | AO147: (if((ROUND(RC[-1],2) = 0),0,((100 * ROUND(RC[-2],2)) / ROUND(RC[-1],2))))/100.0 -> 0.775 | AP147: 12.4 | AQ147: 16.0 | AR147: (if((ROUND(RC[-1],2) = 0),0,((100 * ROUND(RC[-2],2)) / ROUND(RC[-1],2))))/100.0 -> 0.775 | AS147: SUM(RC[-42],RC[-39],RC[-36],RC[-33],RC[-30],RC[-27],RC[-24],RC[-21],RC[-18],RC[-15],RC[-12],RC[-9],RC[-6],RC[-3]) -> 167.4 | AT147: SUM(RC[-42],RC[-39],RC[-36],RC[-33],RC[-30],RC[-27],RC[-24],RC[-21],RC[-18],RC[-15],RC[-12],RC[-9],RC[-6],RC[-3]) -> 528.0 | AU147: (if((ROUND(RC[-1],2) = 0),0,((100 * ROUND(RC[-2],2)) / ROUND(RC[-1],2))))/100.0 -> 0.3170454545454545
A148: Total - Rob Rolvink | C148: SUM(R[-5]C:R[-1]C) -> 5.6 | D148: 32.0 | E148: (if((ROUND(RC[-1],2) = 0),0,((100 * ROUND(RC[-2],2)) / ROUND(RC[-1],2))))/100.0 -> 0.175 | F148: SUM(R[-5]C:R[-1]C) ->  | G148: 40.0 | H148: (if((ROUND(RC[-1],2) = 0),0,((100 * ROUND(RC[-2],2)) / ROUND(RC[-1],2))))/100.0 -> 0.0 | I148: SUM(R[-5]C:R[-1]C) ->  | J148: 40.0 | K148: (if((ROUND(RC[-1],2) = 0),0,((100 * ROUND(RC[-2],2)) / ROUND(RC[-1],2))))/100.0 -> 0.0 | L148: SUM(R[-5]C:R[-1]C) ->  | M148: 40.0 | N148: (if((ROUND(RC[-1],2) = 0),0,((100 * ROUND(RC[-2],2)) / ROUND(RC[-1],2))))/100.0 -> 0.0 | O148: SUM(R[-5]C:R[-1]C) -> 32.0 | P148: 40.0 | Q148: (if((ROUND(RC[-1],2) = 0),0,((100 * ROUND(RC[-2],2)) / ROUND(RC[-1],2))))/100.0 -> 0.8 | R148: SUM(R[-5]C:R[-1]C) -> 32.0 | S148: 40.0 | T148: (if((ROUND(RC[-1],2) = 0),0,((100 * ROUND(RC[-2],2)) / ROUND(RC[-1],2))))/100.0 -> 0.8 | U148: SUM(R[-5]C:R[-1]C) -> 32.0 | V148: 40.0 | W148: (if((ROUND(RC[-1],2) = 0),0,((100 * ROUND(RC[-2],2)) / ROUND(RC[-1],2))))/100.0 -> 0.8 | X148: SUM(R[-5]C:R[-1]C) -> 32.0 | Y148: 40.0 | Z148: (if((ROUND(RC[-1],2) = 0),0,((100 * ROUND(RC[-2],2)) / ROUND(RC[-1],2))))/100.0 -> 0.8 | AA148: SUM(R[-5]C:R[-1]C) -> 32.0 | AB148: 40.0 | AC148: (if((ROUND(RC[-1],2) = 0),0,((100 * ROUND(RC[-2],2)) / ROUND(RC[-1],2))))/100.0 -> 0.8 | AD148: SUM(R[-5]C:R[-1]C) -> 32.0 | AE148: 40.0 | AF148: (if((ROUND(RC[-1],2) = 0),0,((100 * ROUND(RC[-2],2)) / ROUND(RC[-1],2))))/100.0 -> 0.8 | AG148: SUM(R[-5]C:R[-1]C) -> 32.0 | AH148: 40.0 | AI148: (if((ROUND(RC[-1],2) = 0),0,((100 * ROUND(RC[-2],2)) / ROUND(RC[-1],2))))/100.0 -> 0.8 | AJ148: SUM(R[-5]C:R[-1]C) -> 32.0 | AK148: 40.0 | AL148: (if((ROUND(RC[-1],2) = 0),0,((100 * ROUND(RC[-2],2)) / ROUND(RC[-1],2))))/100.0 -> 0.8 | AM148: SUM(R[-5]C:R[-1]C) -> 32.0 | AN148: 40.0 | AO148: (if((ROUND(RC[-1],2) = 0),0,((100 * ROUND(RC[-2],2)) / ROUND(RC[-1],2))))/100.0 -> 0.8 | AP148: SUM(R[-5]C:R[-1]C) -> 12.8 | AQ148: 16.0 | AR148: (if((ROUND(RC[-1],2) = 0),0,((100 * ROUND(RC[-2],2)) / ROUND(RC[-1],2))))/100.0 -> 0.8 | AS148: SUM(R[-5]C:R[-1]C) -> 306.40000000000003 | AT148: SUM(R[-5]C:R[-1]C) -> 528.0 | AU148: (if((ROUND(RC[-1],2) = 0),0,((100 * ROUND(RC[-2],2)) / ROUND(RC[-1],2))))/100.0 -> 0.5803030303030302
A149: Roman Bik | B149: Cus-01168 DipNed MR : Proj-01001 DipNed WKI implementatie in HHF 2025 | C149: 19.2 | D149: 32.0 | E149: (if((ROUND(RC[-1],2) = 0),0,((100 * ROUND(RC[-2],2)) / ROUND(RC[-1],2))))/100.0 -> 0.6 | F149: 24.0 | G149: 40.0 | H149: (if((ROUND(RC[-1],2) = 0),0,((100 * ROUND(RC[-2],2)) / ROUND(RC[-1],2))))/100.0 -> 0.6 | I149: 8.0 | J149: 40.0 | K149: (if((ROUND(RC[-1],2) = 0),0,((100 * ROUND(RC[-2],2)) / ROUND(RC[-1],2))))/100.0 -> 0.2 | M149: 40.0 | N149: (if((ROUND(RC[-1],2) = 0),0,((100 * ROUND(RC[-2],2)) / ROUND(RC[-1],2))))/100.0 -> 0.0 | P149: 40.0 | Q149: (if((ROUND(RC[-1],2) = 0),0,((100 * ROUND(RC[-2],2)) / ROUND(RC[-1],2))))/100.0 -> 0.0 | R149: 24.0 | S149: 40.0 | T149: (if((ROUND(RC[-1],2) = 0),0,((100 * ROUND(RC[-2],2)) / ROUND(RC[-1],2))))/100.0 -> 0.6 | V149: 40.0 | W149: (if((ROUND(RC[-1],2) = 0),0,((100 * ROUND(RC[-2],2)) / ROUND(RC[-1],2))))/100.0 -> 0.0 | Y149: 40.0 | Z149: (if((ROUND(RC[-1],2) = 0),0,((100 * ROUND(RC[-2],2)) / ROUND(RC[-1],2))))/100.0 -> 0.0 | AB149: 40.0 | AC149: (if((ROUND(RC[-1],2) = 0),0,((100 * ROUND(RC[-2],2)) / ROUND(RC[-1],2))))/100.0 -> 0.0 | AE149: 40.0 | AF149: (if((ROUND(RC[-1],2) = 0),0,((100 * ROUND(RC[-2],2)) / ROUND(RC[-1],2))))/100.0 -> 0.0 | AH149: 40.0 | AI149: (if((ROUND(RC[-1],2) = 0),0,((100 * ROUND(RC[-2],2)) / ROUND(RC[-1],2))))/100.0 -> 0.0 | AK149: 40.0 | AL149: (if((ROUND(RC[-1],2) = 0),0,((100 * ROUND(RC[-2],2)) / ROUND(RC[-1],2))))/100.0 -> 0.0 | AN149: 40.0 | AO149: (if((ROUND(RC[-1],2) = 0),0,((100 * ROUND(RC[-2],2)) / ROUND(RC[-1],2))))/100.0 -> 0.0 | AQ149: 16.0 | AR149: (if((ROUND(RC[-1],2) = 0),0,((100 * ROUND(RC[-2],2)) / ROUND(RC[-1],2))))/100.0 -> 0.0 | AS149: SUM(RC[-42],RC[-39],RC[-36],RC[-33],RC[-30],RC[-27],RC[-24],RC[-21],RC[-18],RC[-15],RC[-12],RC[-9],RC[-6],RC[-3]) -> 75.2 | AT149: SUM(RC[-42],RC[-39],RC[-36],RC[-33],RC[-30],RC[-27],RC[-24],RC[-21],RC[-18],RC[-15],RC[-12],RC[-9],RC[-6],RC[-3]) -> 528.0 | AU149: (if((ROUND(RC[-1],2) = 0),0,((100 * ROUND(RC[-2],2)) / ROUND(RC[-1],2))))/100.0 -> 0.14242424242424243
A150: Sander Wit
B151: Cus-01163 Aryza B.V. : Proj-00976 Interne uren 2025 | C151: 16.0 | D151: 32.0 | E151: (if((ROUND(RC[-1],2) = 0),0,((100 * ROUND(RC[-2],2)) / ROUND(RC[-1],2))))/100.0 -> 0.5 | G151: 40.0 | H151: (if((ROUND(RC[-1],2) = 0),0,((100 * ROUND(RC[-2],2)) / ROUND(RC[-1],2))))/100.0 -> 0.0 | J151: 40.0 | K151: (if((ROUND(RC[-1],2) = 0),0,((100 * ROUND(RC[-2],2)) / ROUND(RC[-1],2))))/100.0 -> 0.0 | M151: 40.0 | N151: (if((ROUND(RC[-1],2) = 0),0,((100 * ROUND(RC[-2],2)) / ROUND(RC[-1],2))))/100.0 -> 0.0 | O151: 16.0 | P151: 40.0 | Q151: (if((ROUND(RC[-1],2) = 0),0,((100 * ROUND(RC[-2],2)) / ROUND(RC[-1],2))))/100.0 -> 0.4 | R151: 9.0 | S151: 40.0 | T151: (if((ROUND(RC[-1],2) = 0),0,((100 * ROUND(RC[-2],2)) / ROUND(RC[-1],2))))/100.0 -> 0.225 | U151: 16.0 | V151: 40.0 | W151: (if((ROUND(RC[-1],2) = 0),0,((100 * ROUND(RC[-2],2)) / ROUND(RC[-1],2))))/100.0 -> 0.4 | X151: 16.0 | Y151: 40.0 | Z151: (if((ROUND(RC[-1],2) = 0),0,((100 * ROUND(RC[-2],2)) / ROUND(RC[-1],2))))/100.0 -> 0.4 | AA151: 16.0 | AB151: 40.0 | AC151: (if((ROUND(RC[-1],2) = 0),0,((100 * ROUND(RC[-2],2)) / ROUND(RC[-1],2))))/100.0 -> 0.4 | AD151: 16.0 | AE151: 40.0 | AF151: (if((ROUND(RC[-1],2) = 0),0,((100 * ROUND(RC[-2],2)) / ROUND(RC[-1],2))))/100.0 -> 0.4 | AH151: 40.0 | AI151: (if((ROUND(RC[-1],2) = 0),0,((100 * ROUND(RC[-2],2)) / ROUND(RC[-1],2))))/100.0 -> 0.0 | AK151: 40.0 | AL151: (if((ROUND(RC[-1],2) = 0),0,((100 * ROUND(RC[-2],2)) / ROUND(RC[-1],2))))/100.0 -> 0.0 | AM151: 8.0 | AN151: 40.0 | AO151: (if((ROUND(RC[-1],2) = 0),0,((100 * ROUND(RC[-2],2)) / ROUND(RC[-1],2))))/100.0 -> 0.2 | AQ151: 16.0 | AR151: (if((ROUND(RC[-1],2) = 0),0,((100 * ROUND(RC[-2],2)) / ROUND(RC[-1],2))))/100.0 -> 0.0 | AS151: SUM(RC[-42],RC[-39],RC[-36],RC[-33],RC[-30],RC[-27],RC[-24],RC[-21],RC[-18],RC[-15],RC[-12],RC[-9],RC[-6],RC[-3]) -> 113.0 | AT151: SUM(RC[-42],RC[-39],RC[-36],RC[-33],RC[-30],RC[-27],RC[-24],RC[-21],RC[-18],RC[-15],RC[-12],RC[-9],RC[-6],RC[-3]) -> 528.0 | AU151: (if((ROUND(RC[-1],2) = 0),0,((100 * ROUND(RC[-2],2)) / ROUND(RC[-1],2))))/100.0 -> 0.21401515151515152
B152: Cus-01231 Gdw kantoor De Best & Partners : Proj-01074 Periodieke begeleiding - De Best | D152: 32.0 | E152: (if((ROUND(RC[-1],2) = 0),0,((100 * ROUND(RC[-2],2)) / ROUND(RC[-1],2))))/100.0 -> 0.0 | G152: 40.0 | H152: (if((ROUND(RC[-1],2) = 0),0,((100 * ROUND(RC[-2],2)) / ROUND(RC[-1],2))))/100.0 -> 0.0 | J152: 40.0 | K152: (if((ROUND(RC[-1],2) = 0),0,((100 * ROUND(RC[-2],2)) / ROUND(RC[-1],2))))/100.0 -> 0.0 | M152: 40.0 | N152: (if((ROUND(RC[-1],2) = 0),0,((100 * ROUND(RC[-2],2)) / ROUND(RC[-1],2))))/100.0 -> 0.0 | P152: 40.0 | Q152: (if((ROUND(RC[-1],2) = 0),0,((100 * ROUND(RC[-2],2)) / ROUND(RC[-1],2))))/100.0 -> 0.0 | R152: 7.0 | S152: 40.0 | T152: (if((ROUND(RC[-1],2) = 0),0,((100 * ROUND(RC[-2],2)) / ROUND(RC[-1],2))))/100.0 -> 0.175 | V152: 40.0 | W152: (if((ROUND(RC[-1],2) = 0),0,((100 * ROUND(RC[-2],2)) / ROUND(RC[-1],2))))/100.0 -> 0.0 | Y152: 40.0 | Z152: (if((ROUND(RC[-1],2) = 0),0,((100 * ROUND(RC[-2],2)) / ROUND(RC[-1],2))))/100.0 -> 0.0 | AB152: 40.0 | AC152: (if((ROUND(RC[-1],2) = 0),0,((100 * ROUND(RC[-2],2)) / ROUND(RC[-1],2))))/100.0 -> 0.0 | AE152: 40.0 | AF152: (if((ROUND(RC[-1],2) = 0),0,((100 * ROUND(RC[-2],2)) / ROUND(RC[-1],2))))/100.0 -> 0.0 | AH152: 40.0 | AI152: (if((ROUND(RC[-1],2) = 0),0,((100 * ROUND(RC[-2],2)) / ROUND(RC[-1],2))))/100.0 -> 0.0 | AK152: 40.0 | AL152: (if((ROUND(RC[-1],2) = 0),0,((100 * ROUND(RC[-2],2)) / ROUND(RC[-1],2))))/100.0 -> 0.0 | AN152: 40.0 | AO152: (if((ROUND(RC[-1],2) = 0),0,((100 * ROUND(RC[-2],2)) / ROUND(RC[-1],2))))/100.0 -> 0.0 | AQ152: 16.0 | AR152: (if((ROUND(RC[-1],2) = 0),0,((100 * ROUND(RC[-2],2)) / ROUND(RC[-1],2))))/100.0 -> 0.0 | AS152: SUM(RC[-42],RC[-39],RC[-36],RC[-33],RC[-30],RC[-27],RC[-24],RC[-21],RC[-18],RC[-15],RC[-12],RC[-9],RC[-6],RC[-3]) -> 7.0 | AT152: SUM(RC[-42],RC[-39],RC[-36],RC[-33],RC[-30],RC[-27],RC[-24],RC[-21],RC[-18],RC[-15],RC[-12],RC[-9],RC[-6],RC[-3]) -> 528.0 | AU152: (if((ROUND(RC[-1],2) = 0),0,((100 * ROUND(RC[-2],2)) / ROUND(RC[-1],2))))/100.0 -> 0.013257575757575756
A153: Total - Sander Wit | C153: SUM(R[-2]C:R[-1]C) -> 16.0 | D153: 32.0 | E153: (if((ROUND(RC[-1],2) = 0),0,((100 * ROUND(RC[-2],2)) / ROUND(RC[-1],2))))/100.0 -> 0.5 | F153: SUM(R[-2]C:R[-1]C) ->  | G153: 40.0 | H153: (if((ROUND(RC[-1],2) = 0),0,((100 * ROUND(RC[-2],2)) / ROUND(RC[-1],2))))/100.0 -> 0.0 | I153: SUM(R[-2]C:R[-1]C) ->  | J153: 40.0 | K153: (if((ROUND(RC[-1],2) = 0),0,((100 * ROUND(RC[-2],2)) / ROUND(RC[-1],2))))/100.0 -> 0.0 | L153: SUM(R[-2]C:R[-1]C) ->  | M153: 40.0 | N153: (if((ROUND(RC[-1],2) = 0),0,((100 * ROUND(RC[-2],2)) / ROUND(RC[-1],2))))/100.0 -> 0.0 | O153: SUM(R[-2]C:R[-1]C) -> 16.0 | P153: 40.0 | Q153: (if((ROUND(RC[-1],2) = 0),0,((100 * ROUND(RC[-2],2)) / ROUND(RC[-1],2))))/100.0 -> 0.4 | R153: SUM(R[-2]C:R[-1]C) -> 16.0 | S153: 40.0 | T153: (if((ROUND(RC[-1],2) = 0),0,((100 * ROUND(RC[-2],2)) / ROUND(RC[-1],2))))/100.0 -> 0.4 | U153: SUM(R[-2]C:R[-1]C) -> 16.0 | V153: 40.0 | W153: (if((ROUND(RC[-1],2) = 0),0,((100 * ROUND(RC[-2],2)) / ROUND(RC[-1],2))))/100.0 -> 0.4 | X153: SUM(R[-2]C:R[-1]C) -> 16.0 | Y153: 40.0 | Z153: (if((ROUND(RC[-1],2) = 0),0,((100 * ROUND(RC[-2],2)) / ROUND(RC[-1],2))))/100.0 -> 0.4 | AA153: SUM(R[-2]C:R[-1]C) -> 16.0 | AB153: 40.0 | AC153: (if((ROUND(RC[-1],2) = 0),0,((100 * ROUND(RC[-2],2)) / ROUND(RC[-1],2))))/100.0 -> 0.4 | AD153: SUM(R[-2]C:R[-1]C) -> 16.0 | AE153: 40.0 | AF153: (if((ROUND(RC[-1],2) = 0),0,((100 * ROUND(RC[-2],2)) / ROUND(RC[-1],2))))/100.0 -> 0.4 | AG153: SUM(R[-2]C:R[-1]C) ->  | AH153: 40.0 | AI153: (if((ROUND(RC[-1],2) = 0),0,((100 * ROUND(RC[-2],2)) / ROUND(RC[-1],2))))/100.0 -> 0.0 | AJ153: SUM(R[-2]C:R[-1]C) ->  | AK153: 40.0 | AL153: (if((ROUND(RC[-1],2) = 0),0,((100 * ROUND(RC[-2],2)) / ROUND(RC[-1],2))))/100.0 -> 0.0 | AM153: SUM(R[-2]C:R[-1]C) -> 8.0 | AN153: 40.0 | AO153: (if((ROUND(RC[-1],2) = 0),0,((100 * ROUND(RC[-2],2)) / ROUND(RC[-1],2))))/100.0 -> 0.2 | AP153: SUM(R[-2]C:R[-1]C) ->  | AQ153: 16.0 | AR153: (if((ROUND(RC[-1],2) = 0),0,((100 * ROUND(RC[-2],2)) / ROUND(RC[-1],2))))/100.0 -> 0.0 | AS153: SUM(R[-2]C:R[-1]C) -> 120.0 | AT153: SUM(R[-2]C:R[-1]C) -> 528.0 | AU153: (if((ROUND(RC[-1],2) = 0),0,((100 * ROUND(RC[-2],2)) / ROUND(RC[-1],2))))/100.0 -> 0.22727272727272727
A154: Walter Smolders
B155: Cus-01105 Lariks Exploitatie B.V. : Proj-00658 Lariks dedicated begeleiding 2025 | C155: 3.2 | D155: 32.0 | E155: (if((ROUND(RC[-1],2) = 0),0,((100 * ROUND(RC[-2],2)) / ROUND(RC[-1],2))))/100.0 -> 0.1 | F155: 4.0 | G155: 40.0 | H155: (if((ROUND(RC[-1],2) = 0),0,((100 * ROUND(RC[-2],2)) / ROUND(RC[-1],2))))/100.0 -> 0.1 | I155: 4.0 | J155: 40.0 | K155: (if((ROUND(RC[-1],2) = 0),0,((100 * ROUND(RC[-2],2)) / ROUND(RC[-1],2))))/100.0 -> 0.1 | L155: 4.0 | M155: 40.0 | N155: (if((ROUND(RC[-1],2) = 0),0,((100 * ROUND(RC[-2],2)) / ROUND(RC[-1],2))))/100.0 -> 0.1 | O155: 4.0 | P155: 40.0 | Q155: (if((ROUND(RC[-1],2) = 0),0,((100 * ROUND(RC[-2],2)) / ROUND(RC[-1],2))))/100.0 -> 0.1 | R155: 4.0 | S155: 40.0 | T155: (if((ROUND(RC[-1],2) = 0),0,((100 * ROUND(RC[-2],2)) / ROUND(RC[-1],2))))/100.0 -> 0.1 | U155: 4.0 | V155: 40.0 | W155: (if((ROUND(RC[-1],2) = 0),0,((100 * ROUND(RC[-2],2)) / ROUND(RC[-1],2))))/100.0 -> 0.1 | X155: 4.0 | Y155: 40.0 | Z155: (if((ROUND(RC[-1],2) = 0),0,((100 * ROUND(RC[-2],2)) / ROUND(RC[-1],2))))/100.0 -> 0.1 | AA155: 4.0 | AB155: 40.0 | AC155: (if((ROUND(RC[-1],2) = 0),0,((100 * ROUND(RC[-2],2)) / ROUND(RC[-1],2))))/100.0 -> 0.1 | AD155: 4.0 | AE155: 40.0 | AF155: (if((ROUND(RC[-1],2) = 0),0,((100 * ROUND(RC[-2],2)) / ROUND(RC[-1],2))))/100.0 -> 0.1 | AG155: 4.0 | AH155: 40.0 | AI155: (if((ROUND(RC[-1],2) = 0),0,((100 * ROUND(RC[-2],2)) / ROUND(RC[-1],2))))/100.0 -> 0.1 | AJ155: 4.0 | AK155: 40.0 | AL155: (if((ROUND(RC[-1],2) = 0),0,((100 * ROUND(RC[-2],2)) / ROUND(RC[-1],2))))/100.0 -> 0.1 | AM155: 4.0 | AN155: 40.0 | AO155: (if((ROUND(RC[-1],2) = 0),0,((100 * ROUND(RC[-2],2)) / ROUND(RC[-1],2))))/100.0 -> 0.1 | AP155: 1.6 | AQ155: 16.0 | AR155: (if((ROUND(RC[-1],2) = 0),0,((100 * ROUND(RC[-2],2)) / ROUND(RC[-1],2))))/100.0 -> 0.1 | AS155: SUM(RC[-42],RC[-39],RC[-36],RC[-33],RC[-30],RC[-27],RC[-24],RC[-21],RC[-18],RC[-15],RC[-12],RC[-9],RC[-6],RC[-3]) -> 52.800000000000004 | AT155: SUM(RC[-42],RC[-39],RC[-36],RC[-33],RC[-30],RC[-27],RC[-24],RC[-21],RC[-18],RC[-15],RC[-12],RC[-9],RC[-6],RC[-3]) -> 528.0 | AU155: (if((ROUND(RC[-1],2) = 0),0,((100 * ROUND(RC[-2],2)) / ROUND(RC[-1],2))))/100.0 -> 0.1
B156: Cus-01114 GGN Mastering Credit B.V. : Proj-00923 Linux migratie support - GGN | D156: 32.0 | E156: (if((ROUND(RC[-1],2) = 0),0,((100 * ROUND(RC[-2],2)) / ROUND(RC[-1],2))))/100.0 -> 0.0 | G156: 40.0 | H156: (if((ROUND(RC[-1],2) = 0),0,((100 * ROUND(RC[-2],2)) / ROUND(RC[-1],2))))/100.0 -> 0.0 | I156: 6.0 | J156: 40.0 | K156: (if((ROUND(RC[-1],2) = 0),0,((100 * ROUND(RC[-2],2)) / ROUND(RC[-1],2))))/100.0 -> 0.15 | L156: 6.0 | M156: 40.0 | N156: (if((ROUND(RC[-1],2) = 0),0,((100 * ROUND(RC[-2],2)) / ROUND(RC[-1],2))))/100.0 -> 0.15 | O156: 6.0 | P156: 40.0 | Q156: (if((ROUND(RC[-1],2) = 0),0,((100 * ROUND(RC[-2],2)) / ROUND(RC[-1],2))))/100.0 -> 0.15 | R156: 6.0 | S156: 40.0 | T156: (if((ROUND(RC[-1],2) = 0),0,((100 * ROUND(RC[-2],2)) / ROUND(RC[-1],2))))/100.0 -> 0.15 | V156: 40.0 | W156: (if((ROUND(RC[-1],2) = 0),0,((100 * ROUND(RC[-2],2)) / ROUND(RC[-1],2))))/100.0 -> 0.0 | Y156: 40.0 | Z156: (if((ROUND(RC[-1],2) = 0),0,((100 * ROUND(RC[-2],2)) / ROUND(RC[-1],2))))/100.0 -> 0.0 | AB156: 40.0 | AC156: (if((ROUND(RC[-1],2) = 0),0,((100 * ROUND(RC[-2],2)) / ROUND(RC[-1],2))))/100.0 -> 0.0 | AE156: 40.0 | AF156: (if((ROUND(RC[-1],2) = 0),0,((100 * ROUND(RC[-2],2)) / ROUND(RC[-1],2))))/100.0 -> 0.0 | AH156: 40.0 | AI156: (if((ROUND(RC[-1],2) = 0),0,((100 * ROUND(RC[-2],2)) / ROUND(RC[-1],2))))/100.0 -> 0.0 | AK156: 40.0 | AL156: (if((ROUND(RC[-1],2) = 0),0,((100 * ROUND(RC[-2],2)) / ROUND(RC[-1],2))))/100.0 -> 0.0 | AN156: 40.0 | AO156: (if((ROUND(RC[-1],2) = 0),0,((100 * ROUND(RC[-2],2)) / ROUND(RC[-1],2))))/100.0 -> 0.0 | AQ156: 16.0 | AR156: (if((ROUND(RC[-1],2) = 0),0,((100 * ROUND(RC[-2],2)) / ROUND(RC[-1],2))))/100.0 -> 0.0 | AS156: SUM(RC[-42],RC[-39],RC[-36],RC[-33],RC[-30],RC[-27],RC[-24],RC[-21],RC[-18],RC[-15],RC[-12],RC[-9],RC[-6],RC[-3]) -> 24.0 | AT156: SUM(RC[-42],RC[-39],RC[-36],RC[-33],RC[-30],RC[-27],RC[-24],RC[-21],RC[-18],RC[-15],RC[-12],RC[-9],RC[-6],RC[-3]) -> 528.0 | AU156: (if((ROUND(RC[-1],2) = 0),0,((100 * ROUND(RC[-2],2)) / ROUND(RC[-1],2))))/100.0 -> 0.045454545454545456
B157: Cus-01163 Aryza B.V. : Proj-00842 Algemeen beheer 2025 | C157: 3.2 | D157: 32.0 | E157: (if((ROUND(RC[-1],2) = 0),0,((100 * ROUND(RC[-2],2)) / ROUND(RC[-1],2))))/100.0 -> 0.1 | F157: 4.0 | G157: 40.0 | H157: (if((ROUND(RC[-1],2) = 0),0,((100 * ROUND(RC[-2],2)) / ROUND(RC[-1],2))))/100.0 -> 0.1 | I157: 4.0 | J157: 40.0 | K157: (if((ROUND(RC[-1],2) = 0),0,((100 * ROUND(RC[-2],2)) / ROUND(RC[-1],2))))/100.0 -> 0.1 | L157: 4.0 | M157: 40.0 | N157: (if((ROUND(RC[-1],2) = 0),0,((100 * ROUND(RC[-2],2)) / ROUND(RC[-1],2))))/100.0 -> 0.1 | O157: 4.0 | P157: 40.0 | Q157: (if((ROUND(RC[-1],2) = 0),0,((100 * ROUND(RC[-2],2)) / ROUND(RC[-1],2))))/100.0 -> 0.1 | R157: 4.0 | S157: 40.0 | T157: (if((ROUND(RC[-1],2) = 0),0,((100 * ROUND(RC[-2],2)) / ROUND(RC[-1],2))))/100.0 -> 0.1 | U157: 4.0 | V157: 40.0 | W157: (if((ROUND(RC[-1],2) = 0),0,((100 * ROUND(RC[-2],2)) / ROUND(RC[-1],2))))/100.0 -> 0.1 | X157: 4.0 | Y157: 40.0 | Z157: (if((ROUND(RC[-1],2) = 0),0,((100 * ROUND(RC[-2],2)) / ROUND(RC[-1],2))))/100.0 -> 0.1 | AA157: 4.0 | AB157: 40.0 | AC157: (if((ROUND(RC[-1],2) = 0),0,((100 * ROUND(RC[-2],2)) / ROUND(RC[-1],2))))/100.0 -> 0.1 | AD157: 4.0 | AE157: 40.0 | AF157: (if((ROUND(RC[-1],2) = 0),0,((100 * ROUND(RC[-2],2)) / ROUND(RC[-1],2))))/100.0 -> 0.1 | AG157: 4.0 | AH157: 40.0 | AI157: (if((ROUND(RC[-1],2) = 0),0,((100 * ROUND(RC[-2],2)) / ROUND(RC[-1],2))))/100.0 -> 0.1 | AJ157: 4.0 | AK157: 40.0 | AL157: (if((ROUND(RC[-1],2) = 0),0,((100 * ROUND(RC[-2],2)) / ROUND(RC[-1],2))))/100.0 -> 0.1 | AM157: 4.0 | AN157: 40.0 | AO157: (if((ROUND(RC[-1],2) = 0),0,((100 * ROUND(RC[-2],2)) / ROUND(RC[-1],2))))/100.0 -> 0.1 | AP157: 1.6 | AQ157: 16.0 | AR157: (if((ROUND(RC[-1],2) = 0),0,((100 * ROUND(RC[-2],2)) / ROUND(RC[-1],2))))/100.0 -> 0.1 | AS157: SUM(RC[-42],RC[-39],RC[-36],RC[-33],RC[-30],RC[-27],RC[-24],RC[-21],RC[-18],RC[-15],RC[-12],RC[-9],RC[-6],RC[-3]) -> 52.800000000000004 | AT157: SUM(RC[-42],RC[-39],RC[-36],RC[-33],RC[-30],RC[-27],RC[-24],RC[-21],RC[-18],RC[-15],RC[-12],RC[-9],RC[-6],RC[-3]) -> 528.0 | AU157: (if((ROUND(RC[-1],2) = 0),0,((100 * ROUND(RC[-2],2)) / ROUND(RC[-1],2))))/100.0 -> 0.1
B158: Cus-01163 Aryza B.V. : Proj-00875 Direct sales 2025 | C158: 3.2 | D158: 32.0 | E158: (if((ROUND(RC[-1],2) = 0),0,((100 * ROUND(RC[-2],2)) / ROUND(RC[-1],2))))/100.0 -> 0.1 | F158: 4.0 | G158: 40.0 | H158: (if((ROUND(RC[-1],2) = 0),0,((100 * ROUND(RC[-2],2)) / ROUND(RC[-1],2))))/100.0 -> 0.1 | I158: 4.0 | J158: 40.0 | K158: (if((ROUND(RC[-1],2) = 0),0,((100 * ROUND(RC[-2],2)) / ROUND(RC[-1],2))))/100.0 -> 0.1 | L158: 4.0 | M158: 40.0 | N158: (if((ROUND(RC[-1],2) = 0),0,((100 * ROUND(RC[-2],2)) / ROUND(RC[-1],2))))/100.0 -> 0.1 | O158: 4.0 | P158: 40.0 | Q158: (if((ROUND(RC[-1],2) = 0),0,((100 * ROUND(RC[-2],2)) / ROUND(RC[-1],2))))/100.0 -> 0.1 | R158: 4.0 | S158: 40.0 | T158: (if((ROUND(RC[-1],2) = 0),0,((100 * ROUND(RC[-2],2)) / ROUND(RC[-1],2))))/100.0 -> 0.1 | U158: 4.0 | V158: 40.0 | W158: (if((ROUND(RC[-1],2) = 0),0,((100 * ROUND(RC[-2],2)) / ROUND(RC[-1],2))))/100.0 -> 0.1 | X158: 4.0 | Y158: 40.0 | Z158: (if((ROUND(RC[-1],2) = 0),0,((100 * ROUND(RC[-2],2)) / ROUND(RC[-1],2))))/100.0 -> 0.1 | AA158: 4.0 | AB158: 40.0 | AC158: (if((ROUND(RC[-1],2) = 0),0,((100 * ROUND(RC[-2],2)) / ROUND(RC[-1],2))))/100.0 -> 0.1 | AD158: 4.0 | AE158: 40.0 | AF158: (if((ROUND(RC[-1],2) = 0),0,((100 * ROUND(RC[-2],2)) / ROUND(RC[-1],2))))/100.0 -> 0.1 | AG158: 4.0 | AH158: 40.0 | AI158: (if((ROUND(RC[-1],2) = 0),0,((100 * ROUND(RC[-2],2)) / ROUND(RC[-1],2))))/100.0 -> 0.1 | AJ158: 4.0 | AK158: 40.0 | AL158: (if((ROUND(RC[-1],2) = 0),0,((100 * ROUND(RC[-2],2)) / ROUND(RC[-1],2))))/100.0 -> 0.1 | AM158: 4.0 | AN158: 40.0 | AO158: (if((ROUND(RC[-1],2) = 0),0,((100 * ROUND(RC[-2],2)) / ROUND(RC[-1],2))))/100.0 -> 0.1 | AP158: 1.6 | AQ158: 16.0 | AR158: (if((ROUND(RC[-1],2) = 0),0,((100 * ROUND(RC[-2],2)) / ROUND(RC[-1],2))))/100.0 -> 0.1 | AS158: SUM(RC[-42],RC[-39],RC[-36],RC[-33],RC[-30],RC[-27],RC[-24],RC[-21],RC[-18],RC[-15],RC[-12],RC[-9],RC[-6],RC[-3]) -> 52.800000000000004 | AT158: SUM(RC[-42],RC[-39],RC[-36],RC[-33],RC[-30],RC[-27],RC[-24],RC[-21],RC[-18],RC[-15],RC[-12],RC[-9],RC[-6],RC[-3]) -> 528.0 | AU158: (if((ROUND(RC[-1],2) = 0),0,((100 * ROUND(RC[-2],2)) / ROUND(RC[-1],2))))/100.0 -> 0.1
B159: Cus-01163 Aryza B.V. : Proj-00976 Interne uren 2025 | C159: 1.6 | D159: 32.0 | E159: (if((ROUND(RC[-1],2) = 0),0,((100 * ROUND(RC[-2],2)) / ROUND(RC[-1],2))))/100.0 -> 0.05 | F159: 2.0 | G159: 40.0 | H159: (if((ROUND(RC[-1],2) = 0),0,((100 * ROUND(RC[-2],2)) / ROUND(RC[-1],2))))/100.0 -> 0.05 | I159: 2.0 | J159: 40.0 | K159: (if((ROUND(RC[-1],2) = 0),0,((100 * ROUND(RC[-2],2)) / ROUND(RC[-1],2))))/100.0 -> 0.05 | L159: 2.0 | M159: 40.0 | N159: (if((ROUND(RC[-1],2) = 0),0,((100 * ROUND(RC[-2],2)) / ROUND(RC[-1],2))))/100.0 -> 0.05 | O159: 4.0 | P159: 40.0 | Q159: (if((ROUND(RC[-1],2) = 0),0,((100 * ROUND(RC[-2],2)) / ROUND(RC[-1],2))))/100.0 -> 0.1 | R159: 2.0 | S159: 40.0 | T159: (if((ROUND(RC[-1],2) = 0),0,((100 * ROUND(RC[-2],2)) / ROUND(RC[-1],2))))/100.0 -> 0.05 | U159: 2.0 | V159: 40.0 | W159: (if((ROUND(RC[-1],2) = 0),0,((100 * ROUND(RC[-2],2)) / ROUND(RC[-1],2))))/100.0 -> 0.05 | X159: 2.0 | Y159: 40.0 | Z159: (if((ROUND(RC[-1],2) = 0),0,((100 * ROUND(RC[-2],2)) / ROUND(RC[-1],2))))/100.0 -> 0.05 | AA159: 4.0 | AB159: 40.0 | AC159: (if((ROUND(RC[-1],2) = 0),0,((100 * ROUND(RC[-2],2)) / ROUND(RC[-1],2))))/100.0 -> 0.1 | AD159: 2.0 | AE159: 40.0 | AF159: (if((ROUND(RC[-1],2) = 0),0,((100 * ROUND(RC[-2],2)) / ROUND(RC[-1],2))))/100.0 -> 0.05 | AG159: 2.0 | AH159: 40.0 | AI159: (if((ROUND(RC[-1],2) = 0),0,((100 * ROUND(RC[-2],2)) / ROUND(RC[-1],2))))/100.0 -> 0.05 | AJ159: 2.0 | AK159: 40.0 | AL159: (if((ROUND(RC[-1],2) = 0),0,((100 * ROUND(RC[-2],2)) / ROUND(RC[-1],2))))/100.0 -> 0.05 | AM159: 2.0 | AN159: 40.0 | AO159: (if((ROUND(RC[-1],2) = 0),0,((100 * ROUND(RC[-2],2)) / ROUND(RC[-1],2))))/100.0 -> 0.05 | AP159: 1.6 | AQ159: 16.0 | AR159: (if((ROUND(RC[-1],2) = 0),0,((100 * ROUND(RC[-2],2)) / ROUND(RC[-1],2))))/100.0 -> 0.1 | AS159: SUM(RC[-42],RC[-39],RC[-36],RC[-33],RC[-30],RC[-27],RC[-24],RC[-21],RC[-18],RC[-15],RC[-12],RC[-9],RC[-6],RC[-3]) -> 31.200000000000003 | AT159: SUM(RC[-42],RC[-39],RC[-36],RC[-33],RC[-30],RC[-27],RC[-24],RC[-21],RC[-18],RC[-15],RC[-12],RC[-9],RC[-6],RC[-3]) -> 528.0 | AU159: (if((ROUND(RC[-1],2) = 0),0,((100 * ROUND(RC[-2],2)) / ROUND(RC[-1],2))))/100.0 -> 0.05909090909090909
B160: Cus-01163 Aryza B.V. : Proj-01055 LDCR 2025 | D160: 32.0 | E160: (if((ROUND(RC[-1],2) = 0),0,((100 * ROUND(RC[-2],2)) / ROUND(RC[-1],2))))/100.0 -> 0.0 | F160: 8.0 | G160: 40.0 | H160: (if((ROUND(RC[-1],2) = 0),0,((100 * ROUND(RC[-2],2)) / ROUND(RC[-1],2))))/100.0 -> 0.2 | I160: 8.0 | J160: 40.0 | K160: (if((ROUND(RC[-1],2) = 0),0,((100 * ROUND(RC[-2],2)) / ROUND(RC[-1],2))))/100.0 -> 0.2 | L160: 8.0 | M160: 40.0 | N160: (if((ROUND(RC[-1],2) = 0),0,((100 * ROUND(RC[-2],2)) / ROUND(RC[-1],2))))/100.0 -> 0.2 | O160: 8.0 | P160: 40.0 | Q160: (if((ROUND(RC[-1],2) = 0),0,((100 * ROUND(RC[-2],2)) / ROUND(RC[-1],2))))/100.0 -> 0.2 | R160: 8.0 | S160: 40.0 | T160: (if((ROUND(RC[-1],2) = 0),0,((100 * ROUND(RC[-2],2)) / ROUND(RC[-1],2))))/100.0 -> 0.2 | U160: 8.0 | V160: 40.0 | W160: (if((ROUND(RC[-1],2) = 0),0,((100 * ROUND(RC[-2],2)) / ROUND(RC[-1],2))))/100.0 -> 0.2 | X160: 8.0 | Y160: 40.0 | Z160: (if((ROUND(RC[-1],2) = 0),0,((100 * ROUND(RC[-2],2)) / ROUND(RC[-1],2))))/100.0 -> 0.2 | AB160: 40.0 | AC160: (if((ROUND(RC[-1],2) = 0),0,((100 * ROUND(RC[-2],2)) / ROUND(RC[-1],2))))/100.0 -> 0.0 | AE160: 40.0 | AF160: (if((ROUND(RC[-1],2) = 0),0,((100 * ROUND(RC[-2],2)) / ROUND(RC[-1],2))))/100.0 -> 0.0 | AH160: 40.0 | AI160: (if((ROUND(RC[-1],2) = 0),0,((100 * ROUND(RC[-2],2)) / ROUND(RC[-1],2))))/100.0 -> 0.0 | AK160: 40.0 | AL160: (if((ROUND(RC[-1],2) = 0),0,((100 * ROUND(RC[-2],2)) / ROUND(RC[-1],2))))/100.0 -> 0.0 | AN160: 40.0 | AO160: (if((ROUND(RC[-1],2) = 0),0,((100 * ROUND(RC[-2],2)) / ROUND(RC[-1],2))))/100.0 -> 0.0 | AQ160: 16.0 | AR160: (if((ROUND(RC[-1],2) = 0),0,((100 * ROUND(RC[-2],2)) / ROUND(RC[-1],2))))/100.0 -> 0.0 | AS160: SUM(RC[-42],RC[-39],RC[-36],RC[-33],RC[-30],RC[-27],RC[-24],RC[-21],RC[-18],RC[-15],RC[-12],RC[-9],RC[-6],RC[-3]) -> 56.0 | AT160: SUM(RC[-42],RC[-39],RC[-36],RC[-33],RC[-30],RC[-27],RC[-24],RC[-21],RC[-18],RC[-15],RC[-12],RC[-9],RC[-6],RC[-3]) -> 528.0 | AU160: (if((ROUND(RC[-1],2) = 0),0,((100 * ROUND(RC[-2],2)) / ROUND(RC[-1],2))))/100.0 -> 0.10606060606060605
B161: Cus-01163 Aryza B.V. : Proj-01059 Upgrade Framework GRFO | C161: 0.8 | D161: 32.0 | E161: (if((ROUND(RC[-1],2) = 0),0,((100 * ROUND(RC[-2],2)) / ROUND(RC[-1],2))))/100.0 -> 0.025 | G161: 40.0 | H161: (if((ROUND(RC[-1],2) = 0),0,((100 * ROUND(RC[-2],2)) / ROUND(RC[-1],2))))/100.0 -> 0.0 | J161: 40.0 | K161: (if((ROUND(RC[-1],2) = 0),0,((100 * ROUND(RC[-2],2)) / ROUND(RC[-1],2))))/100.0 -> 0.0 | M161: 40.0 | N161: (if((ROUND(RC[-1],2) = 0),0,((100 * ROUND(RC[-2],2)) / ROUND(RC[-1],2))))/100.0 -> 0.0 | P161: 40.0 | Q161: (if((ROUND(RC[-1],2) = 0),0,((100 * ROUND(RC[-2],2)) / ROUND(RC[-1],2))))/100.0 -> 0.0 | S161: 40.0 | T161: (if((ROUND(RC[-1],2) = 0),0,((100 * ROUND(RC[-2],2)) / ROUND(RC[-1],2))))/100.0 -> 0.0 | V161: 40.0 | W161: (if((ROUND(RC[-1],2) = 0),0,((100 * ROUND(RC[-2],2)) / ROUND(RC[-1],2))))/100.0 -> 0.0 | Y161: 40.0 | Z161: (if((ROUND(RC[-1],2) = 0),0,((100 * ROUND(RC[-2],2)) / ROUND(RC[-1],2))))/100.0 -> 0.0 | AB161: 40.0 | AC161: (if((ROUND(RC[-1],2) = 0),0,((100 * ROUND(RC[-2],2)) / ROUND(RC[-1],2))))/100.0 -> 0.0 | AE161: 40.0 | AF161: (if((ROUND(RC[-1],2) = 0),0,((100 * ROUND(RC[-2],2)) / ROUND(RC[-1],2))))/100.0 -> 0.0 | AH161: 40.0 | AI161: (if((ROUND(RC[-1],2) = 0),0,((100 * ROUND(RC[-2],2)) / ROUND(RC[-1],2))))/100.0 -> 0.0 | AK161: 40.0 | AL161: (if((ROUND(RC[-1],2) = 0),0,((100 * ROUND(RC[-2],2)) / ROUND(RC[-1],2))))/100.0 -> 0.0 | AN161: 40.0 | AO161: (if((ROUND(RC[-1],2) = 0),0,((100 * ROUND(RC[-2],2)) / ROUND(RC[-1],2))))/100.0 -> 0.0 | AQ161: 16.0 | AR161: (if((ROUND(RC[-1],2) = 0),0,((100 * ROUND(RC[-2],2)) / ROUND(RC[-1],2))))/100.0 -> 0.0 | AS161: SUM(RC[-42],RC[-39],RC[-36],RC[-33],RC[-30],RC[-27],RC[-24],RC[-21],RC[-18],RC[-15],RC[-12],RC[-9],RC[-6],RC[-3]) -> 0.8 | AT161: SUM(RC[-42],RC[-39],RC[-36],RC[-33],RC[-30],RC[-27],RC[-24],RC[-21],RC[-18],RC[-15],RC[-12],RC[-9],RC[-6],RC[-3]) -> 528.0 | AU161: (if((ROUND(RC[-1],2) = 0),0,((100 * ROUND(RC[-2],2)) / ROUND(RC[-1],2))))/100.0 -> 0.0015151515151515152
B162: Cus-01168 DipNed MR : Proj-00994 DipNed Wensen eindgebruikers Mappen/financieel 2025 | D162: 32.0 | E162: (if((ROUND(RC[-1],2) = 0),0,((100 * ROUND(RC[-2],2)) / ROUND(RC[-1],2))))/100.0 -> 0.0 | G162: 40.0 | H162: (if((ROUND(RC[-1],2) = 0),0,((100 * ROUND(RC[-2],2)) / ROUND(RC[-1],2))))/100.0 -> 0.0 | J162: 40.0 | K162: (if((ROUND(RC[-1],2) = 0),0,((100 * ROUND(RC[-2],2)) / ROUND(RC[-1],2))))/100.0 -> 0.0 | M162: 40.0 | N162: (if((ROUND(RC[-1],2) = 0),0,((100 * ROUND(RC[-2],2)) / ROUND(RC[-1],2))))/100.0 -> 0.0 | P162: 40.0 | Q162: (if((ROUND(RC[-1],2) = 0),0,((100 * ROUND(RC[-2],2)) / ROUND(RC[-1],2))))/100.0 -> 0.0 | S162: 40.0 | T162: (if((ROUND(RC[-1],2) = 0),0,((100 * ROUND(RC[-2],2)) / ROUND(RC[-1],2))))/100.0 -> 0.0 | U162: 8.0 | V162: 40.0 | W162: (if((ROUND(RC[-1],2) = 0),0,((100 * ROUND(RC[-2],2)) / ROUND(RC[-1],2))))/100.0 -> 0.2 | Y162: 40.0 | Z162: (if((ROUND(RC[-1],2) = 0),0,((100 * ROUND(RC[-2],2)) / ROUND(RC[-1],2))))/100.0 -> 0.0 | AB162: 40.0 | AC162: (if((ROUND(RC[-1],2) = 0),0,((100 * ROUND(RC[-2],2)) / ROUND(RC[-1],2))))/100.0 -> 0.0 | AE162: 40.0 | AF162: (if((ROUND(RC[-1],2) = 0),0,((100 * ROUND(RC[-2],2)) / ROUND(RC[-1],2))))/100.0 -> 0.0 | AH162: 40.0 | AI162: (if((ROUND(RC[-1],2) = 0),0,((100 * ROUND(RC[-2],2)) / ROUND(RC[-1],2))))/100.0 -> 0.0 | AK162: 40.0 | AL162: (if((ROUND(RC[-1],2) = 0),0,((100 * ROUND(RC[-2],2)) / ROUND(RC[-1],2))))/100.0 -> 0.0 | AN162: 40.0 | AO162: (if((ROUND(RC[-1],2) = 0),0,((100 * ROUND(RC[-2],2)) / ROUND(RC[-1],2))))/100.0 -> 0.0 | AQ162: 16.0 | AR162: (if((ROUND(RC[-1],2) = 0),0,((100 * ROUND(RC[-2],2)) / ROUND(RC[-1],2))))/100.0 -> 0.0 | AS162: SUM(RC[-42],RC[-39],RC[-36],RC[-33],RC[-30],RC[-27],RC[-24],RC[-21],RC[-18],RC[-15],RC[-12],RC[-9],RC[-6],RC[-3]) -> 8.0 | AT162: SUM(RC[-42],RC[-39],RC[-36],RC[-33],RC[-30],RC[-27],RC[-24],RC[-21],RC[-18],RC[-15],RC[-12],RC[-9],RC[-6],RC[-3]) -> 528.0 | AU162: (if((ROUND(RC[-1],2) = 0),0,((100 * ROUND(RC[-2],2)) / ROUND(RC[-1],2))))/100.0 -> 0.015151515151515152
B163: Cus-01202 Syntrus Achmea Hypotheekdiensten B.V. : Proj-01089 Ontsluiting klantportaal API - Syntrus | C163: 0.0 | D163: 32.0 | E163: (if((ROUND(RC[-1],2) = 0),0,((100 * ROUND(RC[-2],2)) / ROUND(RC[-1],2))))/100.0 -> 0.0 | F163: 0.0 | G163: 40.0 | H163: (if((ROUND(RC[-1],2) = 0),0,((100 * ROUND(RC[-2],2)) / ROUND(RC[-1],2))))/100.0 -> 0.0 | I163: 4.0 | J163: 40.0 | K163: (if((ROUND(RC[-1],2) = 0),0,((100 * ROUND(RC[-2],2)) / ROUND(RC[-1],2))))/100.0 -> 0.1 | M163: 40.0 | N163: (if((ROUND(RC[-1],2) = 0),0,((100 * ROUND(RC[-2],2)) / ROUND(RC[-1],2))))/100.0 -> 0.0 | P163: 40.0 | Q163: (if((ROUND(RC[-1],2) = 0),0,((100 * ROUND(RC[-2],2)) / ROUND(RC[-1],2))))/100.0 -> 0.0 | S163: 40.0 | T163: (if((ROUND(RC[-1],2) = 0),0,((100 * ROUND(RC[-2],2)) / ROUND(RC[-1],2))))/100.0 -> 0.0 | V163: 40.0 | W163: (if((ROUND(RC[-1],2) = 0),0,((100 * ROUND(RC[-2],2)) / ROUND(RC[-1],2))))/100.0 -> 0.0 | Y163: 40.0 | Z163: (if((ROUND(RC[-1],2) = 0),0,((100 * ROUND(RC[-2],2)) / ROUND(RC[-1],2))))/100.0 -> 0.0 | AB163: 40.0 | AC163: (if((ROUND(RC[-1],2) = 0),0,((100 * ROUND(RC[-2],2)) / ROUND(RC[-1],2))))/100.0 -> 0.0 | AE163: 40.0 | AF163: (if((ROUND(RC[-1],2) = 0),0,((100 * ROUND(RC[-2],2)) / ROUND(RC[-1],2))))/100.0 -> 0.0 | AH163: 40.0 | AI163: (if((ROUND(RC[-1],2) = 0),0,((100 * ROUND(RC[-2],2)) / ROUND(RC[-1],2))))/100.0 -> 0.0 | AK163: 40.0 | AL163: (if((ROUND(RC[-1],2) = 0),0,((100 * ROUND(RC[-2],2)) / ROUND(RC[-1],2))))/100.0 -> 0.0 | AN163: 40.0 | AO163: (if((ROUND(RC[-1],2) = 0),0,((100 * ROUND(RC[-2],2)) / ROUND(RC[-1],2))))/100.0 -> 0.0 | AQ163: 16.0 | AR163: (if((ROUND(RC[-1],2) = 0),0,((100 * ROUND(RC[-2],2)) / ROUND(RC[-1],2))))/100.0 -> 0.0 | AS163: SUM(RC[-42],RC[-39],RC[-36],RC[-33],RC[-30],RC[-27],RC[-24],RC[-21],RC[-18],RC[-15],RC[-12],RC[-9],RC[-6],RC[-3]) -> 4.0 | AT163: SUM(RC[-42],RC[-39],RC[-36],RC[-33],RC[-30],RC[-27],RC[-24],RC[-21],RC[-18],RC[-15],RC[-12],RC[-9],RC[-6],RC[-3]) -> 528.0 | AU163: (if((ROUND(RC[-1],2) = 0),0,((100 * ROUND(RC[-2],2)) / ROUND(RC[-1],2))))/100.0 -> 0.007575757575757576
B164: Cus-01214 Creditbility B.V. : Proj-01056 OPDPortal Notificaties | C164: 1.6 | D164: 32.0 | E164: (if((ROUND(RC[-1],2) = 0),0,((100 * ROUND(RC[-2],2)) / ROUND(RC[-1],2))))/100.0 -> 0.05 | G164: 40.0 | H164: (if((ROUND(RC[-1],2) = 0),0,((100 * ROUND(RC[-2],2)) / ROUND(RC[-1],2))))/100.0 -> 0.0 | J164: 40.0 | K164: (if((ROUND(RC[-1],2) = 0),0,((100 * ROUND(RC[-2],2)) / ROUND(RC[-1],2))))/100.0 -> 0.0 | M164: 40.0 | N164: (if((ROUND(RC[-1],2) = 0),0,((100 * ROUND(RC[-2],2)) / ROUND(RC[-1],2))))/100.0 -> 0.0 | P164: 40.0 | Q164: (if((ROUND(RC[-1],2) = 0),0,((100 * ROUND(RC[-2],2)) / ROUND(RC[-1],2))))/100.0 -> 0.0 | S164: 40.0 | T164: (if((ROUND(RC[-1],2) = 0),0,((100 * ROUND(RC[-2],2)) / ROUND(RC[-1],2))))/100.0 -> 0.0 | V164: 40.0 | W164: (if((ROUND(RC[-1],2) = 0),0,((100 * ROUND(RC[-2],2)) / ROUND(RC[-1],2))))/100.0 -> 0.0 | Y164: 40.0 | Z164: (if((ROUND(RC[-1],2) = 0),0,((100 * ROUND(RC[-2],2)) / ROUND(RC[-1],2))))/100.0 -> 0.0 | AB164: 40.0 | AC164: (if((ROUND(RC[-1],2) = 0),0,((100 * ROUND(RC[-2],2)) / ROUND(RC[-1],2))))/100.0 -> 0.0 | AE164: 40.0 | AF164: (if((ROUND(RC[-1],2) = 0),0,((100 * ROUND(RC[-2],2)) / ROUND(RC[-1],2))))/100.0 -> 0.0 | AH164: 40.0 | AI164: (if((ROUND(RC[-1],2) = 0),0,((100 * ROUND(RC[-2],2)) / ROUND(RC[-1],2))))/100.0 -> 0.0 | AK164: 40.0 | AL164: (if((ROUND(RC[-1],2) = 0),0,((100 * ROUND(RC[-2],2)) / ROUND(RC[-1],2))))/100.0 -> 0.0 | AN164: 40.0 | AO164: (if((ROUND(RC[-1],2) = 0),0,((100 * ROUND(RC[-2],2)) / ROUND(RC[-1],2))))/100.0 -> 0.0 | AQ164: 16.0 | AR164: (if((ROUND(RC[-1],2) = 0),0,((100 * ROUND(RC[-2],2)) / ROUND(RC[-1],2))))/100.0 -> 0.0 | AS164: SUM(RC[-42],RC[-39],RC[-36],RC[-33],RC[-30],RC[-27],RC[-24],RC[-21],RC[-18],RC[-15],RC[-12],RC[-9],RC[-6],RC[-3]) -> 1.6 | AT164: SUM(RC[-42],RC[-39],RC[-36],RC[-33],RC[-30],RC[-27],RC[-24],RC[-21],RC[-18],RC[-15],RC[-12],RC[-9],RC[-6],RC[-3]) -> 528.0 | AU164: (if((ROUND(RC[-1],2) = 0),0,((100 * ROUND(RC[-2],2)) / ROUND(RC[-1],2))))/100.0 -> 0.0030303030303030303
B165: Cus-01736 LDCR Afd. Fin. : Proj-00805 LDCR C-Kasapplicatie | C165: 3.2 | D165: 32.0 | E165: (if((ROUND(RC[-1],2) = 0),0,((100 * ROUND(RC[-2],2)) / ROUND(RC[-1],2))))/100.0 -> 0.1 | F165: 4.0 | G165: 40.0 | H165: (if((ROUND(RC[-1],2) = 0),0,((100 * ROUND(RC[-2],2)) / ROUND(RC[-1],2))))/100.0 -> 0.1 | I165: 6.0 | J165: 40.0 | K165: (if((ROUND(RC[-1],2) = 0),0,((100 * ROUND(RC[-2],2)) / ROUND(RC[-1],2))))/100.0 -> 0.15 | L165: 6.0 | M165: 40.0 | N165: (if((ROUND(RC[-1],2) = 0),0,((100 * ROUND(RC[-2],2)) / ROUND(RC[-1],2))))/100.0 -> 0.15 | O165: 6.0 | P165: 40.0 | Q165: (if((ROUND(RC[-1],2) = 0),0,((100 * ROUND(RC[-2],2)) / ROUND(RC[-1],2))))/100.0 -> 0.15 | R165: 6.0 | S165: 40.0 | T165: (if((ROUND(RC[-1],2) = 0),0,((100 * ROUND(RC[-2],2)) / ROUND(RC[-1],2))))/100.0 -> 0.15 | U165: 8.0 | V165: 40.0 | W165: (if((ROUND(RC[-1],2) = 0),0,((100 * ROUND(RC[-2],2)) / ROUND(RC[-1],2))))/100.0 -> 0.2 | X165: 16.0 | Y165: 40.0 | Z165: (if((ROUND(RC[-1],2) = 0),0,((100 * ROUND(RC[-2],2)) / ROUND(RC[-1],2))))/100.0 -> 0.4 | AA165: 24.0 | AB165: 40.0 | AC165: (if((ROUND(RC[-1],2) = 0),0,((100 * ROUND(RC[-2],2)) / ROUND(RC[-1],2))))/100.0 -> 0.6 | AD165: 24.0 | AE165: 40.0 | AF165: (if((ROUND(RC[-1],2) = 0),0,((100 * ROUND(RC[-2],2)) / ROUND(RC[-1],2))))/100.0 -> 0.6 | AG165: 24.0 | AH165: 40.0 | AI165: (if((ROUND(RC[-1],2) = 0),0,((100 * ROUND(RC[-2],2)) / ROUND(RC[-1],2))))/100.0 -> 0.6 | AK165: 40.0 | AL165: (if((ROUND(RC[-1],2) = 0),0,((100 * ROUND(RC[-2],2)) / ROUND(RC[-1],2))))/100.0 -> 0.0 | AM165: 24.0 | AN165: 40.0 | AO165: (if((ROUND(RC[-1],2) = 0),0,((100 * ROUND(RC[-2],2)) / ROUND(RC[-1],2))))/100.0 -> 0.6 | AP165: 9.6 | AQ165: 16.0 | AR165: (if((ROUND(RC[-1],2) = 0),0,((100 * ROUND(RC[-2],2)) / ROUND(RC[-1],2))))/100.0 -> 0.6 | AS165: SUM(RC[-42],RC[-39],RC[-36],RC[-33],RC[-30],RC[-27],RC[-24],RC[-21],RC[-18],RC[-15],RC[-12],RC[-9],RC[-6],RC[-3]) -> 160.79999999999998 | AT165: SUM(RC[-42],RC[-39],RC[-36],RC[-33],RC[-30],RC[-27],RC[-24],RC[-21],RC[-18],RC[-15],RC[-12],RC[-9],RC[-6],RC[-3]) -> 528.0 | AU165: (if((ROUND(RC[-1],2) = 0),0,((100 * ROUND(RC[-2],2)) / ROUND(RC[-1],2))))/100.0 -> 0.30454545454545456
B166: Cus-01736 LDCR Afd. Fin. : Proj-01031 Wishes LDCR Period 3 | C166: 8.0 | D166: 32.0 | E166: (if((ROUND(RC[-1],2) = 0),0,((100 * ROUND(RC[-2],2)) / ROUND(RC[-1],2))))/100.0 -> 0.25 | F166: 14.0 | G166: 40.0 | H166: (if((ROUND(RC[-1],2) = 0),0,((100 * ROUND(RC[-2],2)) / ROUND(RC[-1],2))))/100.0 -> 0.35 | J166: 40.0 | K166: (if((ROUND(RC[-1],2) = 0),0,((100 * ROUND(RC[-2],2)) / ROUND(RC[-1],2))))/100.0 -> 0.0 | M166: 40.0 | N166: (if((ROUND(RC[-1],2) = 0),0,((100 * ROUND(RC[-2],2)) / ROUND(RC[-1],2))))/100.0 -> 0.0 | P166: 40.0 | Q166: (if((ROUND(RC[-1],2) = 0),0,((100 * ROUND(RC[-2],2)) / ROUND(RC[-1],2))))/100.0 -> 0.0 | S166: 40.0 | T166: (if((ROUND(RC[-1],2) = 0),0,((100 * ROUND(RC[-2],2)) / ROUND(RC[-1],2))))/100.0 -> 0.0 | V166: 40.0 | W166: (if((ROUND(RC[-1],2) = 0),0,((100 * ROUND(RC[-2],2)) / ROUND(RC[-1],2))))/100.0 -> 0.0 | Y166: 40.0 | Z166: (if((ROUND(RC[-1],2) = 0),0,((100 * ROUND(RC[-2],2)) / ROUND(RC[-1],2))))/100.0 -> 0.0 | AB166: 40.0 | AC166: (if((ROUND(RC[-1],2) = 0),0,((100 * ROUND(RC[-2],2)) / ROUND(RC[-1],2))))/100.0 -> 0.0 | AE166: 40.0 | AF166: (if((ROUND(RC[-1],2) = 0),0,((100 * ROUND(RC[-2],2)) / ROUND(RC[-1],2))))/100.0 -> 0.0 | AH166: 40.0 | AI166: (if((ROUND(RC[-1],2) = 0),0,((100 * ROUND(RC[-2],2)) / ROUND(RC[-1],2))))/100.0 -> 0.0 | AK166: 40.0 | AL166: (if((ROUND(RC[-1],2) = 0),0,((100 * ROUND(RC[-2],2)) / ROUND(RC[-1],2))))/100.0 -> 0.0 | AN166: 40.0 | AO166: (if((ROUND(RC[-1],2) = 0),0,((100 * ROUND(RC[-2],2)) / ROUND(RC[-1],2))))/100.0 -> 0.0 | AQ166: 16.0 | AR166: (if((ROUND(RC[-1],2) = 0),0,((100 * ROUND(RC[-2],2)) / ROUND(RC[-1],2))))/100.0 -> 0.0 | AS166: SUM(RC[-42],RC[-39],RC[-36],RC[-33],RC[-30],RC[-27],RC[-24],RC[-21],RC[-18],RC[-15],RC[-12],RC[-9],RC[-6],RC[-3]) -> 22.0 | AT166: SUM(RC[-42],RC[-39],RC[-36],RC[-33],RC[-30],RC[-27],RC[-24],RC[-21],RC[-18],RC[-15],RC[-12],RC[-9],RC[-6],RC[-3]) -> 528.0 | AU166: (if((ROUND(RC[-1],2) = 0),0,((100 * ROUND(RC[-2],2)) / ROUND(RC[-1],2))))/100.0 -> 0.04166666666666667
A167: Total - Walter Smolders | C167: SUM(R[-12]C:R[-1]C) -> 24.8 | D167: 32.0 | E167: (if((ROUND(RC[-1],2) = 0),0,((100 * ROUND(RC[-2],2)) / ROUND(RC[-1],2))))/100.0 -> 0.775 | F167: SUM(R[-12]C:R[-1]C) -> 40.0 | G167: 40.0 | H167: (if((ROUND(RC[-1],2) = 0),0,((100 * ROUND(RC[-2],2)) / ROUND(RC[-1],2))))/100.0 -> 1.0 | I167: SUM(R[-12]C:R[-1]C) -> 38.0 | J167: 40.0 | K167: (if((ROUND(RC[-1],2) = 0),0,((100 * ROUND(RC[-2],2)) / ROUND(RC[-1],2))))/100.0 -> 0.95 | L167: SUM(R[-12]C:R[-1]C) -> 34.0 | M167: 40.0 | N167: (if((ROUND(RC[-1],2) = 0),0,((100 * ROUND(RC[-2],2)) / ROUND(RC[-1],2))))/100.0 -> 0.85 | O167: SUM(R[-12]C:R[-1]C) -> 36.0 | P167: 40.0 | Q167: (if((ROUND(RC[-1],2) = 0),0,((100 * ROUND(RC[-2],2)) / ROUND(RC[-1],2))))/100.0 -> 0.9 | R167: SUM(R[-12]C:R[-1]C) -> 34.0 | S167: 40.0 | T167: (if((ROUND(RC[-1],2) = 0),0,((100 * ROUND(RC[-2],2)) / ROUND(RC[-1],2))))/100.0 -> 0.85 | U167: SUM(R[-12]C:R[-1]C) -> 38.0 | V167: 40.0 | W167: (if((ROUND(RC[-1],2) = 0),0,((100 * ROUND(RC[-2],2)) / ROUND(RC[-1],2))))/100.0 -> 0.95 | X167: SUM(R[-12]C:R[-1]C) -> 38.0 | Y167: 40.0 | Z167: (if((ROUND(RC[-1],2) = 0),0,((100 * ROUND(RC[-2],2)) / ROUND(RC[-1],2))))/100.0 -> 0.95 | AA167: SUM(R[-12]C:R[-1]C) -> 40.0 | AB167: 40.0 | AC167: (if((ROUND(RC[-1],2) = 0),0,((100 * ROUND(RC[-2],2)) / ROUND(RC[-1],2))))/100.0 -> 1.0 | AD167: SUM(R[-12]C:R[-1]C) -> 38.0 | AE167: 40.0 | AF167: (if((ROUND(RC[-1],2) = 0),0,((100 * ROUND(RC[-2],2)) / ROUND(RC[-1],2))))/100.0 -> 0.95 | AG167: SUM(R[-12]C:R[-1]C) -> 38.0 | AH167: 40.0 | AI167: (if((ROUND(RC[-1],2) = 0),0,((100 * ROUND(RC[-2],2)) / ROUND(RC[-1],2))))/100.0 -> 0.95 | AJ167: SUM(R[-12]C:R[-1]C) -> 14.0 | AK167: 40.0 | AL167: (if((ROUND(RC[-1],2) = 0),0,((100 * ROUND(RC[-2],2)) / ROUND(RC[-1],2))))/100.0 -> 0.35 | AM167: SUM(R[-12]C:R[-1]C) -> 38.0 | AN167: 40.0 | AO167: (if((ROUND(RC[-1],2) = 0),0,((100 * ROUND(RC[-2],2)) / ROUND(RC[-1],2))))/100.0 -> 0.95 | AP167: SUM(R[-12]C:R[-1]C) -> 16.0 | AQ167: 16.0 | AR167: (if((ROUND(RC[-1],2) = 0),0,((100 * ROUND(RC[-2],2)) / ROUND(RC[-1],2))))/100.0 -> 1.0 | AS167: SUM(R[-12]C:R[-1]C) -> 466.8 | AT167: SUM(R[-12]C:R[-1]C) -> 528.0 | AU167: (if((ROUND(RC[-1],2) = 0),0,((100 * ROUND(RC[-2],2)) / ROUND(RC[-1],2))))/100.0 -> 0.884090909090909
A168: Total | C168: SUM(R[-155]C,R[-148]C:R[-147]C,R[-140]C,R[-135]C,R[-129]C,R[-117]C,R[-103]C,R[-95]C,R[-88]C,R[-78]C,R[-68]C,R[-61]C,R[-48]C,R[-34]C,R[-27]C,R[-20]C:R[-19]C,R[-15]C,R[-1]C) -> 320.00000000000006 | D168: 640.0 | E168: (if((ROUND(RC[-1],2) = 0),0,((100 * ROUND(RC[-2],2)) / ROUND(RC[-1],2))))/100.0 -> 0.5 | F168: SUM(R[-155]C,R[-148]C:R[-147]C,R[-140]C,R[-135]C,R[-129]C,R[-117]C,R[-103]C,R[-95]C,R[-88]C,R[-78]C,R[-68]C,R[-61]C,R[-48]C,R[-34]C,R[-27]C,R[-20]C:R[-19]C,R[-15]C,R[-1]C) -> 323.0 | G168: 800.0 | H168: (if((ROUND(RC[-1],2) = 0),0,((100 * ROUND(RC[-2],2)) / ROUND(RC[-1],2))))/100.0 -> 0.40375 | I168: SUM(R[-155]C,R[-148]C:R[-147]C,R[-140]C,R[-135]C,R[-129]C,R[-117]C,R[-103]C,R[-95]C,R[-88]C,R[-78]C,R[-68]C,R[-61]C,R[-48]C,R[-34]C,R[-27]C,R[-20]C:R[-19]C,R[-15]C,R[-1]C) -> 334.0 | J168: 800.0 | K168: (if((ROUND(RC[-1],2) = 0),0,((100 * ROUND(RC[-2],2)) / ROUND(RC[-1],2))))/100.0 -> 0.4175 | L168: SUM(R[-155]C,R[-148]C:R[-147]C,R[-140]C,R[-135]C,R[-129]C,R[-117]C,R[-103]C,R[-95]C,R[-88]C,R[-78]C,R[-68]C,R[-61]C,R[-48]C,R[-34]C,R[-27]C,R[-20]C:R[-19]C,R[-15]C,R[-1]C) -> 353.0 | M168: 800.0 | N168: (if((ROUND(RC[-1],2) = 0),0,((100 * ROUND(RC[-2],2)) / ROUND(RC[-1],2))))/100.0 -> 0.44125 | O168: SUM(R[-155]C,R[-148]C:R[-147]C,R[-140]C,R[-135]C,R[-129]C,R[-117]C,R[-103]C,R[-95]C,R[-88]C,R[-78]C,R[-68]C,R[-61]C,R[-48]C,R[-34]C,R[-27]C,R[-20]C:R[-19]C,R[-15]C,R[-1]C) -> 446.0 | P168: 800.0 | Q168: (if((ROUND(RC[-1],2) = 0),0,((100 * ROUND(RC[-2],2)) / ROUND(RC[-1],2))))/100.0 -> 0.5575 | R168: SUM(R[-155]C,R[-148]C:R[-147]C,R[-140]C,R[-135]C,R[-129]C,R[-117]C,R[-103]C,R[-95]C,R[-88]C,R[-78]C,R[-68]C,R[-61]C,R[-48]C,R[-34]C,R[-27]C,R[-20]C:R[-19]C,R[-15]C,R[-1]C) -> 376.0 | S168: 800.0 | T168: (if((ROUND(RC[-1],2) = 0),0,((100 * ROUND(RC[-2],2)) / ROUND(RC[-1],2))))/100.0 -> 0.47 | U168: SUM(R[-155]C,R[-148]C:R[-147]C,R[-140]C,R[-135]C,R[-129]C,R[-117]C,R[-103]C,R[-95]C,R[-88]C,R[-78]C,R[-68]C,R[-61]C,R[-48]C,R[-34]C,R[-27]C,R[-20]C:R[-19]C,R[-15]C,R[-1]C) -> 415.0 | V168: 800.0 | W168: (if((ROUND(RC[-1],2) = 0),0,((100 * ROUND(RC[-2],2)) / ROUND(RC[-1],2))))/100.0 -> 0.51875 | X168: SUM(R[-155]C,R[-148]C:R[-147]C,R[-140]C,R[-135]C,R[-129]C,R[-117]C,R[-103]C,R[-95]C,R[-88]C,R[-78]C,R[-68]C,R[-61]C,R[-48]C,R[-34]C,R[-27]C,R[-20]C:R[-19]C,R[-15]C,R[-1]C) -> 443.0 | Y168: 800.0 | Z168: (if((ROUND(RC[-1],2) = 0),0,((100 * ROUND(RC[-2],2)) / ROUND(RC[-1],2))))/100.0 -> 0.55375 | AA168: SUM(R[-155]C,R[-148]C:R[-147]C,R[-140]C,R[-135]C,R[-129]C,R[-117]C,R[-103]C,R[-95]C,R[-88]C,R[-78]C,R[-68]C,R[-61]C,R[-48]C,R[-34]C,R[-27]C,R[-20]C:R[-19]C,R[-15]C,R[-1]C) -> 467.0 | AB168: 800.0 | AC168: (if((ROUND(RC[-1],2) = 0),0,((100 * ROUND(RC[-2],2)) / ROUND(RC[-1],2))))/100.0 -> 0.58375 | AD168: SUM(R[-155]C,R[-148]C:R[-147]C,R[-140]C,R[-135]C,R[-129]C,R[-117]C,R[-103]C,R[-95]C,R[-88]C,R[-78]C,R[-68]C,R[-61]C,R[-48]C,R[-34]C,R[-27]C,R[-20]C:R[-19]C,R[-15]C,R[-1]C) -> 510.2 | AE168: 800.0 | AF168: (if((ROUND(RC[-1],2) = 0),0,((100 * ROUND(RC[-2],2)) / ROUND(RC[-1],2))))/100.0 -> 0.63775 | AG168: SUM(R[-155]C,R[-148]C:R[-147]C,R[-140]C,R[-135]C,R[-129]C,R[-117]C,R[-103]C,R[-95]C,R[-88]C,R[-78]C,R[-68]C,R[-61]C,R[-48]C,R[-34]C,R[-27]C,R[-20]C:R[-19]C,R[-15]C,R[-1]C) -> 434.0 | AH168: 800.0 | AI168: (if((ROUND(RC[-1],2) = 0),0,((100 * ROUND(RC[-2],2)) / ROUND(RC[-1],2))))/100.0 -> 0.5425 | AJ168: SUM(R[-155]C,R[-148]C:R[-147]C,R[-140]C,R[-135]C,R[-129]C,R[-117]C,R[-103]C,R[-95]C,R[-88]C,R[-78]C,R[-68]C,R[-61]C,R[-48]C,R[-34]C,R[-27]C,R[-20]C:R[-19]C,R[-15]C,R[-1]C) -> 428.0 | AK168: 800.0 | AL168: (if((ROUND(RC[-1],2) = 0),0,((100 * ROUND(RC[-2],2)) / ROUND(RC[-1],2))))/100.0 -> 0.535 | AM168: SUM(R[-155]C,R[-148]C:R[-147]C,R[-140]C,R[-135]C,R[-129]C,R[-117]C,R[-103]C,R[-95]C,R[-88]C,R[-78]C,R[-68]C,R[-61]C,R[-48]C,R[-34]C,R[-27]C,R[-20]C:R[-19]C,R[-15]C,R[-1]C) -> 425.0 | AN168: 800.0 | AO168: (if((ROUND(RC[-1],2) = 0),0,((100 * ROUND(RC[-2],2)) / ROUND(RC[-1],2))))/100.0 -> 0.53125 | AP168: SUM(R[-155]C,R[-148]C:R[-147]C,R[-140]C,R[-135]C,R[-129]C,R[-117]C,R[-103]C,R[-95]C,R[-88]C,R[-78]C,R[-68]C,R[-61]C,R[-48]C,R[-34]C,R[-27]C,R[-20]C:R[-19]C,R[-15]C,R[-1]C) -> 175.6 | AQ168: 320.0 | AR168: (if((ROUND(RC[-1],2) = 0),0,((100 * ROUND(RC[-2],2)) / ROUND(RC[-1],2))))/100.0 -> 0.54875 | AS168: SUM(R[-155]C,R[-148]C:R[-147]C,R[-140]C,R[-135]C,R[-129]C,R[-117]C,R[-103]C,R[-95]C,R[-88]C,R[-78]C,R[-68]C,R[-61]C,R[-48]C,R[-34]C,R[-27]C,R[-20]C:R[-19]C,R[-15]C,R[-1]C) -> 5449.8 | AT168: SUM(R[-155]C,R[-148]C:R[-147]C,R[-140]C,R[-135]C,R[-129]C,R[-117]C,R[-103]C,R[-95]C,R[-88]C,R[-78]C,R[-68]C,R[-61]C,R[-48]C,R[-34]C,R[-27]C,R[-20]C:R[-19]C,R[-15]C,R[-1]C) -> 10560.0 | AU168: (if((ROUND(RC[-1],2) = 0),0,((100 * ROUND(RC[-2],2)) / ROUND(RC[-1],2))))/100.0 -> 0.5160795454545455