Sheet: NavigateDailyPlanning
A1: ARY(P)
A2: Atlas Topco 1 Limited : Atlas Midco 1 Limited : Atlas Bidco 1 Limited : Aryza Holdings Limited : Chiron Holdings Limited : Saturn Topco S.a.r.l : Saturn F17-349 Midco GmbH : Saturn F17-350 Bidco GmbH : Aryza Europe GmbH : Aryza Holding B.V. : Collenda Holding B.V : Aryza B.V.
A3: Navigate Daily Planning
A4: 29 July 2025 - 28 October 2025
A7: Resource | B7: Customer: Project | C7: Week 31 2025 | F7: Week 32 2025 | I7: Week 33 2025 | L7: Week 34 2025 | O7: Week 35 2025 | R7: Week 36 2025 | U7: Week 37 2025 | X7: Week 38 2025 | AA7: Week 39 2025 | AD7: Week 40 2025 | AG7: Week 41 2025 | AJ7: Week 42 2025 | AM7: Week 43 2025 | AP7: Week 44 2025 | AS7: Total
C8: Allocated Time | D8: Available Hours | E8: Utilization | F8: Allocated Time | G8: Available Hours | H8: Utilization | I8: Allocated Time | J8: Available Hours | K8: Utilization | L8: Allocated Time | M8: Available Hours | N8: Utilization | O8: Allocated Time | P8: Available Hours | Q8: Utilization | R8: Allocated Time | S8: Available Hours | T8: Utilization | U8: Allocated Time | V8: Available Hours | W8: Utilization | X8: Allocated Time | Y8: Available Hours | Z8: Utilization | AA8: Allocated Time | AB8: Available Hours | AC8: Utilization | AD8: Allocated Time | AE8: Available Hours | AF8: Utilization | AG8: Allocated Time | AH8: Available Hours | AI8: Utilization | AJ8: Allocated Time | AK8: Available Hours | AL8: Utilization | AM8: Allocated Time | AN8: Available Hours | AO8: Utilization | AP8: Allocated Time | AQ8: Available Hours | AR8: Utilization | AS8: Allocated Time | AT8: Available Hours | AU8: Utilization
A9: Mike Testor
B10: Cus-01159 Vesting Finance : Proj-00846 Vesting Finance Maintenance 2025 | D10: 32 | E10: =(IF((ROUND(RC[-1],2) = 0),0,((100 * ROUND(RC[-2],2)) / ROUND(RC[-1],2))))/100 -> 0 | G10: 40 | H10: =(IF((ROUND(RC[-1],2) = 0),0,((100 * ROUND(RC[-2],2)) / ROUND(RC[-1],2))))/100 -> 0 | J10: 40 | K10: =(IF((ROUND(RC[-1],2) = 0),0,((100 * ROUND(RC[-2],2)) / ROUND(RC[-1],2))))/100 -> 0 | L10: 4 | M10: 40 | N10: =(IF((ROUND(RC[-1],2) = 0),0,((100 * ROUND(RC[-2],2)) / ROUND(RC[-1],2))))/100 -> 0.1 | P10: 40 | Q10: =(IF((ROUND(RC[-1],2) = 0),0,((100 * ROUND(RC[-2],2)) / ROUND(RC[-1],2))))/100 -> 0 | S10: 40 | T10: =(IF((ROUND(RC[-1],2) = 0),0,((100 * ROUND(RC[-2],2)) / ROUND(RC[-1],2))))/100 -> 0 | V10: 40 | W10: =(IF((ROUND(RC[-1],2) = 0),0,((100 * ROUND(RC[-2],2)) / ROUND(RC[-1],2))))/100 -> 0 | Y10: 40 | Z10: =(IF((ROUND(RC[-1],2) = 0),0,((100 * ROUND(RC[-2],2)) / ROUND(RC[-1],2))))/100 -> 0 | AB10: 40 | AC10: =(IF((ROUND(RC[-1],2) = 0),0,((100 * ROUND(RC[-2],2)) / ROUND(RC[-1],2))))/100 -> 0 | AE10: 40 | AF10: =(IF((ROUND(RC[-1],2) = 0),0,((100 * ROUND(RC[-2],2)) / ROUND(RC[-1],2))))/100 -> 0 | AH10: 40 | AI10: =(IF((ROUND(RC[-1],2) = 0),0,((100 * ROUND(RC[-2],2)) / ROUND(RC[-1],2))))/100 -> 0 | AK10: 40 | AL10: =(IF((ROUND(RC[-1],2) = 0),0,((100 * ROUND(RC[-2],2)) / ROUND(RC[-1],2))))/100 -> 0 | AN10: 40 | AO10: =(IF((ROUND(RC[-1],2) = 0),0,((100 * ROUND(RC[-2],2)) / ROUND(RC[-1],2))))/100 -> 0 | AQ10: 16 | AR10: =(IF((ROUND(RC[-1],2) = 0),0,((100 * ROUND(RC[-2],2)) / ROUND(RC[-1],2))))/100 -> 0 | AS10: =SUM(RC[-42],RC[-39],RC[-36],RC[-33],RC[-30],RC[-27],RC[-24],RC[-21],RC[-18],RC[-15],RC[-12],RC[-9],RC[-6],RC[-3]) -> 4 | AT10: =SUM(RC[-42],RC[-39],RC[-36],RC[-33],RC[-30],RC[-27],RC[-24],RC[-21],RC[-18],RC[-15],RC[-12],RC[-9],RC[-6],RC[-3]) -> 528 | AU10: =(IF((ROUND(RC[-1],2) = 0),0,((100 * ROUND(RC[-2],2)) / ROUND(RC[-1],2))))/100 -> 7.575757575757576E-3
B11: Cus-01163 Aryza B.V. : Proj-00976 Interne uren 2025 | C11: 1 | D11: 32 | E11: =(IF((ROUND(RC[-1],2) = 0),0,((100 * ROUND(RC[-2],2)) / ROUND(RC[-1],2))))/100 -> 3.125E-2 | G11: 40 | H11: =(IF((ROUND(RC[-1],2) = 0),0,((100 * ROUND(RC[-2],2)) / ROUND(RC[-1],2))))/100 -> 0 | J11: 40 | K11: =(IF((ROUND(RC[-1],2) = 0),0,((100 * ROUND(RC[-2],2)) / ROUND(RC[-1],2))))/100 -> 0 | L11: 1 | M11: 40 | N11: =(IF((ROUND(RC[-1],2) = 0),0,((100 * ROUND(RC[-2],2)) / ROUND(RC[-1],2))))/100 -> 2.5000000000000001E-2 | O11: 3 | P11: 40 | Q11: =(IF((ROUND(RC[-1],2) = 0),0,((100 * ROUND(RC[-2],2)) / ROUND(RC[-1],2))))/100 -> 7.4999999999999997E-2 | R11: 1 | S11: 40 | T11: =(IF((ROUND(RC[-1],2) = 0),0,((100 * ROUND(RC[-2],2)) / ROUND(RC[-1],2))))/100 -> 2.5000000000000001E-2 | U11: 1 | V11: 40 | W11: =(IF((ROUND(RC[-1],2) = 0),0,((100 * ROUND(RC[-2],2)) / ROUND(RC[-1],2))))/100 -> 2.5000000000000001E-2 | X11: 1 | Y11: 40 | Z11: =(IF((ROUND(RC[-1],2) = 0),0,((100 * ROUND(RC[-2],2)) / ROUND(RC[-1],2))))/100 -> 2.5000000000000001E-2 | AA11: 1 | AB11: 40 | AC11: =(IF((ROUND(RC[-1],2) = 0),0,((100 * ROUND(RC[-2],2)) / ROUND(RC[-1],2))))/100 -> 2.5000000000000001E-2 | AD11: 3 | AE11: 40 | AF11: =(IF((ROUND(RC[-1],2) = 0),0,((100 * ROUND(RC[-2],2)) / ROUND(RC[-1],2))))/100 -> 7.4999999999999997E-2 | AG11: 1 | AH11: 40 | AI11: =(IF((ROUND(RC[-1],2) = 0),0,((100 * ROUND(RC[-2],2)) / ROUND(RC[-1],2))))/100 -> 2.5000000000000001E-2 | AJ11: 1 | AK11: 40 | AL11: =(IF((ROUND(RC[-1],2) = 0),0,((100 * ROUND(RC[-2],2)) / ROUND(RC[-1],2))))/100 -> 2.5000000000000001E-2 | AM11: 1 | AN11: 40 | AO11: =(IF((ROUND(RC[-1],2) = 0),0,((100 * ROUND(RC[-2],2)) / ROUND(RC[-1],2))))/100 -> 2.5000000000000001E-2 | AP11: 1.2 | AQ11: 16 | AR11: =(IF((ROUND(RC[-1],2) = 0),0,((100 * ROUND(RC[-2],2)) / ROUND(RC[-1],2))))/100 -> 7.4999999999999997E-2 | AS11: =SUM(RC[-42],RC[-39],RC[-36],RC[-33],RC[-30],RC[-27],RC[-24],RC[-21],RC[-18],RC[-15],RC[-12],RC[-9],RC[-6],RC[-3]) -> 16.2 | AT11: =SUM(RC[-42],RC[-39],RC[-36],RC[-33],RC[-30],RC[-27],RC[-24],RC[-21],RC[-18],RC[-15],RC[-12],RC[-9],RC[-6],RC[-3]) -> 528 | AU11: =(IF((ROUND(RC[-1],2) = 0),0,((100 * ROUND(RC[-2],2)) / ROUND(RC[-1],2))))/100 -> 3.0681818181818185E-2
B12: Cus-01163 Aryza B.V. : Proj-01059 Upgrade Framework GRFO | C12: 20 | D12: 32 | E12: =(IF((ROUND(RC[-1],2) = 0),0,((100 * ROUND(RC[-2],2)) / ROUND(RC[-1],2))))/100 -> 0.625 | G12: 40 | H12: =(IF((ROUND(RC[-1],2) = 0),0,((100 * ROUND(RC[-2],2)) / ROUND(RC[-1],2))))/100 -> 0 | J12: 40 | K12: =(IF((ROUND(RC[-1],2) = 0),0,((100 * ROUND(RC[-2],2)) / ROUND(RC[-1],2))))/100 -> 0 | M12: 40 | N12: =(IF((ROUND(RC[-1],2) = 0),0,((100 * ROUND(RC[-2],2)) / ROUND(RC[-1],2))))/100 -> 0 | P12: 40 | Q12: =(IF((ROUND(RC[-1],2) = 0),0,((100 * ROUND(RC[-2],2)) / ROUND(RC[-1],2))))/100 -> 0 | S12: 40 | T12: =(IF((ROUND(RC[-1],2) = 0),0,((100 * ROUND(RC[-2],2)) / ROUND(RC[-1],2))))/100 -> 0 | V12: 40 | W12: =(IF((ROUND(RC[-1],2) = 0),0,((100 * ROUND(RC[-2],2)) / ROUND(RC[-1],2))))/100 -> 0 | Y12: 40 | Z12: =(IF((ROUND(RC[-1],2) = 0),0,((100 * ROUND(RC[-2],2)) / ROUND(RC[-1],2))))/100 -> 0 | AB12: 40 | AC12: =(IF((ROUND(RC[-1],2) = 0),0,((100 * ROUND(RC[-2],2)) / ROUND(RC[-1],2))))/100 -> 0 | AE12: 40 | AF12: =(IF((ROUND(RC[-1],2) = 0),0,((100 * ROUND(RC[-2],2)) / ROUND(RC[-1],2))))/100 -> 0 | AH12: 40 | AI12: =(IF((ROUND(RC[-1],2) = 0),0,((100 * ROUND(RC[-2],2)) / ROUND(RC[-1],2))))/100 -> 0 | AK12: 40 | AL12: =(IF((ROUND(RC[-1],2) = 0),0,((100 * ROUND(RC[-2],2)) / ROUND(RC[-1],2))))/100 -> 0 | AN12: 40 | AO12: =(IF((ROUND(RC[-1],2) = 0),0,((100 * ROUND(RC[-2],2)) / ROUND(RC[-1],2))))/100 -> 0 | AQ12: 16 | AR12: =(IF((ROUND(RC[-1],2) = 0),0,((100 * ROUND(RC[-2],2)) / ROUND(RC[-1],2))))/100 -> 0 | AS12: =SUM(RC[-42],RC[-39],RC[-36],RC[-33],RC[-30],RC[-27],RC[-24],RC[-21],RC[-18],RC[-15],RC[-12],RC[-9],RC[-6],RC[-3]) -> 20 | AT12: =SUM(RC[-42],RC[-39],RC[-36],RC[-33],RC[-30],RC[-27],RC[-24],RC[-21],RC[-18],RC[-15],RC[-12],RC[-9],RC[-6],RC[-3]) -> 528 | AU12: =(IF((ROUND(RC[-1],2) = 0),0,((100 * ROUND(RC[-2],2)) / ROUND(RC[-1],2))))/100 -> 3.787878787878788E-2
B13: Cus-01163 Aryza B.V. : Proj-01123 GoPay Email in Bulk | D13: 32 | E13: =(IF((ROUND(RC[-1],2) = 0),0,((100 * ROUND(RC[-2],2)) / ROUND(RC[-1],2))))/100 -> 0 | G13: 40 | H13: =(IF((ROUND(RC[-1],2) = 0),0,((100 * ROUND(RC[-2],2)) / ROUND(RC[-1],2))))/100 -> 0 | J13: 40 | K13: =(IF((ROUND(RC[-1],2) = 0),0,((100 * ROUND(RC[-2],2)) / ROUND(RC[-1],2))))/100 -> 0 | L13: 2 | M13: 40 | N13: =(IF((ROUND(RC[-1],2) = 0),0,((100 * ROUND(RC[-2],2)) / ROUND(RC[-1],2))))/100 -> 0.05 | O13: 20 | P13: 40 | Q13: =(IF((ROUND(RC[-1],2) = 0),0,((100 * ROUND(RC[-2],2)) / ROUND(RC[-1],2))))/100 -> 0.5 | R13: 16 | S13: 40 | T13: =(IF((ROUND(RC[-1],2) = 0),0,((100 * ROUND(RC[-2],2)) / ROUND(RC[-1],2))))/100 -> 0.4 | U13: 4 | V13: 40 | W13: =(IF((ROUND(RC[-1],2) = 0),0,((100 * ROUND(RC[-2],2)) / ROUND(RC[-1],2))))/100 -> 0.1 | Y13: 40 | Z13: =(IF((ROUND(RC[-1],2) = 0),0,((100 * ROUND(RC[-2],2)) / ROUND(RC[-1],2))))/100 -> 0 | AB13: 40 | AC13: =(IF((ROUND(RC[-1],2) = 0),0,((100 * ROUND(RC[-2],2)) / ROUND(RC[-1],2))))/100 -> 0 | AE13: 40 | AF13: =(IF((ROUND(RC[-1],2) = 0),0,((100 * ROUND(RC[-2],2)) / ROUND(RC[-1],2))))/100 -> 0 | AH13: 40 | AI13: =(IF((ROUND(RC[-1],2) = 0),0,((100 * ROUND(RC[-2],2)) / ROUND(RC[-1],2))))/100 -> 0 | AK13: 40 | AL13: =(IF((ROUND(RC[-1],2) = 0),0,((100 * ROUND(RC[-2],2)) / ROUND(RC[-1],2))))/100 -> 0 | AN13: 40 | AO13: =(IF((ROUND(RC[-1],2) = 0),0,((100 * ROUND(RC[-2],2)) / ROUND(RC[-1],2))))/100 -> 0 | AQ13: 16 | AR13: =(IF((ROUND(RC[-1],2) = 0),0,((100 * ROUND(RC[-2],2)) / ROUND(RC[-1],2))))/100 -> 0 | AS13: =SUM(RC[-42],RC[-39],RC[-36],RC[-33],RC[-30],RC[-27],RC[-24],RC[-21],RC[-18],RC[-15],RC[-12],RC[-9],RC[-6],RC[-3]) -> 42 | AT13: =SUM(RC[-42],RC[-39],RC[-36],RC[-33],RC[-30],RC[-27],RC[-24],RC[-21],RC[-18],RC[-15],RC[-12],RC[-9],RC[-6],RC[-3]) -> 528 | AU13: =(IF((ROUND(RC[-1],2) = 0),0,((100 * ROUND(RC[-2],2)) / ROUND(RC[-1],2))))/100 -> 7.9545454545454544E-2
B14: Cus-01169 Werkgroep CJIB : Proj-01125 CJIB Tol-zaken | D14: 32 | E14: =(IF((ROUND(RC[-1],2) = 0),0,((100 * ROUND(RC[-2],2)) / ROUND(RC[-1],2))))/100 -> 0 | G14: 40 | H14: =(IF((ROUND(RC[-1],2) = 0),0,((100 * ROUND(RC[-2],2)) / ROUND(RC[-1],2))))/100 -> 0 | J14: 40 | K14: =(IF((ROUND(RC[-1],2) = 0),0,((100 * ROUND(RC[-2],2)) / ROUND(RC[-1],2))))/100 -> 0 | L14: 4 | M14: 40 | N14: =(IF((ROUND(RC[-1],2) = 0),0,((100 * ROUND(RC[-2],2)) / ROUND(RC[-1],2))))/100 -> 0.1 | P14: 40 | Q14: =(IF((ROUND(RC[-1],2) = 0),0,((100 * ROUND(RC[-2],2)) / ROUND(RC[-1],2))))/100 -> 0 | S14: 40 | T14: =(IF((ROUND(RC[-1],2) = 0),0,((100 * ROUND(RC[-2],2)) / ROUND(RC[-1],2))))/100 -> 0 | V14: 40 | W14: =(IF((ROUND(RC[-1],2) = 0),0,((100 * ROUND(RC[-2],2)) / ROUND(RC[-1],2))))/100 -> 0 | Y14: 40 | Z14: =(IF((ROUND(RC[-1],2) = 0),0,((100 * ROUND(RC[-2],2)) / ROUND(RC[-1],2))))/100 -> 0 | AB14: 40 | AC14: =(IF((ROUND(RC[-1],2) = 0),0,((100 * ROUND(RC[-2],2)) / ROUND(RC[-1],2))))/100 -> 0 | AE14: 40 | AF14: =(IF((ROUND(RC[-1],2) = 0),0,((100 * ROUND(RC[-2],2)) / ROUND(RC[-1],2))))/100 -> 0 | AH14: 40 | AI14: =(IF((ROUND(RC[-1],2) = 0),0,((100 * ROUND(RC[-2],2)) / ROUND(RC[-1],2))))/100 -> 0 | AK14: 40 | AL14: =(IF((ROUND(RC[-1],2) = 0),0,((100 * ROUND(RC[-2],2)) / ROUND(RC[-1],2))))/100 -> 0 | AN14: 40 | AO14: =(IF((ROUND(RC[-1],2) = 0),0,((100 * ROUND(RC[-2],2)) / ROUND(RC[-1],2))))/100 -> 0 | AQ14: 16 | AR14: =(IF((ROUND(RC[-1],2) = 0),0,((100 * ROUND(RC[-2],2)) / ROUND(RC[-1],2))))/100 -> 0 | AS14: =SUM(RC[-42],RC[-39],RC[-36],RC[-33],RC[-30],RC[-27],RC[-24],RC[-21],RC[-18],RC[-15],RC[-12],RC[-9],RC[-6],RC[-3]) -> 4 | AT14: =SUM(RC[-42],RC[-39],RC[-36],RC[-33],RC[-30],RC[-27],RC[-24],RC[-21],RC[-18],RC[-15],RC[-12],RC[-9],RC[-6],RC[-3]) -> 528 | AU14: =(IF((ROUND(RC[-1],2) = 0),0,((100 * ROUND(RC[-2],2)) / ROUND(RC[-1],2))))/100 -> 7.575757575757576E-3
A15: Total - Mike Testor | C15: =SUM(R[-5]C:R[-1]C) -> 21 | D15: 32 | E15: =(IF((ROUND(RC[-1],2) = 0),0,((100 * ROUND(RC[-2],2)) / ROUND(RC[-1],2))))/100 -> 0.65625 | F15: =SUM(R[-5]C:R[-1]C) -> 0 | G15: 40 | H15: =(IF((ROUND(RC[-1],2) = 0),0,((100 * ROUND(RC[-2],2)) / ROUND(RC[-1],2))))/100 -> 0 | I15: =SUM(R[-5]C:R[-1]C) -> 0 | J15: 40 | K15: =(IF((ROUND(RC[-1],2) = 0),0,((100 * ROUND(RC[-2],2)) / ROUND(RC[-1],2))))/100 -> 0 | L15: =SUM(R[-5]C:R[-1]C) -> 11 | M15: 40 | N15: =(IF((ROUND(RC[-1],2) = 0),0,((100 * ROUND(RC[-2],2)) / ROUND(RC[-1],2))))/100 -> 0.27500000000000002 | O15: =SUM(R[-5]C:R[-1]C) -> 23 | P15: 40 | Q15: =(IF((ROUND(RC[-1],2) = 0),0,((100 * ROUND(RC[-2],2)) / ROUND(RC[-1],2))))/100 -> 0.57499999999999996 | R15: =SUM(R[-5]C:R[-1]C) -> 17 | S15: 40 | T15: =(IF((ROUND(RC[-1],2) = 0),0,((100 * ROUND(RC[-2],2)) / ROUND(RC[-1],2))))/100 -> 0.42499999999999999 | U15: =SUM(R[-5]C:R[-1]C) -> 5 | V15: 40 | W15: =(IF((ROUND(RC[-1],2) = 0),0,((100 * ROUND(RC[-2],2)) / ROUND(RC[-1],2))))/100 -> 0.125 | X15: =SUM(R[-5]C:R[-1]C) -> 1 | Y15: 40 | Z15: =(IF((ROUND(RC[-1],2) = 0),0,((100 * ROUND(RC[-2],2)) / ROUND(RC[-1],2))))/100 -> 2.5000000000000001E-2 | AA15: =SUM(R[-5]C:R[-1]C) -> 1 | AB15: 40 | AC15: =(IF((ROUND(RC[-1],2) = 0),0,((100 * ROUND(RC[-2],2)) / ROUND(RC[-1],2))))/100 -> 2.5000000000000001E-2 | AD15: =SUM(R[-5]C:R[-1]C) -> 3 | AE15: 40 | AF15: =(IF((ROUND(RC[-1],2) = 0),0,((100 * ROUND(RC[-2],2)) / ROUND(RC[-1],2))))/100 -> 7.4999999999999997E-2 | AG15: =SUM(R[-5]C:R[-1]C) -> 1 | AH15: 40 | AI15: =(IF((ROUND(RC[-1],2) = 0),0,((100 * ROUND(RC[-2],2)) / ROUND(RC[-1],2))))/100 -> 2.5000000000000001E-2 | AJ15: =SUM(R[-5]C:R[-1]C) -> 1 | AK15: 40 | AL15: =(IF((ROUND(RC[-1],2) = 0),0,((100 * ROUND(RC[-2],2)) / ROUND(RC[-1],2))))/100 -> 2.5000000000000001E-2 | AM15: =SUM(R[-5]C:R[-1]C) -> 1 | AN15: 40 | AO15: =(IF((ROUND(RC[-1],2) = 0),0,((100 * ROUND(RC[-2],2)) / ROUND(RC[-1],2))))/100 -> 2.5000000000000001E-2 | AP15: =SUM(R[-5]C:R[-1]C) -> 1.2 | AQ15: 16 | AR15: =(IF((ROUND(RC[-1],2) = 0),0,((100 * ROUND(RC[-2],2)) / ROUND(RC[-1],2))))/100 -> 7.4999999999999997E-2 | AS15: =SUM(R[-5]C:R[-1]C) -> 86.2 | AT15: =SUM(R[-5]C:R[-1]C) -> 2640 | AU15: =(IF((ROUND(RC[-1],2) = 0),0,((100 * ROUND(RC[-2],2)) / ROUND(RC[-1],2))))/100 -> 3.2651515151515154E-2